[{"ShowId":"3860","ShowNameId":"12","Number":"38","PostedDate":"6/24/2015 12:00:00 PM","Title":"Maids of Dishonor","VideoFileUrl":"https://www.keithandthegirl.com/vip/download/shows/lauren/video/38/HENNY-2015-06-24.m3u8","VideoThumbnailUrl":"https://www.keithandthegirl.com/vip/download/shows/lauren/video/38/HENNY-2015-06-24-video.jpg","PreviewUrl":"https://www.youtube.com/watch?v=IhyzEOhqfWs","FileUrl":"http://www.keithandthegirl.com/vip/download/shows/lauren/HENNY-2015-06-24.mp3","Type":"0","Public":"0","Timestamp":1435161600,"Guests":[]},{"ShowId":"3833","ShowNameId":"12","Number":"37","PostedDate":"6/3/2015 12:00:00 PM","Title":"Whoroscope","VideoFileUrl":"https://www.keithandthegirl.com/vip/download/shows/lauren/video/37/HENNY-2015-06-03.m3u8","VideoThumbnailUrl":"https://www.keithandthegirl.com/vip/download/shows/lauren/video/37/HENNY-2015-06-03-video.jpg","PreviewUrl":"https://www.youtube.com/watch?v=KQiVg2CBylQ","FileUrl":"http://www.keithandthegirl.com/vip/download/shows/lauren/HENNY-2015-06-03.mp3","Type":"0","Public":"0","Timestamp":1433347200,"Guests":[]},{"ShowId":"3795","ShowNameId":"12","Number":"36","PostedDate":"5/6/2015 4:00:00 PM","Title":"Who\u0027s On Second?","VideoFileUrl":"https://www.keithandthegirl.com/vip/download/shows/lauren/video/36/HENNY-2015-05-06.m3u8","VideoThumbnailUrl":"https://www.keithandthegirl.com/vip/download/shows/lauren/video/36/HENNY-2015-05-06-video.jpg","PreviewUrl":"https://www.youtube.com/watch?v=NWt9Jouxtes","FileUrl":"http://www.keithandthegirl.com/vip/download/shows/lauren/HENNY-2015-05-06.mp3","Type":"0","Public":"0","Timestamp":1430942400,"Guests":[]},{"ShowId":"3755","ShowNameId":"12","Number":"35","PostedDate":"4/8/2015 12:00:00 PM","Title":"I\u0027m Just a Girl","VideoFileUrl":"https://www.keithandthegirl.com/vip/download/shows/lauren/video/35/HENNY-2015-04-08.m3u8","VideoThumbnailUrl":"https://www.keithandthegirl.com/vip/download/shows/lauren/video/35/HENNY-2015-04-08-video.jpg","PreviewUrl":"https://www.youtube.com/watch?v=KaGYfExjXZY","FileUrl":"http://www.keithandthegirl.com/vip/download/shows/lauren/HENNY-2015-04-08.mp3","Type":"0","Public":"0","Timestamp":1428508800,"Guests":[]},{"ShowId":"3716","ShowNameId":"12","Number":"34","PostedDate":"3/11/2015 12:00:00 PM","Title":"Being a Guy is Haawrrrrd","VideoFileUrl":"https://www.keithandthegirl.com/vip/download/shows/lauren/video/34/HENNY-2015-03-11.m3u8","VideoThumbnailUrl":"https://www.keithandthegirl.com/vip/download/shows/lauren/video/34/HENNY-2015-03-11-video.jpg","PreviewUrl":"https://www.youtube.com/watch?v=goZkPbRH8CE","FileUrl":"http://www.keithandthegirl.com/vip/download/shows/lauren/HENNY-2015-03-11.mp3","Type":"0","Public":"0","Timestamp":1426089600,"Guests":[]},{"ShowId":"3642","ShowNameId":"12","Number":"33","PostedDate":"1/14/2015 12:00:00 PM","Title":"It Was an Accident!","VideoFileUrl":"https://www.keithandthegirl.com/vip/download/shows/lauren/video/33/HENNY-2015-01-14.m3u8","VideoThumbnailUrl":"https://www.keithandthegirl.com/vip/download/shows/lauren/video/33/HENNY-2015-01-14-video.jpg","PreviewUrl":"https://www.youtube.com/watch?v=G7gTd2OPqFo","FileUrl":"http://www.keithandthegirl.com/vip/download/shows/lauren/HENNY-2015-01-14.mp3","Type":"0","Public":"0","Timestamp":1421254800,"Guests":[]},{"ShowId":"3533","ShowNameId":"12","Number":"32","PostedDate":"11/12/2014 12:00:00 PM","Title":"Mos Deaf","VideoFileUrl":"https://www.keithandthegirl.com/vip/download/shows/lauren/video/32/HENNY-2014-11-11.m3u8","VideoThumbnailUrl":"https://www.keithandthegirl.com/vip/download/shows/lauren/video/32/HENNY-2014-11-11-video.jpg","PreviewUrl":"https://www.youtube.com/watch?v=0ZcgbZ9B4X4","FileUrl":"http://www.keithandthegirl.com/vip/download/shows/lauren/HENNY-2014-11-11.mp3","Type":"0","Public":"0","Timestamp":1415811600,"Guests":[]},{"ShowId":"3501","ShowNameId":"12","Number":"31","PostedDate":"10/22/2014 12:00:00 PM","Title":"They\u0027re Just Like Us!","VideoFileUrl":"https://www.keithandthegirl.com/vip/download/shows/lauren/video/31/HENNY-2014-10-22.m3u8","VideoThumbnailUrl":"https://www.keithandthegirl.com/vip/download/shows/lauren/video/31/HENNY-2014-10-22-video.jpg","PreviewUrl":"https://www.youtube.com/watch?v=Kunq0JnYCKE","FileUrl":"http://www.keithandthegirl.com/vip/download/shows/lauren/HENNY-2014-10-22.mp3","Type":"0","Public":"0","Timestamp":1413993600,"Guests":[]},{"ShowId":"3462","ShowNameId":"12","Number":"30","PostedDate":"9/24/2014 12:00:00 PM","Title":"Because I Got High","VideoFileUrl":"https://www.keithandthegirl.com/vip/download/shows/lauren/video/30/HENNY-2014-09-24.m3u8","VideoThumbnailUrl":"https://www.keithandthegirl.com/vip/download/shows/lauren/video/30/HENNY-2014-09-24-video.jpg","PreviewUrl":"https://www.youtube.com/watch?v=ZtASDaZUEbA","FileUrl":"http://www.keithandthegirl.com/vip/download/shows/lauren/HENNY-2014-09-24.mp3","Type":"0","Public":"0","Timestamp":1411574400,"Guests":[]},{"ShowId":"3432","ShowNameId":"12","Number":"29","PostedDate":"9/3/2014 12:00:00 PM","Title":"Continental Drift","VideoFileUrl":"https://www.keithandthegirl.com/vip/download/shows/lauren/video/29/HENNY-2014-09-03.m3u8","VideoThumbnailUrl":"https://www.keithandthegirl.com/vip/download/shows/lauren/video/29/HENNY-2014-09-03-video.jpg","PreviewUrl":"https://www.youtube.com/watch?v=r1j4S-CiXqk","FileUrl":"http://www.keithandthegirl.com/vip/download/shows/lauren/HENNY-2014-09-03.mp3","Type":"0","Public":"0","Timestamp":1409760000,"Guests":[]},{"ShowId":"3377","ShowNameId":"12","Number":"28","PostedDate":"7/30/2014 12:00:00 PM","Title":"No-Knickers-Chloe","VideoFileUrl":"https://www.keithandthegirl.com/vip/download/shows/lauren/video/28/HENNY-2014-07-30.m3u8","VideoThumbnailUrl":"https://www.keithandthegirl.com/vip/download/shows/lauren/video/28/HENNY-2014-07-30-video.jpg","PreviewUrl":"https://www.youtube.com/watch?v=SYxueDEaHRU","FileUrl":"http://www.keithandthegirl.com/vip/download/shows/lauren/HENNY-2014-07-30.mp3","Type":"0","Public":"0","Timestamp":1406736000,"Guests":[]},{"ShowId":"3336","ShowNameId":"12","Number":"27","PostedDate":"7/2/2014 12:00:00 PM","Title":"Serenity Corner of Evilness","VideoFileUrl":"https://www.keithandthegirl.com/vip/download/shows/lauren/video/27/HENNY-2014-07-02.m3u8","VideoThumbnailUrl":"https://www.keithandthegirl.com/vip/download/shows/lauren/video/27/HENNY-2014-07-02-video.jpg","PreviewUrl":"https://www.youtube.com/watch?v=rl9PgOLW0DA","FileUrl":"http://www.keithandthegirl.com/vip/download/shows/lauren/HENNY-2014-07-02.mp3","Type":"0","Public":"0","Timestamp":1404316800,"Guests":[]},{"ShowId":"3293","ShowNameId":"12","Number":"26","PostedDate":"6/4/2014 12:00:00 PM","Title":"No Offense, But…","VideoFileUrl":"https://www.keithandthegirl.com/vip/download/shows/lauren/video/26/HENNY-2014-06-04.m3u8","VideoThumbnailUrl":"https://www.keithandthegirl.com/vip/download/shows/lauren/video/26/HENNY-2014-06-04-video.jpg","PreviewUrl":"https://www.youtube.com/watch?v=UxAprh3Us_I","FileUrl":"http://www.keithandthegirl.com/vip/download/shows/lauren/HENNY-2014-06-04.mp3","Type":"0","Public":"0","Timestamp":1401897600,"Guests":[]},{"ShowId":"3246","ShowNameId":"12","Number":"25","PostedDate":"5/7/2014 12:00:00 PM","Title":"Nightmare","VideoFileUrl":"https://www.keithandthegirl.com/vip/download/shows/lauren/video/25/HENNY-2014-05-07.m3u8","VideoThumbnailUrl":"https://www.keithandthegirl.com/vip/download/shows/lauren/video/25/HENNY-2014-05-07-video.jpg","PreviewUrl":"https://www.youtube.com/watch?v=C147FH6MlcU","FileUrl":"http://www.keithandthegirl.com/vip/download/shows/lauren/HENNY-2014-05-07.mp3","Type":"0","Public":"0","Timestamp":1399478400,"Guests":[]},{"ShowId":"3206","ShowNameId":"12","Number":"24","PostedDate":"4/9/2014 12:00:00 PM","Title":"Panicked","VideoFileUrl":"https://www.keithandthegirl.com/vip/download/shows/lauren/video/24/HENNY-2014-04-09.m3u8","VideoThumbnailUrl":"https://www.keithandthegirl.com/vip/download/shows/lauren/video/24/HENNY-2014-04-09-video.jpg","PreviewUrl":"https://www.youtube.com/watch?v=ffBloPDamys","FileUrl":"http://www.keithandthegirl.com/vip/download/shows/lauren/HENNY-2014-04-09.mp3","Type":"0","Public":"0","Timestamp":1397059200,"Guests":[]},{"ShowId":"3165","ShowNameId":"12","Number":"23","PostedDate":"3/12/2014 12:00:00 PM","Title":"38 Hours of Vomit","VideoFileUrl":"https://www.keithandthegirl.com/vip/download/shows/lauren/video/23/HENNY-2014-03-12.m3u8","VideoThumbnailUrl":"https://www.keithandthegirl.com/vip/download/shows/lauren/video/23/HENNY-2014-03-12-video.jpg","PreviewUrl":"https://www.youtube.com/watch?v=fL73FPi60mw","FileUrl":"http://www.keithandthegirl.com/vip/download/shows/lauren/HENNY-2014-03-12.mp3","Type":"0","Public":"0","Timestamp":1394640000,"Guests":[]},{"ShowId":"3119","ShowNameId":"12","Number":"22","PostedDate":"2/12/2014 12:00:00 PM","Title":"Say What?","VideoFileUrl":"https://www.keithandthegirl.com/vip/download/shows/lauren/video/22/HENNY-2014-02-12.m3u8","VideoThumbnailUrl":"https://www.keithandthegirl.com/vip/download/shows/lauren/video/22/HENNY-2014-02-12-video.jpg","PreviewUrl":"http://www.youtube.com/watch?v=oUu41zd80gw","FileUrl":"http://www.keithandthegirl.com/vip/download/shows/lauren/HENNY-2014-02-12.mp3","Type":"0","Public":"0","Timestamp":1392224400,"Guests":[]},{"ShowId":"3085","ShowNameId":"12","Number":"21","PostedDate":"1/22/2014 12:00:00 PM","Title":"Bottoms Grow\u0027d Up","VideoFileUrl":"https://www.keithandthegirl.com/vip/download/shows/lauren/video/21/HENNY-2014-01-22.m3u8","VideoThumbnailUrl":"https://www.keithandthegirl.com/vip/download/shows/lauren/video/21/HENNY-2014-01-22-video.jpg","PreviewUrl":"https://www.youtube.com/watch?v=bQVsnf2-FjU","FileUrl":"http://www.keithandthegirl.com/vip/download/shows/lauren/HENNY-2014-01-22.mp3","Type":"0","Public":"0","Timestamp":1390410000,"Guests":[]},{"ShowId":"3054","ShowNameId":"12","Number":"20","PostedDate":"1/1/2014 12:00:00 PM","Title":"Auditions","VideoFileUrl":"https://www.keithandthegirl.com/vip/download/shows/lauren/video/20/HENNY-2014-01-01.m3u8","VideoThumbnailUrl":"https://www.keithandthegirl.com/vip/download/shows/lauren/video/20/HENNY-2014-01-01-video.jpg","PreviewUrl":"http://www.youtube.com/watch?v=36LhX-d2R1I","FileUrl":"http://www.keithandthegirl.com/vip/download/shows/lauren/HENNY-2014-01-01.mp3","Type":"0","Public":"0","Timestamp":1388595600,"Guests":[]},{"ShowId":"3031","ShowNameId":"12","Number":"19","PostedDate":"12/11/2013 12:00:00 PM","Title":"Spirit Animal","VideoFileUrl":"https://www.keithandthegirl.com/vip/download/shows/lauren/video/19/HENNY-2013-12-11.m3u8","VideoThumbnailUrl":"https://www.keithandthegirl.com/vip/download/shows/lauren/video/19/HENNY-2013-12-11-video.jpg","PreviewUrl":"http://www.youtube.com/watch?v=TqR8CiaRSuA","FileUrl":"http://www.keithandthegirl.com/vip/download/shows/lauren/HENNY-2013-12-11.mp3","Type":"0","Public":"0","Timestamp":1386781200,"Guests":[]},{"ShowId":"3011","ShowNameId":"12","Number":"18","PostedDate":"11/26/2013 12:00:00 PM","Title":"That was really nice of you, Andrea!","VideoFileUrl":"https://www.keithandthegirl.com/vip/download/shows/lauren/video/18/HENNY-2013-11-26.m3u8","VideoThumbnailUrl":"https://www.keithandthegirl.com/vip/download/shows/lauren/video/18/HENNY-2013-11-26-video.jpg","PreviewUrl":"http://www.youtube.com/watch?v=W6Z74-AaA3Y","FileUrl":"http://www.keithandthegirl.com/vip/download/shows/lauren/HENNY-2013-11-26.mp3","Type":"0","Public":"0","Timestamp":1385485200,"Guests":[{"Data":"262","ShowGuestId":"262","RealName":"Andrea Allan","Description":"Comedian and writer best known for her contributions to College Candy\u0027s Ask a Slut column.","PictureFilename":"Andrea-Allan.jpg","Url1":"http://www.facebook.com/andrea.allan.9","Url2":"","PictureUrl":"http://static-1.keithandthegirl.net/guests/pics/processed/Andrea-Allan-150x150.jpg","PictureUrlLarge":"http://static-1.keithandthegirl.net/guests/pics/processed/Andrea-Allan-600x600.jpg"},{"Data":"376","ShowGuestId":"376","RealName":"Chemda","Description":"Singer, comic and host of the Keith and The Girl podcast.","PictureFilename":"chemda.jpg","Url1":"http://keithandthegirl.com","Url2":"http://chemda.com","PictureUrl":"http://static-3.keithandthegirl.net/guests/pics/processed/chemda-150x150.jpg","PictureUrlLarge":"http://static-3.keithandthegirl.net/guests/pics/processed/chemda-600x600.jpg"}]},{"ShowId":"2995","ShowNameId":"12","Number":"17","PostedDate":"11/13/2013 12:00:00 PM","Title":"Now and Later","VideoFileUrl":"https://www.keithandthegirl.com/vip/download/shows/lauren/video/17/HENNY-2013-11-13.m3u8","VideoThumbnailUrl":"https://www.keithandthegirl.com/vip/download/shows/lauren/video/17/HENNY-2013-11-13-video.jpg","PreviewUrl":"http://www.youtube.com/watch?v=uftepotQDH8","FileUrl":"http://www.keithandthegirl.com/vip/download/shows/lauren/HENNY-2013-11-13.mp3","Type":"0","Public":"0","Timestamp":1384362000,"Guests":[{"Data":"387","ShowGuestId":"387","RealName":"Jordan Tierney","Description":"Actor and astrologer who will read your chart and tell you how you\u0027re going to die (probably.)","PictureFilename":"jordan-tierney.jpg","Url1":"https://twitter.com/JordanCTierney","Url2":"http://www.jordantierney.net/","PictureUrl":"http://static-4.keithandthegirl.net/guests/pics/processed/jordan-tierney-150x150.jpg","PictureUrlLarge":"http://static-4.keithandthegirl.net/guests/pics/processed/jordan-tierney-600x600.jpg"}]},{"ShowId":"2969","ShowNameId":"12","Number":"16","PostedDate":"10/30/2013 12:00:00 PM","Title":"Beware of the French Maid","VideoFileUrl":"https://www.keithandthegirl.com/vip/download/shows/lauren/video/16/HENNY-2013-10-30.m3u8","VideoThumbnailUrl":"https://www.keithandthegirl.com/vip/download/shows/lauren/video/16/HENNY-2013-10-30-video.jpg","PreviewUrl":"http://www.youtube.com/watch?v=L6UC4F-TfZw","FileUrl":"http://www.keithandthegirl.com/vip/download/shows/lauren/HENNY-2013-10-30.mp3","Type":"0","Public":"0","Timestamp":1383148800,"Guests":[{"Data":"376","ShowGuestId":"376","RealName":"Chemda","Description":"Singer, comic and host of the Keith and The Girl podcast.","PictureFilename":"chemda.jpg","Url1":"http://keithandthegirl.com","Url2":"http://chemda.com","PictureUrl":"http://static-3.keithandthegirl.net/guests/pics/processed/chemda-150x150.jpg","PictureUrlLarge":"http://static-3.keithandthegirl.net/guests/pics/processed/chemda-600x600.jpg"}]},{"ShowId":"2948","ShowNameId":"12","Number":"15","PostedDate":"10/15/2013 12:00:00 PM","Title":"Heeeeiiighhnnnnnn!!!","VideoFileUrl":"https://www.keithandthegirl.com/vip/download/shows/lauren/video/15/HENNY-2013-10-16.m3u8","VideoThumbnailUrl":"https://www.keithandthegirl.com/vip/download/shows/lauren/video/15/HENNY-2013-10-16-video.jpg","PreviewUrl":"http://www.youtube.com/watch?v=90dutJGFeaA","FileUrl":"http://www.keithandthegirl.com/vip/download/shows/lauren/HENNY-2013-10-16.mp3","Type":"0","Public":"0","Timestamp":1381852800,"Guests":[]},{"ShowId":"2927","ShowNameId":"12","Number":"14","PostedDate":"10/1/2013 12:00:00 PM","Title":"Broke","VideoFileUrl":"https://www.keithandthegirl.com/vip/download/shows/lauren/video/14/HENNY-2013-10-01.m3u8","VideoThumbnailUrl":"https://www.keithandthegirl.com/vip/download/shows/lauren/video/14/HENNY-2013-10-01-video.jpg","PreviewUrl":"http://www.youtube.com/watch?v=3W4B6QNhpxI","FileUrl":"http://www.keithandthegirl.com/vip/download/shows/lauren/HENNY-2013-10-01.mp3","Type":"0","Public":"0","Timestamp":1380643200,"Guests":[{"Data":"215","ShowGuestId":"215","RealName":"Adam Spiegelman","Description":"Comedy booker and host of the podcast Proudly Resents.","PictureFilename":"Adam-Spiegelman.jpg","Url1":"","Url2":"http://www.facebook.com/reachadam","PictureUrl":"http://static-4.keithandthegirl.net/guests/pics/processed/Adam-Spiegelman-150x150.jpg","PictureUrlLarge":"http://static-4.keithandthegirl.net/guests/pics/processed/Adam-Spiegelman-600x600.jpg"},{"Data":"203","ShowGuestId":"203","RealName":"Danny Hatch","Description":"Comedian, writer, and host of That’s the Show with Danny.","PictureFilename":"Danny-Hatch.jpg","Url1":"http://dannyhatch.tumblr.com","Url2":"http://twitter.com/dannyhatch","PictureUrl":"http://static-3.keithandthegirl.net/guests/pics/processed/Danny-Hatch-150x150.jpg","PictureUrlLarge":"http://static-3.keithandthegirl.net/guests/pics/processed/Danny-Hatch-600x600.jpg"}]},{"ShowId":"2908","ShowNameId":"12","Number":"13","PostedDate":"9/18/2013 12:00:00 PM","Title":"Campin’!","VideoFileUrl":"https://www.keithandthegirl.com/vip/download/shows/lauren/video/13/HENNY-2013-09-18.m3u8","VideoThumbnailUrl":"https://www.keithandthegirl.com/vip/download/shows/lauren/video/13/HENNY-2013-09-18-video.jpg","PreviewUrl":"http://www.youtube.com/watch?v=pvzzMxWvxYo","FileUrl":"http://www.keithandthegirl.com/vip/download/shows/lauren/HENNY-2013-09-18.mp3","Type":"0","Public":"0","Timestamp":1379520000,"Guests":[]},{"ShowId":"2890","ShowNameId":"12","Number":"12","PostedDate":"9/3/2013 12:00:00 PM","Title":"Now I Know My Abc\u0027s.","VideoFileUrl":"https://www.keithandthegirl.com/vip/download/shows/lauren/video/12/HENNY-2013-09-03.m3u8","VideoThumbnailUrl":"https://www.keithandthegirl.com/vip/download/shows/lauren/video/12/HENNY-2013-09-03-video.jpg","PreviewUrl":"http://www.youtube.com/watch?v=sJhl92vdK0c","FileUrl":"http://www.keithandthegirl.com/vip/download/shows/lauren/HENNY-2013-09-03.mp3","Type":"0","Public":"0","Timestamp":1378224000,"Guests":[]},{"ShowId":"2866","ShowNameId":"12","Number":"11","PostedDate":"8/20/2013 12:00:00 PM","Title":"Does it Come with Homefries?","VideoFileUrl":"https://www.keithandthegirl.com/vip/download/shows/lauren/video/11/HENNY-2013-08-20.m3u8","VideoThumbnailUrl":"https://www.keithandthegirl.com/vip/download/shows/lauren/video/11/HENNY-2013-08-20-video.jpg","PreviewUrl":"http://www.youtube.com/watch?v=WDAMiPjo8TQ","FileUrl":"http://www.keithandthegirl.com/vip/download/shows/lauren/HENNY-2013-08-20.mp3","Type":"0","Public":"0","Timestamp":1377014400,"Guests":[]},{"ShowId":"2828","ShowNameId":"12","Number":"10","PostedDate":"7/30/2013 1:26:18 PM","Title":"Emmmyyyy!","VideoFileUrl":"https://www.keithandthegirl.com/vip/download/shows/lauren/video/10/HENNY-2013-07-30.m3u8","VideoThumbnailUrl":"https://www.keithandthegirl.com/vip/download/shows/lauren/video/10/HENNY-2013-07-30-video.jpg","PreviewUrl":"http://www.youtube.com/watch?v=UK1jqB2KJHY","FileUrl":"http://www.keithandthegirl.com/vip/download/shows/lauren/HENNY-2013-07-30.mp3","Type":"0","Public":"0","Timestamp":1375205178,"Guests":[{"Data":"263","ShowGuestId":"263","RealName":"Katharine Heller","Description":"Comedian and actress known for hosting the Tell the Bartender podcast.","PictureFilename":"Katharine-Heller.jpg","Url1":"http://katharineheller.com","Url2":"","PictureUrl":"http://static-1.keithandthegirl.net/guests/pics/processed/Katharine-Heller-150x150.jpg","PictureUrlLarge":"http://static-1.keithandthegirl.net/guests/pics/processed/Katharine-Heller-600x600.jpg"},{"Data":"323","ShowGuestId":"323","RealName":"Keith and The Girl","Description":"","PictureFilename":"Keith-and-The-Girl.jpg","Url1":"","Url2":"http://keithandthegirl.com/","PictureUrl":"http://static-2.keithandthegirl.net/guests/pics/processed/Keith-and-The-Girl-150x150.jpg","PictureUrlLarge":"http://static-2.keithandthegirl.net/guests/pics/processed/Keith-and-The-Girl-600x600.jpg"}]},{"ShowId":"2800","ShowNameId":"12","Number":"9","PostedDate":"7/16/2013 11:12:15 AM","Title":"Jimmy Fallon Face","VideoFileUrl":"https://www.keithandthegirl.com/vip/download/shows/lauren/video/9/HENNY-2013-07-16.m3u8","VideoThumbnailUrl":"https://www.keithandthegirl.com/vip/download/shows/lauren/video/9/HENNY-2013-07-16-video.jpg","PreviewUrl":"http://www.youtube.com/watch?v=7bOsNEb4enQ","FileUrl":"http://www.keithandthegirl.com/vip/download/shows/lauren/HENNY-2013-07-16.mp3","Type":"0","Public":"0","Timestamp":1373987535,"Guests":[]},{"ShowId":"2777","ShowNameId":"12","Number":"8","PostedDate":"7/2/2013 3:24:41 PM","Title":"Fail","VideoFileUrl":"https://www.keithandthegirl.com/vip/download/shows/lauren/video/8/HENNY-2013-07-02.m3u8","VideoThumbnailUrl":"https://www.keithandthegirl.com/vip/download/shows/lauren/video/8/HENNY-2013-07-02-video.jpg","PreviewUrl":"http://www.youtube.com/watch?v=5G0tSaugRSY\u0026list=PLqRSwyqnU1WG6lXWxntNU5_MYUuhkPUXy","FileUrl":"http://www.keithandthegirl.com/vip/download/shows/lauren/HENNY-2013-07-02.mp3","Type":"0","Public":"0","Timestamp":1372793081,"Guests":[]},{"ShowId":"2758","ShowNameId":"12","Number":"7","PostedDate":"6/17/2013 2:31:44 AM","Title":"New York Shitty","PreviewUrl":"https://www.keithandthegirl.com/mp3/promo/bottoms-up-with-hennessy/bottoms-up-7-trailer.mp3 ","FileUrl":"http://www.keithandthegirl.com/vip/download/shows/lauren/HENNY-2013-06-17.mp3","Type":"0","Public":"0","Timestamp":1371450704,"Guests":[{"Data":"376","ShowGuestId":"376","RealName":"Chemda","Description":"Singer, comic and host of the Keith and The Girl podcast.","PictureFilename":"chemda.jpg","Url1":"http://keithandthegirl.com","Url2":"http://chemda.com","PictureUrl":"http://static-3.keithandthegirl.net/guests/pics/processed/chemda-150x150.jpg","PictureUrlLarge":"http://static-3.keithandthegirl.net/guests/pics/processed/chemda-600x600.jpg"}]},{"ShowId":"2605","ShowNameId":"12","Number":"5","PostedDate":"3/26/2013 12:00:00 PM","Title":"Thicker Than Water","PreviewUrl":"https://www.youtube.com/watch?v=PcP9U_3WotI\u0026list=PLqRSwyqnU1WGgBhcG_Cqr5Kd56VOjXNgS","FileUrl":"http://www.keithandthegirl.com/vip/download/shows/lauren/HENNY-2013-03-26.mp3","Type":"0","Public":"0","Timestamp":1364313600,"Guests":[]},{"ShowId":"2591","ShowNameId":"12","Number":"4","PostedDate":"3/13/2013 7:00:00 PM","Title":"... But What Am I?","PreviewUrl":"https://www.keithandthegirl.com/mp3/promo/bottoms-up-with-hennessy/bottoms-up-4-trailer.mp3","FileUrl":"http://www.keithandthegirl.com/vip/download/shows/lauren/HENNY-2013-03-13.mp3","Type":"0","Public":"0","Timestamp":1363215600,"Guests":[]},{"ShowId":"2575","ShowNameId":"12","Number":"3","PostedDate":"2/27/2013 12:00:00 PM","Title":"Solar System of Jizz","PreviewUrl":"","FileUrl":"http://www.keithandthegirl.com/vip/download/shows/lauren/HENNY-2013-02-27.mp3","Type":"0","Public":"0","Timestamp":1361984400,"Guests":[]},{"ShowId":"2562","ShowNameId":"12","Number":"2","PostedDate":"2/12/2013 12:00:00 PM","Title":"I Know YOU Are...","PreviewUrl":"https://www.keithandthegirl.com/mp3/promo/bottoms-up-with-hennessy/bottoms-up-2-trailer.mp3","FileUrl":"http://www.keithandthegirl.com/vip/download/shows/lauren/HENNY-2013-02-12.mp3","Type":"0","Public":"0","Timestamp":1360688400,"Guests":[]},{"ShowId":"2546","ShowNameId":"12","Number":"1","PostedDate":"1/29/2013 8:00:00 PM","Title":"Stupid Butterfly Bitches","PreviewUrl":"https://www.keithandthegirl.com/mp3/promo/bottoms-up-with-hennessy/bottoms-up-1-trailer.mp3","FileUrl":"http://www.keithandthegirl.com/vip/download/shows/lauren/HENNY-2013-01-29.mp3","Type":"0","Public":"0","Timestamp":1359507600,"Guests":[]}]