[{"ShowId":"3877","ShowNameId":"3","Number":"45","PostedDate":"7/7/2015 12:00:00 PM","Title":"The 1-Slice Pizza Challenge","VideoFileUrl":"https://www.keithandthegirl.com/vip/download/shows/katgtv/video/45/KATGtv-2015-07-07.m3u8","VideoThumbnailUrl":"https://www.keithandthegirl.com/vip/download/shows/katgtv/video/45/KATGtv-2015-07-07-video.jpg","PreviewUrl":"","FileUrl":"http://www.keithandthegirl.com/vip/download/shows/katgtv/KATGtv-2015-07-07.mp3","Type":"0","Public":"0","Timestamp":1436284800,"Guests":[]},{"ShowId":"3876","ShowNameId":"3","Number":"44","PostedDate":"7/6/2015 12:00:00 PM","Title":"The All-Female Pizza Eating Competition","VideoFileUrl":"https://www.keithandthegirl.com/vip/download/shows/katgtv/video/44/KATGtv-2015-07-06.m3u8","VideoThumbnailUrl":"https://www.keithandthegirl.com/vip/download/shows/katgtv/video/44/KATGtv-2015-07-06-video.jpg","PreviewUrl":"https://www.youtube.com/watch?v=lV_FbBL4Fuk","FileUrl":"http://www.keithandthegirl.com/vip/download/shows/katgtv/KATGtv-2015-07-06.mp3","Type":"0","Public":"0","Timestamp":1436198400,"Guests":[]},{"ShowId":"3129","ShowNameId":"3","Number":"43","PostedDate":"2/17/2014 12:00:00 PM","Title":" Keith and The Girl\u0027s First Silent Film","VideoFileUrl":"https://www.keithandthegirl.com/vip/download/shows/katgtv/video/43/KATGtv-2014-02-17.m3u8","VideoThumbnailUrl":"https://www.keithandthegirl.com/vip/download/shows/katgtv/video/43/KATGtv-2014-02-17-video.jpg","PreviewUrl":"","FileUrl":"http://www.keithandthegirl.com/vip/download/shows/katgtv/KATGtv-2014-02-17.mp3","Type":"0","Public":"0","Timestamp":1392656400,"Guests":[]},{"ShowId":"3397","ShowNameId":"3","Number":"42","PostedDate":"3/22/2013 7:00:00 PM","Title":"Danny Hatch ","VideoFileUrl":"https://www.keithandthegirl.com/vip/download/shows/katgtv/video/42/KATGtv-2013-03-22.m3u8","VideoThumbnailUrl":"https://www.keithandthegirl.com/vip/download/shows/katgtv/video/42/KATGtv-2013-03-22-video.jpg","PreviewUrl":"https://www.youtube.com/watch?v=sKgfgA8B7vc","FileUrl":"http://www.keithandthegirl.com/vip/download/shows/katgtv/KATGtv-2013-03-22.mp3","Type":"0","Public":"0","Timestamp":1363993200,"Guests":[]},{"ShowId":"2521","ShowNameId":"3","Number":"41","PostedDate":"12/18/2012 1:00:00 AM","Title":"The Burger-Off 2","VideoFileUrl":"https://www.keithandthegirl.com/vip/download/shows/katgtv/video/41/KATGtv-2012-12-18.m3u8","VideoThumbnailUrl":"https://www.keithandthegirl.com/vip/download/shows/katgtv/video/41/KATGtv-2012-12-18-video.jpg","PreviewUrl":"https://www.youtube.com/watch?v=FToBuu7ckGQ","FileUrl":"http://www.keithandthegirl.com/vip/download/shows/katgtv/KATGtv-2012-12-18.mp3","Type":"0","Public":"0","Timestamp":1355810400,"Guests":[{"Data":"78","ShowGuestId":"78","RealName":"36D","Description":"Spooky\u0027s on again/off again/really off again love interest.","PictureFilename":"36D.jpg","Url1":"\thttp://www.myspace.com/36dkatg","Url2":"","PictureUrl":"http://static-2.keithandthegirl.net/guests/pics/processed/36D-150x150.jpg","PictureUrlLarge":"http://static-2.keithandthegirl.net/guests/pics/processed/36D-600x600.jpg"},{"Data":"91","ShowGuestId":"91","RealName":"Myka Fox","Description":"Comedian and writer for Saturday Night Live and someecards, and host of Myka Fox \u0026 Friends.","PictureFilename":"Myka-Fox.jpg","Url1":"http://www.twitter.com/mykafox","Url2":"http://www.facebook.com/mykafox","PictureUrl":"http://static-3.keithandthegirl.net/guests/pics/processed/Myka-Fox-150x150.jpg","PictureUrlLarge":"http://static-3.keithandthegirl.net/guests/pics/processed/Myka-Fox-600x600.jpg"},{"Data":"86","ShowGuestId":"86","RealName":"Pat Dixon","Description":"Comedian known for his appearances on Best Week Ever and for his podcast, The New York City Crime Report.","PictureFilename":"Pat-Dixon.jpg","Url1":"http://www.facebook.com/comedianpatdixon?ref=ts","Url2":"http://www.ComedianPatDixon.com","PictureUrl":"http://static-1.keithandthegirl.net/guests/pics/processed/Pat-Dixon-150x150.jpg","PictureUrlLarge":"http://static-1.keithandthegirl.net/guests/pics/processed/Pat-Dixon-600x600.jpg"},{"Data":"225","ShowGuestId":"225","RealName":"Peter Grossman","Description":"Editor for US Weekly who tracked down John Petrie.","PictureFilename":"Peter-Grossman.jpg","Url1":"","Url2":"","PictureUrl":"http://static-4.keithandthegirl.net/guests/pics/processed/Peter-Grossman-150x150.jpg","PictureUrlLarge":"http://static-4.keithandthegirl.net/guests/pics/processed/Peter-Grossman-600x600.jpg"}]},{"ShowId":"2354","ShowNameId":"3","Number":"40","PostedDate":"6/15/2012 12:00:00 PM","Title":"Rex Ryan Gets Off On The Wrong Foot","VideoFileUrl":"https://www.keithandthegirl.com/vip/download/shows/katgtv/video/40/KATGtv-2012-06-15.m3u8","VideoThumbnailUrl":"https://www.keithandthegirl.com/vip/download/shows/katgtv/video/40/KATGtv-2012-06-15-video.jpg","PreviewUrl":"","FileUrl":"http://www.keithandthegirl.com/vip/download/shows/katgtv/KATGtv-2012-06-15.mp3","Type":"0","Public":"0","Timestamp":1339776000,"Guests":[]},{"ShowId":"2332","ShowNameId":"3","Number":"39","PostedDate":"5/16/2012","Title":"Man\u0027s Best Friend","VideoFileUrl":"https://www.keithandthegirl.com/vip/download/shows/katgtv/video/39/KATGtv-2012-05-16.m3u8","VideoThumbnailUrl":"https://www.keithandthegirl.com/vip/download/shows/katgtv/video/39/KATGtv-2012-05-16-video.jpg","PreviewUrl":"","FileUrl":"http://www.keithandthegirl.com/vip/download/shows/katgtv/KATGtv-2012-05-16.mp3","Type":"0","Public":"0","Timestamp":1337140800,"Guests":[{"Data":"209","ShowGuestId":"209","RealName":"Benjamin \u0026 TJ","Description":"The sweetest gay dog couple you\u0027ll ever meet.","PictureFilename":"Benjamin-TJ.jpg","Url1":"","Url2":"","PictureUrl":"http://static-1.keithandthegirl.net/guests/pics/processed/Benjamin-TJ-150x150.jpg","PictureUrlLarge":"http://static-1.keithandthegirl.net/guests/pics/processed/Benjamin-TJ-600x600.jpg"}]},{"ShowId":"2330","ShowNameId":"3","Number":"38","PostedDate":"5/15/2012","Title":"The Keith and The Girl Flash Mob","VideoFileUrl":"https://www.keithandthegirl.com/vip/download/shows/katgtv/video/38/KATGtv-2012-05-15.m3u8","VideoThumbnailUrl":"https://www.keithandthegirl.com/vip/download/shows/katgtv/video/38/KATGtv-2012-05-15-video.jpg","PreviewUrl":"","FileUrl":"http://www.keithandthegirl.com/vip/download/shows/katgtv/KATGtv-2012-05-15.mp3","Type":"0","Public":"0","Timestamp":1337054400,"Guests":[]},{"ShowId":"2190","ShowNameId":"3","Number":"37","PostedDate":"8/24/2011","Title":"The Keith and The Girl Roast","VideoFileUrl":"https://www.keithandthegirl.com/vip/download/shows/katgtv/video/37/KATGtv-2011-08-24.m3u8","VideoThumbnailUrl":"https://www.keithandthegirl.com/vip/download/shows/katgtv/video/37/KATGtv-2011-08-24-video.jpg","PreviewUrl":"","FileUrl":"http://www.keithandthegirl.com/vip/download/shows/katgtv/KATGtv-2011-08-24.mp3","Type":"0","Public":"0","Timestamp":1314158400,"Guests":[]},{"ShowId":"2047","ShowNameId":"3","Number":"36","PostedDate":"4/25/2011","Title":"The King","VideoFileUrl":"https://www.keithandthegirl.com/vip/download/shows/katgtv/video/36/KATGtv-2011-04-25.m3u8","VideoThumbnailUrl":"https://www.keithandthegirl.com/vip/download/shows/katgtv/video/36/KATGtv-2011-04-25-video.jpg","PreviewUrl":"","FileUrl":"http://www.keithandthegirl.com/vip/download/shows/katgtv/KATGtv-2011-04-25.mp3","Type":"0","Public":"0","Timestamp":1303704000,"Guests":[]},{"ShowId":"1915","ShowNameId":"3","Number":"35","PostedDate":"12/1/2010","Title":"Comic Con (Fuck Yeah! Suck Yeah!)","VideoFileUrl":"https://www.keithandthegirl.com/vip/download/shows/katgtv/video/35/KATGtv-2010-12-01.m3u8","VideoThumbnailUrl":"https://www.keithandthegirl.com/vip/download/shows/katgtv/video/35/KATGtv-2010-12-01-video.jpg","PreviewUrl":"","FileUrl":"http://www.keithandthegirl.com/vip/download/shows/katgtv/KATGtv-2010-12-01.mp3","Type":"0","Public":"0","Timestamp":1291179600,"Guests":[]},{"ShowId":"1814","ShowNameId":"3","Number":"34","PostedDate":"6/17/2010 8:00:00 PM","Title":"A Few Goat Men","VideoFileUrl":"https://www.keithandthegirl.com/vip/download/shows/katgtv/video/34/KATGtv-2010-06-17.m3u8","VideoThumbnailUrl":"https://www.keithandthegirl.com/vip/download/shows/katgtv/video/34/KATGtv-2010-06-17-video.jpg","PreviewUrl":"","FileUrl":"http://www.keithandthegirl.com/vip/download/shows/katgtv/KATGtv-2010-06-17.mp3","Type":"0","Public":"0","Timestamp":1276819200,"Guests":[{"Data":"48","ShowGuestId":"48","RealName":"F-MOS","Description":"Rapper known for his album BNYB-Bringing New York Back.","PictureFilename":"F-MOS.jpg","Url1":"http://facebook.com/fmosmusic","Url2":"http://www.fmosmusic.com","PictureUrl":"http://static-4.keithandthegirl.net/guests/pics/processed/F-MOS-150x150.jpg","PictureUrlLarge":"http://static-4.keithandthegirl.net/guests/pics/processed/F-MOS-600x600.jpg"},{"Data":"2","ShowGuestId":"2","RealName":"Patrice Callender","Description":"Gossip Queen turned major scam artist that preys on close friends","PictureFilename":"Patrice.jpg","Url1":"","Url2":"","PictureUrl":"http://static-4.keithandthegirl.net/guests/pics/processed/Patrice-150x150.jpg","PictureUrlLarge":"http://static-4.keithandthegirl.net/guests/pics/processed/Patrice-600x600.jpg"}]},{"ShowId":"1634","ShowNameId":"3","Number":"33","PostedDate":"6/15/2010 8:00:00 PM","Title":"Sliding Down","VideoFileUrl":"https://www.keithandthegirl.com/vip/download/shows/katgtv/video/33/KATGtv-2010-06-15.m3u8","VideoThumbnailUrl":"https://www.keithandthegirl.com/vip/download/shows/katgtv/video/33/KATGtv-2010-06-15-video.jpg","PreviewUrl":"","FileUrl":"http://www.keithandthegirl.com/vip/download/shows/katgtv/KATGtv-2010-06-15.mp3","Type":"0","Public":"0","Timestamp":1276646400,"Guests":[{"Data":"99","ShowGuestId":"99","RealName":"Newsy","Description":"Sexual deviant/photographer. ","PictureFilename":"newsy-new.jpg","Url1":"http://newsy412.tumblr.com/","Url2":"https://twitter.com/Newsy412","PictureUrl":"http://static-3.keithandthegirl.net/guests/pics/processed/newsy-new-150x150.jpg","PictureUrlLarge":"http://static-3.keithandthegirl.net/guests/pics/processed/newsy-new-600x600.jpg"}]},{"ShowId":"1631","ShowNameId":"3","Number":"32","PostedDate":"6/14/2010 6:30:00 PM","Title":"Cactus Joe","VideoFileUrl":"https://www.keithandthegirl.com/vip/download/shows/katgtv/video/32/KATGtv-2010-06-14.m3u8","VideoThumbnailUrl":"https://www.keithandthegirl.com/vip/download/shows/katgtv/video/32/KATGtv-2010-06-14-video.jpg","PreviewUrl":"","FileUrl":"http://www.keithandthegirl.com/vip/download/shows/katgtv/KATGtv-2010-06-14.mp3","Type":"0","Public":"0","Timestamp":1276554600,"Guests":[{"Data":"130","ShowGuestId":"130","RealName":"Kyle Thompson","Description":"Musician known for his bands Bridget and the Squares, Spookyhoot!, and DEAD//BEAT.","PictureFilename":"Kyle-Thompson.jpg","Url1":"http://www.twitter.com/kyleinnyc","Url2":"http://www.facebook.com/kyyylethompson","PictureUrl":"http://static-1.keithandthegirl.net/guests/pics/processed/Kyle-Thompson-150x150.jpg","PictureUrlLarge":"http://static-1.keithandthegirl.net/guests/pics/processed/Kyle-Thompson-600x600.jpg"}]},{"ShowId":"1543","ShowNameId":"3","Number":"31","PostedDate":"2/4/2010","Title":"Little Baby Faggot","VideoFileUrl":"https://www.keithandthegirl.com/vip/download/shows/katgtv/video/31/KATGtv-2010-02-04.m3u8","VideoThumbnailUrl":"https://www.keithandthegirl.com/vip/download/shows/katgtv/video/31/KATGtv-2010-02-04-video.jpg","PreviewUrl":"","FileUrl":"http://www.keithandthegirl.com/vip/download/shows/katgtv/KATGtv-2010-02-04.mp3","Type":"0","Public":"0","Timestamp":1265259600,"Guests":[{"Data":"86","ShowGuestId":"86","RealName":"Pat Dixon","Description":"Comedian known for his appearances on Best Week Ever and for his podcast, The New York City Crime Report.","PictureFilename":"Pat-Dixon.jpg","Url1":"http://www.facebook.com/comedianpatdixon?ref=ts","Url2":"http://www.ComedianPatDixon.com","PictureUrl":"http://static-1.keithandthegirl.net/guests/pics/processed/Pat-Dixon-150x150.jpg","PictureUrlLarge":"http://static-1.keithandthegirl.net/guests/pics/processed/Pat-Dixon-600x600.jpg"}]},{"ShowId":"1540","ShowNameId":"3","Number":"30","PostedDate":"2/2/2010 10:00:00 PM","Title":"Man vs. Machine","VideoFileUrl":"https://www.keithandthegirl.com/vip/download/shows/katgtv/video/30/KATGtv-2010-02-02.m3u8","VideoThumbnailUrl":"https://www.keithandthegirl.com/vip/download/shows/katgtv/video/30/KATGtv-2010-02-02-video.jpg","PreviewUrl":"","FileUrl":"http://www.keithandthegirl.com/vip/download/shows/katgtv/KATGtv-2010-02-02.mp3","Type":"0","Public":"0","Timestamp":1265166000,"Guests":[{"Data":"130","ShowGuestId":"130","RealName":"Kyle Thompson","Description":"Musician known for his bands Bridget and the Squares, Spookyhoot!, and DEAD//BEAT.","PictureFilename":"Kyle-Thompson.jpg","Url1":"http://www.twitter.com/kyleinnyc","Url2":"http://www.facebook.com/kyyylethompson","PictureUrl":"http://static-1.keithandthegirl.net/guests/pics/processed/Kyle-Thompson-150x150.jpg","PictureUrlLarge":"http://static-1.keithandthegirl.net/guests/pics/processed/Kyle-Thompson-600x600.jpg"},{"Data":"99","ShowGuestId":"99","RealName":"Newsy","Description":"Sexual deviant/photographer. ","PictureFilename":"newsy-new.jpg","Url1":"http://newsy412.tumblr.com/","Url2":"https://twitter.com/Newsy412","PictureUrl":"http://static-3.keithandthegirl.net/guests/pics/processed/newsy-new-150x150.jpg","PictureUrlLarge":"http://static-3.keithandthegirl.net/guests/pics/processed/newsy-new-600x600.jpg"}]},{"ShowId":"1504","ShowNameId":"3","Number":"29","PostedDate":"12/10/2009 9:30:00 PM","Title":"Keith Malley","VideoFileUrl":"https://www.keithandthegirl.com/vip/download/shows/katgtv/video/29/KATGtv-2009-12-10.m3u8","VideoThumbnailUrl":"https://www.keithandthegirl.com/vip/download/shows/katgtv/video/29/KATGtv-2009-12-10-video.jpg","PreviewUrl":"","FileUrl":"http://www.keithandthegirl.com/vip/download/shows/katgtv/KATGtv-2009-12-10.mp3","Type":"0","Public":"0","Timestamp":1260498600,"Guests":[]},{"ShowId":"1485","ShowNameId":"3","Number":"28","PostedDate":"11/11/2009","Title":"Pat Dixon and Jesse Joyce","VideoFileUrl":"https://www.keithandthegirl.com/vip/download/shows/katgtv/video/28/KATGtv-2009-11-11.m3u8","VideoThumbnailUrl":"https://www.keithandthegirl.com/vip/download/shows/katgtv/video/28/KATGtv-2009-11-11-video.jpg","PreviewUrl":"","FileUrl":"http://www.keithandthegirl.com/vip/download/shows/katgtv/KATGtv-2009-11-11.mp3","Type":"0","Public":"0","Timestamp":1257915600,"Guests":[{"Data":"51","ShowGuestId":"51","RealName":"Jesse Joyce","Description":"Comedian and writer who wrote for numerous Comedy Central Roasts and the 85th Academy Awards ceremony.","PictureFilename":"Jesse-Joyce.jpg","Url1":"http://www.facebook.com/profile.php?id=506265141\u0026ref=ts#!/JesseJoyce.comedy","Url2":"http://www.jessejoyce.com","PictureUrl":"http://static-1.keithandthegirl.net/guests/pics/processed/Jesse-Joyce-150x150.jpg","PictureUrlLarge":"http://static-1.keithandthegirl.net/guests/pics/processed/Jesse-Joyce-600x600.jpg"},{"Data":"86","ShowGuestId":"86","RealName":"Pat Dixon","Description":"Comedian known for his appearances on Best Week Ever and for his podcast, The New York City Crime Report.","PictureFilename":"Pat-Dixon.jpg","Url1":"http://www.facebook.com/comedianpatdixon?ref=ts","Url2":"http://www.ComedianPatDixon.com","PictureUrl":"http://static-1.keithandthegirl.net/guests/pics/processed/Pat-Dixon-150x150.jpg","PictureUrlLarge":"http://static-1.keithandthegirl.net/guests/pics/processed/Pat-Dixon-600x600.jpg"}]},{"ShowId":"1467","ShowNameId":"3","Number":"27","PostedDate":"10/18/2009 11:59:00 PM","Title":"Victor Varnado","VideoFileUrl":"https://www.keithandthegirl.com/vip/download/shows/katgtv/video/27/KATGtv-2009-10-18.m3u8","VideoThumbnailUrl":"https://www.keithandthegirl.com/vip/download/shows/katgtv/video/27/KATGtv-2009-10-18-video.jpg","PreviewUrl":"","FileUrl":"http://www.keithandthegirl.com/vip/download/shows/katgtv/KATGtv-2009-10-18.mp3","Type":"0","Public":"0","Timestamp":1255924740,"Guests":[{"Data":"7","ShowGuestId":"7","RealName":"Victor Varnado","Description":"Stand-up comic, actor, producer, and director of The Awkward Comedy Show and Tell Your Friends: The Concert Film.","PictureFilename":"Victor-Varnado.jpg","Url1":"http://www.facebook.com/#!/vvarnado?ref=ts","Url2":"http://www.bestalbino.com","PictureUrl":"http://static-3.keithandthegirl.net/guests/pics/processed/Victor-Varnado-150x150.jpg","PictureUrlLarge":"http://static-3.keithandthegirl.net/guests/pics/processed/Victor-Varnado-600x600.jpg"}]},{"ShowId":"1456","ShowNameId":"3","Number":"26","PostedDate":"10/1/2009","Title":"The Hot Dog Eating Contest","VideoFileUrl":"https://www.keithandthegirl.com/vip/download/shows/katgtv/video/26/KATGtv-2009-10-01.m3u8","VideoThumbnailUrl":"https://www.keithandthegirl.com/vip/download/shows/katgtv/video/26/KATGtv-2009-10-01-video.jpg","PreviewUrl":"","FileUrl":"http://www.keithandthegirl.com/vip/download/shows/katgtv/KATGtv-2009-10-01.mp3","Type":"0","Public":"0","Timestamp":1254369600,"Guests":[{"Data":"74","ShowGuestId":"74","RealName":"Jeremy Schultz","Description":"KATG\u0027s Girl Friday - the finder of all information.","PictureFilename":"Jeremy-Schultz.jpg","Url1":"","Url2":"","PictureUrl":"http://static-3.keithandthegirl.net/guests/pics/processed/Jeremy-Schultz-150x150.jpg","PictureUrlLarge":"http://static-3.keithandthegirl.net/guests/pics/processed/Jeremy-Schultz-600x600.jpg"},{"Data":"92","ShowGuestId":"92","RealName":"Myq Kaplan","Description":"Comedian known for his appearances on Last Comic Standing and The Late Show with David Letterman, and for hosting the podcast Hang Out with Me.","PictureFilename":"Myq-Kaplan.jpg","Url1":"http://www.godzillionaire.blogspot.com","Url2":"http://www.myqkaplan.com","PictureUrl":"http://static-4.keithandthegirl.net/guests/pics/processed/Myq-Kaplan-150x150.jpg","PictureUrlLarge":"http://static-4.keithandthegirl.net/guests/pics/processed/Myq-Kaplan-600x600.jpg"}]},{"ShowId":"1448","ShowNameId":"3","Number":"25","PostedDate":"9/23/2009","Title":"Myq Kaplan","VideoFileUrl":"https://www.keithandthegirl.com/vip/download/shows/katgtv/video/25/KATGtv-2009-09-23.m3u8","VideoThumbnailUrl":"https://www.keithandthegirl.com/vip/download/shows/katgtv/video/25/KATGtv-2009-09-23-video.jpg","PreviewUrl":"","FileUrl":"http://www.keithandthegirl.com/vip/download/shows/katgtv/KATGtv-2009-09-23.mp3","Type":"0","Public":"0","Timestamp":1253678400,"Guests":[{"Data":"92","ShowGuestId":"92","RealName":"Myq Kaplan","Description":"Comedian known for his appearances on Last Comic Standing and The Late Show with David Letterman, and for hosting the podcast Hang Out with Me.","PictureFilename":"Myq-Kaplan.jpg","Url1":"http://www.godzillionaire.blogspot.com","Url2":"http://www.myqkaplan.com","PictureUrl":"http://static-4.keithandthegirl.net/guests/pics/processed/Myq-Kaplan-150x150.jpg","PictureUrlLarge":"http://static-4.keithandthegirl.net/guests/pics/processed/Myq-Kaplan-600x600.jpg"}]},{"ShowId":"1442","ShowNameId":"3","Number":"24","PostedDate":"9/16/2009 10:00:00 PM","Title":"Ray DeVito","VideoFileUrl":"https://www.keithandthegirl.com/vip/download/shows/katgtv/video/24/KATGtv-2009-09-16.m3u8","VideoThumbnailUrl":"https://www.keithandthegirl.com/vip/download/shows/katgtv/video/24/KATGtv-2009-09-16-video.jpg","PreviewUrl":"","FileUrl":"http://www.keithandthegirl.com/vip/download/shows/katgtv/KATGtv-2009-09-16.mp3","Type":"0","Public":"0","Timestamp":1253152800,"Guests":[{"Data":"89","ShowGuestId":"89","RealName":"Ray DeVito","Description":"Comedian known for his work on MTV\u0027s Guy Code and his album, 1647 Waterbury.","PictureFilename":"Ray-DeVito.jpg","Url1":"http://www.facebook.com/ray.devito","Url2":"http://www.raydevito.net","PictureUrl":"http://static-4.keithandthegirl.net/guests/pics/processed/Ray-DeVito-150x150.jpg","PictureUrlLarge":"http://static-4.keithandthegirl.net/guests/pics/processed/Ray-DeVito-600x600.jpg"}]},{"ShowId":"1428","ShowNameId":"3","Number":"23","PostedDate":"9/1/2009 7:45:00 PM","Title":"Chemda in Chell","VideoFileUrl":"https://www.keithandthegirl.com/vip/download/shows/katgtv/video/23/KATGtv-2009-09-01.m3u8","VideoThumbnailUrl":"https://www.keithandthegirl.com/vip/download/shows/katgtv/video/23/KATGtv-2009-09-01-video.jpg","PreviewUrl":"","FileUrl":"http://www.keithandthegirl.com/vip/download/shows/katgtv/KATGtv-2009-09-01.mp3","Type":"0","Public":"0","Timestamp":1251848700,"Guests":[]},{"ShowId":"1425","ShowNameId":"3","Number":"22","PostedDate":"8/30/2009 11:59:00 PM","Title":"The KATG Branding","VideoFileUrl":"https://www.keithandthegirl.com/vip/download/shows/katgtv/video/22/KATGtv-2009-08-30.m3u8","VideoThumbnailUrl":"https://www.keithandthegirl.com/vip/download/shows/katgtv/video/22/KATGtv-2009-08-30-video.jpg","PreviewUrl":"","FileUrl":"http://www.keithandthegirl.com/vip/download/shows/katgtv/KATGtv-2009-08-30.mp3","Type":"0","Public":"0","Timestamp":1251691140,"Guests":[{"Data":"100","ShowGuestId":"100","RealName":"Mike the Intern","Description":"Former pick-up artist and ex-KATG intern.","PictureFilename":"Mike-the-Intern.jpg","Url1":"http://www.facebook.com/mgarod","Url2":"http://twitter.com/astigos","PictureUrl":"http://static-2.keithandthegirl.net/guests/pics/processed/Mike-the-Intern-150x150.jpg","PictureUrlLarge":"http://static-2.keithandthegirl.net/guests/pics/processed/Mike-the-Intern-600x600.jpg"}]},{"ShowId":"1422","ShowNameId":"3","Number":"21","PostedDate":"8/27/2009 9:50:00 PM","Title":"The Chili-off","VideoFileUrl":"https://www.keithandthegirl.com/vip/download/shows/katgtv/video/21/KATGtv-2009-08-27.m3u8","VideoThumbnailUrl":"https://www.keithandthegirl.com/vip/download/shows/katgtv/video/21/KATGtv-2009-08-27-video.jpg","PreviewUrl":"","FileUrl":"http://www.keithandthegirl.com/vip/download/shows/katgtv/KATGtv-2009-08-27.mp3","Type":"0","Public":"0","Timestamp":1251424200,"Guests":[{"Data":"106","ShowGuestId":"106","RealName":"Lauren Hennessy","Description":"Icelandic Academy Award nominated actor, host of the podcast Bottoms Up with Hennessy, and Chemda\u0027s fiancé.","PictureFilename":"Lauren-Hennessy.jpg","Url1":"http://laurenhennessy.com","Url2":"http://www.facebook.com/lauren.hennessy","PictureUrl":"http://static-1.keithandthegirl.net/guests/pics/processed/Lauren-Hennessy-150x150.jpg","PictureUrlLarge":"http://static-1.keithandthegirl.net/guests/pics/processed/Lauren-Hennessy-600x600.jpg"},{"Data":"6","ShowGuestId":"6","RealName":"Matthew Bray","Description":"Film maker and KATG\u0027s technical support. Cinematographer on An Oversimplification of Her Beauty.","PictureFilename":"Matthew-Bray.jpg","Url1":"http://www.truthfilms.com","Url2":"","PictureUrl":"http://static-3.keithandthegirl.net/guests/pics/processed/Matthew-Bray-150x150.jpg","PictureUrlLarge":"http://static-3.keithandthegirl.net/guests/pics/processed/Matthew-Bray-600x600.jpg"},{"Data":"100","ShowGuestId":"100","RealName":"Mike the Intern","Description":"Former pick-up artist and ex-KATG intern.","PictureFilename":"Mike-the-Intern.jpg","Url1":"http://www.facebook.com/mgarod","Url2":"http://twitter.com/astigos","PictureUrl":"http://static-2.keithandthegirl.net/guests/pics/processed/Mike-the-Intern-150x150.jpg","PictureUrlLarge":"http://static-2.keithandthegirl.net/guests/pics/processed/Mike-the-Intern-600x600.jpg"}]},{"ShowId":"1416","ShowNameId":"3","Number":"20","PostedDate":"8/22/2009 12:00:00 PM","Title":"Myka FOX!!!","VideoFileUrl":"https://www.keithandthegirl.com/vip/download/shows/katgtv/video/20/KATGtv-2009-08-22.m3u8","VideoThumbnailUrl":"https://www.keithandthegirl.com/vip/download/shows/katgtv/video/20/KATGtv-2009-08-22-video.jpg","PreviewUrl":"","FileUrl":"http://www.keithandthegirl.com/vip/download/shows/katgtv/KATGtv-2009-08-22.mp3","Type":"0","Public":"0","Timestamp":1250956800,"Guests":[{"Data":"91","ShowGuestId":"91","RealName":"Myka Fox","Description":"Comedian and writer for Saturday Night Live and someecards, and host of Myka Fox \u0026 Friends.","PictureFilename":"Myka-Fox.jpg","Url1":"http://www.twitter.com/mykafox","Url2":"http://www.facebook.com/mykafox","PictureUrl":"http://static-3.keithandthegirl.net/guests/pics/processed/Myka-Fox-150x150.jpg","PictureUrlLarge":"http://static-3.keithandthegirl.net/guests/pics/processed/Myka-Fox-600x600.jpg"}]},{"ShowId":"1411","ShowNameId":"3","Number":"19","PostedDate":"8/16/2009 11:59:00 PM","Title":"The Burger-Off","VideoFileUrl":"https://www.keithandthegirl.com/vip/download/shows/katgtv/video/19/KATGtv-2009-08-16.m3u8","VideoThumbnailUrl":"https://www.keithandthegirl.com/vip/download/shows/katgtv/video/19/KATGtv-2009-08-16-video.jpg","PreviewUrl":"","FileUrl":"http://www.keithandthegirl.com/vip/download/shows/katgtv/KATGtv-2009-08-16.mp3","Type":"0","Public":"0","Timestamp":1250481540,"Guests":[]},{"ShowId":"1296","ShowNameId":"3","Number":"18","PostedDate":"3/6/2009","Title":"Party! Super Party!","VideoFileUrl":"https://www.keithandthegirl.com/vip/download/shows/katgtv/video/18/KATGtv-2009-03-06.m3u8","VideoThumbnailUrl":"https://www.keithandthegirl.com/vip/download/shows/katgtv/video/18/KATGtv-2009-03-06-video.jpg","PreviewUrl":"","FileUrl":"http://www.keithandthegirl.com/vip/download/shows/katgtv/KATGtv-2009-03-06.mp3","Type":"0","Public":"0","Timestamp":1236315600,"Guests":[]},{"ShowId":"1249","ShowNameId":"3","Number":"17","PostedDate":"12/30/2008","Title":"Yoink","VideoFileUrl":"https://www.keithandthegirl.com/vip/download/shows/katgtv/video/17/KATGtv-2008-12-30.m3u8","VideoThumbnailUrl":"https://www.keithandthegirl.com/vip/download/shows/katgtv/video/17/KATGtv-2008-12-30-video.jpg","PreviewUrl":"","FileUrl":"http://www.keithandthegirl.com/vip/download/shows/katgtv/KATGtv-2008-12-30.mp3","Type":"0","Public":"0","Timestamp":1230613200,"Guests":[]},{"ShowId":"1238","ShowNameId":"3","Number":"16","PostedDate":"12/18/2008","Title":"How to Take Care of a Baby","VideoFileUrl":"https://www.keithandthegirl.com/vip/download/shows/katgtv/video/16/KATGtv-2008-12-18.m3u8","VideoThumbnailUrl":"https://www.keithandthegirl.com/vip/download/shows/katgtv/video/16/KATGtv-2008-12-18-video.jpg","PreviewUrl":"","FileUrl":"http://www.keithandthegirl.com/vip/download/shows/katgtv/KATGtv-2008-12-18.mp3","Type":"0","Public":"0","Timestamp":1229576400,"Guests":[]},{"ShowId":"1185","ShowNameId":"3","Number":"15","PostedDate":"10/27/2008","Title":"A - Salvia","VideoFileUrl":"https://www.keithandthegirl.com/vip/download/shows/katgtv/video/15/KATGtv-2008-10-27.m3u8","VideoThumbnailUrl":"https://www.keithandthegirl.com/vip/download/shows/katgtv/video/15/KATGtv-2008-10-27-video.jpg","PreviewUrl":"","FileUrl":"http://www.keithandthegirl.com/vip/download/shows/katgtv/KATGtv-2008-10-27.mp3","Type":"0","Public":"0","Timestamp":1225080000,"Guests":[{"Data":"33","ShowGuestId":"33","RealName":"Keith McNally","Description":"Former porn store clerk and learner of no life lessons whatsoever.","PictureFilename":"Keith-McNally.jpg","Url1":"http://www.facebook.com/#!/profile.php?id=100000959949180\u0026v=info\u0026ref=ts","Url2":"http://www.keithcourage.com","PictureUrl":"http://static-3.keithandthegirl.net/guests/pics/processed/Keith-McNally-150x150.jpg","PictureUrlLarge":"http://static-3.keithandthegirl.net/guests/pics/processed/Keith-McNally-600x600.jpg"},{"Data":"100","ShowGuestId":"100","RealName":"Mike the Intern","Description":"Former pick-up artist and ex-KATG intern.","PictureFilename":"Mike-the-Intern.jpg","Url1":"http://www.facebook.com/mgarod","Url2":"http://twitter.com/astigos","PictureUrl":"http://static-2.keithandthegirl.net/guests/pics/processed/Mike-the-Intern-150x150.jpg","PictureUrlLarge":"http://static-2.keithandthegirl.net/guests/pics/processed/Mike-the-Intern-600x600.jpg"}]},{"ShowId":"1226","ShowNameId":"3","Number":"15","PostedDate":"12/2/2008","Title":"B - Baked PotatoE","VideoFileUrl":"https://www.keithandthegirl.com/vip/download/shows/katgtv/video/15/KATGtv-2008-12-02.m3u8","VideoThumbnailUrl":"https://www.keithandthegirl.com/vip/download/shows/katgtv/video/15/KATGtv-2008-12-02-video.jpg","PreviewUrl":"","FileUrl":"http://www.keithandthegirl.com/vip/download/shows/katgtv/KATGtv-2008-12-02.mp3","Type":"0","Public":"0","Timestamp":1228194000,"Guests":[{"Data":"69","ShowGuestId":"69","RealName":"Emmy","Description":"KATG\u0027s original intern.","PictureFilename":"Sexy-PotatoE.jpg","Url1":"http://www.facebook.com/emmyp","Url2":"http://thehardcandy.com/","PictureUrl":"http://static-1.keithandthegirl.net/guests/pics/processed/Sexy-PotatoE-150x150.jpg","PictureUrlLarge":"http://static-1.keithandthegirl.net/guests/pics/processed/Sexy-PotatoE-600x600.jpg"}]},{"ShowId":"1146","ShowNameId":"3","Number":"14","PostedDate":"9/1/2008","Title":"KATG\u0027s Wedding/Fight","VideoFileUrl":"https://www.keithandthegirl.com/vip/download/shows/katgtv/video/14/KATGtv-2008-09-01.m3u8","VideoThumbnailUrl":"https://www.keithandthegirl.com/vip/download/shows/katgtv/video/14/KATGtv-2008-09-01-video.jpg","PreviewUrl":"","FileUrl":"http://www.keithandthegirl.com/vip/download/shows/katgtv/KATGtv-2008-09-01.mp3","Type":"0","Public":"0","Timestamp":1220241600,"Guests":[]},{"ShowId":"1082","ShowNameId":"3","Number":"13","PostedDate":"6/1/2008 9:25:00 PM","Title":"Dance Monkey Dance","VideoFileUrl":"https://www.keithandthegirl.com/vip/download/shows/katgtv/video/13/KATGtv-2008-06-01.m3u8","VideoThumbnailUrl":"https://www.keithandthegirl.com/vip/download/shows/katgtv/video/13/KATGtv-2008-06-01-video.jpg","PreviewUrl":"","FileUrl":"http://www.keithandthegirl.com/vip/download/shows/katgtv/KATGtv-2008-06-01.mp3","Type":"0","Public":"0","Timestamp":1212369900,"Guests":[]},{"ShowId":"1061","ShowNameId":"3","Number":"12","PostedDate":"5/4/2008 10:55:00 AM","Title":"Derby!!!","VideoFileUrl":"https://www.keithandthegirl.com/vip/download/shows/katgtv/video/12/KATGtv-2008-05-04.m3u8","VideoThumbnailUrl":"https://www.keithandthegirl.com/vip/download/shows/katgtv/video/12/KATGtv-2008-05-04-video.jpg","PreviewUrl":"","FileUrl":"http://www.keithandthegirl.com/vip/download/shows/katgtv/KATGtv-2008-05-04.mp3","Type":"0","Public":"0","Timestamp":1209912900,"Guests":[]},{"ShowId":"1058","ShowNameId":"3","Number":"11","PostedDate":"4/28/2008","Title":"Spooky vs Deuce 2","VideoFileUrl":"https://www.keithandthegirl.com/vip/download/shows/katgtv/video/11/KATGtv-2008-04-28.m3u8","VideoThumbnailUrl":"https://www.keithandthegirl.com/vip/download/shows/katgtv/video/11/KATGtv-2008-04-28-video.jpg","PreviewUrl":"","FileUrl":"http://www.keithandthegirl.com/vip/download/shows/katgtv/KATGtv-2008-04-28.mp3","Type":"0","Public":"0","Timestamp":1209355200,"Guests":[{"Data":"12","ShowGuestId":"12","RealName":"MC Deuce Deuce","Description":"Israeli comedian/soldier/douche.","PictureFilename":"MC-Deuce-Deuce.jpg","Url1":"","Url2":"","PictureUrl":"http://static-4.keithandthegirl.net/guests/pics/processed/MC-Deuce-Deuce-150x150.jpg","PictureUrlLarge":"http://static-4.keithandthegirl.net/guests/pics/processed/MC-Deuce-Deuce-600x600.jpg"},{"Data":"4","ShowGuestId":"4","RealName":"Spooky","Description":"This socially retarded 30-something-year old is just starting to get over his stunted growth as a man. Feel free to point and laugh.","PictureFilename":"Spooky.jpg","Url1":"http://www.myspace.com/spookyinthecity","Url2":"","PictureUrl":"http://static-4.keithandthegirl.net/guests/pics/processed/Spooky-150x150.jpg","PictureUrlLarge":"http://static-4.keithandthegirl.net/guests/pics/processed/Spooky-600x600.jpg"}]},{"ShowId":"1016","ShowNameId":"3","Number":"10","PostedDate":"3/3/2008","Title":"Four Short Films","VideoFileUrl":"https://www.keithandthegirl.com/vip/download/shows/katgtv/video/10/KATGtv-2008-03-03.m3u8","VideoThumbnailUrl":"https://www.keithandthegirl.com/vip/download/shows/katgtv/video/10/KATGtv-2008-03-03-video.jpg","PreviewUrl":"","FileUrl":"http://www.keithandthegirl.com/vip/download/shows/katgtv/KATGtv-2008-03-03.mp3","Type":"0","Public":"0","Timestamp":1204520400,"Guests":[]},{"ShowId":"995","ShowNameId":"3","Number":"9","PostedDate":"2/11/2008","Title":"Last Comic Standing","VideoFileUrl":"https://www.keithandthegirl.com/vip/download/shows/katgtv/video/9/KATGtv-2008-02-11.m3u8","VideoThumbnailUrl":"https://www.keithandthegirl.com/vip/download/shows/katgtv/video/9/KATGtv-2008-02-11-video.jpg","PreviewUrl":"","FileUrl":"http://www.keithandthegirl.com/vip/download/shows/katgtv/KATGtv-2008-02-11.mp3","Type":"0","Public":"0","Timestamp":1202706000,"Guests":[{"Data":"51","ShowGuestId":"51","RealName":"Jesse Joyce","Description":"Comedian and writer who wrote for numerous Comedy Central Roasts and the 85th Academy Awards ceremony.","PictureFilename":"Jesse-Joyce.jpg","Url1":"http://www.facebook.com/profile.php?id=506265141\u0026ref=ts#!/JesseJoyce.comedy","Url2":"http://www.jessejoyce.com","PictureUrl":"http://static-1.keithandthegirl.net/guests/pics/processed/Jesse-Joyce-150x150.jpg","PictureUrlLarge":"http://static-1.keithandthegirl.net/guests/pics/processed/Jesse-Joyce-600x600.jpg"},{"Data":"47","ShowGuestId":"47","RealName":"Michael Mattera","Description":"Comedian who was voted into the semi-finals for the 2007 New York Comedy Festival\u0027s \"Funniest Comedian in the City.\"","PictureFilename":"Michael-Mattera.jpg","Url1":"http://www.facebook.com/#!/profile.php?id=778466037\u0026ref=ts","Url2":"","PictureUrl":"http://static-3.keithandthegirl.net/guests/pics/processed/Michael-Mattera-150x150.jpg","PictureUrlLarge":"http://static-3.keithandthegirl.net/guests/pics/processed/Michael-Mattera-600x600.jpg"}]},{"ShowId":"989","ShowNameId":"3","Number":"8","PostedDate":"2/4/2008 7:00:00 PM","Title":"Ask Heath Ledger","VideoFileUrl":"https://www.keithandthegirl.com/vip/download/shows/katgtv/video/8/KATGtv-2008-02-04.m3u8","VideoThumbnailUrl":"https://www.keithandthegirl.com/vip/download/shows/katgtv/video/8/KATGtv-2008-02-04-video.jpg","PreviewUrl":"","FileUrl":"http://www.keithandthegirl.com/vip/download/shows/katgtv/KATGtv-2008-02-04.mp3","Type":"0","Public":"0","Timestamp":1202169600,"Guests":[{"Data":"4","ShowGuestId":"4","RealName":"Spooky","Description":"This socially retarded 30-something-year old is just starting to get over his stunted growth as a man. Feel free to point and laugh.","PictureFilename":"Spooky.jpg","Url1":"http://www.myspace.com/spookyinthecity","Url2":"","PictureUrl":"http://static-4.keithandthegirl.net/guests/pics/processed/Spooky-150x150.jpg","PictureUrlLarge":"http://static-4.keithandthegirl.net/guests/pics/processed/Spooky-600x600.jpg"}]},{"ShowId":"981","ShowNameId":"3","Number":"7","PostedDate":"1/21/2008","Title":"Game Night","VideoFileUrl":"https://www.keithandthegirl.com/vip/download/shows/katgtv/video/7/KATGtv-2008-01-21.m3u8","VideoThumbnailUrl":"https://www.keithandthegirl.com/vip/download/shows/katgtv/video/7/KATGtv-2008-01-21-video.jpg","PreviewUrl":"","FileUrl":"http://www.keithandthegirl.com/vip/download/shows/katgtv/KATGtv-2008-01-21.mp3","Type":"0","Public":"0","Timestamp":1200891600,"Guests":[]},{"ShowId":"976","ShowNameId":"3","Number":"6","PostedDate":"1/14/2008","Title":"Personal Time","VideoFileUrl":"https://www.keithandthegirl.com/vip/download/shows/katgtv/video/6/KATGtv-2008-01-14.m3u8","VideoThumbnailUrl":"https://www.keithandthegirl.com/vip/download/shows/katgtv/video/6/KATGtv-2008-01-14-video.jpg","PreviewUrl":"","FileUrl":"http://www.keithandthegirl.com/vip/download/shows/katgtv/KATGtv-2008-01-14.mp3","Type":"0","Public":"0","Timestamp":1200286800,"Guests":[]},{"ShowId":"953","ShowNameId":"3","Number":"5","PostedDate":"12/17/2007","Title":"Cinnamon Challenge","VideoFileUrl":"https://www.keithandthegirl.com/vip/download/shows/katgtv/video/5/KATGtv-2007-12-17.m3u8","VideoThumbnailUrl":"https://www.keithandthegirl.com/vip/download/shows/katgtv/video/5/KATGtv-2007-12-17-video.jpg","PreviewUrl":"","FileUrl":"http://www.keithandthegirl.com/vip/download/shows/katgtv/KATGtv-2007-12-17.mp3","Type":"0","Public":"0","Timestamp":1197867600,"Guests":[]},{"ShowId":"947","ShowNameId":"3","Number":"4","PostedDate":"12/10/2007","Title":"Bad Breath","VideoFileUrl":"https://www.keithandthegirl.com/vip/download/shows/katgtv/video/4/KATGtv-2007-12-10.m3u8","VideoThumbnailUrl":"https://www.keithandthegirl.com/vip/download/shows/katgtv/video/4/KATGtv-2007-12-10-video.jpg","PreviewUrl":"","FileUrl":"http://www.keithandthegirl.com/vip/download/shows/katgtv/KATGtv-2007-12-10.mp3","Type":"0","Public":"0","Timestamp":1197262800,"Guests":[]},{"ShowId":"936","ShowNameId":"3","Number":"3","PostedDate":"11/26/2007","Title":"Phenomenon","VideoFileUrl":"https://www.keithandthegirl.com/vip/download/shows/katgtv/video/3/KATGtv-2007-11-26.m3u8","VideoThumbnailUrl":"https://www.keithandthegirl.com/vip/download/shows/katgtv/video/3/KATGtv-2007-11-26-video.jpg","PreviewUrl":"","FileUrl":"http://www.keithandthegirl.com/vip/download/shows/katgtv/KATGtv-2007-11-26.mp3","Type":"0","Public":"0","Timestamp":1196053200,"Guests":[]},{"ShowId":"932","ShowNameId":"3","Number":"2","PostedDate":"11/18/2007 9:00:00 PM","Title":"2 Girls 1 Cup","VideoFileUrl":"https://www.keithandthegirl.com/vip/download/shows/katgtv/video/2/KATGtv-2007-11-18.m3u8","VideoThumbnailUrl":"https://www.keithandthegirl.com/vip/download/shows/katgtv/video/2/KATGtv-2007-11-18-video.jpg","PreviewUrl":"","FileUrl":"http://www.keithandthegirl.com/vip/download/shows/katgtv/KATGtv-2007-11-18.mp3","Type":"0","Public":"0","Timestamp":1195437600,"Guests":[]},{"ShowId":"933","ShowNameId":"3","Number":"1","PostedDate":"11/11/2007 9:00:00 PM","Title":"Heather Mills","VideoFileUrl":"https://www.keithandthegirl.com/vip/download/shows/katgtv/video/1/KATGtv-2007-11-11.m3u8","VideoThumbnailUrl":"https://www.keithandthegirl.com/vip/download/shows/katgtv/video/1/KATGtv-2007-11-11-video.jpg","PreviewUrl":"","FileUrl":"http://www.keithandthegirl.com/vip/download/shows/katgtv/KATGtv-2007-11-11.mp3","Type":"0","Public":"0","Timestamp":1194832800,"Guests":[]}]