[{"ShowId":"3887","ShowNameId":"16","Number":"100","PostedDate":"7/13/2015 12:00:00 PM","Title":"Growing Up Danny","VideoFileUrl":"https://www.keithandthegirl.com/vip/download/shows/myka/video/100/MYKA-2015-07-13.m3u8","VideoThumbnailUrl":"https://www.keithandthegirl.com/vip/download/shows/myka/video/100/MYKA-2015-07-13-video.jpg","PreviewUrl":"https://www.youtube.com/watch?v=QawcELKASCc","FileUrl":"http://www.keithandthegirl.com/vip/download/shows/myka/MYKA-2015-07-13.mp3","Type":"0","Public":"0","Timestamp":1436803200,"Guests":[]},{"ShowId":"3878","ShowNameId":"16","Number":"99","PostedDate":"7/6/2015 12:00:00 PM","Title":"Clean Nails and Orgasms","VideoFileUrl":"https://www.keithandthegirl.com/vip/download/shows/myka/video/99/MYKA-2015-07-06.m3u8","VideoThumbnailUrl":"https://www.keithandthegirl.com/vip/download/shows/myka/video/99/MYKA-2015-07-06-video.jpg","PreviewUrl":"https://www.youtube.com/watch?v=aLXjbvsNZNg","FileUrl":"http://www.keithandthegirl.com/vip/download/shows/myka/MYKA-2015-07-06.mp3","Type":"0","Public":"0","Timestamp":1436198400,"Guests":[]},{"ShowId":"3866","ShowNameId":"16","Number":"98","PostedDate":"6/29/2015 12:00:00 PM","Title":"Everything They Do Is Bad","VideoFileUrl":"https://www.keithandthegirl.com/vip/download/shows/myka/video/98/MYKA-2015-06-29.m3u8","VideoThumbnailUrl":"https://www.keithandthegirl.com/vip/download/shows/myka/video/98/MYKA-2015-06-29-video.jpg","PreviewUrl":"https://www.youtube.com/watch?v=RpKI3s9V928","FileUrl":"http://www.keithandthegirl.com/vip/download/shows/myka/MYKA-2015-06-29.mp3","Type":"0","Public":"0","Timestamp":1435593600,"Guests":[]},{"ShowId":"3857","ShowNameId":"16","Number":"97","PostedDate":"6/22/2015 12:00:00 PM","Title":"Trans-Rachel","VideoFileUrl":"https://www.keithandthegirl.com/vip/download/shows/myka/video/97/MYKA-2015-06-22.m3u8","VideoThumbnailUrl":"https://www.keithandthegirl.com/vip/download/shows/myka/video/97/MYKA-2015-06-22-video.jpg","PreviewUrl":"https://www.youtube.com/watch?v=JdjHlMvxr2s","FileUrl":"http://www.keithandthegirl.com/vip/download/shows/myka/MYKA-2015-06-22.mp3","Type":"0","Public":"0","Timestamp":1434988800,"Guests":[]},{"ShowId":"3847","ShowNameId":"16","Number":"96","PostedDate":"6/15/2015 12:00:00 PM","Title":"Nacho Rides Again","VideoFileUrl":"https://www.keithandthegirl.com/vip/download/shows/myka/video/96/MYKA-2015-06-15.m3u8","VideoThumbnailUrl":"https://www.keithandthegirl.com/vip/download/shows/myka/video/96/MYKA-2015-06-15-video.jpg","PreviewUrl":"https://www.youtube.com/watch?v=g7aaLgdJaM8","FileUrl":"http://www.keithandthegirl.com/vip/download/shows/myka/MYKA-2015-06-15.mp3","Type":"0","Public":"0","Timestamp":1434384000,"Guests":[]},{"ShowId":"3838","ShowNameId":"16","Number":"95","PostedDate":"6/8/2015 12:00:00 PM","Title":"I\u0027m The Best Drunk","VideoFileUrl":"https://www.keithandthegirl.com/vip/download/shows/myka/video/95/MYKA-2015-06-08.m3u8","VideoThumbnailUrl":"https://www.keithandthegirl.com/vip/download/shows/myka/video/95/MYKA-2015-06-08-video.jpg","PreviewUrl":"https://www.youtube.com/watch?v=j_bMmjcmuXw","FileUrl":"http://www.keithandthegirl.com/vip/download/shows/myka/MYKA-2015-06-08.mp3","Type":"0","Public":"0","Timestamp":1433779200,"Guests":[]},{"ShowId":"3829","ShowNameId":"16","Number":"94","PostedDate":"6/1/2015 12:00:00 PM","Title":"Wiffle Juice","VideoFileUrl":"https://www.keithandthegirl.com/vip/download/shows/myka/video/94/MYKA-2015-06-01.m3u8","VideoThumbnailUrl":"https://www.keithandthegirl.com/vip/download/shows/myka/video/94/MYKA-2015-06-01-video.jpg","PreviewUrl":"https://www.youtube.com/watch?v=pn43caXZ-no","FileUrl":"http://www.keithandthegirl.com/vip/download/shows/myka/MYKA-2015-06-01.mp3","Type":"0","Public":"0","Timestamp":1433174400,"Guests":[]},{"ShowId":"3817","ShowNameId":"16","Number":"93","PostedDate":"5/25/2015 12:00:00 PM","Title":"The National Anthem","VideoFileUrl":"https://www.keithandthegirl.com/vip/download/shows/myka/video/93/MYKA-2015-05-25.m3u8","VideoThumbnailUrl":"https://www.keithandthegirl.com/vip/download/shows/myka/video/93/MYKA-2015-05-25-video.jpg","PreviewUrl":"https://www.youtube.com/watch?v=nTLS0JgbP_Q","FileUrl":"http://www.keithandthegirl.com/vip/download/shows/myka/MYKA-2015-05-25.mp3","Type":"0","Public":"0","Timestamp":1432569600,"Guests":[]},{"ShowId":"3798","ShowNameId":"16","Number":"92","PostedDate":"5/11/2015 12:00:00 PM","Title":"Myka\u0027s Gained Weight","VideoFileUrl":"https://www.keithandthegirl.com/vip/download/shows/myka/video/92/MYKA-2015-05-11.m3u8","VideoThumbnailUrl":"https://www.keithandthegirl.com/vip/download/shows/myka/video/92/MYKA-2015-05-11-video.jpg","PreviewUrl":"https://www.youtube.com/watch?v=Alz2HsXI7nY","FileUrl":"http://www.keithandthegirl.com/vip/download/shows/myka/MYKA-2015-05-11.mp3","Type":"0","Public":"0","Timestamp":1431360000,"Guests":[]},{"ShowId":"3790","ShowNameId":"16","Number":"91","PostedDate":"5/4/2015 12:00:00 PM","Title":"Celebrity Crush","VideoFileUrl":"https://www.keithandthegirl.com/vip/download/shows/myka/video/91/MYKA-2015-05-04.m3u8","VideoThumbnailUrl":"https://www.keithandthegirl.com/vip/download/shows/myka/video/91/MYKA-2015-05-04-video.jpg","PreviewUrl":"https://www.youtube.com/watch?v=oP5x6_p6RXc","FileUrl":"http://www.keithandthegirl.com/vip/download/shows/myka/MYKA-2015-05-04.mp3","Type":"0","Public":"0","Timestamp":1430755200,"Guests":[]},{"ShowId":"3777","ShowNameId":"16","Number":"90","PostedDate":"4/27/2015 12:00:00 PM","Title":"I\u0027m Trying to Do Something Here","VideoFileUrl":"https://www.keithandthegirl.com/vip/download/shows/myka/video/90/MYKA-2015-04-27.m3u8","VideoThumbnailUrl":"https://www.keithandthegirl.com/vip/download/shows/myka/video/90/MYKA-2015-04-27-video.jpg","PreviewUrl":"https://www.youtube.com/watch?v=Xsjg40yRY60","FileUrl":"http://www.keithandthegirl.com/vip/download/shows/myka/MYKA-2015-04-27.mp3","Type":"0","Public":"0","Timestamp":1430150400,"Guests":[]},{"ShowId":"3767","ShowNameId":"16","Number":"89","PostedDate":"4/20/2015 12:00:00 PM","Title":"Welcome To the Sub-Bergs","VideoFileUrl":"https://www.keithandthegirl.com/vip/download/shows/myka/video/89/MYKA-2015-04-20.m3u8","VideoThumbnailUrl":"https://www.keithandthegirl.com/vip/download/shows/myka/video/89/MYKA-2015-04-20-video.jpg","PreviewUrl":"https://www.youtube.com/watch?v=TbEnr2fzHXg","FileUrl":"http://www.keithandthegirl.com/vip/download/shows/myka/MYKA-2015-04-20.mp3","Type":"0","Public":"0","Timestamp":1429545600,"Guests":[]},{"ShowId":"3763","ShowNameId":"16","Number":"88","PostedDate":"4/13/2015 12:00:00 PM","Title":"Are You On Slither?","VideoFileUrl":"https://www.keithandthegirl.com/vip/download/shows/myka/video/88/MYKA-2015-04-13.m3u8","VideoThumbnailUrl":"https://www.keithandthegirl.com/vip/download/shows/myka/video/88/MYKA-2015-04-13-video.jpg","PreviewUrl":"https://www.youtube.com/watch?v=hBAsLp-hYvw","FileUrl":"http://www.keithandthegirl.com/vip/download/shows/myka/MYKA-2015-04-13.mp3","Type":"0","Public":"0","Timestamp":1428940800,"Guests":[]},{"ShowId":"3751","ShowNameId":"16","Number":"87","PostedDate":"4/6/2015 12:00:00 PM","Title":"Trampoline Abortion or the Sweaty Blackouts","VideoFileUrl":"https://www.keithandthegirl.com/vip/download/shows/myka/video/87/MYKA-2015-04-06.m3u8","VideoThumbnailUrl":"https://www.keithandthegirl.com/vip/download/shows/myka/video/87/MYKA-2015-04-06-video.jpg","PreviewUrl":"https://www.youtube.com/watch?v=UXIyGfjWofA","FileUrl":"http://www.keithandthegirl.com/vip/download/shows/myka/MYKA-2015-04-06.mp3","Type":"0","Public":"0","Timestamp":1428336000,"Guests":[]},{"ShowId":"3739","ShowNameId":"16","Number":"86","PostedDate":"3/30/2015 12:00:00 PM","Title":"Quitting Time","VideoFileUrl":"https://www.keithandthegirl.com/vip/download/shows/myka/video/86/MYKA-2015-03-30.m3u8","VideoThumbnailUrl":"https://www.keithandthegirl.com/vip/download/shows/myka/video/86/MYKA-2015-03-30-video.jpg","PreviewUrl":"https://www.youtube.com/watch?v=G84fZtMGwL4","FileUrl":"http://www.keithandthegirl.com/vip/download/shows/myka/MYKA-2015-03-30.mp3","Type":"0","Public":"0","Timestamp":1427731200,"Guests":[]},{"ShowId":"3761","ShowNameId":"16","Number":"85","PostedDate":"3/24/2015 12:21:02 PM","Title":"Jimi Hendrix on the Banjo","VideoFileUrl":"https://www.keithandthegirl.com/vip/download/shows/myka/video/85/MYKA-2015-03-24.m3u8","VideoThumbnailUrl":"https://www.keithandthegirl.com/vip/download/shows/myka/video/85/MYKA-2015-03-24-video.jpg","PreviewUrl":"https://www.youtube.com/watch?v=wS71fZk1M9A","FileUrl":"http://www.keithandthegirl.com/vip/download/shows/myka/MYKA-2015-03-24.mp3","Type":"0","Public":"0","Timestamp":1427214062,"Guests":[]},{"ShowId":"3710","ShowNameId":"16","Number":"84","PostedDate":"3/9/2015 12:00:00 PM","Title":"I Saw Your Privates","VideoFileUrl":"https://www.keithandthegirl.com/vip/download/shows/myka/video/84/MYKA-2015-03-09.m3u8","VideoThumbnailUrl":"https://www.keithandthegirl.com/vip/download/shows/myka/video/84/MYKA-2015-03-09-video.jpg","PreviewUrl":"https://www.youtube.com/watch?v=wZ5EIznPaD8","FileUrl":"http://www.keithandthegirl.com/vip/download/shows/myka/MYKA-2015-03-09.mp3","Type":"0","Public":"0","Timestamp":1425916800,"Guests":[]},{"ShowId":"3697","ShowNameId":"16","Number":"83","PostedDate":"3/2/2015 12:00:00 PM","Title":"Stairwell Sex","VideoFileUrl":"https://www.keithandthegirl.com/vip/download/shows/myka/video/83/MYKA-2015-03-02.m3u8","VideoThumbnailUrl":"https://www.keithandthegirl.com/vip/download/shows/myka/video/83/MYKA-2015-03-02-video.jpg","PreviewUrl":"https://www.youtube.com/watch?v=WY6TKhL4434","FileUrl":"http://www.keithandthegirl.com/vip/download/shows/myka/MYKA-2015-03-02.mp3","Type":"0","Public":"0","Timestamp":1425315600,"Guests":[]},{"ShowId":"3683","ShowNameId":"16","Number":"82","PostedDate":"2/16/2015 12:00:00 PM","Title":"This Is the Worst Shit Ever Written","VideoFileUrl":"https://www.keithandthegirl.com/vip/download/shows/myka/video/82/MYKA-2015-02-16.m3u8","VideoThumbnailUrl":"https://www.keithandthegirl.com/vip/download/shows/myka/video/82/MYKA-2015-02-16-video.jpg","PreviewUrl":"https://www.youtube.com/watch?v=Yusash-fAcs","FileUrl":"http://www.keithandthegirl.com/vip/download/shows/myka/MYKA-2015-02-16.mp3","Type":"0","Public":"0","Timestamp":1424106000,"Guests":[]},{"ShowId":"3676","ShowNameId":"16","Number":"81","PostedDate":"2/9/2015 12:00:00 PM","Title":"Small World, Big Gums","VideoFileUrl":"https://www.keithandthegirl.com/vip/download/shows/myka/video/81/MYKA-2015-02-09.m3u8","VideoThumbnailUrl":"https://www.keithandthegirl.com/vip/download/shows/myka/video/81/MYKA-2015-02-09-video.jpg","PreviewUrl":"https://www.youtube.com/watch?v=FjXgjKl86j4","FileUrl":"http://www.keithandthegirl.com/vip/download/shows/myka/MYKA-2015-02-09.mp3","Type":"0","Public":"0","Timestamp":1423501200,"Guests":[]},{"ShowId":"3662","ShowNameId":"16","Number":"80","PostedDate":"1/26/2015 12:00:00 PM","Title":"Drunk at Work","VideoFileUrl":"https://www.keithandthegirl.com/vip/download/shows/myka/video/80/MYKA-2015-01-26.m3u8","VideoThumbnailUrl":"https://www.keithandthegirl.com/vip/download/shows/myka/video/80/MYKA-2015-01-26-video.jpg","PreviewUrl":"https://www.youtube.com/watch?v=wEGhWxj_Ii8","FileUrl":"http://www.keithandthegirl.com/vip/download/shows/myka/MYKA-2015-01-26.mp3","Type":"0","Public":"0","Timestamp":1422291600,"Guests":[]},{"ShowId":"3647","ShowNameId":"16","Number":"79","PostedDate":"1/19/2015 12:00:00 PM","Title":"Jizzy Mist","VideoFileUrl":"https://www.keithandthegirl.com/vip/download/shows/myka/video/79/MYKA-2015-01-19.m3u8","VideoThumbnailUrl":"https://www.keithandthegirl.com/vip/download/shows/myka/video/79/MYKA-2015-01-19-video.jpg","PreviewUrl":"https://www.youtube.com/watch?v=8skQMSfdWek","FileUrl":"http://www.keithandthegirl.com/vip/download/shows/myka/MYKA-2015-01-19.mp3","Type":"0","Public":"0","Timestamp":1421686800,"Guests":[]},{"ShowId":"3636","ShowNameId":"16","Number":"78","PostedDate":"1/12/2015 12:00:00 PM","Title":"New Years Desolations","VideoFileUrl":"https://www.keithandthegirl.com/vip/download/shows/myka/video/78/MYKA-2015-01-12.m3u8","VideoThumbnailUrl":"https://www.keithandthegirl.com/vip/download/shows/myka/video/78/MYKA-2015-01-12-video.jpg","PreviewUrl":"https://www.youtube.com/watch?v=DmPHsWecP4U","FileUrl":"http://www.keithandthegirl.com/vip/download/shows/myka/MYKA-2015-01-12.mp3","Type":"0","Public":"0","Timestamp":1421082000,"Guests":[]},{"ShowId":"3619","ShowNameId":"16","Number":"77","PostedDate":"1/5/2015 12:00:00 PM","Title":"Count to Ten","VideoFileUrl":"https://www.keithandthegirl.com/vip/download/shows/myka/video/77/MYKA-2015-01-05.m3u8","VideoThumbnailUrl":"https://www.keithandthegirl.com/vip/download/shows/myka/video/77/MYKA-2015-01-05-video.jpg","PreviewUrl":"https://www.youtube.com/watch?v=3gW7YoEjh_8","FileUrl":"http://www.keithandthegirl.com/vip/download/shows/myka/MYKA-2015-01-05.mp3","Type":"0","Public":"0","Timestamp":1420477200,"Guests":[]},{"ShowId":"3615","ShowNameId":"16","Number":"76","PostedDate":"12/29/2014 12:00:00 PM","Title":"Are You My Boyfriend?","VideoFileUrl":"https://www.keithandthegirl.com/vip/download/shows/myka/video/76/MYKA-2014-12-29.m3u8","VideoThumbnailUrl":"https://www.keithandthegirl.com/vip/download/shows/myka/video/76/MYKA-2014-12-29-video.jpg","PreviewUrl":"https://www.youtube.com/watch?v=thZL_E70Tis","FileUrl":"http://www.keithandthegirl.com/vip/download/shows/myka/MYKA-2014-12-29.mp3","Type":"0","Public":"0","Timestamp":1419872400,"Guests":[]},{"ShowId":"3590","ShowNameId":"16","Number":"75","PostedDate":"12/22/2014 12:00:00 PM","Title":"Myka\u0027s First Blackout","VideoFileUrl":"https://www.keithandthegirl.com/vip/download/shows/myka/video/75/MYKA-2014-12-22.m3u8","VideoThumbnailUrl":"https://www.keithandthegirl.com/vip/download/shows/myka/video/75/MYKA-2014-12-22-video.jpg","PreviewUrl":"https://www.youtube.com/watch?v=SG-Lwn-3XXg","FileUrl":"http://www.keithandthegirl.com/vip/download/shows/myka/MYKA-2014-12-22.mp3","Type":"0","Public":"0","Timestamp":1419267600,"Guests":[]},{"ShowId":"3580","ShowNameId":"16","Number":"74","PostedDate":"12/15/2014 12:00:00 PM","Title":"On Loan from God","VideoFileUrl":"https://www.keithandthegirl.com/vip/download/shows/myka/video/74/MYKA-2014-12-15.m3u8","VideoThumbnailUrl":"https://www.keithandthegirl.com/vip/download/shows/myka/video/74/MYKA-2014-12-15-video.jpg","PreviewUrl":"https://www.youtube.com/watch?v=ST866WXgtvc","FileUrl":"http://www.keithandthegirl.com/vip/download/shows/myka/MYKA-2014-12-15.mp3","Type":"0","Public":"0","Timestamp":1418662800,"Guests":[]},{"ShowId":"3561","ShowNameId":"16","Number":"73","PostedDate":"12/1/2014 12:00:00 PM","Title":"You Gotta Eat the Horse Pussy","VideoFileUrl":"https://www.keithandthegirl.com/vip/download/shows/myka/video/73/MYKA-2014-12-01.m3u8","VideoThumbnailUrl":"https://www.keithandthegirl.com/vip/download/shows/myka/video/73/MYKA-2014-12-01-video.jpg","PreviewUrl":"https://www.youtube.com/watch?v=dTzTVBu2veY","FileUrl":"http://www.keithandthegirl.com/vip/download/shows/myka/MYKA-2014-12-01.mp3","Type":"0","Public":"0","Timestamp":1417453200,"Guests":[]},{"ShowId":"3553","ShowNameId":"16","Number":"72","PostedDate":"11/24/2014 12:00:00 PM","Title":"Her Shirt Wouldn\u0027t Come Off","VideoFileUrl":"https://www.keithandthegirl.com/vip/download/shows/myka/video/72/MYKA-2014-11-24.m3u8","VideoThumbnailUrl":"https://www.keithandthegirl.com/vip/download/shows/myka/video/72/MYKA-2014-11-24-video.jpg","PreviewUrl":"https://www.youtube.com/watch?v=z0hzXv9Clg0","FileUrl":"http://www.keithandthegirl.com/vip/download/shows/myka/MYKA-2014-11-24.mp3","Type":"0","Public":"0","Timestamp":1416848400,"Guests":[]},{"ShowId":"3544","ShowNameId":"16","Number":"71","PostedDate":"11/17/2014 12:00:00 PM","Title":"A Cain State of Mind","VideoFileUrl":"https://www.keithandthegirl.com/vip/download/shows/myka/video/71/MYKA-2014-11-17.m3u8","VideoThumbnailUrl":"https://www.keithandthegirl.com/vip/download/shows/myka/video/71/MYKA-2014-11-17-video.jpg","PreviewUrl":"https://www.youtube.com/watch?v=JaFxRAaYb9g","FileUrl":"http://www.keithandthegirl.com/vip/download/shows/myka/MYKA-2014-11-17.mp3","Type":"0","Public":"0","Timestamp":1416243600,"Guests":[]},{"ShowId":"3528","ShowNameId":"16","Number":"70","PostedDate":"11/10/2014 12:00:00 PM","Title":"Are You Pregnant?","VideoFileUrl":"https://www.keithandthegirl.com/vip/download/shows/myka/video/70/MYKA-2014-11-10.m3u8","VideoThumbnailUrl":"https://www.keithandthegirl.com/vip/download/shows/myka/video/70/MYKA-2014-11-10-video.jpg","PreviewUrl":"https://www.youtube.com/watch?v=PL6XYQ64dvY","FileUrl":"http://www.keithandthegirl.com/vip/download/shows/myka/MYKA-2014-11-10.mp3","Type":"0","Public":"0","Timestamp":1415638800,"Guests":[]},{"ShowId":"3520","ShowNameId":"16","Number":"69","PostedDate":"11/3/2014 12:00:00 PM","Title":"Slipped Through Your Crack","VideoFileUrl":"https://www.keithandthegirl.com/vip/download/shows/myka/video/69/MYKA-2014-11-03.m3u8","VideoThumbnailUrl":"https://www.keithandthegirl.com/vip/download/shows/myka/video/69/MYKA-2014-11-03-video.jpg","PreviewUrl":"https://www.youtube.com/watch?v=WGG7vFW5oNg","FileUrl":"http://www.keithandthegirl.com/vip/download/shows/myka/MYKA-2014-11-03.mp3","Type":"0","Public":"0","Timestamp":1415034000,"Guests":[]},{"ShowId":"3507","ShowNameId":"16","Number":"68","PostedDate":"10/27/2014 12:00:00 PM","Title":"Leave a Note","VideoFileUrl":"https://www.keithandthegirl.com/vip/download/shows/myka/video/68/MYKA-2014-10-27.m3u8","VideoThumbnailUrl":"https://www.keithandthegirl.com/vip/download/shows/myka/video/68/MYKA-2014-10-27-video.jpg","PreviewUrl":"https://www.youtube.com/watch?v=hEqR0P2Aa_s","FileUrl":"http://www.keithandthegirl.com/vip/download/shows/myka/MYKA-2014-10-27.mp3","Type":"0","Public":"0","Timestamp":1414425600,"Guests":[]},{"ShowId":"3496","ShowNameId":"16","Number":"67","PostedDate":"10/20/2014 12:00:00 PM","Title":"Lauren\u0027s Year","VideoFileUrl":"https://www.keithandthegirl.com/vip/download/shows/myka/video/67/MYKA-2014-10-20.m3u8","VideoThumbnailUrl":"https://www.keithandthegirl.com/vip/download/shows/myka/video/67/MYKA-2014-10-20-video.jpg","PreviewUrl":"https://www.youtube.com/watch?v=mSjhMYzVrvM","FileUrl":"http://www.keithandthegirl.com/vip/download/shows/myka/MYKA-2014-10-20.mp3","Type":"0","Public":"0","Timestamp":1413820800,"Guests":[]},{"ShowId":"3486","ShowNameId":"16","Number":"66","PostedDate":"10/13/2014 12:00:00 PM","Title":"Adulting","VideoFileUrl":"https://www.keithandthegirl.com/vip/download/shows/myka/video/66/MYKA-2014-10-13.m3u8","VideoThumbnailUrl":"https://www.keithandthegirl.com/vip/download/shows/myka/video/66/MYKA-2014-10-13-video.jpg","PreviewUrl":"https://www.youtube.com/watch?v=ljzmibD8NU4","FileUrl":"http://www.keithandthegirl.com/vip/download/shows/myka/MYKA-2014-10-13.mp3","Type":"0","Public":"0","Timestamp":1413216000,"Guests":[]},{"ShowId":"3477","ShowNameId":"16","Number":"65","PostedDate":"10/6/2014 12:00:00 PM","Title":"The Train Came, He Didn\u0027t","VideoFileUrl":"https://www.keithandthegirl.com/vip/download/shows/myka/video/65/MYKA-2014-10-06.m3u8","VideoThumbnailUrl":"https://www.keithandthegirl.com/vip/download/shows/myka/video/65/MYKA-2014-10-06-video.jpg","PreviewUrl":"https://www.youtube.com/watch?v=NwbdNV2w7mc","FileUrl":"http://www.keithandthegirl.com/vip/download/shows/myka/MYKA-2014-10-06.mp3","Type":"0","Public":"0","Timestamp":1412611200,"Guests":[]},{"ShowId":"3468","ShowNameId":"16","Number":"64","PostedDate":"9/29/2014 12:00:00 PM","Title":"Time To See Jesus!","VideoFileUrl":"https://www.keithandthegirl.com/vip/download/shows/myka/video/64/MYKA-2014-09-29.m3u8","VideoThumbnailUrl":"https://www.keithandthegirl.com/vip/download/shows/myka/video/64/MYKA-2014-09-29-video.jpg","PreviewUrl":"https://www.youtube.com/watch?v=iEWzFbeO4mQ","FileUrl":"http://www.keithandthegirl.com/vip/download/shows/myka/MYKA-2014-09-29.mp3","Type":"0","Public":"0","Timestamp":1412006400,"Guests":[]},{"ShowId":"3447","ShowNameId":"16","Number":"63","PostedDate":"9/15/2014 12:00:00 PM","Title":"The Rainbow Fish","VideoFileUrl":"https://www.keithandthegirl.com/vip/download/shows/myka/video/63/MYKA-2014-09-15.m3u8","VideoThumbnailUrl":"https://www.keithandthegirl.com/vip/download/shows/myka/video/63/MYKA-2014-09-15-video.jpg","PreviewUrl":"https://www.youtube.com/watch?v=vE_BrdiCGV0","FileUrl":"http://www.keithandthegirl.com/vip/download/shows/myka/MYKA-2014-09-15.mp3","Type":"0","Public":"0","Timestamp":1410796800,"Guests":[]},{"ShowId":"3437","ShowNameId":"16","Number":"62","PostedDate":"9/8/2014 12:00:00 PM","Title":"Bed Bugs and Doom Sticks","VideoFileUrl":"https://www.keithandthegirl.com/vip/download/shows/myka/video/62/MYKA-2014-09-08.m3u8","VideoThumbnailUrl":"https://www.keithandthegirl.com/vip/download/shows/myka/video/62/MYKA-2014-09-08-video.jpg","PreviewUrl":"https://www.youtube.com/watch?v=4tcFDD5mP8E","FileUrl":"http://www.keithandthegirl.com/vip/download/shows/myka/MYKA-2014-09-08.mp3","Type":"0","Public":"0","Timestamp":1410192000,"Guests":[]},{"ShowId":"3428","ShowNameId":"16","Number":"61","PostedDate":"9/1/2014 12:00:00 PM","Title":"How Much for a Threesome","VideoFileUrl":"https://www.keithandthegirl.com/vip/download/shows/myka/video/61/MYKA-2014-09-01.m3u8","VideoThumbnailUrl":"https://www.keithandthegirl.com/vip/download/shows/myka/video/61/MYKA-2014-09-01-video.jpg","PreviewUrl":"https://www.youtube.com/watch?v=LfIBNNwnzE4","FileUrl":"http://www.keithandthegirl.com/vip/download/shows/myka/MYKA-2014-09-01.mp3","Type":"0","Public":"0","Timestamp":1409587200,"Guests":[]},{"ShowId":"3416","ShowNameId":"16","Number":"60","PostedDate":"8/25/2014 12:00:00 PM","Title":"How Have You Never Told Me This Before?","VideoFileUrl":"https://www.keithandthegirl.com/vip/download/shows/myka/video/60/MYKA-2014-08-25.m3u8","VideoThumbnailUrl":"https://www.keithandthegirl.com/vip/download/shows/myka/video/60/MYKA-2014-08-25-video.jpg","PreviewUrl":"https://www.youtube.com/watch?v=OF43GqeiEaM","FileUrl":"http://www.keithandthegirl.com/vip/download/shows/myka/MYKA-2014-08-25.mp3","Type":"0","Public":"0","Timestamp":1408982400,"Guests":[]},{"ShowId":"3407","ShowNameId":"16","Number":"59","PostedDate":"8/18/2014 12:00:00 PM","Title":"Dr. Dad","VideoFileUrl":"https://www.keithandthegirl.com/vip/download/shows/myka/video/59/MYKA-2014-08-18.m3u8","VideoThumbnailUrl":"https://www.keithandthegirl.com/vip/download/shows/myka/video/59/MYKA-2014-08-18-video.jpg","PreviewUrl":"https://www.youtube.com/watch?v=AA4l-u1hkd8","FileUrl":"http://www.keithandthegirl.com/vip/download/shows/myka/MYKA-2014-08-18.mp3","Type":"0","Public":"0","Timestamp":1408377600,"Guests":[]},{"ShowId":"3394","ShowNameId":"16","Number":"58","PostedDate":"8/11/2014 12:00:00 PM","Title":"Ivy League Porn School","VideoFileUrl":"https://www.keithandthegirl.com/vip/download/shows/myka/video/58/MYKA-2014-08-11.m3u8","VideoThumbnailUrl":"https://www.keithandthegirl.com/vip/download/shows/myka/video/58/MYKA-2014-08-11-video.jpg","PreviewUrl":"https://www.youtube.com/watch?v=V_fjXAF7xcE","FileUrl":"http://www.keithandthegirl.com/vip/download/shows/myka/MYKA-2014-08-11.mp3","Type":"0","Public":"0","Timestamp":1407772800,"Guests":[]},{"ShowId":"3383","ShowNameId":"16","Number":"57","PostedDate":"8/4/2014 12:00:00 PM","Title":"Myq and Kasey","VideoFileUrl":"https://www.keithandthegirl.com/vip/download/shows/myka/video/57/MYKA-2014-08-04.m3u8","VideoThumbnailUrl":"https://www.keithandthegirl.com/vip/download/shows/myka/video/57/MYKA-2014-08-04-video.jpg","PreviewUrl":"https://www.youtube.com/watch?v=JjsX2hueoMs","FileUrl":"http://www.keithandthegirl.com/vip/download/shows/myka/MYKA-2014-08-04.mp3","Type":"0","Public":"0","Timestamp":1407168000,"Guests":[]},{"ShowId":"3372","ShowNameId":"16","Number":"56","PostedDate":"7/28/2014 12:00:00 PM","Title":"Endships","VideoFileUrl":"https://www.keithandthegirl.com/vip/download/shows/myka/video/56/MYKA-2014-07-28.m3u8","VideoThumbnailUrl":"https://www.keithandthegirl.com/vip/download/shows/myka/video/56/MYKA-2014-07-28-video.jpg","PreviewUrl":"https://www.youtube.com/watch?v=T5JNbqYEmWI","FileUrl":"http://www.keithandthegirl.com/vip/download/shows/myka/MYKA-2014-07-28.mp3","Type":"0","Public":"0","Timestamp":1406563200,"Guests":[]},{"ShowId":"3358","ShowNameId":"16","Number":"55","PostedDate":"7/21/2014 12:00:00 PM","Title":"Stalking","VideoFileUrl":"https://www.keithandthegirl.com/vip/download/shows/myka/video/55/MYKA-2014-07-21.m3u8","VideoThumbnailUrl":"https://www.keithandthegirl.com/vip/download/shows/myka/video/55/MYKA-2014-07-21-video.jpg","PreviewUrl":"https://www.youtube.com/watch?v=hL5TdrK6Le8","FileUrl":"http://www.keithandthegirl.com/vip/download/shows/myka/MYKA-2014-07-21.mp3","Type":"0","Public":"0","Timestamp":1405958400,"Guests":[]},{"ShowId":"3348","ShowNameId":"16","Number":"54","PostedDate":"7/14/2014 12:00:00 PM","Title":"1-Year Anniversary","VideoFileUrl":"https://www.keithandthegirl.com/vip/download/shows/myka/video/54/MYKA-2014-07-14.m3u8","VideoThumbnailUrl":"https://www.keithandthegirl.com/vip/download/shows/myka/video/54/MYKA-2014-07-14-video.jpg","PreviewUrl":"https://www.youtube.com/watch?v=uKIXq0ifgho","FileUrl":"http://www.keithandthegirl.com/vip/download/shows/myka/MYKA-2014-07-14.mp3","Type":"0","Public":"0","Timestamp":1405353600,"Guests":[]},{"ShowId":"3342","ShowNameId":"16","Number":"53","PostedDate":"7/7/2014 12:00:00 PM","Title":"Don\u0027t Be a Dick About It","VideoFileUrl":"https://www.keithandthegirl.com/vip/download/shows/myka/video/53/MYKA-2014-07-07.m3u8","VideoThumbnailUrl":"https://www.keithandthegirl.com/vip/download/shows/myka/video/53/MYKA-2014-07-07-video.jpg","PreviewUrl":"https://www.youtube.com/watch?v=R4kHYEzqFKs","FileUrl":"http://www.keithandthegirl.com/vip/download/shows/myka/MYKA-2014-07-07.mp3","Type":"0","Public":"0","Timestamp":1404748800,"Guests":[]},{"ShowId":"3331","ShowNameId":"16","Number":"52","PostedDate":"6/30/2014 12:00:00 PM","Title":"Try-Curious","VideoFileUrl":"https://www.keithandthegirl.com/vip/download/shows/myka/video/52/MYKA-2014-06-30.m3u8","VideoThumbnailUrl":"https://www.keithandthegirl.com/vip/download/shows/myka/video/52/MYKA-2014-06-30-video.jpg","PreviewUrl":"https://www.youtube.com/watch?v=9n5nH-OMI3E","FileUrl":"http://www.keithandthegirl.com/vip/download/shows/myka/MYKA-2014-06-30.mp3","Type":"0","Public":"0","Timestamp":1404144000,"Guests":[]},{"ShowId":"3320","ShowNameId":"16","Number":"51","PostedDate":"6/23/2014 12:00:00 PM","Title":"Andy Kaufman Is a Fuckface","VideoFileUrl":"https://www.keithandthegirl.com/vip/download/shows/myka/video/51/MYKA-2014-06-23.m3u8","VideoThumbnailUrl":"https://www.keithandthegirl.com/vip/download/shows/myka/video/51/MYKA-2014-06-23-video.jpg","PreviewUrl":"https://www.youtube.com/watch?v=e6AOYwMBzhI","FileUrl":"http://www.keithandthegirl.com/vip/download/shows/myka/MYKA-2014-06-23.mp3","Type":"0","Public":"0","Timestamp":1403539200,"Guests":[]},{"ShowId":"3312","ShowNameId":"16","Number":"50","PostedDate":"6/16/2014 12:00:00 PM","Title":"This Week in Jacqueline","VideoFileUrl":"https://www.keithandthegirl.com/vip/download/shows/myka/video/50/MYKA-2014-06-16.m3u8","VideoThumbnailUrl":"https://www.keithandthegirl.com/vip/download/shows/myka/video/50/MYKA-2014-06-16-video.jpg","PreviewUrl":"https://www.youtube.com/watch?v=XGxuKyqCYzA","FileUrl":"http://www.keithandthegirl.com/vip/download/shows/myka/MYKA-2014-06-16.mp3","Type":"0","Public":"0","Timestamp":1402934400,"Guests":[]},{"ShowId":"3304","ShowNameId":"16","Number":"49","PostedDate":"6/9/2014 12:00:00 PM","Title":"The Big Question","VideoFileUrl":"https://www.keithandthegirl.com/vip/download/shows/myka/video/49/MYKA-2014-06-09.m3u8","VideoThumbnailUrl":"https://www.keithandthegirl.com/vip/download/shows/myka/video/49/MYKA-2014-06-09-video.jpg","PreviewUrl":"https://www.youtube.com/watch?v=gH1M1t75Cxo","FileUrl":"http://www.keithandthegirl.com/vip/download/shows/myka/MYKA-2014-06-09.mp3","Type":"0","Public":"0","Timestamp":1402329600,"Guests":[{"Data":"397","ShowGuestId":"397","RealName":"Maria Heinegg","Description":"Comedian and writer best known for her contributions to The Huffington Post.","PictureFilename":"maria-heinegg.jpg","Url1":"","Url2":"https://twitter.com/MariaElizabest","PictureUrl":"http://static-4.keithandthegirl.net/guests/pics/processed/maria-heinegg-150x150.jpg","PictureUrlLarge":"http://static-4.keithandthegirl.net/guests/pics/processed/maria-heinegg-600x600.jpg"}]},{"ShowId":"3284","ShowNameId":"16","Number":"48","PostedDate":"6/2/2014 12:00:00 PM","Title":"You\u0027re Corny as Shit","VideoFileUrl":"https://www.keithandthegirl.com/vip/download/shows/myka/video/48/MYKA-2014-06-02.m3u8","VideoThumbnailUrl":"https://www.keithandthegirl.com/vip/download/shows/myka/video/48/MYKA-2014-06-02-video.jpg","PreviewUrl":"https://www.youtube.com/watch?v=rMDn6CezK-k","FileUrl":"http://www.keithandthegirl.com/vip/download/shows/myka/MYKA-2014-06-02.mp3","Type":"0","Public":"0","Timestamp":1401724800,"Guests":[{"Data":"468","ShowGuestId":"468","RealName":"Alexis Guerreros","Description":"Comedian and host of the Show Me Your Bits podcast.","PictureFilename":"AlexisGuerreros.jpg","Url1":"","Url2":"http://www.alexisguerreros.com/","PictureUrl":"http://static-1.keithandthegirl.net/guests/pics/processed/AlexisGuerreros-150x150.jpg","PictureUrlLarge":"http://static-1.keithandthegirl.net/guests/pics/processed/AlexisGuerreros-600x600.jpg"}]},{"ShowId":"3272","ShowNameId":"16","Number":"47","PostedDate":"5/26/2014 12:00:00 PM","Title":"Too Many Packages","VideoFileUrl":"https://www.keithandthegirl.com/vip/download/shows/myka/video/47/MYKA-2014-05-26.m3u8","VideoThumbnailUrl":"https://www.keithandthegirl.com/vip/download/shows/myka/video/47/MYKA-2014-05-26-video.jpg","PreviewUrl":"https://www.youtube.com/watch?v=PZmSv8aVU7w","FileUrl":"http://www.keithandthegirl.com/vip/download/shows/myka/MYKA-2014-05-26.mp3","Type":"0","Public":"0","Timestamp":1401120000,"Guests":[{"Data":"274","ShowGuestId":"274","RealName":"Jon Fisch","Description":"Comedian who has appeared on The Celebrity Apprentice and a whole slew of parking tickets.","PictureFilename":"Jon-Fisch.jpg","Url1":"http://jonfisch.com","Url2":"http://twitter.com/jonnyfisch","PictureUrl":"http://static-1.keithandthegirl.net/guests/pics/processed/Jon-Fisch-150x150.jpg","PictureUrlLarge":"http://static-1.keithandthegirl.net/guests/pics/processed/Jon-Fisch-600x600.jpg"}]},{"ShowId":"3262","ShowNameId":"16","Number":"46","PostedDate":"5/19/2014 12:00:00 PM","Title":"Just Work for SNL","VideoFileUrl":"https://www.keithandthegirl.com/vip/download/shows/myka/video/46/MYKA-2014-05-19.m3u8","VideoThumbnailUrl":"https://www.keithandthegirl.com/vip/download/shows/myka/video/46/MYKA-2014-05-19-video.jpg","PreviewUrl":"https://www.youtube.com/watch?v=HJ9H-N9jPv8","FileUrl":"http://www.keithandthegirl.com/vip/download/shows/myka/MYKA-2014-05-19.mp3","Type":"0","Public":"0","Timestamp":1400515200,"Guests":[{"Data":"150","ShowGuestId":"150","RealName":"Claudia Cogan","Description":"Comedian known for her appearance on Last Comic Standing and for winning the first ever Time Out New York Joke of the Year.","PictureFilename":"Claudia-Cogan.jpg","Url1":"","Url2":"http://www.claudiacogan.com/","PictureUrl":"http://static-2.keithandthegirl.net/guests/pics/processed/Claudia-Cogan-150x150.jpg","PictureUrlLarge":"http://static-2.keithandthegirl.net/guests/pics/processed/Claudia-Cogan-600x600.jpg"}]},{"ShowId":"3252","ShowNameId":"16","Number":"45","PostedDate":"5/12/2014 12:00:00 PM","Title":"#fuckcancer","VideoFileUrl":"https://www.keithandthegirl.com/vip/download/shows/myka/video/45/MYKA-2014-05-12.m3u8","VideoThumbnailUrl":"https://www.keithandthegirl.com/vip/download/shows/myka/video/45/MYKA-2014-05-12-video.jpg","PreviewUrl":"https://www.youtube.com/watch?v=QTHLzAk1Qyk","FileUrl":"http://www.keithandthegirl.com/vip/download/shows/myka/MYKA-2014-05-12.mp3","Type":"0","Public":"0","Timestamp":1399910400,"Guests":[{"Data":"347","ShowGuestId":"347","RealName":"Ron Krasnow","Description":"Comedian using humor to battle cancer.\r\n","PictureFilename":"Ron-Krasnow.JPG","Url1":"","Url2":"http://twitter.com/BrooklynRon","PictureUrl":"http://static-3.keithandthegirl.net/guests/pics/processed/Ron-Krasnow-150x150.JPG","PictureUrlLarge":"http://static-3.keithandthegirl.net/guests/pics/processed/Ron-Krasnow-600x600.JPG"}]},{"ShowId":"3242","ShowNameId":"16","Number":"44","PostedDate":"5/5/2014 12:00:00 PM","Title":"Shit Show","VideoFileUrl":"https://www.keithandthegirl.com/vip/download/shows/myka/video/44/MYKA-2014-05-05.m3u8","VideoThumbnailUrl":"https://www.keithandthegirl.com/vip/download/shows/myka/video/44/MYKA-2014-05-05-video.jpg","PreviewUrl":"https://www.youtube.com/watch?v=JukbPL8SIEM","FileUrl":"http://www.keithandthegirl.com/vip/download/shows/myka/MYKA-2014-05-05.mp3","Type":"0","Public":"0","Timestamp":1399305600,"Guests":[{"Data":"473","ShowGuestId":"473","RealName":"Kerryn Feehan","Description":"Comedian and actress who has appeared in the independent film The Reunion.","PictureFilename":"KerrynFeehan.jpg","Url1":"","Url2":"http://www.kerrynfeehan.com/","PictureUrl":"http://static-1.keithandthegirl.net/guests/pics/processed/KerrynFeehan-150x150.jpg","PictureUrlLarge":"http://static-1.keithandthegirl.net/guests/pics/processed/KerrynFeehan-600x600.jpg"},{"Data":"472","ShowGuestId":"472","RealName":"Lance Weiss","Description":"Comedian who was featured on NBC\u0027s The Today Show and was a top-4 finalist in CMT\u0027s Next Big Comic.","PictureFilename":"lanceweiss.jpeg","Url1":"","Url2":"http://lanceweiss.com/","PictureUrl":"http://static-3.keithandthegirl.net/guests/pics/processed/lanceweiss-150x150.jpeg","PictureUrlLarge":"http://static-3.keithandthegirl.net/guests/pics/processed/lanceweiss-600x600.jpeg"}]},{"ShowId":"3228","ShowNameId":"16","Number":"43","PostedDate":"4/28/2014 12:00:00 PM","Title":"Getting Fired Up","VideoFileUrl":"https://www.keithandthegirl.com/vip/download/shows/myka/video/43/MYKA-2014-04-28.m3u8","VideoThumbnailUrl":"https://www.keithandthegirl.com/vip/download/shows/myka/video/43/MYKA-2014-04-28-video.jpg","PreviewUrl":"https://www.youtube.com/watch?v=2I2wYQYynb8","FileUrl":"http://www.keithandthegirl.com/vip/download/shows/myka/MYKA-2014-04-28.mp3","Type":"0","Public":"0","Timestamp":1398700800,"Guests":[{"Data":"460","ShowGuestId":"460","RealName":"Caity Quinn","Description":"One of Myka Fox\u0027s real life friends.","PictureFilename":"CaityQuinn.jpg","Url1":"","Url2":"https://twitter.com/caity_quinn","PictureUrl":"http://static-3.keithandthegirl.net/guests/pics/processed/CaityQuinn-150x150.jpg","PictureUrlLarge":"http://static-3.keithandthegirl.net/guests/pics/processed/CaityQuinn-600x600.jpg"}]},{"ShowId":"3220","ShowNameId":"16","Number":"42","PostedDate":"4/21/2014 12:00:00 PM","Title":"Hobos and Jewelry","VideoFileUrl":"https://www.keithandthegirl.com/vip/download/shows/myka/video/42/MYKA-2014-04-21.m3u8","VideoThumbnailUrl":"https://www.keithandthegirl.com/vip/download/shows/myka/video/42/MYKA-2014-04-21-video.jpg","PreviewUrl":"https://www.youtube.com/watch?v=5UFwLxNP_ys","FileUrl":"http://www.keithandthegirl.com/vip/download/shows/myka/MYKA-2014-04-21.mp3","Type":"0","Public":"0","Timestamp":1398096000,"Guests":[{"Data":"236","ShowGuestId":"236","RealName":"Chris Laker","Description":"Comedian best known for hosting the podcasts The Show with Chris Laker, The Week, and This Week in Jackin\u0027.","PictureFilename":"Chris-Laker.jpg","Url1":"http://chrislaker.com/","Url2":"","PictureUrl":"http://static-4.keithandthegirl.net/guests/pics/processed/Chris-Laker-150x150.jpg","PictureUrlLarge":"http://static-4.keithandthegirl.net/guests/pics/processed/Chris-Laker-600x600.jpg"}]},{"ShowId":"3213","ShowNameId":"16","Number":"41","PostedDate":"4/14/2014 12:00:00 PM","Title":"Coke Shit Larry","VideoFileUrl":"https://www.keithandthegirl.com/vip/download/shows/myka/video/41/MYKA-2014-04-14.m3u8","VideoThumbnailUrl":"https://www.keithandthegirl.com/vip/download/shows/myka/video/41/MYKA-2014-04-14-video.jpg","PreviewUrl":"https://www.youtube.com/watch?v=EAgmNuxB3Tg","FileUrl":"http://www.keithandthegirl.com/vip/download/shows/myka/MYKA-2014-04-14.mp3","Type":"0","Public":"0","Timestamp":1397491200,"Guests":[{"Data":"477","ShowGuestId":"477","RealName":"Lukas Kaiser","Description":"Comedian and senior writer/producer at Spike TV.","PictureFilename":"LukasKaiser.jpg","Url1":"","Url2":"https://twitter.com/thelukaskaiser","PictureUrl":"http://static-3.keithandthegirl.net/guests/pics/processed/LukasKaiser-150x150.jpg","PictureUrlLarge":"http://static-3.keithandthegirl.net/guests/pics/processed/LukasKaiser-600x600.jpg"}]},{"ShowId":"3203","ShowNameId":"16","Number":"40","PostedDate":"4/7/2014 12:00:00 PM","Title":"What a Great Week!","VideoFileUrl":"https://www.keithandthegirl.com/vip/download/shows/myka/video/40/MYKA-2014-04-07.m3u8","VideoThumbnailUrl":"https://www.keithandthegirl.com/vip/download/shows/myka/video/40/MYKA-2014-04-07-video.jpg","PreviewUrl":"https://www.youtube.com/watch?v=SZ77yN6JdjM","FileUrl":"http://www.keithandthegirl.com/vip/download/shows/myka/MYKA-2014-04-07.mp3","Type":"0","Public":"0","Timestamp":1396886400,"Guests":[{"Data":"465","ShowGuestId":"465","RealName":"Katie Compa","Description":"Comedian and 2007 Battle of the Bay Comedy Competition finalist.","PictureFilename":"katiecompa.jpg","Url1":"","Url2":"https://twitter.com/katiecompa","PictureUrl":"http://static-3.keithandthegirl.net/guests/pics/processed/katiecompa-150x150.jpg","PictureUrlLarge":"http://static-3.keithandthegirl.net/guests/pics/processed/katiecompa-600x600.jpg"}]},{"ShowId":"3191","ShowNameId":"16","Number":"39","PostedDate":"3/31/2014 12:00:00 PM","Title":"Wheat Belly","VideoFileUrl":"https://www.keithandthegirl.com/vip/download/shows/myka/video/39/MYKA-2014-03-31.m3u8","VideoThumbnailUrl":"https://www.keithandthegirl.com/vip/download/shows/myka/video/39/MYKA-2014-03-31-video.jpg","PreviewUrl":"https://www.youtube.com/watch?v=coJqq1LvxzI","FileUrl":"http://www.keithandthegirl.com/vip/download/shows/myka/MYKA-2014-03-31.mp3","Type":"0","Public":"0","Timestamp":1396281600,"Guests":[{"Data":"257","ShowGuestId":"257","RealName":"Tim Dillon","Description":"Comedian and co-founder of Vise Films.","PictureFilename":"Tim-Dillon.jpg","Url1":"http://twitter.com/timjdillon","Url2":"","PictureUrl":"http://static-4.keithandthegirl.net/guests/pics/processed/Tim-Dillon-150x150.jpg","PictureUrlLarge":"http://static-4.keithandthegirl.net/guests/pics/processed/Tim-Dillon-600x600.jpg"}]},{"ShowId":"3174","ShowNameId":"16","Number":"38","PostedDate":"3/24/2014 12:00:00 PM","Title":"Gina-cologist","VideoFileUrl":"https://www.keithandthegirl.com/vip/download/shows/myka/video/38/MYKA-2014-03-24.m3u8","VideoThumbnailUrl":"https://www.keithandthegirl.com/vip/download/shows/myka/video/38/MYKA-2014-03-24-video.jpg","PreviewUrl":"https://www.youtube.com/watch?v=lSUx4wIfewQ","FileUrl":"http://www.keithandthegirl.com/vip/download/shows/myka/MYKA-2014-03-24.mp3","Type":"0","Public":"0","Timestamp":1395676800,"Guests":[{"Data":"150","ShowGuestId":"150","RealName":"Claudia Cogan","Description":"Comedian known for her appearance on Last Comic Standing and for winning the first ever Time Out New York Joke of the Year.","PictureFilename":"Claudia-Cogan.jpg","Url1":"","Url2":"http://www.claudiacogan.com/","PictureUrl":"http://static-2.keithandthegirl.net/guests/pics/processed/Claudia-Cogan-150x150.jpg","PictureUrlLarge":"http://static-2.keithandthegirl.net/guests/pics/processed/Claudia-Cogan-600x600.jpg"}]},{"ShowId":"3172","ShowNameId":"16","Number":"37","PostedDate":"3/17/2014 12:00:00 PM","Title":"Non Alcoholic or Grindin on That Good Good","VideoFileUrl":"https://www.keithandthegirl.com/vip/download/shows/myka/video/37/MYKA-2014-03-17.m3u8","VideoThumbnailUrl":"https://www.keithandthegirl.com/vip/download/shows/myka/video/37/MYKA-2014-03-17-video.jpg","PreviewUrl":"https://www.youtube.com/watch?v=SsGgHWS-0Ok","FileUrl":"http://www.keithandthegirl.com/vip/download/shows/myka/MYKA-2014-03-17.mp3","Type":"0","Public":"0","Timestamp":1395072000,"Guests":[{"Data":"473","ShowGuestId":"473","RealName":"Kerryn Feehan","Description":"Comedian and actress who has appeared in the independent film The Reunion.","PictureFilename":"KerrynFeehan.jpg","Url1":"","Url2":"http://www.kerrynfeehan.com/","PictureUrl":"http://static-1.keithandthegirl.net/guests/pics/processed/KerrynFeehan-150x150.jpg","PictureUrlLarge":"http://static-1.keithandthegirl.net/guests/pics/processed/KerrynFeehan-600x600.jpg"}]},{"ShowId":"3162","ShowNameId":"16","Number":"36","PostedDate":"3/10/2014 12:00:00 PM","Title":"Grandma\u0027s Meatloaf","VideoFileUrl":"https://www.keithandthegirl.com/vip/download/shows/myka/video/36/MYKA-2014-03-10.m3u8","VideoThumbnailUrl":"https://www.keithandthegirl.com/vip/download/shows/myka/video/36/MYKA-2014-03-10-video.jpg","PreviewUrl":"https://www.youtube.com/watch?v=SC3xdts5vVU","FileUrl":"http://www.keithandthegirl.com/vip/download/shows/myka/MYKA-2014-03-10.mp3","Type":"0","Public":"0","Timestamp":1394467200,"Guests":[{"Data":"461","ShowGuestId":"461","RealName":"Thomas Giglio","Description":"Reality TV producer and one of Myka Fox\u0027s real life friends.","PictureFilename":"ThomasGiglio.jpg","Url1":"","Url2":"http://thomasgiglio.com/","PictureUrl":"http://static-4.keithandthegirl.net/guests/pics/processed/ThomasGiglio-150x150.jpg","PictureUrlLarge":"http://static-4.keithandthegirl.net/guests/pics/processed/ThomasGiglio-600x600.jpg"}]},{"ShowId":"3150","ShowNameId":"16","Number":"35","PostedDate":"3/3/2014 12:00:00 PM","Title":"Put the Shun in Sexual Tension","PreviewUrl":"","FileUrl":"http://www.keithandthegirl.com/vip/download/shows/myka/MYKA-2014-03-03.mp3","Type":"0","Public":"0","Timestamp":1393866000,"Guests":[{"Data":"134","ShowGuestId":"134","RealName":"John F. O\u0027Donnell","Description":"Comedian known for hosting Live From Outer Space comedy show and for appearing as a correspondent on the television show Redacted Tonight.","PictureFilename":"John-F-ODonnell.jpg","Url1":"https://twitter.com/jfodcomedy","Url2":"http://www.livefromouterspace.com","PictureUrl":"http://static-2.keithandthegirl.net/guests/pics/processed/John-F-ODonnell-150x150.jpg","PictureUrlLarge":"http://static-2.keithandthegirl.net/guests/pics/processed/John-F-ODonnell-600x600.jpg"}]},{"ShowId":"3136","ShowNameId":"16","Number":"34","PostedDate":"2/24/2014 12:00:00 PM","Title":"The Secret","VideoFileUrl":"https://www.keithandthegirl.com/vip/download/shows/myka/video/34/MYKA-2014-02-24.m3u8","VideoThumbnailUrl":"https://www.keithandthegirl.com/vip/download/shows/myka/video/34/MYKA-2014-02-24-video.jpg","PreviewUrl":"http://www.youtube.com/watch?v=zQe92OSUrdc","FileUrl":"http://www.keithandthegirl.com/vip/download/shows/myka/MYKA-2014-02-24.mp3","Type":"0","Public":"0","Timestamp":1393261200,"Guests":[{"Data":"476","ShowGuestId":"476","RealName":"Frank Liotti","Description":"Comedian who won the Laughing Skull comedy competition two years in a row and has appeared on Law and Order.","PictureFilename":"Frank-Liotti.jpg","Url1":"","Url2":"http://frankliotti.com/","PictureUrl":"http://static-1.keithandthegirl.net/guests/pics/processed/Frank-Liotti-150x150.jpg","PictureUrlLarge":"http://static-1.keithandthegirl.net/guests/pics/processed/Frank-Liotti-600x600.jpg"}]},{"ShowId":"3124","ShowNameId":"16","Number":"33","PostedDate":"2/17/2014 12:00:00 PM","Title":"Comic Strippers","VideoFileUrl":"https://www.keithandthegirl.com/vip/download/shows/myka/video/33/MYKA-2014-02-17.m3u8","VideoThumbnailUrl":"https://www.keithandthegirl.com/vip/download/shows/myka/video/33/MYKA-2014-02-17-video.jpg","PreviewUrl":"http://www.youtube.com/watch?v=6Aist9bdqkQ","FileUrl":"http://www.keithandthegirl.com/vip/download/shows/myka/MYKA-2014-02-17.mp3","Type":"0","Public":"0","Timestamp":1392656400,"Guests":[{"Data":"370","ShowGuestId":"370","RealName":"Justy Dodge","Description":"Comedian and winner of Time Out New York\u0027s Joke of the Week competition.","PictureFilename":"Justy-Dodge.jpg","Url1":"","Url2":"https://twitter.com/justydodge","PictureUrl":"http://static-2.keithandthegirl.net/guests/pics/processed/Justy-Dodge-150x150.jpg","PictureUrlLarge":"http://static-2.keithandthegirl.net/guests/pics/processed/Justy-Dodge-600x600.jpg"},{"Data":"212","ShowGuestId":"212","RealName":"Paul Hooper","Description":"Comic who has been featured in Michael Moore and Jeff Garlin’s Traverse City Comedy Arts Festival and was a finalist in the 30th Annual Seattle International Comedy Competition.","PictureFilename":"Paul-Hooper.jpg","Url1":"http://www.paulhoopercomedy.com/","Url2":"","PictureUrl":"http://static-4.keithandthegirl.net/guests/pics/processed/Paul-Hooper-150x150.jpg","PictureUrlLarge":"http://static-4.keithandthegirl.net/guests/pics/processed/Paul-Hooper-600x600.jpg"}]},{"ShowId":"3116","ShowNameId":"16","Number":"32","PostedDate":"2/10/2014 12:00:00 PM","Title":"Models and Bottles","VideoFileUrl":"https://www.keithandthegirl.com/vip/download/shows/myka/video/32/MYKA-2014-02-10.m3u8","VideoThumbnailUrl":"https://www.keithandthegirl.com/vip/download/shows/myka/video/32/MYKA-2014-02-10-video.jpg","PreviewUrl":"http://www.youtube.com/watch?v=h8ojdbxRfYs","FileUrl":"http://www.keithandthegirl.com/vip/download/shows/myka/MYKA-2014-02-10.mp3","Type":"0","Public":"0","Timestamp":1392051600,"Guests":[{"Data":"235","ShowGuestId":"235","RealName":"Liz Miele","Description":"Comedian and creator of the webseries\u0027 Apt. C3 and Damaged.","PictureFilename":"Liz-Miele.jpg","Url1":"http://lizmiele.com/","Url2":"","PictureUrl":"http://static-4.keithandthegirl.net/guests/pics/processed/Liz-Miele-150x150.jpg","PictureUrlLarge":"http://static-4.keithandthegirl.net/guests/pics/processed/Liz-Miele-600x600.jpg"}]},{"ShowId":"3103","ShowNameId":"16","Number":"31","PostedDate":"2/3/2014 12:00:00 PM","Title":"ChipGate","VideoFileUrl":"https://www.keithandthegirl.com/vip/download/shows/myka/video/31/MYKA-2014-02-03.m3u8","VideoThumbnailUrl":"https://www.keithandthegirl.com/vip/download/shows/myka/video/31/MYKA-2014-02-03-video.jpg","PreviewUrl":"http://www.youtube.com/watch?v=zUVeGySJx0s","FileUrl":"http://www.keithandthegirl.com/vip/download/shows/myka/MYKA-2014-02-03.mp3","Type":"0","Public":"0","Timestamp":1391446800,"Guests":[{"Data":"376","ShowGuestId":"376","RealName":"Chemda","Description":"Singer, comic and host of the Keith and The Girl podcast.","PictureFilename":"chemda.jpg","Url1":"http://keithandthegirl.com","Url2":"http://chemda.com","PictureUrl":"http://static-3.keithandthegirl.net/guests/pics/processed/chemda-150x150.jpg","PictureUrlLarge":"http://static-3.keithandthegirl.net/guests/pics/processed/chemda-600x600.jpg"},{"Data":"316","ShowGuestId":"316","RealName":"Kendra Cunningham","Description":"Comedian who has appeared on Saturday Night Live and season 8 of Last Comic Standing.","PictureFilename":"Kendra-Cunningham.jpg","Url1":"","Url2":"http://www.kendracunningham.com/","PictureUrl":"http://static-2.keithandthegirl.net/guests/pics/processed/Kendra-Cunningham-150x150.jpg","PictureUrlLarge":"http://static-2.keithandthegirl.net/guests/pics/processed/Kendra-Cunningham-600x600.jpg"},{"Data":"474","ShowGuestId":"474","RealName":"RG Daniels","Description":"Comedian and blogger for MTV2\u0027s Guy Code.","PictureFilename":"RG-Daniels.jpg","Url1":"","Url2":"https://twitter.com/RGDaniels","PictureUrl":"http://static-1.keithandthegirl.net/guests/pics/processed/RG-Daniels-150x150.jpg","PictureUrlLarge":"http://static-1.keithandthegirl.net/guests/pics/processed/RG-Daniels-600x600.jpg"}]},{"ShowId":"3092","ShowNameId":"16","Number":"30","PostedDate":"1/27/2014 12:00:00 PM","Title":"Just Wanted to Say Hi","VideoFileUrl":"https://www.keithandthegirl.com/vip/download/shows/myka/video/30/MYKA-2014-01-27.m3u8","VideoThumbnailUrl":"https://www.keithandthegirl.com/vip/download/shows/myka/video/30/MYKA-2014-01-27-video.jpg","PreviewUrl":"http://www.youtube.com/watch?v=4_jzTweUd74","FileUrl":"http://www.keithandthegirl.com/vip/download/shows/myka/MYKA-2014-01-27.mp3","Type":"0","Public":"0","Timestamp":1390842000,"Guests":[{"Data":"236","ShowGuestId":"236","RealName":"Chris Laker","Description":"Comedian best known for hosting the podcasts The Show with Chris Laker, The Week, and This Week in Jackin\u0027.","PictureFilename":"Chris-Laker.jpg","Url1":"http://chrislaker.com/","Url2":"","PictureUrl":"http://static-4.keithandthegirl.net/guests/pics/processed/Chris-Laker-150x150.jpg","PictureUrlLarge":"http://static-4.keithandthegirl.net/guests/pics/processed/Chris-Laker-600x600.jpg"},{"Data":"473","ShowGuestId":"473","RealName":"Kerryn Feehan","Description":"Comedian and actress who has appeared in the independent film The Reunion.","PictureFilename":"KerrynFeehan.jpg","Url1":"","Url2":"http://www.kerrynfeehan.com/","PictureUrl":"http://static-1.keithandthegirl.net/guests/pics/processed/KerrynFeehan-150x150.jpg","PictureUrlLarge":"http://static-1.keithandthegirl.net/guests/pics/processed/KerrynFeehan-600x600.jpg"}]},{"ShowId":"3081","ShowNameId":"16","Number":"29","PostedDate":"1/20/2014 12:00:00 PM","Title":"Lance-ing Michigan","VideoFileUrl":"https://www.keithandthegirl.com/vip/download/shows/myka/video/29/MYKA-2014-01-20.m3u8","VideoThumbnailUrl":"https://www.keithandthegirl.com/vip/download/shows/myka/video/29/MYKA-2014-01-20-video.jpg","PreviewUrl":"http://www.youtube.com/watch?v=niimPVIofrI","FileUrl":"http://www.keithandthegirl.com/vip/download/shows/myka/MYKA-2014-01-20.mp3","Type":"0","Public":"0","Timestamp":1390237200,"Guests":[{"Data":"472","ShowGuestId":"472","RealName":"Lance Weiss","Description":"Comedian who was featured on NBC\u0027s The Today Show and was a top-4 finalist in CMT\u0027s Next Big Comic.","PictureFilename":"lanceweiss.jpeg","Url1":"","Url2":"http://lanceweiss.com/","PictureUrl":"http://static-3.keithandthegirl.net/guests/pics/processed/lanceweiss-150x150.jpeg","PictureUrlLarge":"http://static-3.keithandthegirl.net/guests/pics/processed/lanceweiss-600x600.jpeg"}]},{"ShowId":"3071","ShowNameId":"16","Number":"28","PostedDate":"1/13/2014 12:00:00 PM","Title":"New Year\u0027s E","VideoFileUrl":"https://www.keithandthegirl.com/vip/download/shows/myka/video/28/MYKA-2014-01-13.m3u8","VideoThumbnailUrl":"https://www.keithandthegirl.com/vip/download/shows/myka/video/28/MYKA-2014-01-13-video.jpg","PreviewUrl":"http://www.youtube.com/watch?v=hJw2-UvEwQY","FileUrl":"http://www.keithandthegirl.com/vip/download/shows/myka/MYKA-2014-01-13.mp3","Type":"0","Public":"0","Timestamp":1389632400,"Guests":[{"Data":"397","ShowGuestId":"397","RealName":"Maria Heinegg","Description":"Comedian and writer best known for her contributions to The Huffington Post.","PictureFilename":"maria-heinegg.jpg","Url1":"","Url2":"https://twitter.com/MariaElizabest","PictureUrl":"http://static-4.keithandthegirl.net/guests/pics/processed/maria-heinegg-150x150.jpg","PictureUrlLarge":"http://static-4.keithandthegirl.net/guests/pics/processed/maria-heinegg-600x600.jpg"}]},{"ShowId":"3060","ShowNameId":"16","Number":"27","PostedDate":"1/6/2014 12:00:00 PM","Title":"New Years Ass Solutions","VideoFileUrl":"https://www.keithandthegirl.com/vip/download/shows/myka/video/27/MYKA-2014-01-06.m3u8","VideoThumbnailUrl":"https://www.keithandthegirl.com/vip/download/shows/myka/video/27/MYKA-2014-01-06-video.jpg","PreviewUrl":"http://www.youtube.com/watch?v=q83GoNRdWRc","FileUrl":"http://www.keithandthegirl.com/vip/download/shows/myka/MYKA-2014-01-06.mp3","Type":"0","Public":"0","Timestamp":1389027600,"Guests":[{"Data":"461","ShowGuestId":"461","RealName":"Thomas Giglio","Description":"Reality TV producer and one of Myka Fox\u0027s real life friends.","PictureFilename":"ThomasGiglio.jpg","Url1":"","Url2":"http://thomasgiglio.com/","PictureUrl":"http://static-4.keithandthegirl.net/guests/pics/processed/ThomasGiglio-150x150.jpg","PictureUrlLarge":"http://static-4.keithandthegirl.net/guests/pics/processed/ThomasGiglio-600x600.jpg"}]},{"ShowId":"3056","ShowNameId":"16","Number":"26","PostedDate":"12/30/2013 12:00:00 PM","Title":"MF\u0026F Redux","VideoFileUrl":"https://www.keithandthegirl.com/vip/download/shows/myka/video/26/MYKA-2013-12-30.m3u8","VideoThumbnailUrl":"https://www.keithandthegirl.com/vip/download/shows/myka/video/26/MYKA-2013-12-30-video.jpg","PreviewUrl":"http://www.youtube.com/watch?v=DD2tvI6h0ss","FileUrl":"http://www.keithandthegirl.com/vip/download/shows/myka/MYKA-2013-12-30.mp3","Type":"0","Public":"0","Timestamp":1388422800,"Guests":[{"Data":"468","ShowGuestId":"468","RealName":"Alexis Guerreros","Description":"Comedian and host of the Show Me Your Bits podcast.","PictureFilename":"AlexisGuerreros.jpg","Url1":"","Url2":"http://www.alexisguerreros.com/","PictureUrl":"http://static-1.keithandthegirl.net/guests/pics/processed/AlexisGuerreros-150x150.jpg","PictureUrlLarge":"http://static-1.keithandthegirl.net/guests/pics/processed/AlexisGuerreros-600x600.jpg"}]},{"ShowId":"3050","ShowNameId":"16","Number":"25","PostedDate":"12/23/2013 12:00:00 PM","Title":"www.Episode25.pod #CaityQuinn","VideoFileUrl":"https://www.keithandthegirl.com/vip/download/shows/myka/video/25/MYKA-2013-12-23.m3u8","VideoThumbnailUrl":"https://www.keithandthegirl.com/vip/download/shows/myka/video/25/MYKA-2013-12-23-video.jpg","PreviewUrl":"http://www.youtube.com/watch?v=xLP3yGWh4Kg","FileUrl":"http://www.keithandthegirl.com/vip/download/shows/myka/MYKA-2013-12-23.mp3","Type":"0","Public":"0","Timestamp":1387818000,"Guests":[{"Data":"460","ShowGuestId":"460","RealName":"Caity Quinn","Description":"One of Myka Fox\u0027s real life friends.","PictureFilename":"CaityQuinn.jpg","Url1":"","Url2":"https://twitter.com/caity_quinn","PictureUrl":"http://static-3.keithandthegirl.net/guests/pics/processed/CaityQuinn-150x150.jpg","PictureUrlLarge":"http://static-3.keithandthegirl.net/guests/pics/processed/CaityQuinn-600x600.jpg"}]},{"ShowId":"3039","ShowNameId":"16","Number":"24","PostedDate":"12/16/2013 12:00:00 PM","Title":"Time Warner A-holes","VideoFileUrl":"https://www.keithandthegirl.com/vip/download/shows/myka/video/24/MYKA-2013-12-16.m3u8","VideoThumbnailUrl":"https://www.keithandthegirl.com/vip/download/shows/myka/video/24/MYKA-2013-12-16-video.jpg","PreviewUrl":"http://www.youtube.com/watch?v=2qIxR7le0Vk","FileUrl":"http://www.keithandthegirl.com/vip/download/shows/myka/MYKA-2013-12-16.mp3","Type":"0","Public":"0","Timestamp":1387213200,"Guests":[{"Data":"237","ShowGuestId":"237","RealName":"Jacqueline Novak","Description":"Comedian best known for her album Quality Notions.","PictureFilename":"Jacqueline-Novak.jpg","Url1":"http://douchechillz.com/","Url2":"","PictureUrl":"http://static-4.keithandthegirl.net/guests/pics/processed/Jacqueline-Novak-150x150.jpg","PictureUrlLarge":"http://static-4.keithandthegirl.net/guests/pics/processed/Jacqueline-Novak-600x600.jpg"}]},{"ShowId":"3028","ShowNameId":"16","Number":"23","PostedDate":"12/9/2013 12:00:00 PM","Title":"The Myka Micah Myq Club (and Danny\u0027s there)","VideoFileUrl":"https://www.keithandthegirl.com/vip/download/shows/myka/video/23/MYKA-2013-12-09.m3u8","VideoThumbnailUrl":"https://www.keithandthegirl.com/vip/download/shows/myka/video/23/MYKA-2013-12-09-video.jpg","PreviewUrl":"https://www.youtube.com/watch?v=KhPt_Z-brUw","FileUrl":"http://www.keithandthegirl.com/vip/download/shows/myka/MYKA-2013-12-09.mp3","Type":"0","Public":"0","Timestamp":1386608400,"Guests":[{"Data":"203","ShowGuestId":"203","RealName":"Danny Hatch","Description":"Comedian, writer, and host of That’s the Show with Danny.","PictureFilename":"Danny-Hatch.jpg","Url1":"http://dannyhatch.tumblr.com","Url2":"http://twitter.com/dannyhatch","PictureUrl":"http://static-3.keithandthegirl.net/guests/pics/processed/Danny-Hatch-150x150.jpg","PictureUrlLarge":"http://static-3.keithandthegirl.net/guests/pics/processed/Danny-Hatch-600x600.jpg"},{"Data":"107","ShowGuestId":"107","RealName":"Micah Sherman","Description":"Comedian known for his documentary Like Me.","PictureFilename":"Micah-Sherman.jpg","Url1":"http://facebook.com/professionaldork","Url2":"http://www.micahsherman.com","PictureUrl":"http://static-2.keithandthegirl.net/guests/pics/processed/Micah-Sherman-150x150.jpg","PictureUrlLarge":"http://static-2.keithandthegirl.net/guests/pics/processed/Micah-Sherman-600x600.jpg"},{"Data":"92","ShowGuestId":"92","RealName":"Myq Kaplan","Description":"Comedian known for his appearances on Last Comic Standing and The Late Show with David Letterman, and for hosting the podcast Hang Out with Me.","PictureFilename":"Myq-Kaplan.jpg","Url1":"http://www.godzillionaire.blogspot.com","Url2":"http://www.myqkaplan.com","PictureUrl":"http://static-4.keithandthegirl.net/guests/pics/processed/Myq-Kaplan-150x150.jpg","PictureUrlLarge":"http://static-4.keithandthegirl.net/guests/pics/processed/Myq-Kaplan-600x600.jpg"}]},{"ShowId":"3018","ShowNameId":"16","Number":"22","PostedDate":"12/2/2013 12:00:00 PM","Title":"Keith Solves Everything","VideoFileUrl":"https://www.keithandthegirl.com/vip/download/shows/myka/video/22/MYKA-2013-12-02.m3u8","VideoThumbnailUrl":"https://www.keithandthegirl.com/vip/download/shows/myka/video/22/MYKA-2013-12-02-video.jpg","PreviewUrl":"http://www.youtube.com/watch?v=J5SrB1Ryr30","FileUrl":"http://www.keithandthegirl.com/vip/download/shows/myka/MYKA-2013-12-02.mp3","Type":"0","Public":"0","Timestamp":1386003600,"Guests":[{"Data":"323","ShowGuestId":"323","RealName":"Keith and The Girl","Description":"","PictureFilename":"Keith-and-The-Girl.jpg","Url1":"","Url2":"http://keithandthegirl.com/","PictureUrl":"http://static-2.keithandthegirl.net/guests/pics/processed/Keith-and-The-Girl-150x150.jpg","PictureUrlLarge":"http://static-2.keithandthegirl.net/guests/pics/processed/Keith-and-The-Girl-600x600.jpg"}]},{"ShowId":"3009","ShowNameId":"16","Number":"21","PostedDate":"11/25/2013 12:00:00 PM","Title":"Lord of the Landlords","VideoFileUrl":"https://www.keithandthegirl.com/vip/download/shows/myka/video/21/MYKA-2013-11-25.m3u8","VideoThumbnailUrl":"https://www.keithandthegirl.com/vip/download/shows/myka/video/21/MYKA-2013-11-25-video.jpg","PreviewUrl":"http://www.youtube.com/watch?v=GAPoo1I9fTw","FileUrl":"http://www.keithandthegirl.com/vip/download/shows/myka/MYKA-2013-11-25.mp3","Type":"0","Public":"0","Timestamp":1385398800,"Guests":[{"Data":"471","ShowGuestId":"471","RealName":"Calvin Cato","Description":"Comedian who has appeared on the Game Show Network and QPTV.","PictureFilename":"CalvinCato.jpg","Url1":"","Url2":"http://calvincato.com/","PictureUrl":"http://static-2.keithandthegirl.net/guests/pics/processed/CalvinCato-150x150.jpg","PictureUrlLarge":"http://static-2.keithandthegirl.net/guests/pics/processed/CalvinCato-600x600.jpg"}]},{"ShowId":"3001","ShowNameId":"16","Number":"20","PostedDate":"11/18/2013 12:00:00 PM","Title":"Fast Times at Riff-mont High","VideoFileUrl":"https://www.keithandthegirl.com/vip/download/shows/myka/video/20/MYKA-2013-11-18.m3u8","VideoThumbnailUrl":"https://www.keithandthegirl.com/vip/download/shows/myka/video/20/MYKA-2013-11-18-video.jpg","PreviewUrl":"http://www.youtube.com/watch?v=4XXC8eatYcY","FileUrl":"http://www.keithandthegirl.com/vip/download/shows/myka/MYKA-2013-11-18.mp3","Type":"0","Public":"0","Timestamp":1384794000,"Guests":[{"Data":"239","ShowGuestId":"239","RealName":"Josh Gondelman","Description":"Comedian and writer best known for producing Last Week Tonight with John Oliver and co-creating the Modern Seinfeld Twitter account.","PictureFilename":"Josh-Gondelman.jpg","Url1":"http://www.joshgondelman.com/","Url2":"","PictureUrl":"http://static-3.keithandthegirl.net/guests/pics/processed/Josh-Gondelman-150x150.jpg","PictureUrlLarge":"http://static-3.keithandthegirl.net/guests/pics/processed/Josh-Gondelman-600x600.jpg"}]},{"ShowId":"2991","ShowNameId":"16","Number":"19","PostedDate":"11/11/2013 12:00:00 PM","Title":"Getting Some Dickstance","VideoFileUrl":"https://www.keithandthegirl.com/vip/download/shows/myka/video/19/MYKA-2013-11-11.m3u8","VideoThumbnailUrl":"https://www.keithandthegirl.com/vip/download/shows/myka/video/19/MYKA-2013-11-11-video.jpg","PreviewUrl":"http://www.youtube.com/watch?v=lFo0k0QXww0","FileUrl":"http://www.keithandthegirl.com/vip/download/shows/myka/MYKA-2013-11-11.mp3","Type":"0","Public":"0","Timestamp":1384189200,"Guests":[{"Data":"376","ShowGuestId":"376","RealName":"Chemda","Description":"Singer, comic and host of the Keith and The Girl podcast.","PictureFilename":"chemda.jpg","Url1":"http://keithandthegirl.com","Url2":"http://chemda.com","PictureUrl":"http://static-3.keithandthegirl.net/guests/pics/processed/chemda-150x150.jpg","PictureUrlLarge":"http://static-3.keithandthegirl.net/guests/pics/processed/chemda-600x600.jpg"}]},{"ShowId":"2973","ShowNameId":"16","Number":"18","PostedDate":"11/4/2013 12:00:00 PM","Title":"Just the Three of Us","VideoFileUrl":"https://www.keithandthegirl.com/vip/download/shows/myka/video/18/MYKA-2013-11-04.m3u8","VideoThumbnailUrl":"https://www.keithandthegirl.com/vip/download/shows/myka/video/18/MYKA-2013-11-04-video.jpg","PreviewUrl":"http://www.youtube.com/watch?v=FaoS-_eYv-E","FileUrl":"http://www.keithandthegirl.com/vip/download/shows/myka/MYKA-2013-11-04.mp3","Type":"0","Public":"0","Timestamp":1383584400,"Guests":[{"Data":"470","ShowGuestId":"470","RealName":"Erika Wasser","Description":"Comedian whose work has been featured in Us Magazine, In Touch Magazine, and Glamour Magazine.","PictureFilename":"erikawasser.jpg","Url1":"","Url2":"http://erikawasser.com/","PictureUrl":"http://static-1.keithandthegirl.net/guests/pics/processed/erikawasser-150x150.jpg","PictureUrlLarge":"http://static-1.keithandthegirl.net/guests/pics/processed/erikawasser-600x600.jpg"},{"Data":"263","ShowGuestId":"263","RealName":"Katharine Heller","Description":"Comedian and actress known for hosting the Tell the Bartender podcast.","PictureFilename":"Katharine-Heller.jpg","Url1":"http://katharineheller.com","Url2":"","PictureUrl":"http://static-1.keithandthegirl.net/guests/pics/processed/Katharine-Heller-150x150.jpg","PictureUrlLarge":"http://static-1.keithandthegirl.net/guests/pics/processed/Katharine-Heller-600x600.jpg"}]},{"ShowId":"2966","ShowNameId":"16","Number":"17","PostedDate":"10/28/2013 12:00:00 PM","Title":"Describe How You\u0027re Crippled","VideoFileUrl":"https://www.keithandthegirl.com/vip/download/shows/myka/video/17/MYKA-2013-10-28.m3u8","VideoThumbnailUrl":"https://www.keithandthegirl.com/vip/download/shows/myka/video/17/MYKA-2013-10-28-video.jpg","PreviewUrl":"http://www.youtube.com/watch?v=hw6ZHDR_YC0","FileUrl":"http://www.keithandthegirl.com/vip/download/shows/myka/MYKA-2013-10-28.mp3","Type":"0","Public":"0","Timestamp":1382976000,"Guests":[{"Data":"423","ShowGuestId":"423","RealName":"Katy Olson","Description":"Comedian and Columbia graduate who doesn\u0027t let cerebral palsy get her down.","PictureFilename":"KatyOlson.jpg","Url1":"","Url2":"https://twitter.com/katyolson","PictureUrl":"http://static-4.keithandthegirl.net/guests/pics/processed/KatyOlson-150x150.jpg","PictureUrlLarge":"http://static-4.keithandthegirl.net/guests/pics/processed/KatyOlson-600x600.jpg"}]},{"ShowId":"2956","ShowNameId":"16","Number":"16","PostedDate":"10/21/2013 12:00:00 PM","Title":"Load Bearing Walls","VideoFileUrl":"https://www.keithandthegirl.com/vip/download/shows/myka/video/16/MYKA-2013-10-21.m3u8","VideoThumbnailUrl":"https://www.keithandthegirl.com/vip/download/shows/myka/video/16/MYKA-2013-10-21-video.jpg","PreviewUrl":"http://www.youtube.com/watch?v=-dxTMD8oPcU","FileUrl":"http://www.keithandthegirl.com/vip/download/shows/myka/MYKA-2013-10-21.mp3","Type":"0","Public":"0","Timestamp":1382371200,"Guests":[{"Data":"468","ShowGuestId":"468","RealName":"Alexis Guerreros","Description":"Comedian and host of the Show Me Your Bits podcast.","PictureFilename":"AlexisGuerreros.jpg","Url1":"","Url2":"http://www.alexisguerreros.com/","PictureUrl":"http://static-1.keithandthegirl.net/guests/pics/processed/AlexisGuerreros-150x150.jpg","PictureUrlLarge":"http://static-1.keithandthegirl.net/guests/pics/processed/AlexisGuerreros-600x600.jpg"},{"Data":"469","ShowGuestId":"469","RealName":"Ryan Johnson","Description":"Comedian who has performed at Caroline\u0027s, Broadway Comedy Club, and Gotham Comedy Club.","PictureFilename":"RyanJohnson.jpg","Url1":"","Url2":"http://bumpyj80.wix.com/home2#!","PictureUrl":"http://static-1.keithandthegirl.net/guests/pics/processed/RyanJohnson-150x150.jpg","PictureUrlLarge":"http://static-1.keithandthegirl.net/guests/pics/processed/RyanJohnson-600x600.jpg"}]},{"ShowId":"2943","ShowNameId":"16","Number":"15","PostedDate":"10/14/2013 12:00:00 PM","Title":"Cheaper Than a Big Mac","VideoFileUrl":"https://www.keithandthegirl.com/vip/download/shows/myka/video/15/MYKA-2013-10-14.m3u8","VideoThumbnailUrl":"https://www.keithandthegirl.com/vip/download/shows/myka/video/15/MYKA-2013-10-14-video.jpg","PreviewUrl":"http://www.youtube.com/watch?v=IeDi9FF4EQQ","FileUrl":"http://www.keithandthegirl.com/vip/download/shows/myka/MYKA-2013-10-14.mp3","Type":"0","Public":"0","Timestamp":1381766400,"Guests":[{"Data":"467","ShowGuestId":"467","RealName":"Coree Spencer","Description":"Comedian and host of the web series Comedian on Comedian.","PictureFilename":"CoreeSpencer.jpg","Url1":"","Url2":"https://twitter.com/coreespencer","PictureUrl":"http://static-1.keithandthegirl.net/guests/pics/processed/CoreeSpencer-150x150.jpg","PictureUrlLarge":"http://static-1.keithandthegirl.net/guests/pics/processed/CoreeSpencer-600x600.jpg"},{"Data":"461","ShowGuestId":"461","RealName":"Thomas Giglio","Description":"Reality TV producer and one of Myka Fox\u0027s real life friends.","PictureFilename":"ThomasGiglio.jpg","Url1":"","Url2":"http://thomasgiglio.com/","PictureUrl":"http://static-4.keithandthegirl.net/guests/pics/processed/ThomasGiglio-150x150.jpg","PictureUrlLarge":"http://static-4.keithandthegirl.net/guests/pics/processed/ThomasGiglio-600x600.jpg"}]},{"ShowId":"2934","ShowNameId":"16","Number":"14","PostedDate":"10/7/2013 12:00:00 PM","Title":"Totally Workless","VideoFileUrl":"https://www.keithandthegirl.com/vip/download/shows/myka/video/14/MYKA-2013-10-07.m3u8","VideoThumbnailUrl":"https://www.keithandthegirl.com/vip/download/shows/myka/video/14/MYKA-2013-10-07-video.jpg","PreviewUrl":"http://www.youtube.com/watch?v=N3z7wBnXViY","FileUrl":"http://www.keithandthegirl.com/vip/download/shows/myka/MYKA-2013-10-07.mp3","Type":"0","Public":"0","Timestamp":1381161600,"Guests":[{"Data":"460","ShowGuestId":"460","RealName":"Caity Quinn","Description":"One of Myka Fox\u0027s real life friends.","PictureFilename":"CaityQuinn.jpg","Url1":"","Url2":"https://twitter.com/caity_quinn","PictureUrl":"http://static-3.keithandthegirl.net/guests/pics/processed/CaityQuinn-150x150.jpg","PictureUrlLarge":"http://static-3.keithandthegirl.net/guests/pics/processed/CaityQuinn-600x600.jpg"}]},{"ShowId":"2926","ShowNameId":"16","Number":"13","PostedDate":"9/30/2013 12:00:00 PM","Title":"Hot Tub Sangria","VideoFileUrl":"https://www.keithandthegirl.com/vip/download/shows/myka/video/13/MYKA-2013-09-30.m3u8","VideoThumbnailUrl":"https://www.keithandthegirl.com/vip/download/shows/myka/video/13/MYKA-2013-09-30-video.jpg","PreviewUrl":"http://www.youtube.com/watch?v=LYNKIbn4EEg","FileUrl":"http://www.keithandthegirl.com/vip/download/shows/myka/MYKA-2013-09-30.mp3","Type":"0","Public":"0","Timestamp":1380556800,"Guests":[{"Data":"111","ShowGuestId":"111","RealName":"Ben Lerman","Description":"Comedian and musician known for his EPs Size Matters and Ukelear Winter, and for hosting the podcast Serving Reelness.","PictureFilename":"Ben-Lerman.jpg","Url1":"http://www.facebook.com/thebenlerman","Url2":"http://www.benlerman.net","PictureUrl":"http://static-2.keithandthegirl.net/guests/pics/processed/Ben-Lerman-150x150.jpg","PictureUrlLarge":"http://static-2.keithandthegirl.net/guests/pics/processed/Ben-Lerman-600x600.jpg"},{"Data":"125","ShowGuestId":"125","RealName":"Jessica Delfino","Description":"Comedian and musician known for her appearances on Good Morning America and her albums Dirty Folk Rock and I Wanna Be Famous.","PictureFilename":"Jessica-Delfino.jpg","Url1":"http://www.facebook.com/jessdelfino","Url2":"http://jessydelfino.blogspot.com","PictureUrl":"http://static-3.keithandthegirl.net/guests/pics/processed/Jessica-Delfino-150x150.jpg","PictureUrlLarge":"http://static-3.keithandthegirl.net/guests/pics/processed/Jessica-Delfino-600x600.jpg"}]},{"ShowId":"2916","ShowNameId":"16","Number":"12","PostedDate":"9/23/2013 12:00:00 PM","Title":"Sara Silverfox","VideoFileUrl":"https://www.keithandthegirl.com/vip/download/shows/myka/video/12/MYKA-2013-09-23.m3u8","VideoThumbnailUrl":"https://www.keithandthegirl.com/vip/download/shows/myka/video/12/MYKA-2013-09-23-video.jpg","PreviewUrl":"http://www.youtube.com/watch?v=c2ziF7A-YSM","FileUrl":"http://www.keithandthegirl.com/vip/download/shows/myka/MYKA-2013-09-23.mp3","Type":"0","Public":"0","Timestamp":1379952000,"Guests":[{"Data":"215","ShowGuestId":"215","RealName":"Adam Spiegelman","Description":"Comedy booker and host of the podcast Proudly Resents.","PictureFilename":"Adam-Spiegelman.jpg","Url1":"","Url2":"http://www.facebook.com/reachadam","PictureUrl":"http://static-4.keithandthegirl.net/guests/pics/processed/Adam-Spiegelman-150x150.jpg","PictureUrlLarge":"http://static-4.keithandthegirl.net/guests/pics/processed/Adam-Spiegelman-600x600.jpg"},{"Data":"376","ShowGuestId":"376","RealName":"Chemda","Description":"Singer, comic and host of the Keith and The Girl podcast.","PictureFilename":"chemda.jpg","Url1":"http://keithandthegirl.com","Url2":"http://chemda.com","PictureUrl":"http://static-3.keithandthegirl.net/guests/pics/processed/chemda-150x150.jpg","PictureUrlLarge":"http://static-3.keithandthegirl.net/guests/pics/processed/chemda-600x600.jpg"}]},{"ShowId":"2906","ShowNameId":"16","Number":"11","PostedDate":"9/16/2013 1:41:09 PM","Title":"X-Raybies","VideoFileUrl":"https://www.keithandthegirl.com/vip/download/shows/myka/video/11/MYKA-2013-09-16.m3u8","VideoThumbnailUrl":"https://www.keithandthegirl.com/vip/download/shows/myka/video/11/MYKA-2013-09-16-video.jpg","PreviewUrl":"http://www.youtube.com/watch?v=bhSAvHk1gc4","FileUrl":"http://www.keithandthegirl.com/vip/download/shows/myka/MYKA-2013-09-16.mp3","Type":"0","Public":"0","Timestamp":1379353269,"Guests":[{"Data":"466","ShowGuestId":"466","RealName":"Erin Lennox","Description":"Comedian who has been featured in the Women in Comedy Festival and has written for ESPN, MTV, and the NFL Network.","PictureFilename":"ErinLennox.jpeg","Url1":"","Url2":"http://erinlennox.com/","PictureUrl":"http://static-3.keithandthegirl.net/guests/pics/processed/ErinLennox-150x150.jpeg","PictureUrlLarge":"http://static-3.keithandthegirl.net/guests/pics/processed/ErinLennox-600x600.jpeg"}]},{"ShowId":"2896","ShowNameId":"16","Number":"10","PostedDate":"9/9/2013 12:00:00 PM","Title":"The Garlic Portal","VideoFileUrl":"https://www.keithandthegirl.com/vip/download/shows/myka/video/10/MYKA-2013-09-09.m3u8","VideoThumbnailUrl":"https://www.keithandthegirl.com/vip/download/shows/myka/video/10/MYKA-2013-09-09-video.jpg","PreviewUrl":"http://www.youtube.com/watch?v=RVZM0C-SHB4","FileUrl":"http://www.keithandthegirl.com/vip/download/shows/myka/MYKA-2013-09-09.mp3","Type":"0","Public":"0","Timestamp":1378742400,"Guests":[{"Data":"150","ShowGuestId":"150","RealName":"Claudia Cogan","Description":"Comedian known for her appearance on Last Comic Standing and for winning the first ever Time Out New York Joke of the Year.","PictureFilename":"Claudia-Cogan.jpg","Url1":"","Url2":"http://www.claudiacogan.com/","PictureUrl":"http://static-2.keithandthegirl.net/guests/pics/processed/Claudia-Cogan-150x150.jpg","PictureUrlLarge":"http://static-2.keithandthegirl.net/guests/pics/processed/Claudia-Cogan-600x600.jpg"},{"Data":"465","ShowGuestId":"465","RealName":"Katie Compa","Description":"Comedian and 2007 Battle of the Bay Comedy Competition finalist.","PictureFilename":"katiecompa.jpg","Url1":"","Url2":"https://twitter.com/katiecompa","PictureUrl":"http://static-3.keithandthegirl.net/guests/pics/processed/katiecompa-150x150.jpg","PictureUrlLarge":"http://static-3.keithandthegirl.net/guests/pics/processed/katiecompa-600x600.jpg"}]},{"ShowId":"2889","ShowNameId":"16","Number":"9","PostedDate":"9/2/2013 12:00:00 PM","Title":"Making Moves","VideoFileUrl":"https://www.keithandthegirl.com/vip/download/shows/myka/video/9/MYKA-2013-09-02.m3u8","VideoThumbnailUrl":"https://www.keithandthegirl.com/vip/download/shows/myka/video/9/MYKA-2013-09-02-video.jpg","PreviewUrl":"http://www.youtube.com/watch?v=2_kMoBjQ9vo","FileUrl":"http://www.keithandthegirl.com/vip/download/shows/myka/MYKA-2013-09-02.mp3","Type":"0","Public":"0","Timestamp":1378137600,"Guests":[{"Data":"365","ShowGuestId":"365","RealName":"Ben Kronberg","Description":"Comedian known for his appearance on NBC\u0027s Last Comic Standing and for his Comedy Central Presents special.","PictureFilename":"BenKronberg.jpg","Url1":"https://twitter.com/benkronberg","Url2":"http://benkronberg.com/","PictureUrl":"http://static-1.keithandthegirl.net/guests/pics/processed/BenKronberg-150x150.jpg","PictureUrlLarge":"http://static-1.keithandthegirl.net/guests/pics/processed/BenKronberg-600x600.jpg"}]},{"ShowId":"2877","ShowNameId":"16","Number":"8","PostedDate":"8/26/2013 2:45:22 PM","Title":"Airplanes and Greyhounds","VideoFileUrl":"https://www.keithandthegirl.com/vip/download/shows/myka/video/8/MYKA-2013-08-26.m3u8","VideoThumbnailUrl":"https://www.keithandthegirl.com/vip/download/shows/myka/video/8/MYKA-2013-08-26-video.jpg","PreviewUrl":"http://www.youtube.com/watch?v=784VEbw6HdE","FileUrl":"http://www.keithandthegirl.com/vip/download/shows/myka/MYKA-2013-08-26.mp3","Type":"0","Public":"0","Timestamp":1377542722,"Guests":[{"Data":"7","ShowGuestId":"7","RealName":"Victor Varnado","Description":"Stand-up comic, actor, producer, and director of The Awkward Comedy Show and Tell Your Friends: The Concert Film.","PictureFilename":"Victor-Varnado.jpg","Url1":"http://www.facebook.com/#!/vvarnado?ref=ts","Url2":"http://www.bestalbino.com","PictureUrl":"http://static-3.keithandthegirl.net/guests/pics/processed/Victor-Varnado-150x150.jpg","PictureUrlLarge":"http://static-3.keithandthegirl.net/guests/pics/processed/Victor-Varnado-600x600.jpg"}]},{"ShowId":"2864","ShowNameId":"16","Number":"7","PostedDate":"8/19/2013 2:47:29 PM","Title":"Tweet Elite","VideoFileUrl":"https://www.keithandthegirl.com/vip/download/shows/myka/video/7/MYKA-2013-08-19.m3u8","VideoThumbnailUrl":"https://www.keithandthegirl.com/vip/download/shows/myka/video/7/MYKA-2013-08-19-video.jpg","PreviewUrl":"http://www.youtube.com/watch?v=mxZi1KcJ0TQ","FileUrl":"http://www.keithandthegirl.com/vip/download/shows/myka/MYKA-2013-08-19.mp3","Type":"0","Public":"0","Timestamp":1376938049,"Guests":[{"Data":"463","ShowGuestId":"463","RealName":"AllCapsBro","Description":"Twitter personality who tweets only in capital letters.","PictureFilename":"AllCapsBro.jpeg","Url1":"","Url2":"https://twitter.com/ALLCAPSBRO","PictureUrl":"http://static-4.keithandthegirl.net/guests/pics/processed/AllCapsBro-150x150.jpeg","PictureUrlLarge":"http://static-4.keithandthegirl.net/guests/pics/processed/AllCapsBro-600x600.jpeg"},{"Data":"464","ShowGuestId":"464","RealName":"Travis LeBlanc","Description":"Comedian and Twitter personality.","PictureFilename":"","Url1":"","Url2":"https://twitter.com/travleblanc","PictureUrl":"http://www.keithandthegirl.com/guests/pictures/unknown.jpg","PictureUrlLarge":"http://www.keithandthegirl.com/guests/pictures/unknown.jpg"}]},{"ShowId":"2851","ShowNameId":"16","Number":"6","PostedDate":"8/12/2013 12:03:51 PM","Title":"Burnt, man","VideoFileUrl":"https://www.keithandthegirl.com/vip/download/shows/myka/video/6/MYKA-2013-08-12.m3u8","VideoThumbnailUrl":"https://www.keithandthegirl.com/vip/download/shows/myka/video/6/MYKA-2013-08-12-video.jpg","PreviewUrl":"http://www.youtube.com/watch?v=d5jm1fH13xw","FileUrl":"http://www.keithandthegirl.com/vip/download/shows/myka/MYKA-2013-08-12.mp3","Type":"0","Public":"0","Timestamp":1376323431,"Guests":[{"Data":"462","ShowGuestId":"462","RealName":"Jacquelyn Gallo","Description":"Publicist and bartender for NYC underground bar The Pyramid Club.","PictureFilename":"JacquelynGallo.jpg","Url1":"","Url2":"https://www.facebook.com/jacquelyn.gallo","PictureUrl":"http://static-3.keithandthegirl.net/guests/pics/processed/JacquelynGallo-150x150.jpg","PictureUrlLarge":"http://static-3.keithandthegirl.net/guests/pics/processed/JacquelynGallo-600x600.jpg"},{"Data":"92","ShowGuestId":"92","RealName":"Myq Kaplan","Description":"Comedian known for his appearances on Last Comic Standing and The Late Show with David Letterman, and for hosting the podcast Hang Out with Me.","PictureFilename":"Myq-Kaplan.jpg","Url1":"http://www.godzillionaire.blogspot.com","Url2":"http://www.myqkaplan.com","PictureUrl":"http://static-4.keithandthegirl.net/guests/pics/processed/Myq-Kaplan-150x150.jpg","PictureUrlLarge":"http://static-4.keithandthegirl.net/guests/pics/processed/Myq-Kaplan-600x600.jpg"}]},{"ShowId":"2838","ShowNameId":"16","Number":"5","PostedDate":"8/5/2013 10:39:09 AM","Title":"Step Off My Tubes","VideoFileUrl":"https://www.keithandthegirl.com/vip/download/shows/myka/video/5/MYKA-2013-08-05.m3u8","VideoThumbnailUrl":"https://www.keithandthegirl.com/vip/download/shows/myka/video/5/MYKA-2013-08-05-video.jpg","PreviewUrl":"http://www.youtube.com/watch?v=PpULh_ZnTgI","FileUrl":"http://www.keithandthegirl.com/vip/download/shows/myka/MYKA-2013-08-05.mp3","Type":"0","Public":"0","Timestamp":1375713549,"Guests":[{"Data":"203","ShowGuestId":"203","RealName":"Danny Hatch","Description":"Comedian, writer, and host of That’s the Show with Danny.","PictureFilename":"Danny-Hatch.jpg","Url1":"http://dannyhatch.tumblr.com","Url2":"http://twitter.com/dannyhatch","PictureUrl":"http://static-3.keithandthegirl.net/guests/pics/processed/Danny-Hatch-150x150.jpg","PictureUrlLarge":"http://static-3.keithandthegirl.net/guests/pics/processed/Danny-Hatch-600x600.jpg"},{"Data":"461","ShowGuestId":"461","RealName":"Thomas Giglio","Description":"Reality TV producer and one of Myka Fox\u0027s real life friends.","PictureFilename":"ThomasGiglio.jpg","Url1":"","Url2":"http://thomasgiglio.com/","PictureUrl":"http://static-4.keithandthegirl.net/guests/pics/processed/ThomasGiglio-150x150.jpg","PictureUrlLarge":"http://static-4.keithandthegirl.net/guests/pics/processed/ThomasGiglio-600x600.jpg"}]},{"ShowId":"2824","ShowNameId":"16","Number":"4","PostedDate":"7/29/2013 12:26:09 PM","Title":"Chunky Qum","VideoFileUrl":"https://www.keithandthegirl.com/vip/download/shows/myka/video/4/MYKA-2013-07-29.m3u8","VideoThumbnailUrl":"https://www.keithandthegirl.com/vip/download/shows/myka/video/4/MYKA-2013-07-29-video.jpg","PreviewUrl":"http://www.youtube.com/watch?v=u_XD-dVBK_k","FileUrl":"http://www.keithandthegirl.com/vip/download/shows/myka/MYKA-2013-07-29.mp3","Type":"0","Public":"0","Timestamp":1375115169,"Guests":[{"Data":"460","ShowGuestId":"460","RealName":"Caity Quinn","Description":"One of Myka Fox\u0027s real life friends.","PictureFilename":"CaityQuinn.jpg","Url1":"","Url2":"https://twitter.com/caity_quinn","PictureUrl":"http://static-3.keithandthegirl.net/guests/pics/processed/CaityQuinn-150x150.jpg","PictureUrlLarge":"http://static-3.keithandthegirl.net/guests/pics/processed/CaityQuinn-600x600.jpg"},{"Data":"459","ShowGuestId":"459","RealName":"Justine Gabanna","Description":"One of Myka Fox\u0027s real life friends.","PictureFilename":"JustineGabbana.jpg","Url1":"","Url2":"https://www.facebook.com/justine.miyagi","PictureUrl":"http://static-2.keithandthegirl.net/guests/pics/processed/JustineGabbana-150x150.jpg","PictureUrlLarge":"http://static-2.keithandthegirl.net/guests/pics/processed/JustineGabbana-600x600.jpg"}]},{"ShowId":"2807","ShowNameId":"16","Number":"3","PostedDate":"7/22/2013 10:46:38 AM","Title":"Love \u0027em or Liam","VideoFileUrl":"https://www.keithandthegirl.com/vip/download/shows/myka/video/3/MYKA-2013-07-22.m3u8","VideoThumbnailUrl":"https://www.keithandthegirl.com/vip/download/shows/myka/video/3/MYKA-2013-07-22-video.jpg","PreviewUrl":"http://www.youtube.com/watch?v=L6z4uwvs5YQ","FileUrl":"http://www.keithandthegirl.com/vip/download/shows/myka/MYKA-2013-07-22.mp3","Type":"0","Public":"0","Timestamp":1374504398,"Guests":[{"Data":"8","ShowGuestId":"8","RealName":"Liam McEneaney","Description":"Stand-up comedian and producer of Tell Your Friends: The Concert Film.","PictureFilename":"Liam-McEneaney.jpg","Url1":"http://www.facebook.com/#!/RadioLiam","Url2":"http://www.kidliam.blogspot.com","PictureUrl":"http://static-4.keithandthegirl.net/guests/pics/processed/Liam-McEneaney-150x150.jpg","PictureUrlLarge":"http://static-4.keithandthegirl.net/guests/pics/processed/Liam-McEneaney-600x600.jpg"}]},{"ShowId":"2797","ShowNameId":"16","Number":"2","PostedDate":"7/15/2013 3:00:00 PM","Title":"Fecal Flora","VideoFileUrl":"https://www.keithandthegirl.com/vip/download/shows/myka/video/2/MYKA-2013-07-15.m3u8","VideoThumbnailUrl":"https://www.keithandthegirl.com/vip/download/shows/myka/video/2/MYKA-2013-07-15-video.jpg","PreviewUrl":"http://www.youtube.com/watch?v=FhzApIQldTU","FileUrl":"http://www.keithandthegirl.com/vip/download/shows/myka/MYKA-2013-07-15.mp3","Type":"0","Public":"0","Timestamp":1373914800,"Guests":[{"Data":"458","ShowGuestId":"458","RealName":"Chris Doucette","Description":"One of Comedy360\u0027s Comics to Watch who has appeared in Time Out NY and the New York Times.","PictureFilename":"Chris-Doucette.png","Url1":"","Url2":"http://www.chrisdoucette.com/","PictureUrl":"http://static-2.keithandthegirl.net/guests/pics/processed/Chris-Doucette-150x150.png","PictureUrlLarge":"http://static-2.keithandthegirl.net/guests/pics/processed/Chris-Doucette-600x600.png"}]},{"ShowId":"2786","ShowNameId":"16","Number":"1","PostedDate":"7/8/2013 3:32:22 PM","Title":"The Debut","VideoFileUrl":"https://www.keithandthegirl.com/vip/download/shows/myka/video/1/MYKA-2013-07-08.m3u8","VideoThumbnailUrl":"https://www.keithandthegirl.com/vip/download/shows/myka/video/1/MYKA-2013-07-08-video.jpg","PreviewUrl":"http://www.youtube.com/watch?v=_eSdgihqn7Y","FileUrl":"http://www.keithandthegirl.com/vip/download/shows/myka/MYKA-2013-07-08.mp3","Type":"0","Public":"0","Timestamp":1373311942,"Guests":[{"Data":"236","ShowGuestId":"236","RealName":"Chris Laker","Description":"Comedian best known for hosting the podcasts The Show with Chris Laker, The Week, and This Week in Jackin\u0027.","PictureFilename":"Chris-Laker.jpg","Url1":"http://chrislaker.com/","Url2":"","PictureUrl":"http://static-4.keithandthegirl.net/guests/pics/processed/Chris-Laker-150x150.jpg","PictureUrlLarge":"http://static-4.keithandthegirl.net/guests/pics/processed/Chris-Laker-600x600.jpg"},{"Data":"237","ShowGuestId":"237","RealName":"Jacqueline Novak","Description":"Comedian best known for her album Quality Notions.","PictureFilename":"Jacqueline-Novak.jpg","Url1":"http://douchechillz.com/","Url2":"","PictureUrl":"http://static-4.keithandthegirl.net/guests/pics/processed/Jacqueline-Novak-150x150.jpg","PictureUrlLarge":"http://static-4.keithandthegirl.net/guests/pics/processed/Jacqueline-Novak-600x600.jpg"}]}]