[{"ShowId":"3894","ShowNameId":"13","Number":"281","PostedDate":"7/16/2015 12:00:00 PM","Title":"Jerry or Bach","PreviewUrl":"http://traffic.libsyn.com/hangoutwithme/MYQ-2015-07-16-S.mp3","FileUrl":"http://traffic.libsyn.com/hangoutwithme/MYQ-2015-07-16.mp3","Length":"2841","FileSize":"45516447","Public":"1","Timestamp":1437062400,"Guests":[]},{"ShowId":"3890","ShowNameId":"13","Number":"280","PostedDate":"7/13/2015 12:00:00 PM","Title":"Drink the Right Amount of the Right Things","PreviewUrl":"http://traffic.libsyn.com/hangoutwithme/MYQ-2015-07-13-S.mp3","FileUrl":"http://traffic.libsyn.com/hangoutwithme/MYQ-2015-07-13.mp3","Length":"3293","FileSize":"52744713","Public":"1","Timestamp":1436803200,"Guests":[]},{"ShowId":"3885","ShowNameId":"15","Number":"279","PostedDate":"7/10/2015 12:00:00 PM","Title":"Ol\u0027 Fred Brimley","VideoFileUrl":"https://www.keithandthegirl.com/vip/download/shows/superhang/video/279/SUPERHANG-2015-07-10.m3u8","VideoThumbnailUrl":"https://www.keithandthegirl.com/vip/download/shows/superhang/video/279/SUPERHANG-2015-07-10-video.jpg","PreviewUrl":"https://www.youtube.com/watch?v=EInVUBF_Fc8","FileUrl":"http://www.keithandthegirl.com/vip/download/shows/superhang/SUPERHANG-2015-07-10.mp3","Length":"2995","FileSize":"48007406","Public":"0","Timestamp":1436544000,"Guests":[]},{"ShowId":"3884","ShowNameId":"13","Number":"278","PostedDate":"7/6/2015 12:00:00 PM","Title":"Compersion, Calm Person","PreviewUrl":"http://traffic.libsyn.com/hangoutwithme/MYQ-2015-07-06-S.mp3","FileUrl":"http://traffic.libsyn.com/hangoutwithme/MYQ-2015-07-06.mp3","Length":"3871","FileSize":"62006751","Public":"1","Timestamp":1436198400,"Guests":[]},{"ShowId":"3875","ShowNameId":"13","Number":"277","PostedDate":"7/2/2015 12:00:00 PM","Title":"Jonathan\u0027s Society","PreviewUrl":"http://traffic.libsyn.com/hangoutwithme/MYQ-2015-07-02-S.mp3","FileUrl":"http://traffic.libsyn.com/hangoutwithme/MYQ-2015-07-02.mp3","Length":"8947","FileSize":"143236265","Public":"1","Timestamp":1435852800,"Guests":[]},{"ShowId":"3870","ShowNameId":"13","Number":"276","PostedDate":"6/29/2015 12:00:00 PM","Title":"Dadcore Galore!","PreviewUrl":"http://traffic.libsyn.com/hangoutwithme/MYQ-2015-06-29-S.mp3","FileUrl":"http://traffic.libsyn.com/hangoutwithme/MYQ-2015-06-29.mp3","Length":"3144","FileSize":"50387858","Public":"1","Timestamp":1435593600,"Guests":[]},{"ShowId":"3862","ShowNameId":"15","Number":"275","PostedDate":"6/25/2015 12:00:00 PM","Title":"Gag Reflex","VideoFileUrl":"https://www.keithandthegirl.com/vip/download/shows/superhang/video/275/SUPERHANG-2015-06-25.m3u8","VideoThumbnailUrl":"https://www.keithandthegirl.com/vip/download/shows/superhang/video/275/SUPERHANG-2015-06-25-video.jpg","PreviewUrl":"https://www.youtube.com/watch?v=CR0Be2XOvrM","FileUrl":"http://www.keithandthegirl.com/vip/download/shows/superhang/SUPERHANG-2015-06-25.mp3","Length":"4372","FileSize":"70031178","Public":"0","Timestamp":1435248000,"Guests":[]},{"ShowId":"3859","ShowNameId":"13","Number":"274","PostedDate":"6/22/2015 12:00:00 PM","Title":"American History XXX","PreviewUrl":"http://traffic.libsyn.com/hangoutwithme/MYQ-2015-06-22-S.mp3","FileUrl":"http://traffic.libsyn.com/hangoutwithme/MYQ-2015-06-22.mp3","Length":"2974","FileSize":"47643869","Public":"1","Timestamp":1434988800,"Guests":[]},{"ShowId":"3853","ShowNameId":"13","Number":"273","PostedDate":"6/18/2015 12:00:00 PM","Title":"Funortunately","PreviewUrl":"http://traffic.libsyn.com/hangoutwithme/MYQ-2015-06-18-S.mp3","FileUrl":"http://traffic.libsyn.com/hangoutwithme/MYQ-2015-06-18.mp3","Length":"3974","FileSize":"63652675","Public":"1","Timestamp":1434643200,"Guests":[]},{"ShowId":"3849","ShowNameId":"13","Number":"272","PostedDate":"6/15/2015 12:00:00 PM","Title":"JAM! (Jamie And Matt!)","PreviewUrl":"http://traffic.libsyn.com/hangoutwithme/MYQ-2015-06-15-S.mp3","FileUrl":"http://traffic.libsyn.com/hangoutwithme/MYQ-2015-06-15.mp3","Length":"2844","FileSize":"45575522","Public":"1","Timestamp":1434384000,"Guests":[]},{"ShowId":"3842","ShowNameId":"15","Number":"271","PostedDate":"6/11/2015 12:00:00 PM","Title":"Help Adam Meet Larry Bird","VideoFileUrl":"https://www.keithandthegirl.com/vip/download/shows/superhang/video/271/SUPERHANG-2015-06-11.m3u8","VideoThumbnailUrl":"https://www.keithandthegirl.com/vip/download/shows/superhang/video/271/SUPERHANG-2015-06-11-video.jpg","PreviewUrl":"https://www.youtube.com/watch?v=F024a5FnHbM","FileUrl":"http://www.keithandthegirl.com/vip/download/shows/superhang/SUPERHANG-2015-06-11.mp3","Length":"3337","FileSize":"53461226","Public":"0","Timestamp":1434038400,"Guests":[]},{"ShowId":"3839","ShowNameId":"13","Number":"270","PostedDate":"6/8/2015 12:00:00 PM","Title":"Waiver Gravy","PreviewUrl":"http://traffic.libsyn.com/hangoutwithme/MYQ-2015-06-08-S.mp3","FileUrl":"http://traffic.libsyn.com/hangoutwithme/MYQ-2015-06-08.mp3","Length":"2967","FileSize":"47527254","Public":"1","Timestamp":1433779200,"Guests":[]},{"ShowId":"3836","ShowNameId":"13","Number":"269","PostedDate":"6/4/2015 12:00:00 PM","Title":"Ramin Williams","PreviewUrl":"http://traffic.libsyn.com/hangoutwithme/MYQ-2015-06-04-S.mp3","FileUrl":"http://traffic.libsyn.com/hangoutwithme/MYQ-2015-06-04.mp3","Length":"3848","FileSize":"61643127","Public":"1","Timestamp":1433433600,"Guests":[]},{"ShowId":"3831","ShowNameId":"13","Number":"268","PostedDate":"6/1/2015 12:00:00 PM","Title":"Mind Strings","PreviewUrl":"http://traffic.libsyn.com/hangoutwithme/MYQ-2015-06-01-S.mp3","FileUrl":"http://traffic.libsyn.com/hangoutwithme/MYQ-2015-06-01.mp3","Length":"2963","FileSize":"47485792","Public":"1","Timestamp":1433174400,"Guests":[]},{"ShowId":"3822","ShowNameId":"15","Number":"267","PostedDate":"5/28/2015 12:00:00 PM","Title":"Ray Hatch, with Danny and DeVito","VideoFileUrl":"https://www.keithandthegirl.com/vip/download/shows/superhang/video/267/SUPERHANG-2015-05-28.m3u8","VideoThumbnailUrl":"https://www.keithandthegirl.com/vip/download/shows/superhang/video/267/SUPERHANG-2015-05-28-video.jpg","PreviewUrl":"https://www.youtube.com/watch?v=M_XrgL8yI1I","FileUrl":"http://www.keithandthegirl.com/vip/download/shows/superhang/SUPERHANG-2015-05-28.mp3","Length":"3072","FileSize":"49234570","Public":"0","Timestamp":1432828800,"Guests":[]},{"ShowId":"3816","ShowNameId":"13","Number":"266","PostedDate":"5/21/2015 12:00:00 PM","Title":"Percentages","PreviewUrl":"http://traffic.libsyn.com/hangoutwithme/MYQ-2015-05-21-S.mp3","FileUrl":"http://traffic.libsyn.com/hangoutwithme/MYQ-2015-05-21.mp3","Length":"3017","FileSize":"48344692","Public":"1","Timestamp":1432224000,"Guests":[]},{"ShowId":"3809","ShowNameId":"13","Number":"265","PostedDate":"5/18/2015 12:00:00 PM","Title":"Howlin’ Ginsberg with Shawn Pearlman and Dave Horwitz","PreviewUrl":"http://traffic.libsyn.com/hangoutwithme/MYQ-2015-05-18-S.mp3","FileUrl":"http://traffic.libsyn.com/hangoutwithme/MYQ-2015-05-18.mp3","Length":"2843","FileSize":"45545656","Public":"1","Timestamp":1431964800,"Guests":[]},{"ShowId":"3804","ShowNameId":"15","Number":"264","PostedDate":"5/14/2015 12:00:00 PM","Title":"When Hammock Met Sandwich","VideoFileUrl":"https://www.keithandthegirl.com/vip/download/shows/superhang/video/264/SUPERHANG-2015-05-14.m3u8","VideoThumbnailUrl":"https://www.keithandthegirl.com/vip/download/shows/superhang/video/264/SUPERHANG-2015-05-14-video.jpg","PreviewUrl":"https://www.youtube.com/watch?v=Y7UtwZbuvKk","FileUrl":"http://www.keithandthegirl.com/vip/download/shows/superhang/SUPERHANG-2015-05-14.mp3","Length":"3266","FileSize":"52345022","Public":"0","Timestamp":1431619200,"Guests":[]},{"ShowId":"3802","ShowNameId":"13","Number":"263","PostedDate":"5/11/2015 12:00:00 PM","Title":"Skateboard Games","PreviewUrl":"http://traffic.libsyn.com/hangoutwithme/MYQ-2015-05-11-S.mp3","FileUrl":"http://traffic.libsyn.com/hangoutwithme/MYQ-2015-05-11.mp3","Length":"2995","FileSize":"47981164","Public":"1","Timestamp":1431360000,"Guests":[]},{"ShowId":"3797","ShowNameId":"13","Number":"262","PostedDate":"5/7/2015 12:00:00 PM","Title":"Badasshole","PreviewUrl":"http://traffic.libsyn.com/hangoutwithme/MYQ-2015-05-07-S.mp3","FileUrl":"http://traffic.libsyn.com/hangoutwithme/MYQ-2015-05-07.mp3","Length":"3497","FileSize":"56001369","Public":"1","Timestamp":1431014400,"Guests":[]},{"ShowId":"3792","ShowNameId":"13","Number":"261","PostedDate":"5/4/2015 12:00:00 PM","Title":"Weevils Grumble","PreviewUrl":"http://traffic.libsyn.com/hangoutwithme/MYQ-2015-05-04-S.mp3","FileUrl":"http://traffic.libsyn.com/hangoutwithme/MYQ-2015-05-04.mp3","Length":"3655","FileSize":"87778973","Public":"1","Timestamp":1430755200,"Guests":[]},{"ShowId":"3788","ShowNameId":"15","Number":"260","PostedDate":"4/30/2015 12:00:00 PM","Title":"Nicked Turner","PreviewUrl":"","FileUrl":"http://www.keithandthegirl.com/vip/download/shows/superhang/SUPERHANG-2015-04-30.mp3","Length":"4245","FileSize":"101953113","Public":"0","Timestamp":1430409600,"Guests":[]},{"ShowId":"3779","ShowNameId":"13","Number":"259","PostedDate":"4/27/2015 12:00:00 PM","Title":"KRS UNO","PreviewUrl":"","FileUrl":"http://traffic.libsyn.com/hangoutwithme/MYQ-2015-04-27.mp3","Length":"2896","FileSize":"69561412","Public":"1","Timestamp":1430150400,"Guests":[]},{"ShowId":"3774","ShowNameId":"13","Number":"258","PostedDate":"4/23/2015 12:00:00 PM","Title":"Stand-Up Chameleon","PreviewUrl":"http://traffic.libsyn.com/hangoutwithme/MYQ-2015-04-23-S.mp3","FileUrl":"http://traffic.libsyn.com/hangoutwithme/MYQ-2015-04-23.mp3","Length":"4055","FileSize":"129836600","Public":"1","Timestamp":1429804800,"Guests":[]},{"ShowId":"3770","ShowNameId":"13","Number":"257","PostedDate":"4/20/2015 12:00:00 PM","Title":"Bern Notice","PreviewUrl":"http://traffic.libsyn.com/hangoutwithme/MYQ-2015-04-20-S.mp3","FileUrl":"http://traffic.libsyn.com/hangoutwithme/MYQ-2015-04-20.mp3","Length":"3926","FileSize":"94302328","Public":"1","Timestamp":1429545600,"Guests":[]},{"ShowId":"3765","ShowNameId":"15","Number":"256","PostedDate":"4/16/2015 12:00:00 PM","Title":"The Stare Master","VideoFileUrl":"https://www.keithandthegirl.com/vip/download/shows/superhang/video/256/SUPERHANG-2015-04-16.m3u8","VideoThumbnailUrl":"https://www.keithandthegirl.com/vip/download/shows/superhang/video/256/SUPERHANG-2015-04-16-video.jpg","PreviewUrl":"https://www.youtube.com/watch?v=EtsGPhnC3hE","FileUrl":"http://www.keithandthegirl.com/vip/download/shows/superhang/SUPERHANG-2015-04-16.mp3","Length":"3296","FileSize":"131915201","Public":"0","Timestamp":1429200000,"Guests":[]},{"ShowId":"3764","ShowNameId":"13","Number":"255","PostedDate":"4/13/2015 12:00:00 PM","Title":"Barney The Farmer","PreviewUrl":"http://traffic.libsyn.com/hangoutwithme/MYQ-2015-04-13-S.mp3","FileUrl":"http://traffic.libsyn.com/hangoutwithme/MYQ-2015-04-13.mp3","Length":"3357","FileSize":"40284191","Public":"1","Timestamp":1428940800,"Guests":[]},{"ShowId":"3758","ShowNameId":"13","Number":"254","PostedDate":"4/9/2015 12:00:00 PM","Title":"Jehovah\u0027s Witness Protection","PreviewUrl":"http://traffic.libsyn.com/hangoutwithme/MYQ-2015-04-09-S.mp3","FileUrl":"http://traffic.libsyn.com/hangoutwithme/MYQ-2015-04-09.mp3","Length":"3258","FileSize":"78237917","Public":"1","Timestamp":1428595200,"Guests":[]},{"ShowId":"3752","ShowNameId":"13","Number":"253","PostedDate":"4/6/2015 12:00:00 PM","Title":"Double Solo","PreviewUrl":"http://traffic.libsyn.com/hangoutwithme/MYQ-2015-04-06-S.mp3","FileUrl":"http://traffic.libsyn.com/hangoutwithme/MYQ-2015-04-06.mp3","Length":"2357","FileSize":"56641543","Public":"1","Timestamp":1428336000,"Guests":[]},{"ShowId":"3746","ShowNameId":"15","Number":"252","PostedDate":"4/2/2015 12:00:00 PM","Title":"Yes More Mr. Nice Guy","VideoFileUrl":"https://www.keithandthegirl.com/vip/download/shows/superhang/video/252/SUPERHANG-2015-04-02.m3u8","VideoThumbnailUrl":"https://www.keithandthegirl.com/vip/download/shows/superhang/video/252/SUPERHANG-2015-04-02-video.jpg","PreviewUrl":"https://www.youtube.com/watch?v=03WvoCBavL8","FileUrl":"http://www.keithandthegirl.com/vip/download/shows/superhang/SUPERHANG-2015-04-02.mp3","Length":"3158","FileSize":"75809334","Public":"0","Timestamp":1427990400,"Guests":[]},{"ShowId":"3743","ShowNameId":"13","Number":"251","PostedDate":"3/30/2015 12:00:00 PM","Title":"Broadwalk Empire","PreviewUrl":" http://traffic.libsyn.com/hangoutwithme/MYQ-2015-03-30-S.mp3 ","FileUrl":"http://traffic.libsyn.com/hangoutwithme/MYQ-2015-03-30.mp3","Length":"3085","FileSize":"74112392","Public":"1","Timestamp":1427731200,"Guests":[]},{"ShowId":"3736","ShowNameId":"13","Number":"250","PostedDate":"3/26/2015 12:00:00 PM","Title":"The Sarah McLachlan Group","PreviewUrl":"http://traffic.libsyn.com/hangoutwithme/MYQ-2015-03-26-S.mp3","FileUrl":"http://traffic.libsyn.com/hangoutwithme/MYQ-2015-03-26.mp3","Length":"3086","FileSize":"74138096","Public":"1","Timestamp":1427385600,"Guests":[]},{"ShowId":"3733","ShowNameId":"13","Number":"249","PostedDate":"3/23/2015 12:00:00 PM","Title":"Garden of Zach","PreviewUrl":"http://traffic.libsyn.com/hangoutwithme/MYQ-2015-03-23-S.mp3","FileUrl":"http://traffic.libsyn.com/hangoutwithme/MYQ-2015-03-23.mp3","Length":"3270","FileSize":"78535011","Public":"1","Timestamp":1427126400,"Guests":[]},{"ShowId":"3726","ShowNameId":"15","Number":"248","PostedDate":"3/19/2015 12:00:00 PM","Title":"Bubble Corn","VideoFileUrl":"https://www.keithandthegirl.com/vip/download/shows/superhang/video/248/SUPERHANG-2015-03-19.m3u8","VideoThumbnailUrl":"https://www.keithandthegirl.com/vip/download/shows/superhang/video/248/SUPERHANG-2015-03-19-video.jpg","PreviewUrl":"https://www.youtube.com/watch?v=8PKDLuPYhV8","FileUrl":"http://www.keithandthegirl.com/vip/download/shows/superhang/SUPERHANG-2015-03-19.mp3","Length":"3396","FileSize":"81550077","Public":"0","Timestamp":1426780800,"Guests":[]},{"ShowId":"3723","ShowNameId":"13","Number":"247","PostedDate":"3/16/2015 12:00:00 PM","Title":"Home Skulled","PreviewUrl":"http://traffic.libsyn.com/hangoutwithme/MYQ-2015-03-16-S.mp3","FileUrl":"http://traffic.libsyn.com/hangoutwithme/MYQ-2015-03-16.mp3","Length":"3040","FileSize":"73037819","Public":"1","Timestamp":1426521600,"Guests":[]},{"ShowId":"3721","ShowNameId":"13","Number":"246","PostedDate":"3/12/2015 12:00:00 PM","Title":"Daggers-Nabbit","PreviewUrl":"http://traffic.libsyn.com/hangoutwithme/MYQ-2015-03-12-S.mp3","FileUrl":"http://traffic.libsyn.com/hangoutwithme/MYQ-2015-03-12.mp3","Length":"3217","FileSize":"77247792","Public":"1","Timestamp":1426176000,"Guests":[]},{"ShowId":"3714","ShowNameId":"13","Number":"245","PostedDate":"3/9/2015 12:00:00 PM","Title":"Thinker Tailor Magic Friends","PreviewUrl":"","FileUrl":"http://traffic.libsyn.com/hangoutwithme/MYQ-2015-03-09.mp3","Length":"2958","FileSize":"71035972","Public":"1","Timestamp":1425916800,"Guests":[]},{"ShowId":"3702","ShowNameId":"15","Number":"244","PostedDate":"3/5/2015 12:00:00 PM","Title":"Communist Angel","VideoFileUrl":"https://www.keithandthegirl.com/vip/download/shows/superhang/video/244/SUPERHANG-2015-03-05.m3u8","VideoThumbnailUrl":"https://www.keithandthegirl.com/vip/download/shows/superhang/video/244/SUPERHANG-2015-03-05-video.jpg","PreviewUrl":"https://www.youtube.com/watch?v=q_mhdhYmujc","FileUrl":"http://www.keithandthegirl.com/vip/download/shows/superhang/SUPERHANG-2015-03-05.mp3","Length":"3729","FileSize":"89588000","Public":"0","Timestamp":1425574800,"Guests":[]},{"ShowId":"3699","ShowNameId":"13","Number":"243","PostedDate":"3/2/2015 12:00:00 PM","Title":"Fat Spree","PreviewUrl":"http://traffic.libsyn.com/hangoutwithme/MYQ-2015-03-02-S.mp3","FileUrl":"http://traffic.libsyn.com/hangoutwithme/MYQ-2015-03-02.mp3","Length":"2870","FileSize":"68953377","Public":"1","Timestamp":1425315600,"Guests":[]},{"ShowId":"3696","ShowNameId":"13","Number":"242","PostedDate":"2/26/2015 12:00:00 PM","Title":"Rich Carrot Man","PreviewUrl":"http://traffic.libsyn.com/hangoutwithme/MYQ-2015-02-26-S.mp3","FileUrl":"http://traffic.libsyn.com/hangoutwithme/MYQ-2015-02-26.mp3","Length":"3005","FileSize":"72200920","Public":"1","Timestamp":1424970000,"Guests":[]},{"ShowId":"3692","ShowNameId":"13","Number":"241","PostedDate":"2/23/2015 12:00:00 PM","Title":"Soul of That Boner","PreviewUrl":"http://traffic.libsyn.com/hangoutwithme/MYQ-2015-02-23-S.mp3","FileUrl":"http://traffic.libsyn.com/hangoutwithme/MYQ-2015-02-23.mp3","Length":"2528","FileSize":"60743614","Public":"1","Timestamp":1424710800,"Guests":[]},{"ShowId":"3687","ShowNameId":"15","Number":"240","PostedDate":"2/19/2015 12:00:00 PM","Title":"Michigan J Fox","VideoFileUrl":"https://www.keithandthegirl.com/vip/download/shows/superhang/video/240/SUPERHANG-2015-02-19.m3u8","VideoThumbnailUrl":"https://www.keithandthegirl.com/vip/download/shows/superhang/video/240/SUPERHANG-2015-02-19-video.jpg","PreviewUrl":"https://www.youtube.com/watch?v=HyEiU8B9aQg","FileUrl":"http://www.keithandthegirl.com/vip/download/shows/superhang/SUPERHANG-2015-02-19.mp3","Length":"3213","FileSize":"77157127","Public":"0","Timestamp":1424365200,"Guests":[]},{"ShowId":"3685","ShowNameId":"13","Number":"239","PostedDate":"2/16/2015 12:00:00 PM","Title":"Punk Rock Juggler Kids","PreviewUrl":"http://traffic.libsyn.com/hangoutwithme/MYQ-2015-02-16-S.mp3","FileUrl":"http://traffic.libsyn.com/hangoutwithme/MYQ-2015-02-16.mp3","Length":"3051","FileSize":"73295555","Public":"1","Timestamp":1424106000,"Guests":[]},{"ShowId":"3681","ShowNameId":"13","Number":"238","PostedDate":"2/9/2015 12:00:00 PM","Title":"LL Cool JK","PreviewUrl":"http://traffic.libsyn.com/hangoutwithme/MYQ-2015-02-09-S.mp3","FileUrl":"http://traffic.libsyn.com/hangoutwithme/MYQ-2015-02-09.mp3","Length":"3344","FileSize":"80327236","Public":"1","Timestamp":1423501200,"Guests":[]},{"ShowId":"3671","ShowNameId":"15","Number":"237","PostedDate":"2/5/2015 12:00:00 PM","Title":"Big Shot of Shark Prison","VideoFileUrl":"https://www.keithandthegirl.com/vip/download/shows/superhang/video/237/SUPERHANG-2015-02-05.m3u8","VideoThumbnailUrl":"https://www.keithandthegirl.com/vip/download/shows/superhang/video/237/SUPERHANG-2015-02-05-video.jpg","PreviewUrl":"https://www.youtube.com/watch?v=wV15E5UkXfk","FileUrl":"http://www.keithandthegirl.com/vip/download/shows/superhang/SUPERHANG-2015-02-05.mp3","Length":"2698","FileSize":"64827053","Public":"0","Timestamp":1423155600,"Guests":[]},{"ShowId":"3668","ShowNameId":"13","Number":"236","PostedDate":"2/2/2015 12:00:00 PM","Title":"Mostly Senators","PreviewUrl":"http://traffic.libsyn.com/hangoutwithme/MYQ-2015-02-02-S.mp3","FileUrl":"http://traffic.libsyn.com/hangoutwithme/MYQ-2015-02-02.mp3","Length":"3001","FileSize":"72071176","Public":"1","Timestamp":1422896400,"Guests":[]},{"ShowId":"3664","ShowNameId":"13","Number":"235","PostedDate":"1/26/2015 12:00:00 PM","Title":"Semantic Satiation","PreviewUrl":"","FileUrl":"http://traffic.libsyn.com/hangoutwithme/MYQ-2015-01-26.mp3","Length":"3566","FileSize":"114183114","Public":"1","Timestamp":1422291600,"Guests":[]},{"ShowId":"3653","ShowNameId":"15","Number":"234","PostedDate":"1/22/2015 12:00:00 PM","Title":"Bru(tality)-Ha-Ha","VideoFileUrl":"https://www.keithandthegirl.com/vip/download/shows/superhang/video/234/SUPERHANG-2015-01-22.m3u8","VideoThumbnailUrl":"https://www.keithandthegirl.com/vip/download/shows/superhang/video/234/SUPERHANG-2015-01-22-video.jpg","PreviewUrl":"https://www.youtube.com/watch?v=ln0GEf8_eXY","FileUrl":"http://www.keithandthegirl.com/vip/download/shows/superhang/SUPERHANG-2015-01-22.mp3","Length":"3389","FileSize":"81410837","Public":"0","Timestamp":1421946000,"Guests":[]},{"ShowId":"3651","ShowNameId":"13","Number":"233","PostedDate":"1/19/2015 12:00:00 PM","Title":"Stand-Up Sincerian","PreviewUrl":"","FileUrl":"http://traffic.libsyn.com/hangoutwithme/MYQ-2015-01-19.mp3","Length":"3071","FileSize":"73783249","Public":"1","Timestamp":1421686800,"Guests":[]},{"ShowId":"3645","ShowNameId":"13","Number":"232","PostedDate":"1/15/2015 12:00:00 PM","Title":"Just Some First Class Turd","PreviewUrl":"http://traffic.libsyn.com/hangoutwithme/MYQ-2015-01-15-S.mp3","FileUrl":"http://traffic.libsyn.com/hangoutwithme/MYQ-2015-01-15.mp3","Length":"2956","FileSize":"70983830","Public":"1","Timestamp":1421341200,"Guests":[]},{"ShowId":"3640","ShowNameId":"13","Number":"231","PostedDate":"1/12/2015 12:00:00 PM","Title":"What\u0027s That","PreviewUrl":"http://traffic.libsyn.com/hangoutwithme/MYQ-2015-01-12-S.mp3","FileUrl":"http://traffic.libsyn.com/hangoutwithme/MYQ-2015-01-12.mp3","Length":"3028","FileSize":"72765070","Public":"1","Timestamp":1421082000,"Guests":[]},{"ShowId":"3625","ShowNameId":"15","Number":"230","PostedDate":"1/8/2015 12:00:00 PM","Title":"Sesame Street Lesbians","VideoFileUrl":"https://www.keithandthegirl.com/vip/download/shows/superhang/video/230/SUPERHANG-2015-01-08.m3u8","VideoThumbnailUrl":"https://www.keithandthegirl.com/vip/download/shows/superhang/video/230/SUPERHANG-2015-01-08-video.jpg","PreviewUrl":"https://www.youtube.com/watch?v=-jvUPP1E1tw","FileUrl":"http://www.keithandthegirl.com/vip/download/shows/superhang/SUPERHANG-2015-01-08.mp3","Length":"3077","FileSize":"73920800","Public":"0","Timestamp":1420736400,"Guests":[]},{"ShowId":"3622","ShowNameId":"13","Number":"229","PostedDate":"1/5/2015 12:00:00 PM","Title":"Greg For One","PreviewUrl":"http://traffic.libsyn.com/hangoutwithme/MYQ-2014-01-05-S.mp3","FileUrl":"http://traffic.libsyn.com/hangoutwithme/MYQ-2014-01-05.mp3","Length":"2904","FileSize":"69773413","Public":"1","Timestamp":1420477200,"Guests":[]},{"ShowId":"3618","ShowNameId":"13","Number":"228","PostedDate":"1/1/2015","Title":"The Vigil Andy","PreviewUrl":"","FileUrl":"http://traffic.libsyn.com/hangoutwithme/MYQ-2015-01-01.mp3","Length":"2842","FileSize":"68248245","Public":"1","Timestamp":1420088400,"Guests":[]},{"ShowId":"3617","ShowNameId":"13","Number":"227","PostedDate":"12/29/2014 12:00:00 PM","Title":"Home Is Where the Hurt Is","PreviewUrl":"http://traffic.libsyn.com/hangoutwithme/MYQ-2014-12-29-S.mp3","FileUrl":"http://traffic.libsyn.com/hangoutwithme/MYQ-2014-12-29.mp3","Length":"3133","FileSize":"100314697","Public":"1","Timestamp":1419872400,"Guests":[]},{"ShowId":"3611","ShowNameId":"15","Number":"226","PostedDate":"12/25/2014 12:00:00 PM","Title":"Deep Pockets Chopra","VideoFileUrl":"https://www.keithandthegirl.com/vip/download/shows/superhang/video/226/SUPERHANG-2014-12-25.m3u8","VideoThumbnailUrl":"https://www.keithandthegirl.com/vip/download/shows/superhang/video/226/SUPERHANG-2014-12-25-video.jpg","PreviewUrl":"https://www.youtube.com/watch?v=eE0pOFhtifI","FileUrl":"http://www.keithandthegirl.com/vip/download/shows/superhang/SUPERHANG-2014-12-25.mp3","Length":"3393","FileSize":"108653774","Public":"0","Timestamp":1419526800,"Guests":[]},{"ShowId":"3610","ShowNameId":"13","Number":"225","PostedDate":"12/22/2014 12:00:00 PM","Title":"AOL Dirty Bastard","PreviewUrl":"http://traffic.libsyn.com/hangoutwithme/MYQ-2014-12-22-S.mp3","FileUrl":"http://traffic.libsyn.com/hangoutwithme/MYQ-2014-12-22.mp3","Length":"2817","FileSize":"90234493","Public":"1","Timestamp":1419267600,"Guests":[]},{"ShowId":"3587","ShowNameId":"13","Number":"224","PostedDate":"12/18/2014 12:00:00 PM","Title":"Pink Collar Stumblebum","PreviewUrl":"http://traffic.libsyn.com/hangoutwithme/MYQ-2014-12-18-S.mp3","FileUrl":"http://traffic.libsyn.com/hangoutwithme/MYQ-2014-12-18.mp3","Length":"2651","FileSize":"63725222","Public":"1","Timestamp":1418922000,"Guests":[]},{"ShowId":"3582","ShowNameId":"13","Number":"223","PostedDate":"12/15/2014 12:00:00 PM","Title":"Tim Burtoff","PreviewUrl":"http://traffic.libsyn.com/hangoutwithme/MYQ-2014-12-15-S.mp3","FileUrl":"http://traffic.libsyn.com/hangoutwithme/MYQ-2014-12-15.mp3","Length":"4048","FileSize":"48685773","Public":"1","Timestamp":1418662800,"Guests":[]},{"ShowId":"3577","ShowNameId":"15","Number":"222","PostedDate":"12/11/2014 12:00:00 PM","Title":"A Lot of Clown Talk","VideoFileUrl":"https://www.keithandthegirl.com/vip/download/shows/superhang/video/222/SUPERHANG-2014-12-11.m3u8","VideoThumbnailUrl":"https://www.keithandthegirl.com/vip/download/shows/superhang/video/222/SUPERHANG-2014-12-11-video.jpg","PreviewUrl":"https://www.youtube.com/watch?v=2820wjVIt6E","FileUrl":"http://www.keithandthegirl.com/vip/download/shows/superhang/SUPERHANG-2014-12-11.mp3","Length":"3276","FileSize":"78652374","Public":"0","Timestamp":1418317200,"Guests":[]},{"ShowId":"3572","ShowNameId":"13","Number":"221","PostedDate":"12/8/2014 12:00:00 PM","Title":"Like A Moth to a Microphone","PreviewUrl":"http://traffic.libsyn.com/hangoutwithme/MYQ-2014-12-08-S.mp3","FileUrl":"http://traffic.libsyn.com/hangoutwithme/MYQ-2014-12-08.mp3","Length":"3154","FileSize":"75742467","Public":"1","Timestamp":1418058000,"Guests":[]},{"ShowId":"3569","ShowNameId":"13","Number":"220","PostedDate":"12/4/2014 12:00:00 PM","Title":"Renaissance Fair Enough","PreviewUrl":"http://traffic.libsyn.com/hangoutwithme/MYQ-2014-12-04-S.mp3","FileUrl":"http://traffic.libsyn.com/hangoutwithme/MYQ-2014-12-04.mp3","Length":"3977","FileSize":"95557484","Public":"1","Timestamp":1417712400,"Guests":[]},{"ShowId":"3564","ShowNameId":"13","Number":"219","PostedDate":"12/1/2014 12:00:00 PM","Title":"Burn Bear","PreviewUrl":"http://traffic.libsyn.com/hangoutwithme/MYQ-2014-12-01-S.mp3","FileUrl":"http://traffic.libsyn.com/hangoutwithme/MYQ-2014-12-01.mp3","Length":"3257","FileSize":"78369834","Public":"1","Timestamp":1417453200,"Guests":[]},{"ShowId":"3560","ShowNameId":"15","Number":"218","PostedDate":"11/27/2014 12:00:00 PM","Title":"Kara Has No Hobbies","VideoFileUrl":"https://www.keithandthegirl.com/vip/download/shows/superhang/video/218/SUPERHANG-2014-11-27.m3u8","VideoThumbnailUrl":"https://www.keithandthegirl.com/vip/download/shows/superhang/video/218/SUPERHANG-2014-11-27-video.jpg","PreviewUrl":"https://www.youtube.com/watch?v=ufKCN7GM8TU","FileUrl":"http://www.keithandthegirl.com/vip/download/shows/superhang/SUPERHANG-2014-11-27.mp3","Length":"3502","FileSize":"84084752","Public":"0","Timestamp":1417107600,"Guests":[]},{"ShowId":"3555","ShowNameId":"13","Number":"217","PostedDate":"11/24/2014 12:00:00 PM","Title":"Oodbye","PreviewUrl":"http://traffic.libsyn.com/hangoutwithme/MYQ-2014-11-24-S.mp3","FileUrl":"http://traffic.libsyn.com/hangoutwithme/MYQ-2014-11-24.mp3","Length":"3173","FileSize":"76208844","Public":"1","Timestamp":1416848400,"Guests":[]},{"ShowId":"3552","ShowNameId":"13","Number":"216","PostedDate":"11/20/2014 12:00:00 PM","Title":"Exactly 10 Names","PreviewUrl":"http://traffic.libsyn.com/hangoutwithme/MYQ-2014-11-20-S.mp3","FileUrl":"http://traffic.libsyn.com/hangoutwithme/MYQ-2014-11-20.mp3","Length":"2883","FileSize":"69245435","Public":"1","Timestamp":1416502800,"Guests":[]},{"ShowId":"3546","ShowNameId":"13","Number":"215","PostedDate":"11/17/2014 12:00:00 PM","Title":"Omega Sci-Fi","PreviewUrl":"http://traffic.libsyn.com/hangoutwithme/MYQ-2014-11-17-S.mp3","FileUrl":"http://traffic.libsyn.com/hangoutwithme/MYQ-2014-11-17.mp3","Length":"3379","FileSize":"81163783","Public":"1","Timestamp":1416243600,"Guests":[]},{"ShowId":"3529","ShowNameId":"15","Number":"214","PostedDate":"11/13/2014 12:00:00 PM","Title":"Sports Thanks Pleasureful","VideoFileUrl":"https://www.keithandthegirl.com/vip/download/shows/superhang/video/214/SUPERHANG-2014-11-13.m3u8","VideoThumbnailUrl":"https://www.keithandthegirl.com/vip/download/shows/superhang/video/214/SUPERHANG-2014-11-13-video.jpg","PreviewUrl":"https://www.youtube.com/watch?v=DqtQZ32O4Nk","FileUrl":"http://www.keithandthegirl.com/vip/download/shows/superhang/SUPERHANG-2014-11-13.mp3","Length":"5014","FileSize":"120373919","Public":"0","Timestamp":1415898000,"Guests":[]},{"ShowId":"3531","ShowNameId":"13","Number":"213","PostedDate":"11/10/2014 12:00:00 PM","Title":"A Two Good Men","PreviewUrl":"http://traffic.libsyn.com/hangoutwithme/MYQ-2014-11-10-S.mp3","FileUrl":"http://traffic.libsyn.com/hangoutwithme/MYQ-2014-11-10.mp3","Length":"749","FileSize":"18058007","Public":"1","Timestamp":1415638800,"Guests":[]},{"ShowId":"3527","ShowNameId":"13","Number":"212","PostedDate":"11/6/2014 12:00:00 PM","Title":"Rorschach Confessions","PreviewUrl":"http://traffic.libsyn.com/hangoutwithme/MYQ-2014-11-06-S.mp3","FileUrl":"http://traffic.libsyn.com/hangoutwithme/MYQ-2014-11-06.mp3","Length":"2921","FileSize":"70179043","Public":"1","Timestamp":1415293200,"Guests":[]},{"ShowId":"3523","ShowNameId":"13","Number":"211","PostedDate":"11/3/2014 12:00:00 PM","Title":"Their Crazy Office","PreviewUrl":"http://traffic.libsyn.com/hangoutwithme/MYQ-2014-11-03-S.mp3","FileUrl":"http://traffic.libsyn.com/hangoutwithme/MYQ-2014-11-03.mp3","Length":"3666","FileSize":"88026318","Public":"1","Timestamp":1415034000,"Guests":[]},{"ShowId":"3516","ShowNameId":"15","Number":"210","PostedDate":"10/30/2014 12:00:00 PM","Title":"Blue Collar Shaman","VideoFileUrl":"https://www.keithandthegirl.com/vip/download/shows/superhang/video/210/SUPERHANG-2014-10-30.m3u8","VideoThumbnailUrl":"https://www.keithandthegirl.com/vip/download/shows/superhang/video/210/SUPERHANG-2014-10-30-video.jpg","PreviewUrl":"https://www.youtube.com/watch?v=6VmBIKsylLc","FileUrl":"http://www.keithandthegirl.com/vip/download/shows/superhang/SUPERHANG-2014-10-30.mp3","Length":"4580","FileSize":"109992349","Public":"0","Timestamp":1414684800,"Guests":[]},{"ShowId":"3510","ShowNameId":"13","Number":"209","PostedDate":"10/27/2014 12:00:00 PM","Title":"Revealing Too Much","PreviewUrl":"http://traffic.libsyn.com/hangoutwithme/MYQ-2014-10-27-S.mp3","FileUrl":"http://traffic.libsyn.com/hangoutwithme/MYQ-2014-10-27.mp3","Length":"3389","FileSize":"81384383","Public":"1","Timestamp":1414425600,"Guests":[]},{"ShowId":"3505","ShowNameId":"13","Number":"208","PostedDate":"10/23/2014 12:00:00 PM","Title":"Pod-sassed","PreviewUrl":"","FileUrl":"http://traffic.libsyn.com/hangoutwithme/MYQ-2014-10-23.mp3","Length":"1140","FileSize":"45665698","Public":"1","Timestamp":1414080000,"Guests":[]},{"ShowId":"3499","ShowNameId":"13","Number":"207","PostedDate":"10/20/2014 12:00:00 PM","Title":"Brainy Butt and Buttsy Brain","PreviewUrl":"http://traffic.libsyn.com/hangoutwithme/MYQ-2014-10-20-S.mp3","FileUrl":"http://traffic.libsyn.com/hangoutwithme/MYQ-2014-10-20.mp3","Length":"2781","FileSize":"66808701","Public":"1","Timestamp":1413820800,"Guests":[]},{"ShowId":"3490","ShowNameId":"15","Number":"206","PostedDate":"10/16/2014 12:00:00 PM","Title":"I\u0027m No Space Doctor","VideoFileUrl":"https://www.keithandthegirl.com/vip/download/shows/superhang/video/206/SUPERHANG-2014-10-16.m3u8","VideoThumbnailUrl":"https://www.keithandthegirl.com/vip/download/shows/superhang/video/206/SUPERHANG-2014-10-16-video.jpg","PreviewUrl":"https://www.youtube.com/watch?v=PDt16kP47YE\u0026","FileUrl":"http://www.keithandthegirl.com/vip/download/shows/superhang/SUPERHANG-2014-10-16.mp3","Length":"4107","FileSize":"99577877","Public":"0","Timestamp":1413475200,"Guests":[]},{"ShowId":"3488","ShowNameId":"13","Number":"205","PostedDate":"10/13/2014 12:00:00 PM","Title":"I\u0027m Pasta","PreviewUrl":"http://traffic.libsyn.com/hangoutwithme/MYQ-2014-10-13-S.mp3","FileUrl":"http://traffic.libsyn.com/hangoutwithme/MYQ-2014-10-13.mp3","Length":"3878","FileSize":"93145837","Public":"1","Timestamp":1413216000,"Guests":[]},{"ShowId":"3485","ShowNameId":"13","Number":"204","PostedDate":"10/9/2014 12:00:00 PM","Title":"Act-ding!","PreviewUrl":"http://traffic.libsyn.com/hangoutwithme/MYQ-2014-10-09-S.mp3","FileUrl":"http://traffic.libsyn.com/hangoutwithme/MYQ-2014-10-09.mp3","Length":"2904","FileSize":"34838248","Public":"1","Timestamp":1412870400,"Guests":[]},{"ShowId":"3480","ShowNameId":"13","Number":"203","PostedDate":"10/6/2014 12:00:00 PM","Title":"IMDuBious","PreviewUrl":"http://traffic.libsyn.com/hangoutwithme/MYQ-2014-10-06-S.mp3","FileUrl":"http://traffic.libsyn.com/hangoutwithme/MYQ-2014-10-06.mp3","Length":"2975","FileSize":"71421728","Public":"1","Timestamp":1412611200,"Guests":[]},{"ShowId":"3473","ShowNameId":"15","Number":"202","PostedDate":"10/2/2014 12:30:00 PM","Title":"Diploma Writing Thesis","VideoFileUrl":"https://www.keithandthegirl.com/vip/download/shows/superhang/video/202/SUPERHANG-2014-10-02.m3u8","VideoThumbnailUrl":"https://www.keithandthegirl.com/vip/download/shows/superhang/video/202/SUPERHANG-2014-10-02-video.jpg","PreviewUrl":"https://www.youtube.com/watch?v=JzwuuGdw4_8","FileUrl":"http://www.keithandthegirl.com/vip/download/shows/superhang/SUPERHANG-2014-10-02.mp3","Length":"3245","FileSize":"78045960","Public":"0","Timestamp":1412267400,"Guests":[]},{"ShowId":"3469","ShowNameId":"13","Number":"201","PostedDate":"9/29/2014 12:00:00 PM","Title":"Always Yes Funny","PreviewUrl":"http://traffic.libsyn.com/hangoutwithme/MYQ-2014-09-29-S.mp3","FileUrl":"http://traffic.libsyn.com/hangoutwithme/MYQ-2014-09-29.mp3","Length":"2772","FileSize":"66539883","Public":"1","Timestamp":1412006400,"Guests":[]},{"ShowId":"3466","ShowNameId":"13","Number":"200","PostedDate":"9/25/2014 12:00:00 PM","Title":"KKKareful","PreviewUrl":"http://traffic.libsyn.com/hangoutwithme/MYQ-2014-09-25-S.mp3","FileUrl":"http://traffic.libsyn.com/hangoutwithme/MYQ-2014-09-25.mp3","Length":"3095","FileSize":"74356482","Public":"1","Timestamp":1411660800,"Guests":[]},{"ShowId":"3463","ShowNameId":"13","Number":"199","PostedDate":"9/22/2014 12:00:00 PM","Title":"We’re All Wearing Shoes, We’re Not Against Feet","PreviewUrl":"http://traffic.libsyn.com/hangoutwithme/MYQ-2014-09-22-S.mp3","FileUrl":"http://traffic.libsyn.com/hangoutwithme/MYQ-2014-09-22.mp3","Length":"3306","FileSize":"79423401","Public":"1","Timestamp":1411401600,"Guests":[]},{"ShowId":"3455","ShowNameId":"15","Number":"198","PostedDate":"9/18/2014 12:00:00 PM","Title":"The Real Slim Shoddy","VideoFileUrl":"https://www.keithandthegirl.com/vip/download/shows/superhang/video/198/SUPERHANG-2014-09-18.m3u8","VideoThumbnailUrl":"https://www.keithandthegirl.com/vip/download/shows/superhang/video/198/SUPERHANG-2014-09-18-video.jpg","PreviewUrl":"https://www.youtube.com/watch?v=kRpKbyeTB_Q","FileUrl":"http://www.keithandthegirl.com/vip/download/shows/superhang/SUPERHANG-2014-09-18.mp3","Length":"3190","FileSize":"77562295","Public":"0","Timestamp":1411056000,"Guests":[]},{"ShowId":"3449","ShowNameId":"13","Number":"197","PostedDate":"9/15/2014 12:00:00 PM","Title":"Little Guesther","PreviewUrl":"http://traffic.libsyn.com/hangoutwithme/MYQ-2014-09-15-S.mp3","FileUrl":"http://traffic.libsyn.com/hangoutwithme/MYQ-2014-09-15.mp3","Length":"2784","FileSize":"66887760","Public":"1","Timestamp":1410796800,"Guests":[]},{"ShowId":"3446","ShowNameId":"13","Number":"196","PostedDate":"9/11/2014 12:00:00 PM","Title":"Please Don’t Try To Have Fun","PreviewUrl":"http://traffic.libsyn.com/hangoutwithme/MYQ-2014-09-11-S.mp3","FileUrl":"http://traffic.libsyn.com/hangoutwithme/MYQ-2014-09-11.mp3","Length":"3362","FileSize":"80710444","Public":"1","Timestamp":1410451200,"Guests":[]},{"ShowId":"3440","ShowNameId":"13","Number":"195","PostedDate":"9/8/2014 12:00:00 PM","Title":"Gregorian Breakdancing","PreviewUrl":"http://traffic.libsyn.com/hangoutwithme/MYQ-2014-09-08-S.mp3","FileUrl":"http://traffic.libsyn.com/hangoutwithme/MYQ-2014-09-08.mp3","Length":"3130","FileSize":"75175899","Public":"1","Timestamp":1410192000,"Guests":[]},{"ShowId":"3433","ShowNameId":"15","Number":"194","PostedDate":"9/4/2014 12:00:00 PM","Title":"Gregory\u0027s Pecs","VideoFileUrl":"https://www.keithandthegirl.com/vip/download/shows/superhang/video/194/SUPERHANG-2014-09-04.m3u8","VideoThumbnailUrl":"https://www.keithandthegirl.com/vip/download/shows/superhang/video/194/SUPERHANG-2014-09-04-video.jpg","PreviewUrl":"https://www.youtube.com/watch?v=dil7qY83_Ms","FileUrl":"http://www.keithandthegirl.com/vip/download/shows/superhang/SUPERHANG-2014-09-04.mp3","Length":"4108","FileSize":"98684848","Public":"0","Timestamp":1409846400,"Guests":[]},{"ShowId":"3429","ShowNameId":"13","Number":"193","PostedDate":"9/1/2014 12:00:00 PM","Title":"Dawn of the Sex","PreviewUrl":"http://traffic.libsyn.com/hangoutwithme/MYQ-2014-09-01-S.mp3","FileUrl":"http://traffic.libsyn.com/hangoutwithme/MYQ-2014-09-01.mp3","Length":"3229","FileSize":"38833718","Public":"1","Timestamp":1409587200,"Guests":[]},{"ShowId":"3426","ShowNameId":"13","Number":"192","PostedDate":"8/28/2014 12:00:00 PM","Title":"Danny Glover Creveland","PreviewUrl":"http://traffic.libsyn.com/hangoutwithme/MYQ-2014-08-28-S.mp3","FileUrl":"http://traffic.libsyn.com/hangoutwithme/MYQ-2014-08-28.mp3","Length":"3049","FileSize":"73174311","Public":"1","Timestamp":1409241600,"Guests":[]},{"ShowId":"3419","ShowNameId":"13","Number":"191","PostedDate":"8/25/2014 12:00:00 PM","Title":"Dubstep and the Fart","PreviewUrl":"http://traffic.libsyn.com/hangoutwithme/MYQ-2014-08-25-S.mp3","FileUrl":"http://traffic.libsyn.com/hangoutwithme/MYQ-2014-08-25.mp3","Length":"3160","FileSize":"75906755","Public":"1","Timestamp":1408982400,"Guests":[]},{"ShowId":"3414","ShowNameId":"15","Number":"190","PostedDate":"8/21/2014 12:00:00 PM","Title":"I Keep Forgetting About the Video","VideoFileUrl":"https://www.keithandthegirl.com/vip/download/shows/superhang/video/190/SUPERHANG-2014-08-21.m3u8","VideoThumbnailUrl":"https://www.keithandthegirl.com/vip/download/shows/superhang/video/190/SUPERHANG-2014-08-21-video.jpg","PreviewUrl":"https://www.youtube.com/watch?v=IPm5Na-Jxv4","FileUrl":"http://www.keithandthegirl.com/vip/download/shows/superhang/SUPERHANG-2014-08-21.mp3","Length":"3984","FileSize":"96626876","Public":"0","Timestamp":1408636800,"Guests":[]},{"ShowId":"3409","ShowNameId":"13","Number":"189","PostedDate":"8/18/2014 4:21:15 PM","Title":"Scientifically Probable","PreviewUrl":"http://traffic.libsyn.com/hangoutwithme/MYQ-2014-08-18-S.mp3","FileUrl":"http://traffic.libsyn.com/hangoutwithme/MYQ-2014-08-18.mp3","Length":"3073","FileSize":"36963543","Public":"1","Timestamp":1408393275,"Guests":[]},{"ShowId":"3405","ShowNameId":"13","Number":"188","PostedDate":"8/14/2014 12:00:00 PM","Title":"Death to Your Children (Explain)","PreviewUrl":"http://traffic.libsyn.com/hangoutwithme/MYQ-2014-08-14-S.mp3","FileUrl":"http://traffic.libsyn.com/hangoutwithme/MYQ-2014-08-14.mp3","Length":"3172","FileSize":"76173413","Public":"1","Timestamp":1408032000,"Guests":[]},{"ShowId":"3399","ShowNameId":"13","Number":"187","PostedDate":"8/11/2014 12:00:00 PM","Title":"Quality, But Not Quantity","PreviewUrl":"http://traffic.libsyn.com/hangoutwithme/MYQ-2014-08-11-S.mp3","FileUrl":"http://traffic.libsyn.com/hangoutwithme/MYQ-2014-08-11.mp3","Length":"2766","FileSize":"66396997","Public":"1","Timestamp":1407772800,"Guests":[]},{"ShowId":"3390","ShowNameId":"15","Number":"186","PostedDate":"8/7/2014 12:00:00 PM","Title":"The Final Countnoun","VideoFileUrl":"https://www.keithandthegirl.com/vip/download/shows/superhang/video/186/SUPERHANG-2014-08-07.m3u8","VideoThumbnailUrl":"https://www.keithandthegirl.com/vip/download/shows/superhang/video/186/SUPERHANG-2014-08-07-video.jpg","PreviewUrl":"https://www.youtube.com/watch?v=bKoO-zs_GJg","FileUrl":"http://www.keithandthegirl.com/vip/download/shows/superhang/SUPERHANG-2014-08-07.mp3","Length":"4207","FileSize":"100998996","Public":"0","Timestamp":1407427200,"Guests":[]},{"ShowId":"3385","ShowNameId":"13","Number":"185","PostedDate":"8/4/2014 12:00:00 PM","Title":"Art and Fake Urine","PreviewUrl":"http://traffic.libsyn.com/hangoutwithme/MYQ-2014-08-04-S.mp3","FileUrl":"http://traffic.libsyn.com/hangoutwithme/MYQ-2014-08-04.mp3","Length":"2921","FileSize":"70174800","Public":"1","Timestamp":1407168000,"Guests":[]},{"ShowId":"3381","ShowNameId":"13","Number":"184","PostedDate":"7/31/2014 12:00:00 PM","Title":"Acomedemia","PreviewUrl":"http://traffic.libsyn.com/hangoutwithme/MYQ-2014-07-31-S.mp3","FileUrl":"http://traffic.libsyn.com/hangoutwithme/MYQ-2014-07-31.mp3","Length":"3570","FileSize":"42924428","Public":"1","Timestamp":1406822400,"Guests":[]},{"ShowId":"3375","ShowNameId":"13","Number":"183","PostedDate":"7/28/2014 12:00:00 PM","Title":"Placebo Hex","PreviewUrl":"http://traffic.libsyn.com/hangoutwithme/MYQ-2014-07-28-S.mp3","FileUrl":"http://traffic.libsyn.com/hangoutwithme/MYQ-2014-07-28.mp3","Length":"2979","FileSize":"71576424","Public":"1","Timestamp":1406563200,"Guests":[]},{"ShowId":"3365","ShowNameId":"15","Number":"182","PostedDate":"7/24/2014 12:00:00 PM","Title":"Sham Man","VideoFileUrl":"https://www.keithandthegirl.com/vip/download/shows/superhang/video/182/SUPERHANG-2014-07-24.m3u8","VideoThumbnailUrl":"https://www.keithandthegirl.com/vip/download/shows/superhang/video/182/SUPERHANG-2014-07-24-video.jpg","PreviewUrl":"https://www.youtube.com/watch?v=ClaWjILOFW4","FileUrl":"http://www.keithandthegirl.com/vip/download/shows/superhang/SUPERHANG-2014-07-24.mp3","Length":"3104","FileSize":"75352590","Public":"0","Timestamp":1406217600,"Guests":[]},{"ShowId":"3360","ShowNameId":"13","Number":"181","PostedDate":"7/21/2014 12:00:00 PM","Title":"Hip Hope","PreviewUrl":"http://traffic.libsyn.com/hangoutwithme/MYQ-2014-07-21-S.mp3","FileUrl":"http://traffic.libsyn.com/hangoutwithme/MYQ-2014-07-21.mp3","Length":"3364","FileSize":"80819529","Public":"1","Timestamp":1405958400,"Guests":[]},{"ShowId":"3355","ShowNameId":"13","Number":"180","PostedDate":"7/17/2014 12:00:00 PM","Title":"Brain Comedy Rap Science","PreviewUrl":"http://traffic.libsyn.com/hangoutwithme/MYQ-2014-07-17-S.mp3","FileUrl":"http://traffic.libsyn.com/hangoutwithme/MYQ-2014-07-17.mp3","Length":"2873","FileSize":"69021649","Public":"1","Timestamp":1405612800,"Guests":[]},{"ShowId":"3350","ShowNameId":"13","Number":"179","PostedDate":"7/14/2014 12:00:00 PM","Title":"The Incompletist","PreviewUrl":"http://traffic.libsyn.com/hangoutwithme/MYQ-2014-07-14-S.mp3","FileUrl":"http://traffic.libsyn.com/hangoutwithme/MYQ-2014-07-14.mp3","Length":"3593","FileSize":"86251505","Public":"1","Timestamp":1405353600,"Guests":[]},{"ShowId":"3346","ShowNameId":"15","Number":"178","PostedDate":"7/10/2014 12:00:00 PM","Title":"White Sheep","VideoFileUrl":"https://www.keithandthegirl.com/vip/download/shows/superhang/video/178/SUPERHANG-2014-07-10.m3u8","VideoThumbnailUrl":"https://www.keithandthegirl.com/vip/download/shows/superhang/video/178/SUPERHANG-2014-07-10-video.jpg","PreviewUrl":"https://www.youtube.com/watch?v=IC5FZddI7Lk","FileUrl":"http://www.keithandthegirl.com/vip/download/shows/superhang/SUPERHANG-2014-07-10.mp3","Length":"3214","FileSize":"39637381","Public":"0","Timestamp":1405008000,"Guests":[]},{"ShowId":"3343","ShowNameId":"13","Number":"177","PostedDate":"7/7/2014 12:00:00 PM","Title":"All Of The Polos","PreviewUrl":"http://traffic.libsyn.com/hangoutwithme/MYQ-2014-07-07-S.mp3","FileUrl":"http://traffic.libsyn.com/hangoutwithme/MYQ-2014-07-07.mp3","Length":"2970","FileSize":"71296511","Public":"1","Timestamp":1404748800,"Guests":[]},{"ShowId":"3340","ShowNameId":"13","Number":"176","PostedDate":"7/3/2014 12:00:00 PM","Title":"Hasidic Fire Drill","PreviewUrl":"http://traffic.libsyn.com/hangoutwithme/MYQ-2014-07-03-S.mp3","FileUrl":"http://traffic.libsyn.com/hangoutwithme/MYQ-2014-07-03.mp3","Length":"3669","FileSize":"44114846","Public":"1","Timestamp":1404403200,"Guests":[]},{"ShowId":"3335","ShowNameId":"13","Number":"175","PostedDate":"6/30/2014 12:00:00 PM","Title":"Three Hole-Punctual","PreviewUrl":"http://traffic.libsyn.com/hangoutwithme/MYQ-2014-06-30-S.mp3","FileUrl":"http://traffic.libsyn.com/hangoutwithme/MYQ-2014-06-30.mp3","Length":"3038","FileSize":"36540480","Public":"1","Timestamp":1404144000,"Guests":[]},{"ShowId":"3327","ShowNameId":"15","Number":"174","PostedDate":"6/26/2014 12:00:00 PM","Title":"Fight Club with Sylvia Plath","VideoFileUrl":"https://www.keithandthegirl.com/vip/download/shows/superhang/video/174/SUPERHANG-2014-06-26.m3u8","VideoThumbnailUrl":"https://www.keithandthegirl.com/vip/download/shows/superhang/video/174/SUPERHANG-2014-06-26-video.jpg","PreviewUrl":"https://www.youtube.com/watch?v=FPkSSp-O_qQ","FileUrl":"http://www.keithandthegirl.com/vip/download/shows/superhang/SUPERHANG-2014-06-26.mp3","Length":"3378","FileSize":"82083181","Public":"0","Timestamp":1403798400,"Guests":[]},{"ShowId":"3323","ShowNameId":"13","Number":"173","PostedDate":"6/23/2014 12:00:00 PM","Title":"The Hounds of Bris-kerville","PreviewUrl":"http://traffic.libsyn.com/hangoutwithme/MYQ-2014-06-23-S.mp3","FileUrl":"http://traffic.libsyn.com/hangoutwithme/MYQ-2014-06-23.mp3","Length":"2779","FileSize":"33427437","Public":"1","Timestamp":1403539200,"Guests":[]},{"ShowId":"3318","ShowNameId":"13","Number":"172","PostedDate":"6/19/2014 12:00:00 PM","Title":"Can One of You Be Chong?","PreviewUrl":"http://traffic.libsyn.com/hangoutwithme/MYQ-2014-06-19-S.mp3","FileUrl":"http://traffic.libsyn.com/hangoutwithme/MYQ-2014-06-19.mp3","Length":"3135","FileSize":"37728496","Public":"1","Timestamp":1403193600,"Guests":[]},{"ShowId":"3314","ShowNameId":"13","Number":"171","PostedDate":"6/16/2014 12:00:00 PM","Title":"When Gallagher and I Broke Up","PreviewUrl":"http://traffic.libsyn.com/hangoutwithme/MYQ-2014-06-16-S.mp3","FileUrl":"http://traffic.libsyn.com/hangoutwithme/MYQ-2014-06-16.mp3","Length":"2913","FileSize":"116582861","Public":"1","Timestamp":1402934400,"Guests":[]},{"ShowId":"3307","ShowNameId":"15","Number":"170","PostedDate":"6/12/2014 12:00:00 PM","Title":"Sweet Tea and Barbecue","VideoFileUrl":"https://www.keithandthegirl.com/vip/download/shows/superhang/video/170/SUPERHANG-2014-06-12.m3u8","VideoThumbnailUrl":"https://www.keithandthegirl.com/vip/download/shows/superhang/video/170/SUPERHANG-2014-06-12-video.jpg","PreviewUrl":"https://www.youtube.com/watch?v=vzO6Y8jSjWM","FileUrl":"http://www.keithandthegirl.com/vip/download/shows/superhang/SUPERHANG-2014-06-12.mp3","Length":"3978","FileSize":"95564980","Public":"0","Timestamp":1402588800,"Guests":[]},{"ShowId":"3303","ShowNameId":"13","Number":"169","PostedDate":"6/9/2014 12:00:00 PM","Title":"Fine-Tastic","PreviewUrl":"http://traffic.libsyn.com/hangoutwithme/MYQ-2014-06-09-S.mp3","FileUrl":"http://traffic.libsyn.com/hangoutwithme/MYQ-2014-06-09.mp3","Length":"1020","FileSize":"12317410","Public":"1","Timestamp":1402329600,"Guests":[]},{"ShowId":"3302","ShowNameId":"13","Number":"168","PostedDate":"6/4/2014 12:00:00 PM","Title":"Occam\u0027s Mysteries","PreviewUrl":"http://traffic.libsyn.com/hangoutwithme/MYQ-2014-06-04-S.mp3","FileUrl":"http://traffic.libsyn.com/hangoutwithme/MYQ-2014-06-04.mp3","Length":"3091","FileSize":"37173734","Public":"1","Timestamp":1401897600,"Guests":[]},{"ShowId":"3292","ShowNameId":"13","Number":"167","PostedDate":"6/2/2014 12:00:00 PM","Title":"Rap Jokes","PreviewUrl":"http://traffic.libsyn.com/hangoutwithme/MYQ-2014-06-02-S.mp3","FileUrl":"http://traffic.libsyn.com/hangoutwithme/MYQ-2014-06-02.mp3","Length":"3946","FileSize":"126353756","Public":"1","Timestamp":1401724800,"Guests":[]},{"ShowId":"3276","ShowNameId":"15","Number":"166","PostedDate":"5/29/2014 12:00:00 PM","Title":"Elmer PhD","VideoFileUrl":"https://www.keithandthegirl.com/vip/download/shows/superhang/video/166/SUPERHANG-2014-05-29.m3u8","VideoThumbnailUrl":"https://www.keithandthegirl.com/vip/download/shows/superhang/video/166/SUPERHANG-2014-05-29-video.jpg","PreviewUrl":"https://www.youtube.com/watch?v=eYHbMhYZnKg","FileUrl":"http://www.keithandthegirl.com/vip/download/shows/superhang/SUPERHANG-2014-05-29.mp3","Length":"2102","FileSize":"51448162","Public":"0","Timestamp":1401379200,"Guests":[]},{"ShowId":"3274","ShowNameId":"13","Number":"165","PostedDate":"5/26/2014 12:00:00 PM","Title":"Milton Burlesque","PreviewUrl":"http://traffic.libsyn.com/hangoutwithme/MYQ-2014-05-26-S.mp3","FileUrl":"http://traffic.libsyn.com/hangoutwithme/MYQ-2014-05-26.mp3","Length":"3032","FileSize":"36461923","Public":"1","Timestamp":1401120000,"Guests":[]},{"ShowId":"3270","ShowNameId":"13","Number":"164","PostedDate":"5/22/2014 12:00:00 PM","Title":"Sci-fientist","PreviewUrl":"http://traffic.libsyn.com/hangoutwithme/MYQ-2014-05-22-S.mp3","FileUrl":"http://traffic.libsyn.com/hangoutwithme/MYQ-2014-05-22.mp3","Length":"2957","FileSize":"94678249","Public":"1","Timestamp":1400774400,"Guests":[]},{"ShowId":"3267","ShowNameId":"13","Number":"163","PostedDate":"5/19/2014 12:00:00 PM","Title":"Pod-catcall","PreviewUrl":"http://traffic.libsyn.com/hangoutwithme/MYQ-2014-05-19-S.mp3","FileUrl":"http://traffic.libsyn.com/hangoutwithme/MYQ-2014-05-19.mp3","Length":"2534","FileSize":"30487513","Public":"1","Timestamp":1400515200,"Guests":[]},{"ShowId":"3257","ShowNameId":"15","Number":"162","PostedDate":"5/15/2014 12:00:00 PM","Title":"Whee!","VideoFileUrl":"https://www.keithandthegirl.com/vip/download/shows/superhang/video/162/SUPERHANG-2014-05-15.m3u8","VideoThumbnailUrl":"https://www.keithandthegirl.com/vip/download/shows/superhang/video/162/SUPERHANG-2014-05-15-video.jpg","PreviewUrl":"https://www.youtube.com/watch?v=u8nQ0B9uEyk","FileUrl":"http://www.keithandthegirl.com/vip/download/shows/superhang/SUPERHANG-2014-05-15.mp3","Length":"3126","FileSize":"75182632","Public":"0","Timestamp":1400169600,"Guests":[]},{"ShowId":"3255","ShowNameId":"13","Number":"161","PostedDate":"5/12/2014","Title":"Hallucibation","PreviewUrl":"","FileUrl":"http://traffic.libsyn.com/hangoutwithme/MYQ-2014-05-12.mp3","Length":"2659","FileSize":"63865896","Public":"1","Timestamp":1399867200,"Guests":[]},{"ShowId":"3249","ShowNameId":"13","Number":"160","PostedDate":"5/8/2014 12:00:00 PM","Title":"You Are Your Own Guru","PreviewUrl":"http://traffic.libsyn.com/hangoutwithme/MYQ-2014-05-08-S.mp3","FileUrl":"http://traffic.libsyn.com/hangoutwithme/MYQ-2014-05-08.mp3","Length":"2869","FileSize":"34504308","Public":"1","Timestamp":1399564800,"Guests":[]},{"ShowId":"3244","ShowNameId":"13","Number":"159","PostedDate":"5/5/2014 12:00:00 PM","Title":"Shits and Giggles","PreviewUrl":"http://traffic.libsyn.com/hangoutwithme/MYQ-2014-05-05-S.mp3","FileUrl":"http://traffic.libsyn.com/hangoutwithme/MYQ-2014-05-05.mp3","Length":"2746","FileSize":"33029499","Public":"1","Timestamp":1399305600,"Guests":[]},{"ShowId":"3234","ShowNameId":"15","Number":"158","PostedDate":"5/1/2014 12:00:00 PM","Title":"Mobius Stripper","VideoFileUrl":"https://www.keithandthegirl.com/vip/download/shows/superhang/video/158/SUPERHANG-2014-05-01.m3u8","VideoThumbnailUrl":"https://www.keithandthegirl.com/vip/download/shows/superhang/video/158/SUPERHANG-2014-05-01-video.jpg","PreviewUrl":"https://www.youtube.com/watch?v=LFc7lKZFvhA","FileUrl":"http://www.keithandthegirl.com/vip/download/shows/superhang/SUPERHANG-2014-05-01.mp3","Length":"3282","FileSize":"79765293","Public":"0","Timestamp":1398960000,"Guests":[]},{"ShowId":"3230","ShowNameId":"13","Number":"157","PostedDate":"4/28/2014 12:00:00 PM","Title":"Long Necked Giraffeasaurus","PreviewUrl":"http://traffic.libsyn.com/hangoutwithme/MYQ-2014-04-28-S.mp3","FileUrl":"http://traffic.libsyn.com/hangoutwithme/MYQ-2014-04-28.mp3","Length":"3334","FileSize":"80075746","Public":"1","Timestamp":1398700800,"Guests":[]},{"ShowId":"3225","ShowNameId":"13","Number":"156","PostedDate":"4/24/2014 12:00:00 PM","Title":"When It Rains, It Whores","PreviewUrl":"http://traffic.libsyn.com/hangoutwithme/MYQ-2014-04-24-S.mp3","FileUrl":"http://traffic.libsyn.com/hangoutwithme/MYQ-2014-04-24.mp3","Length":"4181","FileSize":"50248008","Public":"1","Timestamp":1398355200,"Guests":[]},{"ShowId":"3221","ShowNameId":"13","Number":"155","PostedDate":"4/21/2014 12:00:00 PM","Title":"Childish Gazebo","PreviewUrl":"http://traffic.libsyn.com/hangoutwithme/MYQ-2014-04-21-S.mp3","FileUrl":"http://traffic.libsyn.com/hangoutwithme/MYQ-2014-04-21.mp3","Length":"2872","FileSize":"34533460","Public":"1","Timestamp":1398096000,"Guests":[]},{"ShowId":"3216","ShowNameId":"15","Number":"154","PostedDate":"4/17/2014 12:00:00 PM","Title":"Everybody\u0027s Mistake","VideoFileUrl":"https://www.keithandthegirl.com/vip/download/shows/superhang/video/154/SUPERHANG-2014-04-17.m3u8","VideoThumbnailUrl":"https://www.keithandthegirl.com/vip/download/shows/superhang/video/154/SUPERHANG-2014-04-17-video.jpg","PreviewUrl":"https://www.youtube.com/watch?v=Bx0eJNBGTcA","FileUrl":"http://www.keithandthegirl.com/vip/download/shows/superhang/SUPERHANG-2014-04-17.mp3","Length":"3219","FileSize":"39696594","Public":"0","Timestamp":1397750400,"Guests":[]},{"ShowId":"3217","ShowNameId":"13","Number":"153","PostedDate":"4/14/2014 12:00:00 PM","Title":"STFU Patrons","PreviewUrl":"http://traffic.libsyn.com/hangoutwithme/MYQ-2014-04-14-S.mp3","FileUrl":"http://traffic.libsyn.com/hangoutwithme/MYQ-2014-04-14.mp3","Length":"3073","FileSize":"36874530","Public":"1","Timestamp":1397491200,"Guests":[]},{"ShowId":"3212","ShowNameId":"13","Number":"152","PostedDate":"4/10/2014 12:00:00 PM","Title":"Storiented","PreviewUrl":"http://traffic.libsyn.com/hangoutwithme/MYQ-2014-04-10-S.mp3","FileUrl":"http://traffic.libsyn.com/hangoutwithme/MYQ-2014-04-10.mp3","Length":"2723","FileSize":"32745684","Public":"1","Timestamp":1397145600,"Guests":[]},{"ShowId":"3207","ShowNameId":"13","Number":"151","PostedDate":"4/7/2014 12:00:00 PM","Title":"Erik\u0027s First Podcast","PreviewUrl":"http://traffic.libsyn.com/hangoutwithme/MYQ-2014-04-07-S.mp3","FileUrl":"http://traffic.libsyn.com/hangoutwithme/MYQ-2014-04-07.mp3","Length":"3326","FileSize":"106503131","Public":"1","Timestamp":1396886400,"Guests":[]},{"ShowId":"3198","ShowNameId":"15","Number":"150","PostedDate":"4/3/2014 12:00:00 PM","Title":"Rosebud was a Surfbort","VideoFileUrl":"https://www.keithandthegirl.com/vip/download/shows/superhang/video/150/SUPERHANG-2014-04-03.m3u8","VideoThumbnailUrl":"https://www.keithandthegirl.com/vip/download/shows/superhang/video/150/SUPERHANG-2014-04-03-video.jpg","PreviewUrl":" https://www.youtube.com/watch?v=cyyyigzz7EA","FileUrl":"http://www.keithandthegirl.com/vip/download/shows/superhang/SUPERHANG-2014-04-03.mp3","Length":"2757","FileSize":"45205344","Public":"0","Timestamp":1396540800,"Guests":[]},{"ShowId":"3196","ShowNameId":"13","Number":"149","PostedDate":"3/31/2014 11:59:00 AM","Title":"Stand-Up Career Friend With Benefits","PreviewUrl":"http://traffic.libsyn.com/hangoutwithme/MYQ-2014-03-31-S.mp3","FileUrl":"http://traffic.libsyn.com/hangoutwithme/MYQ-2014-03-31.mp3","Length":"0","FileSize":"28327427","Public":"1","Timestamp":1396281540,"Guests":[]},{"ShowId":"3186","ShowNameId":"13","Number":"148","PostedDate":"3/24/2014 12:00:00 PM","Title":"Dirty Tricks for Clean Comedians","PreviewUrl":"http://traffic.libsyn.com/hangoutwithme/MYQ-2014-03-24-S.mp3","FileUrl":"http://traffic.libsyn.com/hangoutwithme/MYQ-2014-03-24.mp3","Length":"3206","FileSize":"38540147","Public":"1","Timestamp":1395676800,"Guests":[]},{"ShowId":"3179","ShowNameId":"15","Number":"147","PostedDate":"3/20/2014 12:00:00 PM","Title":"This K-Hole World","VideoFileUrl":"https://www.keithandthegirl.com/vip/download/shows/superhang/video/147/SUPERHANG-2014-03-20.m3u8","VideoThumbnailUrl":"https://www.keithandthegirl.com/vip/download/shows/superhang/video/147/SUPERHANG-2014-03-20-video.jpg","PreviewUrl":"https://www.youtube.com/watch?v=Z-gZwLqrFTY","FileUrl":"http://www.keithandthegirl.com/vip/download/shows/superhang/SUPERHANG-2014-03-20.mp3","Length":"3301","FileSize":"53902571","Public":"0","Timestamp":1395331200,"Guests":[]},{"ShowId":"3176","ShowNameId":"13","Number":"146","PostedDate":"3/17/2014 12:00:00 PM","Title":"Trapping People Into Being Racist and Sexist","PreviewUrl":"http://traffic.libsyn.com/hangoutwithme/MYQ-2014-03-17-S.mp3","FileUrl":"http://traffic.libsyn.com/hangoutwithme/MYQ-2014-03-17.mp3","Length":"0","FileSize":"36164575","Public":"1","Timestamp":1395072000,"Guests":[]},{"ShowId":"3169","ShowNameId":"13","Number":"145","PostedDate":"3/13/2014 12:00:00 PM","Title":"Almost Self-Titled","PreviewUrl":"http://traffic.libsyn.com/hangoutwithme/MYQ-2014-03-13-S.mp3","FileUrl":"http://traffic.libsyn.com/hangoutwithme/MYQ-2014-03-13.mp3","Length":"3261","FileSize":"39205473","Public":"1","Timestamp":1394726400,"Guests":[]},{"ShowId":"3163","ShowNameId":"13","Number":"144","PostedDate":"3/10/2014 12:00:00 PM","Title":"Russian Stacked Doll","PreviewUrl":"http://traffic.libsyn.com/hangoutwithme/MYQ-2014-03-10-S.mp3","FileUrl":"http://traffic.libsyn.com/hangoutwithme/MYQ-2014-03-10.mp3","Length":"3524","FileSize":"35311969","Public":"1","Timestamp":1394467200,"Guests":[]},{"ShowId":"3156","ShowNameId":"15","Number":"143","PostedDate":"3/6/2014 12:00:00 PM","Title":"Hyperbolic Chamber","VideoFileUrl":"https://www.keithandthegirl.com/vip/download/shows/superhang/video/143/SUPERHANG-2014-03-06.m3u8","VideoThumbnailUrl":"https://www.keithandthegirl.com/vip/download/shows/superhang/video/143/SUPERHANG-2014-03-06-video.jpg","PreviewUrl":"https://www.youtube.com/watch?v=MayHYIjqBSI","FileUrl":"http://www.keithandthegirl.com/vip/download/shows/superhang/SUPERHANG-2014-03-06.mp3","Length":"3681","FileSize":"44222533","Public":"0","Timestamp":1394125200,"Guests":[]},{"ShowId":"3151","ShowNameId":"13","Number":"142","PostedDate":"3/3/2014 12:00:00 PM","Title":"More On DNA","PreviewUrl":"http://traffic.libsyn.com/hangoutwithme/MYQ-2014-03-03-S.mp3","FileUrl":"http://traffic.libsyn.com/hangoutwithme/MYQ-2014-03-03.mp3","Length":"3331","FileSize":"40047305","Public":"1","Timestamp":1393866000,"Guests":[]},{"ShowId":"3146","ShowNameId":"13","Number":"141","PostedDate":"2/27/2014 12:00:00 PM","Title":"Female Banksy","PreviewUrl":"","FileUrl":"http://traffic.libsyn.com/hangoutwithme/MYQ-2014-02-27.mp3","Length":"2805","FileSize":"33734128","Public":"1","Timestamp":1393520400,"Guests":[]},{"ShowId":"3141","ShowNameId":"13","Number":"140","PostedDate":"2/24/2014 12:00:00 PM","Title":"Working Title","PreviewUrl":"http://traffic.libsyn.com/hangoutwithme/MYQ-2014-02-24-S.mp3","FileUrl":"http://traffic.libsyn.com/hangoutwithme/MYQ-2014-02-24.mp3","Length":"2956","FileSize":"35550667","Public":"1","Timestamp":1393261200,"Guests":[]},{"ShowId":"3133","ShowNameId":"15","Number":"139","PostedDate":"2/20/2014 12:00:00 PM","Title":"Sex Riffin\u0027","VideoFileUrl":"https://www.keithandthegirl.com/vip/download/shows/superhang/video/139/SUPERHANG-2014-02-20.m3u8","VideoThumbnailUrl":"https://www.keithandthegirl.com/vip/download/shows/superhang/video/139/SUPERHANG-2014-02-20-video.jpg","PreviewUrl":"http://www.youtube.com/watch?v=-ZKq1BhX-co","FileUrl":"http://www.keithandthegirl.com/vip/download/shows/superhang/SUPERHANG-2014-02-20.mp3","Length":"3296","FileSize":"52893599","Public":"0","Timestamp":1392915600,"Guests":[]},{"ShowId":"3131","ShowNameId":"13","Number":"138","PostedDate":"2/17/2014 12:00:00 PM","Title":"Fast and/or Furious","PreviewUrl":"http://traffic.libsyn.com/hangoutwithme/MYQ-2014-02-17-S.mp3","FileUrl":"http://traffic.libsyn.com/hangoutwithme/MYQ-2014-02-17.mp3","Length":"3325","FileSize":"53266346","Public":"1","Timestamp":1392656400,"Guests":[]},{"ShowId":"3127","ShowNameId":"13","Number":"137","PostedDate":"2/13/2014 12:00:00 PM","Title":"An Apple a Day Keeps the Gwyneth Away","PreviewUrl":"http://traffic.libsyn.com/hangoutwithme/MYQ-2014-02-13-S.mp3","FileUrl":"http://traffic.libsyn.com/hangoutwithme/MYQ-2014-02-13.mp3","Length":"2758","FileSize":"44187285","Public":"1","Timestamp":1392310800,"Guests":[]},{"ShowId":"3117","ShowNameId":"13","Number":"136","PostedDate":"2/10/2014 12:00:00 PM","Title":"Satyr Dinner","PreviewUrl":"http://traffic.libsyn.com/hangoutwithme/MYQ-2014-02-10-S.mp3","FileUrl":"http://traffic.libsyn.com/hangoutwithme/MYQ-2014-02-10.mp3","Length":"3106","FileSize":"49775551","Public":"1","Timestamp":1392051600,"Guests":[]},{"ShowId":"3112","ShowNameId":"15","Number":"135","PostedDate":"2/6/2014 12:00:00 PM","Title":"Emotionally Manipulative Cats","VideoFileUrl":"https://www.keithandthegirl.com/vip/download/shows/superhang/video/135/SUPERHANG-2014-02-06.m3u8","VideoThumbnailUrl":"https://www.keithandthegirl.com/vip/download/shows/superhang/video/135/SUPERHANG-2014-02-06-video.jpg","PreviewUrl":"http://www.youtube.com/watch?v=BmclcxpCDAg","FileUrl":"http://www.keithandthegirl.com/vip/download/shows/superhang/SUPERHANG-2014-02-06.mp3","Length":"3384","FileSize":"54302559","Public":"0","Timestamp":1391706000,"Guests":[]},{"ShowId":"3105","ShowNameId":"13","Number":"134","PostedDate":"2/3/2014 12:00:00 PM","Title":"Weird Criminal","PreviewUrl":"http://traffic.libsyn.com/hangoutwithme/MYQ-2014-02-03-S.mp3","FileUrl":"http://traffic.libsyn.com/hangoutwithme/MYQ-2014-02-03.mp3","Length":"2697","FileSize":"43203331","Public":"1","Timestamp":1391446800,"Guests":[]},{"ShowId":"3099","ShowNameId":"13","Number":"133","PostedDate":"1/30/2014 12:00:00 PM","Title":"Quit Your Bonin\u0027","PreviewUrl":"http://traffic.libsyn.com/hangoutwithme/MYQ-2014-01-30-S.mp3","FileUrl":"http://traffic.libsyn.com/hangoutwithme/MYQ-2014-01-30.mp3","Length":"2651","FileSize":"31888019","Public":"1","Timestamp":1391101200,"Guests":[]},{"ShowId":"3094","ShowNameId":"13","Number":"132","PostedDate":"1/28/2014 12:00:00 PM","Title":"The Cat in the Rap","PreviewUrl":"http://traffic.libsyn.com/hangoutwithme/MYQ-2014-01-28-S.mp3","FileUrl":"http://traffic.libsyn.com/hangoutwithme/MYQ-2014-01-28.mp3","Length":"2515","FileSize":"40271943","Public":"1","Timestamp":1390928400,"Guests":[]},{"ShowId":"3088","ShowNameId":"15","Number":"131","PostedDate":"1/23/2014 12:00:00 PM","Title":"It\u0027s All Downhill From Here","VideoFileUrl":"https://www.keithandthegirl.com/vip/download/shows/superhang/video/131/SUPERHANG-2014-01-23.m3u8","VideoThumbnailUrl":"https://www.keithandthegirl.com/vip/download/shows/superhang/video/131/SUPERHANG-2014-01-23-video.jpg","PreviewUrl":"http://www.youtube.com/watch?v=ZEWD2N29X8A","FileUrl":"http://www.keithandthegirl.com/vip/download/shows/superhang/SUPERHANG-2014-01-23.mp3","Length":"3190","FileSize":"52122394","Public":"0","Timestamp":1390496400,"Guests":[]},{"ShowId":"3082","ShowNameId":"13","Number":"130","PostedDate":"1/20/2014 12:00:00 PM","Title":"Re: Public Cans","PreviewUrl":"http://traffic.libsyn.com/hangoutwithme/MYQ-2014-01-20-S.mp3","FileUrl":"http://traffic.libsyn.com/hangoutwithme/MYQ-2014-01-20.mp3","Length":"2703","FileSize":"43305291","Public":"1","Timestamp":1390237200,"Guests":[]},{"ShowId":"3078","ShowNameId":"13","Number":"129","PostedDate":"1/16/2014 12:00:00 PM","Title":"The Pot and the Ketel One","PreviewUrl":"http://traffic.libsyn.com/hangoutwithme/MYQ-2014-01-16-S.mp3","FileUrl":"http://traffic.libsyn.com/hangoutwithme/MYQ-2014-01-16.mp3","Length":"3338","FileSize":"53455041","Public":"1","Timestamp":1389891600,"Guests":[]},{"ShowId":"3072","ShowNameId":"13","Number":"128","PostedDate":"1/13/2014 12:00:00 PM","Title":"Zamatteo","PreviewUrl":"http://traffic.libsyn.com/hangoutwithme/MYQ-2014-01-13-S.mp3","FileUrl":"http://traffic.libsyn.com/hangoutwithme/MYQ-2014-01-13.mp3","Length":"3005","FileSize":"48126862","Public":"1","Timestamp":1389632400,"Guests":[]},{"ShowId":"3065","ShowNameId":"15","Number":"127","PostedDate":"1/9/2014 12:00:00 PM","Title":"BananAIDS","VideoFileUrl":"https://www.keithandthegirl.com/vip/download/shows/superhang/video/127/SUPERHANG-2014-01-09.m3u8","VideoThumbnailUrl":"https://www.keithandthegirl.com/vip/download/shows/superhang/video/127/SUPERHANG-2014-01-09-video.jpg","PreviewUrl":"http://www.youtube.com/watch?v=kSIswz5sNA4","FileUrl":"http://www.keithandthegirl.com/vip/download/shows/superhang/SUPERHANG-2014-01-09.mp3","Length":"3472","FileSize":"55714037","Public":"0","Timestamp":1389286800,"Guests":[]},{"ShowId":"3062","ShowNameId":"13","Number":"126","PostedDate":"1/6/2014 12:00:00 PM","Title":"Direct to Audio","PreviewUrl":"http://traffic.libsyn.com/hangoutwithme/MYQ-2014-01-06-S.mp3","FileUrl":"http://traffic.libsyn.com/hangoutwithme/MYQ-2014-01-06.mp3","Length":"2816","FileSize":"45170850","Public":"1","Timestamp":1389027600,"Guests":[]},{"ShowId":"3058","ShowNameId":"13","Number":"125","PostedDate":"1/2/2014 12:00:00 PM","Title":"Andes Candies Dice Clay Fruit Flute Fart Hang Glide","PreviewUrl":"http://traffic.libsyn.com/hangoutwithme/MYQ-2014-01-02-S.mp3","FileUrl":"http://traffic.libsyn.com/hangoutwithme/MYQ-2014-01-02.mp3","Length":"2754","FileSize":"44168367","Public":"1","Timestamp":1388682000,"Guests":[]},{"ShowId":"3057","ShowNameId":"13","Number":"124","PostedDate":"12/30/2013 12:00:00 PM","Title":"Drunk Feminism","PreviewUrl":"http://traffic.libsyn.com/hangoutwithme/MYQ-2013-12-30-S.mp3","FileUrl":"http://traffic.libsyn.com/hangoutwithme/MYQ-2013-12-30.mp3","Length":"2946","FileSize":"47183118","Public":"1","Timestamp":1388422800,"Guests":[]},{"ShowId":"3051","ShowNameId":"15","Number":"123","PostedDate":"12/26/2013 12:00:00 PM","Title":"Punk\u0027d-tuality","VideoFileUrl":"https://www.keithandthegirl.com/vip/download/shows/superhang/video/123/SUPERHANG-2013-12-16.m3u8","VideoThumbnailUrl":"https://www.keithandthegirl.com/vip/download/shows/superhang/video/123/SUPERHANG-2013-12-16-video.jpg","PreviewUrl":"http://www.youtube.com/watch?v=_acAWI_pfds","FileUrl":"http://www.keithandthegirl.com/vip/download/shows/superhang/SUPERHANG-2013-12-16.mp3","Length":"3213","FileSize":"51569946","Public":"0","Timestamp":1388077200,"Guests":[]},{"ShowId":"3055","ShowNameId":"13","Number":"122","PostedDate":"12/23/2013 12:00:00 PM","Title":"Stuckey and Murrayed with Children","PreviewUrl":"http://traffic.libsyn.com/hangoutwithme/MYQ-2013-12-23-S.mp3","FileUrl":"http://traffic.libsyn.com/hangoutwithme/MYQ-2013-12-23.mp3","Length":"3017","FileSize":"48322495","Public":"1","Timestamp":1387818000,"Guests":[]},{"ShowId":"3045","ShowNameId":"13","Number":"121","PostedDate":"12/19/2013 12:00:00 PM","Title":"Time to Make the Careers","PreviewUrl":"http://traffic.libsyn.com/hangoutwithme/MYQ-2013-12-19-S.mp3","FileUrl":"http://traffic.libsyn.com/hangoutwithme/MYQ-2013-12-19.mp3","Length":"2726","FileSize":"43669433","Public":"1","Timestamp":1387472400,"Guests":[]},{"ShowId":"3040","ShowNameId":"13","Number":"120","PostedDate":"12/16/2013 12:00:00 PM","Title":"Anglerphile","PreviewUrl":"http://traffic.libsyn.com/hangoutwithme/MYQ-2013-12-16-S.mp3","FileUrl":"http://traffic.libsyn.com/hangoutwithme/MYQ-2013-12-16.mp3","Length":"2881","FileSize":"46156600","Public":"1","Timestamp":1387213200,"Guests":[]},{"ShowId":"3035","ShowNameId":"15","Number":"119","PostedDate":"12/12/2013 12:00:00 PM","Title":"Ecsta-, Ecsta-...-cy All About It!","VideoFileUrl":"https://www.keithandthegirl.com/vip/download/shows/superhang/video/119/SUPERHANG-2013-12-12.m3u8","VideoThumbnailUrl":"https://www.keithandthegirl.com/vip/download/shows/superhang/video/119/SUPERHANG-2013-12-12-video.jpg","PreviewUrl":"http://www.youtube.com/watch?v=WufejjBdCWo","FileUrl":"http://www.keithandthegirl.com/vip/download/shows/superhang/SUPERHANG-2013-12-12.mp3","Length":"3318","FileSize":"40939591","Public":"0","Timestamp":1386867600,"Guests":[]},{"ShowId":"3029","ShowNameId":"13","Number":"118","PostedDate":"12/9/2013 12:00:00 PM","Title":"Maury Holes","PreviewUrl":"http://traffic.libsyn.com/hangoutwithme/MYQ-2013-12-09-S.mp3","FileUrl":"http://traffic.libsyn.com/hangoutwithme/MYQ-2013-12-09.mp3","Length":"3026","FileSize":"48466678","Public":"1","Timestamp":1386608400,"Guests":[]},{"ShowId":"3025","ShowNameId":"13","Number":"117","PostedDate":"12/5/2013 12:00:00 PM","Title":"Frank O\u0027Phile","PreviewUrl":"http://traffic.libsyn.com/hangoutwithme/MYQ-2013-12-05-S.mp3","FileUrl":"http://traffic.libsyn.com/hangoutwithme/MYQ-2013-12-05.mp3","Length":"3331","FileSize":"53343985","Public":"1","Timestamp":1386262800,"Guests":[]},{"ShowId":"3019","ShowNameId":"13","Number":"116","PostedDate":"12/2/2013 12:00:00 PM","Title":"Hapbarn","PreviewUrl":"http://traffic.libsyn.com/hangoutwithme/MYQ-2013-11-02-S.mp3","FileUrl":"http://traffic.libsyn.com/hangoutwithme/MYQ-2013-11-02.mp3","Length":"2629","FileSize":"42111179","Public":"1","Timestamp":1386003600,"Guests":[]},{"ShowId":"3010","ShowNameId":"15","Number":"115","PostedDate":"11/28/2013 12:00:00 PM","Title":"Bye, Racial!","VideoFileUrl":"https://www.keithandthegirl.com/vip/download/shows/superhang/video/115/SUPERHANG-2013-11-25.m3u8","VideoThumbnailUrl":"https://www.keithandthegirl.com/vip/download/shows/superhang/video/115/SUPERHANG-2013-11-25-video.jpg","PreviewUrl":"http://www.youtube.com/watch?v=qEEC7rFuwEo","FileUrl":"http://www.keithandthegirl.com/vip/download/shows/superhang/SUPERHANG-2013-11-25.mp3","Length":"3151","FileSize":"50572669","Public":"0","Timestamp":1385658000,"Guests":[]},{"ShowId":"3015","ShowNameId":"13","Number":"114","PostedDate":"11/25/2013 12:00:00 PM","Title":"You\u0027ve Got Sleepless Male Met Sally","PreviewUrl":"http://traffic.libsyn.com/hangoutwithme/MYQ-2013-11-25-S.mp3","FileUrl":"http://traffic.libsyn.com/hangoutwithme/MYQ-2013-11-25.mp3","Length":"2946","FileSize":"47187462","Public":"1","Timestamp":1385398800,"Guests":[]},{"ShowId":"3008","ShowNameId":"13","Number":"113","PostedDate":"11/21/2013 12:00:00 PM","Title":"Nicolas Cage, Axe User","PreviewUrl":"http://traffic.libsyn.com/hangoutwithme/MYQ-2013-11-21-S.mp3","FileUrl":"http://traffic.libsyn.com/hangoutwithme/MYQ-2013-11-21.mp3","Length":"2854","FileSize":"45711238","Public":"1","Timestamp":1385053200,"Guests":[]},{"ShowId":"3003","ShowNameId":"13","Number":"112","PostedDate":"11/18/2013 12:00:00 PM","Title":"Manslaughterpunch","PreviewUrl":"http://traffic.libsyn.com/hangoutwithme/MYQ-2013-11-18-S.mp3","FileUrl":"http://traffic.libsyn.com/hangoutwithme/MYQ-2013-11-18.mp3","Length":"2726","FileSize":"43673103","Public":"1","Timestamp":1384794000,"Guests":[]},{"ShowId":"2996","ShowNameId":"15","Number":"111","PostedDate":"11/14/2013 12:00:00 PM","Title":"Elimi-Friend","PreviewUrl":"","FileUrl":"http://www.keithandthegirl.com/vip/download/shows/superhang/SUPERHANG-2013-11-14.mp3","Length":"3511","FileSize":"56333811","Public":"0","Timestamp":1384448400,"Guests":[]},{"ShowId":"2992","ShowNameId":"13","Number":"110","PostedDate":"11/11/2013 12:00:00 PM","Title":"Kashlinger: Live from the Bridgetown Comedy Festival","PreviewUrl":"http://traffic.libsyn.com/hangoutwithme/MYQ-2013-11-11-S.mp3","FileUrl":"http://traffic.libsyn.com/hangoutwithme/MYQ-2013-11-11.mp3","Length":"2947","FileSize":"47210373","Public":"1","Timestamp":1384189200,"Guests":[]},{"ShowId":"2987","ShowNameId":"13","Number":"109","PostedDate":"11/7/2013 12:00:00 PM","Title":"ConsPiRacy","PreviewUrl":"http://traffic.libsyn.com/hangoutwithme/MYQ-2013-11-07-S.mp3","FileUrl":"http://traffic.libsyn.com/hangoutwithme/MYQ-2013-11-07.mp3","Length":"3477","FileSize":"55687323","Public":"1","Timestamp":1383843600,"Guests":[]},{"ShowId":"2981","ShowNameId":"13","Number":"108","PostedDate":"11/4/2013 12:01:04 PM","Title":"The Center of Sports and Everything","PreviewUrl":"http://traffic.libsyn.com/hangoutwithme/MYQ-2013-11-04-S.mp3","FileUrl":"http://traffic.libsyn.com/hangoutwithme/MYQ-2013-11-04.mp3","Length":"2656","FileSize":"42552170","Public":"1","Timestamp":1383584464,"Guests":[{"Data":"191","ShowGuestId":"191","RealName":"Dan Soder","Description":"Comedian known for his appearances on Conan and his Comedy Central Half Hour.","PictureFilename":"Dan-Soder.jpg","Url1":"http://twitter.com/#!/dansoder","Url2":"","PictureUrl":"http://static-1.keithandthegirl.net/guests/pics/processed/Dan-Soder-150x150.jpg","PictureUrlLarge":"http://static-1.keithandthegirl.net/guests/pics/processed/Dan-Soder-600x600.jpg"},{"Data":"270","ShowGuestId":"270","RealName":"Kelly Fastuca","Description":"Comedian best known for her appearances on the You Know What Dude! podcast.","PictureFilename":"Kelly-Fastuca.jpg","Url1":"http://www.kellyfastuca.com","Url2":"http://twitter.com/kellyfastuca","PictureUrl":"http://static-4.keithandthegirl.net/guests/pics/processed/Kelly-Fastuca-150x150.jpg","PictureUrlLarge":"http://static-4.keithandthegirl.net/guests/pics/processed/Kelly-Fastuca-600x600.jpg"}]},{"ShowId":"2971","ShowNameId":"15","Number":"107","PostedDate":"10/31/2013 10:45:00 AM","Title":"Matters","VideoFileUrl":"https://www.keithandthegirl.com/vip/download/shows/superhang/video/107/SUPERHANG-2013-10-31.m3u8","VideoThumbnailUrl":"https://www.keithandthegirl.com/vip/download/shows/superhang/video/107/SUPERHANG-2013-10-31-video.jpg","PreviewUrl":"http://www.youtube.com/watch?v=DYWfE9lrbCQ","FileUrl":"http://www.keithandthegirl.com/vip/download/shows/superhang/SUPERHANG-2013-10-31.mp3","Length":"3478","FileSize":"55797557","Public":"0","Timestamp":1383230700,"Guests":[]},{"ShowId":"2967","ShowNameId":"13","Number":"106","PostedDate":"10/28/2013 12:00:00 PM","Title":"Avoid Monsters","PreviewUrl":"http://traffic.libsyn.com/hangoutwithme/MYQ-2013-10-28-S.mp3","FileUrl":"http://traffic.libsyn.com/hangoutwithme/MYQ-2013-10-28.mp3","Length":"3045","FileSize":"48828120","Public":"1","Timestamp":1382976000,"Guests":[]},{"ShowId":"2963","ShowNameId":"13","Number":"105","PostedDate":"10/24/2013 12:00:00 PM","Title":"Myq Kaplan Fixes The World","PreviewUrl":"http://traffic.libsyn.com/hangoutwithme/MYQ-2013-10-24-S.mp3","FileUrl":"http://traffic.libsyn.com/hangoutwithme/MYQ-2013-10-24.mp3","Length":"2923","FileSize":"46874679","Public":"1","Timestamp":1382630400,"Guests":[]},{"ShowId":"2957","ShowNameId":"13","Number":"104","PostedDate":"10/21/2013 12:00:00 PM","Title":"Tell On Yourself","PreviewUrl":"http://traffic.libsyn.com/hangoutwithme/MYQ-2013-10-21-S.mp3","FileUrl":"http://traffic.libsyn.com/hangoutwithme/MYQ-2013-10-21.mp3","Length":"2893","FileSize":"46389616","Public":"1","Timestamp":1382371200,"Guests":[]},{"ShowId":"2950","ShowNameId":"15","Number":"103","PostedDate":"10/17/2013 12:00:00 PM","Title":"Friendtors","VideoFileUrl":"https://www.keithandthegirl.com/vip/download/shows/superhang/video/103/SUPERHANG-2013-10-17.m3u8","VideoThumbnailUrl":"https://www.keithandthegirl.com/vip/download/shows/superhang/video/103/SUPERHANG-2013-10-17-video.jpg","PreviewUrl":"http://www.youtube.com/watch?v=I3dbqM4Dkvc","FileUrl":"http://www.keithandthegirl.com/vip/download/shows/superhang/SUPERHANG-2013-10-17.mp3","Length":"2883","FileSize":"46283405","Public":"0","Timestamp":1382025600,"Guests":[]},{"ShowId":"2945","ShowNameId":"13","Number":"102","PostedDate":"10/14/2013 12:00:00 PM","Title":"But Siriusly, Guys","PreviewUrl":"http://traffic.libsyn.com/hangoutwithme/MYQ-2013-10-14-S.mp3","FileUrl":"http://traffic.libsyn.com/hangoutwithme/MYQ-2013-10-14.mp3","Length":"2990","FileSize":"47950006","Public":"1","Timestamp":1381766400,"Guests":[]},{"ShowId":"2939","ShowNameId":"13","Number":"101","PostedDate":"10/10/2013 12:00:00 PM","Title":"Tall For One And One For Tall","PreviewUrl":"http://traffic.libsyn.com/hangoutwithme/MYQ-2013-10-10-S.mp3","FileUrl":"http://traffic.libsyn.com/hangoutwithme/MYQ-2013-10-10.mp3","Length":"2581","FileSize":"41408973","Public":"1","Timestamp":1381420800,"Guests":[]},{"ShowId":"2936","ShowNameId":"13","Number":"100","PostedDate":"10/7/2013 12:00:00 PM","Title":"Everyone\u0027s Mom Has AIDS","PreviewUrl":"http://traffic.libsyn.com/hangoutwithme/MYQ-2013-10-07-S.mp3","FileUrl":"http://traffic.libsyn.com/hangoutwithme/MYQ-2013-10-07.mp3","Length":"2740","FileSize":"43955148","Public":"1","Timestamp":1381161600,"Guests":[]},{"ShowId":"2932","ShowNameId":"15","Number":"99","PostedDate":"10/3/2013 12:00:00 PM","Title":"Nobody Gets Drunk Or Shows Their Boobs","VideoFileUrl":"https://www.keithandthegirl.com/vip/download/shows/superhang/video/99/SUPERHANG-2013-10-03.m3u8","VideoThumbnailUrl":"https://www.keithandthegirl.com/vip/download/shows/superhang/video/99/SUPERHANG-2013-10-03-video.jpg","PreviewUrl":"http://www.youtube.com/watch?v=IgKNgeyzC28","FileUrl":"http://www.keithandthegirl.com/vip/download/shows/superhang/SUPERHANG-2013-10-03.mp3","Length":"4426","FileSize":"53263974","Public":"0","Timestamp":1380816000,"Guests":[]},{"ShowId":"2929","ShowNameId":"13","Number":"98","PostedDate":"9/30/2013 12:00:00 PM","Title":"The Virtues of Dane Cook, and Other Stories","PreviewUrl":"http://traffic.libsyn.com/hangoutwithme/MYQ-2013-09-30-S.mp3","FileUrl":"http://traffic.libsyn.com/hangoutwithme/MYQ-2013-09-30.mp3","Length":"2762","FileSize":"44300005","Public":"1","Timestamp":1380556800,"Guests":[]},{"ShowId":"2923","ShowNameId":"13","Number":"97","PostedDate":"9/26/2013 11:45:00 AM","Title":"Not Misspelling \u0027Miss Stelling\u0027 (And Also Correctly Spelling \u0027Esposito\u0027)","PreviewUrl":"http://traffic.libsyn.com/hangoutwithme/MYQ-2013-09-26_S.mp3","FileUrl":"http://traffic.libsyn.com/hangoutwithme/MYQ-2013-09-26.mp3","Length":"3154","FileSize":"50579051","Public":"1","Timestamp":1380210300,"Guests":[]},{"ShowId":"2917","ShowNameId":"13","Number":"96","PostedDate":"9/23/2013 4:46:49 PM","Title":"Acupunk\u0027d!","PreviewUrl":"http://traffic.libsyn.com/hangoutwithme/MYQ-2013-09-23-S.mp3","FileUrl":"http://traffic.libsyn.com/hangoutwithme/MYQ-2013-09-23.mp3","Length":"2570","FileSize":"41267150","Public":"1","Timestamp":1379969209,"Guests":[]},{"ShowId":"2911","ShowNameId":"15","Number":"95","PostedDate":"9/19/2013 12:00:00 PM","Title":"Cownsensual","PreviewUrl":"","FileUrl":"http://www.keithandthegirl.com/vip/download/shows/superhang/SUPERHANG-2013-09-19.mp3","Length":"3867","FileSize":"61887852","Public":"0","Timestamp":1379606400,"Guests":[]},{"ShowId":"2907","ShowNameId":"13","Number":"94","PostedDate":"9/16/2013 3:34:11 PM","Title":"Everyone Works for the Onion","PreviewUrl":"http://traffic.libsyn.com/hangoutwithme/MYQ-2013-09-16-S.mp3","FileUrl":"http://traffic.libsyn.com/hangoutwithme/MYQ-2013-09-16.mp3","Length":"2748","FileSize":"44112724","Public":"1","Timestamp":1379360051,"Guests":[]},{"ShowId":"2903","ShowNameId":"13","Number":"93","PostedDate":"9/12/2013 1:31:22 PM","Title":"Bunny Jobs","PreviewUrl":"http://traffic.libsyn.com/hangoutwithme/MYQ-2013-09-12-S.mp3","FileUrl":"http://traffic.libsyn.com/hangoutwithme/MYQ-2013-09-12.mp3","Length":"2711","FileSize":"43526007","Public":"1","Timestamp":1379007082,"Guests":[]},{"ShowId":"2898","ShowNameId":"13","Number":"92","PostedDate":"9/9/2013 6:38:23 PM","Title":"PSAchedelic","PreviewUrl":"http://traffic.libsyn.com/hangoutwithme/MYQ-2013-09-09-S.mp3","FileUrl":"http://traffic.libsyn.com/hangoutwithme/MYQ-2013-09-09.mp3","Length":"2771","FileSize":"44483934","Public":"1","Timestamp":1378766303,"Guests":[]},{"ShowId":"2894","ShowNameId":"15","Number":"91","PostedDate":"9/5/2013 12:03:52 PM","Title":"Relax Against the Machine","VideoFileUrl":"https://www.keithandthegirl.com/vip/download/shows/superhang/video/91/SUPERHANG-2013-09-05.m3u8","VideoThumbnailUrl":"https://www.keithandthegirl.com/vip/download/shows/superhang/video/91/SUPERHANG-2013-09-05-video.jpg","PreviewUrl":"http://www.youtube.com/watch?v=YfgmY9gvyIc","FileUrl":"http://www.keithandthegirl.com/vip/download/shows/superhang/SUPERHANG-2013-09-05.mp3","Length":"4048","FileSize":"64773019","Public":"0","Timestamp":1378397032,"Guests":[]},{"ShowId":"2891","ShowNameId":"13","Number":"90","PostedDate":"9/2/2013 7:25:53 PM","Title":"Jaywalking Monkeys","PreviewUrl":"http://traffic.libsyn.com/hangoutwithme/MYQ-2013-09-02-S.mp3","FileUrl":"http://traffic.libsyn.com/hangoutwithme/MYQ-2013-09-02.mp3","Length":"2740","FileSize":"43992630","Public":"1","Timestamp":1378164353,"Guests":[{"Data":"396","ShowGuestId":"396","RealName":"Chris Distefano","Description":"Comedian best known as a cast member of MTV\u0027s Guy Code.","PictureFilename":"chris-distefano.jpg","Url1":"","Url2":"https://twitter.com/chrisdcomedy","PictureUrl":"http://static-4.keithandthegirl.net/guests/pics/processed/chris-distefano-150x150.jpg","PictureUrlLarge":"http://static-4.keithandthegirl.net/guests/pics/processed/chris-distefano-600x600.jpg"},{"Data":"397","ShowGuestId":"397","RealName":"Maria Heinegg","Description":"Comedian and writer best known for her contributions to The Huffington Post.","PictureFilename":"maria-heinegg.jpg","Url1":"","Url2":"https://twitter.com/MariaElizabest","PictureUrl":"http://static-4.keithandthegirl.net/guests/pics/processed/maria-heinegg-150x150.jpg","PictureUrlLarge":"http://static-4.keithandthegirl.net/guests/pics/processed/maria-heinegg-600x600.jpg"}]},{"ShowId":"2885","ShowNameId":"13","Number":"89","PostedDate":"8/29/2013 3:54:08 PM","Title":"Ornery Adams","PreviewUrl":"http://traffic.libsyn.com/hangoutwithme/MYQ-2013-08-29-S.mp3","FileUrl":"http://traffic.libsyn.com/hangoutwithme/MYQ-2013-08-29.mp3","Length":"2828","FileSize":"45397100","Public":"1","Timestamp":1377806048,"Guests":[]},{"ShowId":"2869","ShowNameId":"15","Number":"88","PostedDate":"8/22/2013 1:09:51 PM","Title":"Daniel Dad Lewis","PreviewUrl":"","FileUrl":"http://www.keithandthegirl.com/vip/download/shows/superhang/SUPERHANG-2013-08-22.mp3","Length":"3094","FileSize":"49548750","Public":"0","Timestamp":1377191391,"Guests":[]},{"ShowId":"2865","ShowNameId":"13","Number":"87","PostedDate":"8/19/2013 3:16:13 PM","Title":"\u0027Throom","PreviewUrl":"http://traffic.libsyn.com/hangoutwithme/MYQ-2013-08-19-S.mp3","FileUrl":"http://traffic.libsyn.com/hangoutwithme/MYQ-2013-08-19.mp3","Length":"2858","FileSize":"45877051","Public":"1","Timestamp":1376939773,"Guests":[]},{"ShowId":"2857","ShowNameId":"13","Number":"86","PostedDate":"8/15/2013 3:02:08 PM","Title":"Bacon Gore","PreviewUrl":"http://traffic.libsyn.com/hangoutwithme/MYQ-2013-08-15-S.mp3","FileUrl":"http://traffic.libsyn.com/hangoutwithme/MYQ-2013-08-15.mp3","Length":"2777","FileSize":"44572288","Public":"1","Timestamp":1376593328,"Guests":[]},{"ShowId":"2852","ShowNameId":"13","Number":"85","PostedDate":"8/12/2013 12:17:39 PM","Title":"Therapists Anonymous","PreviewUrl":"http://traffic.libsyn.com/hangoutwithme/MYQ-2013-08-12-S.mp3","FileUrl":"http://traffic.libsyn.com/hangoutwithme/MYQ-2013-08-12.mp3","Length":"2795","FileSize":"44869605","Public":"1","Timestamp":1376324259,"Guests":[]},{"ShowId":"2878","ShowNameId":"13","Number":"84","PostedDate":"8/26/2013 3:33:39 PM","Title":"Clunkmedian","PreviewUrl":"http://traffic.libsyn.com/hangoutwithme/MYQ-2013-08-26-S.mp3","FileUrl":"http://traffic.libsyn.com/hangoutwithme/MYQ-2013-08-26.mp3","Length":"2856","FileSize":"45835768","Public":"1","Timestamp":1377545619,"Guests":[]},{"ShowId":"2839","ShowNameId":"13","Number":"83","PostedDate":"8/5/2013 10:39:15 AM","Title":"2 Goonies 2 Furious","PreviewUrl":"http://traffic.libsyn.com/hangoutwithme/MYQ-2013-08-05-S.mp3","FileUrl":"http://traffic.libsyn.com/hangoutwithme/MYQ-2013-08-05.mp3","Length":"2818","FileSize":"45229849","Public":"1","Timestamp":1375713555,"Guests":[]},{"ShowId":"2833","ShowNameId":"13","Number":"82","PostedDate":"8/1/2013 12:47:50 PM","Title":"Pregnant Nun","PreviewUrl":"http://traffic.libsyn.com/hangoutwithme/MYQ-2013-08-01-S.mp3","FileUrl":"http://traffic.libsyn.com/hangoutwithme/MYQ-2013-08-01.mp3","Length":"2838","FileSize":"45559696","Public":"1","Timestamp":1375375670,"Guests":[]},{"ShowId":"2826","ShowNameId":"13","Number":"81","PostedDate":"7/29/2013 3:29:25 PM","Title":"Show Bizrael","PreviewUrl":"http://traffic.libsyn.com/hangoutwithme/MYQ-2013-07-29-S.mp3","FileUrl":"http://traffic.libsyn.com/hangoutwithme/MYQ-2013-07-29.mp3","Length":"2859","FileSize":"45892520","Public":"1","Timestamp":1375126165,"Guests":[]},{"ShowId":"2816","ShowNameId":"15","Number":"80","PostedDate":"7/25/2013 12:00:00 PM","Title":"Superhero Bidet","VideoFileUrl":"https://www.keithandthegirl.com/vip/download/shows/superhang/video/80/SUPERHANG-2013-07-25.m3u8","VideoThumbnailUrl":"https://www.keithandthegirl.com/vip/download/shows/superhang/video/80/SUPERHANG-2013-07-25-video.jpg","PreviewUrl":"http://www.youtube.com/watch?v=ljBp9mk3gQ0","FileUrl":"http://www.keithandthegirl.com/vip/download/shows/superhang/SUPERHANG-2013-07-25.mp3","Length":"4075","FileSize":"65208383","Public":"0","Timestamp":1374768000,"Guests":[]},{"ShowId":"2808","ShowNameId":"13","Number":"79","PostedDate":"7/22/2013 6:29:36 PM","Title":"Melting Down","PreviewUrl":"http://traffic.libsyn.com/hangoutwithme/MYQ-2013-07-22-S.mp3","FileUrl":"http://traffic.libsyn.com/hangoutwithme/MYQ-2013-07-22.mp3","Length":"2870","FileSize":"45975673","Public":"1","Timestamp":1374532176,"Guests":[]},{"ShowId":"2803","ShowNameId":"13","Number":"78","PostedDate":"7/18/2013 8:17:29 AM","Title":"Nobody Wins","PreviewUrl":"http://traffic.libsyn.com/hangoutwithme/MYQ-2013-07-17-S.mp3","FileUrl":"http://traffic.libsyn.com/hangoutwithme/MYQ-2013-07-17.mp3","Length":"2966","FileSize":"47506049","Public":"1","Timestamp":1374149849,"Guests":[{"Data":"378","ShowGuestId":"378","RealName":"Damien Lemon","Description":"Comedian best known for appearing in MTV\u0027s Guy Code and in the film The Amazing Spider-Man.","PictureFilename":"Damien-Lemon.jpg","Url1":"https://twitter.com/dlemoncomedy","Url2":"http://damienlemon.com/","PictureUrl":"http://static-3.keithandthegirl.net/guests/pics/processed/Damien-Lemon-150x150.jpg","PictureUrlLarge":"http://static-3.keithandthegirl.net/guests/pics/processed/Damien-Lemon-600x600.jpg"},{"Data":"245","ShowGuestId":"245","RealName":"Jay Nog","Description":"Comedian and co-creator of the web series Heromakers with Dan Hirshon.","PictureFilename":"JayNog.jpg","Url1":"https://twitter.com/JayNog","Url2":"","PictureUrl":"http://static-1.keithandthegirl.net/guests/pics/processed/JayNog-150x150.jpg","PictureUrlLarge":"http://static-1.keithandthegirl.net/guests/pics/processed/JayNog-600x600.jpg"}]},{"ShowId":"2796","ShowNameId":"13","Number":"77","PostedDate":"7/15/2013 3:54:05 PM","Title":"Don\u0027t Talk To Police","PreviewUrl":"http://traffic.libsyn.com/hangoutwithme/MYQ-2013-07-15-S.mp3","FileUrl":"http://traffic.libsyn.com/hangoutwithme/MYQ-2013-07-15.mp3","Length":"2555","FileSize":"41021970","Public":"1","Timestamp":1373918045,"Guests":[{"Data":"128","ShowGuestId":"128","RealName":"Jermaine Fowler","Description":"Comedian and actor known for his roles on MTV\u0027s Guy Code and Orange Is the New Black.","PictureFilename":"Jermaine-Fowler.jpg","Url1":"http://www.facebook.com/jermaine.fowler","Url2":"http://www.rooftopcomedy.com/comics/JermaineFowler1","PictureUrl":"http://static-3.keithandthegirl.net/guests/pics/processed/Jermaine-Fowler-150x150.jpg","PictureUrlLarge":"http://static-3.keithandthegirl.net/guests/pics/processed/Jermaine-Fowler-600x600.jpg"},{"Data":"125","ShowGuestId":"125","RealName":"Jessica Delfino","Description":"Comedian and musician known for her appearances on Good Morning America and her albums Dirty Folk Rock and I Wanna Be Famous.","PictureFilename":"Jessica-Delfino.jpg","Url1":"http://www.facebook.com/jessdelfino","Url2":"http://jessydelfino.blogspot.com","PictureUrl":"http://static-3.keithandthegirl.net/guests/pics/processed/Jessica-Delfino-150x150.jpg","PictureUrlLarge":"http://static-3.keithandthegirl.net/guests/pics/processed/Jessica-Delfino-600x600.jpg"}]},{"ShowId":"2791","ShowNameId":"15","Number":"76","PostedDate":"7/11/2013 12:00:00 PM","Title":"Line, Sync, and Hooker","VideoFileUrl":"https://www.keithandthegirl.com/vip/download/shows/superhang/video/76/SUPERHANG-2013-07-11.m3u8","VideoThumbnailUrl":"https://www.keithandthegirl.com/vip/download/shows/superhang/video/76/SUPERHANG-2013-07-11-video.jpg","PreviewUrl":"http://www.youtube.com/watch?v=btfAQuBnQmI","FileUrl":"http://www.keithandthegirl.com/vip/download/shows/superhang/SUPERHANG-2013-07-11.mp3","Length":"3711","FileSize":"59401307","Public":"0","Timestamp":1373558400,"Guests":[{"Data":"376","ShowGuestId":"376","RealName":"Chemda","Description":"Singer, comic and host of the Keith and The Girl podcast.","PictureFilename":"chemda.jpg","Url1":"http://keithandthegirl.com","Url2":"http://chemda.com","PictureUrl":"http://static-3.keithandthegirl.net/guests/pics/processed/chemda-150x150.jpg","PictureUrlLarge":"http://static-3.keithandthegirl.net/guests/pics/processed/chemda-600x600.jpg"},{"Data":"106","ShowGuestId":"106","RealName":"Lauren Hennessy","Description":"Icelandic Academy Award nominated actor, host of the podcast Bottoms Up with Hennessy, and Chemda\u0027s fiancé.","PictureFilename":"Lauren-Hennessy.jpg","Url1":"http://laurenhennessy.com","Url2":"http://www.facebook.com/lauren.hennessy","PictureUrl":"http://static-1.keithandthegirl.net/guests/pics/processed/Lauren-Hennessy-150x150.jpg","PictureUrlLarge":"http://static-1.keithandthegirl.net/guests/pics/processed/Lauren-Hennessy-600x600.jpg"},{"Data":"157","ShowGuestId":"157","RealName":"Mark Normand","Description":"Comedian known for his appearances on Last Comic Standing and Conan, and for hosting the podcast Tuesdays with Stories.","PictureFilename":"Mark-Normand.jpg","Url1":"http://www.facebook.com/#!/profile.php?id=577356034\u0026ref=ts","Url2":"http://marknormandcomedy.com","PictureUrl":"http://static-2.keithandthegirl.net/guests/pics/processed/Mark-Normand-150x150.jpg","PictureUrlLarge":"http://static-2.keithandthegirl.net/guests/pics/processed/Mark-Normand-600x600.jpg"}]},{"ShowId":"2785","ShowNameId":"13","Number":"75","PostedDate":"7/8/2013 11:51:40 AM","Title":"Brofessional Handball","PreviewUrl":"http://traffic.libsyn.com/hangoutwithme/MYQ-2013-07-08-S.mp3","FileUrl":"http://traffic.libsyn.com/hangoutwithme/MYQ-2013-07-08.mp3","Length":"2871","FileSize":"45983660","Public":"1","Timestamp":1373298700,"Guests":[{"Data":"373","ShowGuestId":"373","RealName":"Christian Polanco","Description":"Comedian and host of the Offstage podcast.","PictureFilename":"Christian-Polanco.jpg","Url1":"","Url2":"http://www.christianpolanco.com/","PictureUrl":"http://static-4.keithandthegirl.net/guests/pics/processed/Christian-Polanco-150x150.jpg","PictureUrlLarge":"http://static-4.keithandthegirl.net/guests/pics/processed/Christian-Polanco-600x600.jpg"},{"Data":"374","ShowGuestId":"374","RealName":"Sara Faith Alterman","Description":"Author of My 15 Minutes and Tears of a Class Clown.","PictureFilename":"Sara-Faith-Alterman.jpg","Url1":"","Url2":"http://sarafaithalterman.com/","PictureUrl":"http://static-3.keithandthegirl.net/guests/pics/processed/Sara-Faith-Alterman-150x150.jpg","PictureUrlLarge":"http://static-3.keithandthegirl.net/guests/pics/processed/Sara-Faith-Alterman-600x600.jpg"}]},{"ShowId":"2782","ShowNameId":"13","Number":"74","PostedDate":"7/4/2013 12:39:03 PM","Title":"Gays Upon My Works","PreviewUrl":"http://traffic.libsyn.com/hangoutwithme/MYQ-2013-07-04-S.mp3","FileUrl":"http://traffic.libsyn.com/hangoutwithme/MYQ-2013-07-04.mp3","Length":"2986","FileSize":"47924100","Public":"1","Timestamp":1372955943,"Guests":[{"Data":"111","ShowGuestId":"111","RealName":"Ben Lerman","Description":"Comedian and musician known for his EPs Size Matters and Ukelear Winter, and for hosting the podcast Serving Reelness.","PictureFilename":"Ben-Lerman.jpg","Url1":"http://www.facebook.com/thebenlerman","Url2":"http://www.benlerman.net","PictureUrl":"http://static-2.keithandthegirl.net/guests/pics/processed/Ben-Lerman-150x150.jpg","PictureUrlLarge":"http://static-2.keithandthegirl.net/guests/pics/processed/Ben-Lerman-600x600.jpg"},{"Data":"375","ShowGuestId":"375","RealName":"Michael Martin","Description":"Comedian and creator of the PIEFOLK website.","PictureFilename":"Michael-Martin.jpg","Url1":"","Url2":"http://piefolk.net/","PictureUrl":"http://static-4.keithandthegirl.net/guests/pics/processed/Michael-Martin-150x150.jpg","PictureUrlLarge":"http://static-4.keithandthegirl.net/guests/pics/processed/Michael-Martin-600x600.jpg"}]},{"ShowId":"2775","ShowNameId":"13","Number":"73","PostedDate":"7/1/2013 6:13:16 PM","Title":"Common Sense","PreviewUrl":"http://traffic.libsyn.com/hangoutwithme/MYQ-2013-07-01-S.mp3","FileUrl":"http://traffic.libsyn.com/hangoutwithme/MYQ-2013-07-01.mp3","Length":"2894","FileSize":"46354758","Public":"1","Timestamp":1372716796,"Guests":[{"Data":"215","ShowGuestId":"215","RealName":"Adam Spiegelman","Description":"Comedy booker and host of the podcast Proudly Resents.","PictureFilename":"Adam-Spiegelman.jpg","Url1":"","Url2":"http://www.facebook.com/reachadam","PictureUrl":"http://static-4.keithandthegirl.net/guests/pics/processed/Adam-Spiegelman-150x150.jpg","PictureUrlLarge":"http://static-4.keithandthegirl.net/guests/pics/processed/Adam-Spiegelman-600x600.jpg"},{"Data":"8","ShowGuestId":"8","RealName":"Liam McEneaney","Description":"Stand-up comedian and producer of Tell Your Friends: The Concert Film.","PictureFilename":"Liam-McEneaney.jpg","Url1":"http://www.facebook.com/#!/RadioLiam","Url2":"http://www.kidliam.blogspot.com","PictureUrl":"http://static-4.keithandthegirl.net/guests/pics/processed/Liam-McEneaney-150x150.jpg","PictureUrlLarge":"http://static-4.keithandthegirl.net/guests/pics/processed/Liam-McEneaney-600x600.jpg"}]},{"ShowId":"2769","ShowNameId":"15","Number":"72","PostedDate":"6/27/2013 12:49:02 PM","Title":"Angry Words","VideoFileUrl":"https://www.keithandthegirl.com/vip/download/shows/superhang/video/72/SUPERHANG-2013-06-27.m3u8","VideoThumbnailUrl":"https://www.keithandthegirl.com/vip/download/shows/superhang/video/72/SUPERHANG-2013-06-27-video.jpg","PreviewUrl":"http://www.youtube.com/watch?v=tLNtLOHtKX8","FileUrl":"http://www.keithandthegirl.com/vip/download/shows/superhang/SUPERHANG-2013-06-27.mp3","Length":"3572","FileSize":"57089969","Public":"0","Timestamp":1372351742,"Guests":[{"Data":"183","ShowGuestId":"183","RealName":"Jared Logan","Description":"Comedian known for his appearances on Comedy Central Presents and Best Week Ever.","PictureFilename":"Jared-Logan.jpg","Url1":"","Url2":"http://www.jaredlogan.com","PictureUrl":"http://static-4.keithandthegirl.net/guests/pics/processed/Jared-Logan-150x150.jpg","PictureUrlLarge":"http://static-4.keithandthegirl.net/guests/pics/processed/Jared-Logan-600x600.jpg"},{"Data":"239","ShowGuestId":"239","RealName":"Josh Gondelman","Description":"Comedian and writer best known for producing Last Week Tonight with John Oliver and co-creating the Modern Seinfeld Twitter account.","PictureFilename":"Josh-Gondelman.jpg","Url1":"http://www.joshgondelman.com/","Url2":"","PictureUrl":"http://static-3.keithandthegirl.net/guests/pics/processed/Josh-Gondelman-150x150.jpg","PictureUrlLarge":"http://static-3.keithandthegirl.net/guests/pics/processed/Josh-Gondelman-600x600.jpg"},{"Data":"315","ShowGuestId":"315","RealName":"Nat Towsen","Description":"Comedian and writer best known for his contributions to Vice and College Humor.","PictureFilename":"Nat-Towsen.png","Url1":"","Url2":"http://twitter.com/NatTowsen","PictureUrl":"http://static-4.keithandthegirl.net/guests/pics/processed/Nat-Towsen-150x150.png","PictureUrlLarge":"http://static-4.keithandthegirl.net/guests/pics/processed/Nat-Towsen-600x600.png"}]},{"ShowId":"2766","ShowNameId":"13","Number":"71","PostedDate":"6/24/2013 12:19:49 PM","Title":"Let\u0027s Start Again","PreviewUrl":"http://traffic.libsyn.com/hangoutwithme/MYQ-2013-06-24-S.mp3","FileUrl":"http://traffic.libsyn.com/hangoutwithme/MYQ-2013-06-24.mp3","Length":"2884","FileSize":"46195043","Public":"1","Timestamp":1372090789,"Guests":[{"Data":"366","ShowGuestId":"366","RealName":"Dan Pasternack","Description":"VP of Development Production for IFC, former first white Harlem Globetrotter wannabe.","PictureFilename":"Dan-Pasternack.jpg","Url1":"","Url2":"https://twitter.com/DanPasternack","PictureUrl":"http://static-2.keithandthegirl.net/guests/pics/processed/Dan-Pasternack-150x150.jpg","PictureUrlLarge":"http://static-2.keithandthegirl.net/guests/pics/processed/Dan-Pasternack-600x600.jpg"},{"Data":"367","ShowGuestId":"367","RealName":"Jim Tews","Description":"Comedian and former member of the United States Coast Guard, best known for his appearance on Louie and the web series The Undone Sweaters.","PictureFilename":"Jim-Tews.jpg","Url1":"","Url2":"https://twitter.com/jimtews","PictureUrl":"http://static-4.keithandthegirl.net/guests/pics/processed/Jim-Tews-150x150.jpg","PictureUrlLarge":"http://static-4.keithandthegirl.net/guests/pics/processed/Jim-Tews-600x600.jpg"}]},{"ShowId":"2765","ShowNameId":"13","Number":"70","PostedDate":"6/20/2013 11:20:13 AM","Title":"Math Amphetamines","PreviewUrl":"http://traffic.libsyn.com/hangoutwithme/MYQ-2013-06-20-S.mp3","FileUrl":"http://traffic.libsyn.com/hangoutwithme/MYQ-2013-06-20.mp3","Length":"2706","FileSize":"43349408","Public":"1","Timestamp":1371741613,"Guests":[{"Data":"370","ShowGuestId":"370","RealName":"Justy Dodge","Description":"Comedian and winner of Time Out New York\u0027s Joke of the Week competition.","PictureFilename":"Justy-Dodge.jpg","Url1":"","Url2":"https://twitter.com/justydodge","PictureUrl":"http://static-2.keithandthegirl.net/guests/pics/processed/Justy-Dodge-150x150.jpg","PictureUrlLarge":"http://static-2.keithandthegirl.net/guests/pics/processed/Justy-Dodge-600x600.jpg"},{"Data":"369","ShowGuestId":"369","RealName":"Mike Cannon","Description":"Comedian and writer best known for his contributions to MTV\u0027s Guy Code and Failosophy.","PictureFilename":"Mike-Cannon.jpg","Url1":"https://twitter.com/IamMikeCannon","Url2":"http://www.mikecannoncomedy.com/","PictureUrl":"http://static-2.keithandthegirl.net/guests/pics/processed/Mike-Cannon-150x150.jpg","PictureUrlLarge":"http://static-2.keithandthegirl.net/guests/pics/processed/Mike-Cannon-600x600.jpg"}]},{"ShowId":"2763","ShowNameId":"13","Number":"69","PostedDate":"6/17/2013 4:46:05 PM","Title":"Aries\u0027 Peers","PreviewUrl":"http://traffic.libsyn.com/hangoutwithme/MYQ-2013-06-17-S.mp3","FileUrl":"http://traffic.libsyn.com/hangoutwithme/MYQ-2013-06-17.mp3","Length":"2802","FileSize":"44881706","Public":"1","Timestamp":1371501965,"Guests":[{"Data":"365","ShowGuestId":"365","RealName":"Ben Kronberg","Description":"Comedian known for his appearance on NBC\u0027s Last Comic Standing and for his Comedy Central Presents special.","PictureFilename":"BenKronberg.jpg","Url1":"https://twitter.com/benkronberg","Url2":"http://benkronberg.com/","PictureUrl":"http://static-1.keithandthegirl.net/guests/pics/processed/BenKronberg-150x150.jpg","PictureUrlLarge":"http://static-1.keithandthegirl.net/guests/pics/processed/BenKronberg-600x600.jpg"},{"Data":"184","ShowGuestId":"184","RealName":"Sean Donnelly","Description":"Comedian known for his appearances on Late Show with David Letterman and Adam Devine\u0027s House Party on Comedy Central.","PictureFilename":"Sean-Donnelly.jpg","Url1":"http://www.facebook.com/seanycomedy","Url2":"http://seandonnellycomedy.com","PictureUrl":"http://static-4.keithandthegirl.net/guests/pics/processed/Sean-Donnelly-150x150.jpg","PictureUrlLarge":"http://static-4.keithandthegirl.net/guests/pics/processed/Sean-Donnelly-600x600.jpg"}]},{"ShowId":"2754","ShowNameId":"15","Number":"68","PostedDate":"6/13/2013","Title":"Superman loves Aquaman","VideoFileUrl":"https://www.keithandthegirl.com/vip/download/shows/superhang/video/68/SUPERHANG-2013-06-13.m3u8","VideoThumbnailUrl":"https://www.keithandthegirl.com/vip/download/shows/superhang/video/68/SUPERHANG-2013-06-13-video.jpg","PreviewUrl":"https://www.youtube.com/watch?v=pYeIk0IQIBI","FileUrl":"http://www.keithandthegirl.com/vip/download/shows/superhang/SUPERHANG-2013-06-13.mp3","Length":"3403","FileSize":"54451856","Public":"0","Timestamp":1371096000,"Guests":[{"Data":"251","ShowGuestId":"251","RealName":"Joe List","Description":"Comedian known for his appearances on Late Show with David Letterman and for hosting the Tuesdays with Stories podcast.","PictureFilename":"Joe-List.jpg","Url1":"http://comedianjoelist.com/","Url2":"","PictureUrl":"http://static-1.keithandthegirl.net/guests/pics/processed/Joe-List-150x150.jpg","PictureUrlLarge":"http://static-1.keithandthegirl.net/guests/pics/processed/Joe-List-600x600.jpg"},{"Data":"107","ShowGuestId":"107","RealName":"Micah Sherman","Description":"Comedian known for his documentary Like Me.","PictureFilename":"Micah-Sherman.jpg","Url1":"http://facebook.com/professionaldork","Url2":"http://www.micahsherman.com","PictureUrl":"http://static-2.keithandthegirl.net/guests/pics/processed/Micah-Sherman-150x150.jpg","PictureUrlLarge":"http://static-2.keithandthegirl.net/guests/pics/processed/Micah-Sherman-600x600.jpg"},{"Data":"310","ShowGuestId":"310","RealName":"Nick Vatterott","Description":"Comedian who has appeare