[{"ShowId":"3892","ShowNameId":"9","Number":"132","PostedDate":"7/16/2015 12:00:00 PM","Title":"Captain Barnes Would Like To See You","VideoFileUrl":"https://www.keithandthegirl.com/vip/download/shows/danny/video/132/TTSWD-2015-07-16.m3u8","VideoThumbnailUrl":"https://www.keithandthegirl.com/vip/download/shows/danny/video/132/TTSWD-2015-07-16-video.jpg","PreviewUrl":"https://www.youtube.com/watch?v=EnFLkn5yP-c","FileUrl":"http://www.keithandthegirl.com/vip/download/shows/danny/TTSWD-2015-07-16.mp3","Type":"0","Public":"0","Timestamp":1437062400,"Guests":[]},{"ShowId":"3872","ShowNameId":"9","Number":"131","PostedDate":"7/2/2015 12:00:00 PM","Title":"Another Awkward Fight Show","VideoFileUrl":"https://www.keithandthegirl.com/vip/download/shows/danny/video/131/TTSWD-2015-07-07.m3u8","VideoThumbnailUrl":"https://www.keithandthegirl.com/vip/download/shows/danny/video/131/TTSWD-2015-07-07-video.jpg","PreviewUrl":"https://www.youtube.com/watch?v=MBO1SsO6wTQ","FileUrl":"http://www.keithandthegirl.com/vip/download/shows/danny/TTSWD-2015-07-07.mp3","Type":"0","Public":"0","Timestamp":1435852800,"Guests":[]},{"ShowId":"3863","ShowNameId":"9","Number":"130","PostedDate":"6/25/2015 12:00:00 PM","Title":"The Banana Chronicles","VideoFileUrl":"https://www.keithandthegirl.com/vip/download/shows/danny/video/130/TTSWD-2015-06-25.m3u8","VideoThumbnailUrl":"https://www.keithandthegirl.com/vip/download/shows/danny/video/130/TTSWD-2015-06-25-video.jpg","PreviewUrl":"https://www.youtube.com/watch?v=2OerhzO5Sa0","FileUrl":"http://www.keithandthegirl.com/vip/download/shows/danny/TTSWD-2015-06-25.mp3","Type":"0","Public":"0","Timestamp":1435248000,"Guests":[]},{"ShowId":"3851","ShowNameId":"9","Number":"129","PostedDate":"6/18/2015 12:00:00 PM","Title":"Flying Solo","VideoFileUrl":"https://www.keithandthegirl.com/vip/download/shows/danny/video/129/TTSWD-2015-06-18.m3u8","VideoThumbnailUrl":"https://www.keithandthegirl.com/vip/download/shows/danny/video/129/TTSWD-2015-06-18-video.jpg","PreviewUrl":"https://www.youtube.com/watch?v=zjLuSwnRtA4","FileUrl":"http://www.keithandthegirl.com/vip/download/shows/danny/TTSWD-2015-06-18.mp3","Type":"0","Public":"0","Timestamp":1434643200,"Guests":[]},{"ShowId":"3841","ShowNameId":"9","Number":"128","PostedDate":"6/11/2015 12:00:00 PM","Title":"Dimed Out","VideoFileUrl":"https://www.keithandthegirl.com/vip/download/shows/danny/video/128/TTSWD-2015-06-11.m3u8","VideoThumbnailUrl":"https://www.keithandthegirl.com/vip/download/shows/danny/video/128/TTSWD-2015-06-11-video.jpg","PreviewUrl":"https://www.youtube.com/watch?v=7WA_LUuTio0","FileUrl":"http://www.keithandthegirl.com/vip/download/shows/danny/TTSWD-2015-06-11.mp3","Type":"0","Public":"0","Timestamp":1434038400,"Guests":[]},{"ShowId":"3834","ShowNameId":"9","Number":"127","PostedDate":"6/4/2015 12:00:00 PM","Title":"The Stand Outs","VideoFileUrl":"https://www.keithandthegirl.com/vip/download/shows/danny/video/127/TTSWD-2015-06-04.m3u8","VideoThumbnailUrl":"https://www.keithandthegirl.com/vip/download/shows/danny/video/127/TTSWD-2015-06-04-video.jpg","PreviewUrl":"https://www.youtube.com/watch?v=zcHhFPslEZ8","FileUrl":"http://www.keithandthegirl.com/vip/download/shows/danny/TTSWD-2015-06-04.mp3","Type":"0","Public":"0","Timestamp":1433433600,"Guests":[]},{"ShowId":"3821","ShowNameId":"9","Number":"126","PostedDate":"5/28/2015 12:00:00 PM","Title":"The Battle of Spunk Her Hill","VideoFileUrl":"https://www.keithandthegirl.com/vip/download/shows/danny/video/126/TTSWD-2015-05-28.m3u8","VideoThumbnailUrl":"https://www.keithandthegirl.com/vip/download/shows/danny/video/126/TTSWD-2015-05-28-video.jpg","PreviewUrl":"https://www.youtube.com/watch?v=Br57KF3n4GI","FileUrl":"http://www.keithandthegirl.com/vip/download/shows/danny/TTSWD-2015-05-28.mp3","Type":"0","Public":"0","Timestamp":1432828800,"Guests":[]},{"ShowId":"3812","ShowNameId":"9","Number":"125","PostedDate":"5/21/2015 12:00:00 PM","Title":"Danny\u0027s Off His Pills During This Episode","VideoFileUrl":"https://www.keithandthegirl.com/vip/download/shows/danny/video/125/TTSWD-2015-05-21.m3u8","VideoThumbnailUrl":"https://www.keithandthegirl.com/vip/download/shows/danny/video/125/TTSWD-2015-05-21-video.jpg","PreviewUrl":"https://www.youtube.com/watch?v=z6grVFGZAIA","FileUrl":"http://www.keithandthegirl.com/vip/download/shows/danny/TTSWD-2015-05-21.mp3","Type":"0","Public":"0","Timestamp":1432224000,"Guests":[]},{"ShowId":"3805","ShowNameId":"9","Number":"124","PostedDate":"5/14/2015 12:00:00 PM","Title":"The Perfect Show","VideoFileUrl":"https://www.keithandthegirl.com/vip/download/shows/danny/video/124/TTSWD-2015-05-14.m3u8","VideoThumbnailUrl":"https://www.keithandthegirl.com/vip/download/shows/danny/video/124/TTSWD-2015-05-14-video.jpg","PreviewUrl":"https://www.youtube.com/watch?v=CjoFG0kU0Ys","FileUrl":"http://www.keithandthegirl.com/vip/download/shows/danny/TTSWD-2015-05-14.mp3","Type":"0","Public":"0","Timestamp":1431619200,"Guests":[]},{"ShowId":"3796","ShowNameId":"9","Number":"123","PostedDate":"5/7/2015 3:00:00 PM","Title":"The Even More Awkward Live Show","VideoFileUrl":"https://www.keithandthegirl.com/vip/download/shows/danny/video/123/TTSWD-2015-05-07.m3u8","VideoThumbnailUrl":"https://www.keithandthegirl.com/vip/download/shows/danny/video/123/TTSWD-2015-05-07-video.jpg","PreviewUrl":"https://www.youtube.com/watch?v=RBXv_PEJMHo","FileUrl":"http://www.keithandthegirl.com/vip/download/shows/danny/TTSWD-2015-05-07.mp3","Type":"0","Public":"0","Timestamp":1431025200,"Guests":[]},{"ShowId":"3784","ShowNameId":"9","Number":"122","PostedDate":"4/30/2015 12:00:00 PM","Title":"The Awkward Live Show","VideoFileUrl":"https://www.keithandthegirl.com/vip/download/shows/danny/video/122/TTSWD-2015-04-30.m3u8","VideoThumbnailUrl":"https://www.keithandthegirl.com/vip/download/shows/danny/video/122/TTSWD-2015-04-30-video.jpg","PreviewUrl":"https://www.youtube.com/watch?v=Ef47VkSPp5s","FileUrl":"http://www.keithandthegirl.com/vip/download/shows/danny/TTSWD-2015-04-30.mp3","Type":"0","Public":"0","Timestamp":1430409600,"Guests":[]},{"ShowId":"3773","ShowNameId":"9","Number":"121","PostedDate":"4/23/2015 12:00:00 PM","Title":"The 4/20 Show","VideoFileUrl":"https://www.keithandthegirl.com/vip/download/shows/danny/video/121/TTSWD-2015-04-23.m3u8","VideoThumbnailUrl":"https://www.keithandthegirl.com/vip/download/shows/danny/video/121/TTSWD-2015-04-23-video.jpg","PreviewUrl":"https://www.youtube.com/watch?v=3vwTx7-l_l8","FileUrl":"http://www.keithandthegirl.com/vip/download/shows/danny/TTSWD-2015-04-23.mp3","Type":"0","Public":"0","Timestamp":1429804800,"Guests":[]},{"ShowId":"3757","ShowNameId":"9","Number":"120","PostedDate":"4/9/2015 12:00:00 PM","Title":"#partygoblin","VideoFileUrl":"https://www.keithandthegirl.com/vip/download/shows/danny/video/120/TTSWD-2015-04-09.m3u8","VideoThumbnailUrl":"https://www.keithandthegirl.com/vip/download/shows/danny/video/120/TTSWD-2015-04-09-video.jpg","PreviewUrl":"https://www.youtube.com/watch?v=wRO1-S-Phrg","FileUrl":"http://www.keithandthegirl.com/vip/download/shows/danny/TTSWD-2015-04-09.mp3","Type":"0","Public":"0","Timestamp":1428595200,"Guests":[]},{"ShowId":"3745","ShowNameId":"9","Number":"119","PostedDate":"4/2/2015 12:00:00 PM","Title":"Sick Bro","VideoFileUrl":"https://www.keithandthegirl.com/vip/download/shows/danny/video/119/TTSWD-2015-04-02.m3u8","VideoThumbnailUrl":"https://www.keithandthegirl.com/vip/download/shows/danny/video/119/TTSWD-2015-04-02-video.jpg","PreviewUrl":"https://www.youtube.com/watch?v=yeEsb6KinF0","FileUrl":"http://www.keithandthegirl.com/vip/download/shows/danny/TTSWD-2015-04-02.mp3","Type":"0","Public":"0","Timestamp":1427990400,"Guests":[]},{"ShowId":"3735","ShowNameId":"9","Number":"118","PostedDate":"3/26/2015 12:00:00 PM","Title":"Headband Geeks","VideoFileUrl":"https://www.keithandthegirl.com/vip/download/shows/danny/video/118/TTSWD-2015-03-26.m3u8","VideoThumbnailUrl":"https://www.keithandthegirl.com/vip/download/shows/danny/video/118/TTSWD-2015-03-26-video.jpg","PreviewUrl":"https://www.youtube.com/watch?v=cgNxTY7a0Zo","FileUrl":"http://www.keithandthegirl.com/vip/download/shows/danny/TTSWD-2015-03-26.mp3","Type":"0","Public":"0","Timestamp":1427385600,"Guests":[]},{"ShowId":"3727","ShowNameId":"9","Number":"117","PostedDate":"3/19/2015 12:00:00 PM","Title":"The One with Mara Wilson","VideoFileUrl":"https://www.keithandthegirl.com/vip/download/shows/danny/video/117/TTSWD-2015-03-19.m3u8","VideoThumbnailUrl":"https://www.keithandthegirl.com/vip/download/shows/danny/video/117/TTSWD-2015-03-19-video.jpg","PreviewUrl":"https://www.youtube.com/watch?v=6S9OP8zWMx0","FileUrl":"http://www.keithandthegirl.com/vip/download/shows/danny/TTSWD-2015-03-19.mp3","Type":"0","Public":"0","Timestamp":1426780800,"Guests":[]},{"ShowId":"3718","ShowNameId":"9","Number":"116","PostedDate":"3/12/2015 12:00:00 PM","Title":"Jerlyn and Out","VideoFileUrl":"https://www.keithandthegirl.com/vip/download/shows/danny/video/116/TTSWD-2015-03-12.m3u8","VideoThumbnailUrl":"https://www.keithandthegirl.com/vip/download/shows/danny/video/116/TTSWD-2015-03-12-video.jpg","PreviewUrl":"https://www.youtube.com/watch?v=p9X31RMYccM","FileUrl":"http://www.keithandthegirl.com/vip/download/shows/danny/TTSWD-2015-03-12.mp3","Type":"0","Public":"0","Timestamp":1426176000,"Guests":[]},{"ShowId":"3703","ShowNameId":"9","Number":"115","PostedDate":"3/5/2015 12:00:00 PM","Title":"Save the Whales","VideoFileUrl":"https://www.keithandthegirl.com/vip/download/shows/danny/video/115/TTSWD-2015-03-05.m3u8","VideoThumbnailUrl":"https://www.keithandthegirl.com/vip/download/shows/danny/video/115/TTSWD-2015-03-05-video.jpg","PreviewUrl":"https://www.youtube.com/watch?v=4mG4BpECRuo","FileUrl":"http://www.keithandthegirl.com/vip/download/shows/danny/TTSWD-2015-03-05.mp3","Type":"0","Public":"0","Timestamp":1425574800,"Guests":[]},{"ShowId":"3688","ShowNameId":"9","Number":"114","PostedDate":"2/19/2015 12:00:00 PM","Title":"Alive II","VideoFileUrl":"https://www.keithandthegirl.com/vip/download/shows/danny/video/114/TTSWD-2015-02-19.m3u8","VideoThumbnailUrl":"https://www.keithandthegirl.com/vip/download/shows/danny/video/114/TTSWD-2015-02-19-video.jpg","PreviewUrl":"https://www.youtube.com/watch?v=we1M2YZEofw","FileUrl":"http://www.keithandthegirl.com/vip/download/shows/danny/TTSWD-2015-02-19.mp3","Type":"0","Public":"0","Timestamp":1424365200,"Guests":[]},{"ShowId":"3682","ShowNameId":"9","Number":"113","PostedDate":"2/12/2015 12:00:00 PM","Title":"Live and Well","VideoFileUrl":"https://www.keithandthegirl.com/vip/download/shows/danny/video/113/TTSWD-2015-02-12.m3u8","VideoThumbnailUrl":"https://www.keithandthegirl.com/vip/download/shows/danny/video/113/TTSWD-2015-02-12-video.jpg","PreviewUrl":"https://www.youtube.com/watch?v=4kNw9QDFfzI","FileUrl":"http://www.keithandthegirl.com/vip/download/shows/danny/TTSWD-2015-02-12.mp3","Type":"0","Public":"0","Timestamp":1423760400,"Guests":[]},{"ShowId":"3670","ShowNameId":"9","Number":"112","PostedDate":"2/5/2015 12:00:00 PM","Title":"Psych!","VideoFileUrl":"https://www.keithandthegirl.com/vip/download/shows/danny/video/112/TTSWD-2015-02-05.m3u8","VideoThumbnailUrl":"https://www.keithandthegirl.com/vip/download/shows/danny/video/112/TTSWD-2015-02-05-video.jpg","PreviewUrl":"https://www.youtube.com/watch?v=jHIpMoVh0m0","FileUrl":"http://www.keithandthegirl.com/vip/download/shows/danny/TTSWD-2015-02-05.mp3","Type":"0","Public":"0","Timestamp":1423155600,"Guests":[]},{"ShowId":"3652","ShowNameId":"9","Number":"111","PostedDate":"1/22/2015 12:00:00 PM","Title":"Field of Dreams","VideoFileUrl":"https://www.keithandthegirl.com/vip/download/shows/danny/video/111/TTSWD-2015-01-22.m3u8","VideoThumbnailUrl":"https://www.keithandthegirl.com/vip/download/shows/danny/video/111/TTSWD-2015-01-22-video.jpg","PreviewUrl":"https://www.youtube.com/watch?v=mwOkKN9hl-Y","FileUrl":"http://www.keithandthegirl.com/vip/download/shows/danny/TTSWD-2015-01-22.mp3","Type":"0","Public":"0","Timestamp":1421946000,"Guests":[]},{"ShowId":"3644","ShowNameId":"9","Number":"110","PostedDate":"1/15/2015 12:00:00 PM","Title":"We\u0027re All Friends Here","VideoFileUrl":"https://www.keithandthegirl.com/vip/download/shows/danny/video/110/TTSWD-2015-01-15.m3u8","VideoThumbnailUrl":"https://www.keithandthegirl.com/vip/download/shows/danny/video/110/TTSWD-2015-01-15-video.jpg","PreviewUrl":"https://www.youtube.com/watch?v=RYGSDPNjj5g","FileUrl":"http://www.keithandthegirl.com/vip/download/shows/danny/TTSWD-2015-01-15.mp3","Type":"0","Public":"0","Timestamp":1421341200,"Guests":[]},{"ShowId":"3626","ShowNameId":"9","Number":"109","PostedDate":"1/8/2015 12:00:00 PM","Title":"New Year, New Us","VideoFileUrl":"https://www.keithandthegirl.com/vip/download/shows/danny/video/109/TTSWD-2015-01-08.m3u8","VideoThumbnailUrl":"https://www.keithandthegirl.com/vip/download/shows/danny/video/109/TTSWD-2015-01-08-video.jpg","PreviewUrl":"https://www.youtube.com/watch?v=gPjy02D8i-Y","FileUrl":"http://www.keithandthegirl.com/vip/download/shows/danny/TTSWD-2015-01-08.mp3","Type":"0","Public":"0","Timestamp":1420736400,"Guests":[]},{"ShowId":"3599","ShowNameId":"9","Number":"108","PostedDate":"12/25/2014 12:00:00 PM","Title":"The 2014 Year in Review Spectacular","VideoFileUrl":"https://www.keithandthegirl.com/vip/download/shows/danny/video/108/TTSWD-2014-12-25.m3u8","VideoThumbnailUrl":"https://www.keithandthegirl.com/vip/download/shows/danny/video/108/TTSWD-2014-12-25-video.jpg","PreviewUrl":"https://www.youtube.com/watch?v=HvU9YcsTR64","FileUrl":"http://www.keithandthegirl.com/vip/download/shows/danny/TTSWD-2014-12-25.mp3","Type":"0","Public":"0","Timestamp":1419526800,"Guests":[]},{"ShowId":"3585","ShowNameId":"9","Number":"107","PostedDate":"12/18/2014 12:00:00 PM","Title":"Code Red (Just Kidding Chemda)","VideoFileUrl":"https://www.keithandthegirl.com/vip/download/shows/danny/video/107/TTSWD-2014-12-18.m3u8","VideoThumbnailUrl":"https://www.keithandthegirl.com/vip/download/shows/danny/video/107/TTSWD-2014-12-18-video.jpg","PreviewUrl":"https://www.youtube.com/watch?v=gU7nT_zAze8","FileUrl":"http://www.keithandthegirl.com/vip/download/shows/danny/TTSWD-2014-12-18.mp3","Type":"0","Public":"0","Timestamp":1418922000,"Guests":[]},{"ShowId":"3576","ShowNameId":"9","Number":"106","PostedDate":"12/11/2014 12:00:00 PM","Title":"The Pretentious Show","VideoFileUrl":"https://www.keithandthegirl.com/vip/download/shows/danny/video/106/TTSWD-2014-12-11.m3u8","VideoThumbnailUrl":"https://www.keithandthegirl.com/vip/download/shows/danny/video/106/TTSWD-2014-12-11-video.jpg","PreviewUrl":"https://www.youtube.com/watch?v=LVCzrE1pVWU","FileUrl":"http://www.keithandthegirl.com/vip/download/shows/danny/TTSWD-2014-12-11.mp3","Type":"0","Public":"0","Timestamp":1418317200,"Guests":[]},{"ShowId":"3566","ShowNameId":"9","Number":"105","PostedDate":"12/4/2014 12:00:00 PM","Title":"Get On My Show","VideoFileUrl":"https://www.keithandthegirl.com/vip/download/shows/danny/video/105/TTSWD-2014-12-04.m3u8","VideoThumbnailUrl":"https://www.keithandthegirl.com/vip/download/shows/danny/video/105/TTSWD-2014-12-04-video.jpg","PreviewUrl":"https://www.youtube.com/watch?v=zBgAiDVmV48","FileUrl":"http://www.keithandthegirl.com/vip/download/shows/danny/TTSWD-2014-12-04.mp3","Type":"0","Public":"0","Timestamp":1417712400,"Guests":[]},{"ShowId":"3559","ShowNameId":"9","Number":"104","PostedDate":"11/27/2014 12:00:00 PM","Title":"Welcome to the Show","VideoFileUrl":"https://www.keithandthegirl.com/vip/download/shows/danny/video/104/TTSWD-2014-11-27.m3u8","VideoThumbnailUrl":"https://www.keithandthegirl.com/vip/download/shows/danny/video/104/TTSWD-2014-11-27-video.jpg","PreviewUrl":"https://www.youtube.com/watch?v=n40nvwz38ls","FileUrl":"http://www.keithandthegirl.com/vip/download/shows/danny/TTSWD-2014-11-27.mp3","Type":"0","Public":"0","Timestamp":1417107600,"Guests":[]},{"ShowId":"3549","ShowNameId":"9","Number":"103","PostedDate":"11/20/2014 12:00:00 PM","Title":"Adios Amigo!","VideoFileUrl":"https://www.keithandthegirl.com/vip/download/shows/danny/video/103/TTSWD-2014-11-20.m3u8","VideoThumbnailUrl":"https://www.keithandthegirl.com/vip/download/shows/danny/video/103/TTSWD-2014-11-20-video.jpg","PreviewUrl":"https://www.youtube.com/watch?v=vovyOD8Hrrk","FileUrl":"http://www.keithandthegirl.com/vip/download/shows/danny/TTSWD-2014-11-20.mp3","Type":"0","Public":"0","Timestamp":1416502800,"Guests":[]},{"ShowId":"3534","ShowNameId":"9","Number":"102","PostedDate":"11/13/2014 12:00:00 PM","Title":"Return of the Queen","VideoFileUrl":"https://www.keithandthegirl.com/vip/download/shows/danny/video/102/TTSWD-2014-11-13.m3u8","VideoThumbnailUrl":"https://www.keithandthegirl.com/vip/download/shows/danny/video/102/TTSWD-2014-11-13-video.jpg","PreviewUrl":"https://www.youtube.com/watch?v=wO2joNc2Xp4","FileUrl":"http://www.keithandthegirl.com/vip/download/shows/danny/TTSWD-2014-11-13.mp3","Type":"0","Public":"0","Timestamp":1415898000,"Guests":[]},{"ShowId":"3525","ShowNameId":"9","Number":"101","PostedDate":"11/6/2014 12:00:00 PM","Title":"The One After Episode 100","VideoFileUrl":"https://www.keithandthegirl.com/vip/download/shows/danny/video/101/TTSWD-2014-11-06.m3u8","VideoThumbnailUrl":"https://www.keithandthegirl.com/vip/download/shows/danny/video/101/TTSWD-2014-11-06-video.jpg","PreviewUrl":"https://www.youtube.com/watch?v=WE7HpSHgV4I","FileUrl":"http://www.keithandthegirl.com/vip/download/shows/danny/TTSWD-2014-11-06.mp3","Type":"0","Public":"0","Timestamp":1415293200,"Guests":[]},{"ShowId":"3513","ShowNameId":"9","Number":"100","PostedDate":"10/30/2014 12:00:00 PM","Title":"The Big One","VideoFileUrl":"https://www.keithandthegirl.com/vip/download/shows/danny/video/100/TTSWD-2014-10-30.m3u8","VideoThumbnailUrl":"https://www.keithandthegirl.com/vip/download/shows/danny/video/100/TTSWD-2014-10-30-video.jpg","PreviewUrl":"https://www.youtube.com/watch?v=UHWtJ7IyiS4","FileUrl":"http://www.keithandthegirl.com/vip/download/shows/danny/TTSWD-2014-10-30.mp3","Type":"0","Public":"0","Timestamp":1414684800,"Guests":[]},{"ShowId":"3503","ShowNameId":"9","Number":"99","PostedDate":"10/23/2014 12:00:00 PM","Title":"The Intense Show","VideoFileUrl":"https://www.keithandthegirl.com/vip/download/shows/danny/video/99/TTSWD-2014-10-23.m3u8","VideoThumbnailUrl":"https://www.keithandthegirl.com/vip/download/shows/danny/video/99/TTSWD-2014-10-23-video.jpg","PreviewUrl":"https://www.youtube.com/watch?v=2uaqIGol6uU","FileUrl":"http://www.keithandthegirl.com/vip/download/shows/danny/TTSWD-2014-10-23.mp3","Type":"0","Public":"0","Timestamp":1414080000,"Guests":[]},{"ShowId":"3492","ShowNameId":"9","Number":"98","PostedDate":"10/15/2014 7:33:27 PM","Title":"The Funeral Event of the Century","VideoFileUrl":"https://www.keithandthegirl.com/vip/download/shows/danny/video/98/TTSWD-2014-10-16.m3u8","VideoThumbnailUrl":"https://www.keithandthegirl.com/vip/download/shows/danny/video/98/TTSWD-2014-10-16-video.jpg","PreviewUrl":"https://www.youtube.com/watch?v=-3xZBnHGRkc","FileUrl":"http://www.keithandthegirl.com/vip/download/shows/danny/TTSWD-2014-10-16.mp3","Type":"0","Public":"0","Timestamp":1413416007,"Guests":[]},{"ShowId":"3482","ShowNameId":"9","Number":"97","PostedDate":"10/9/2014 12:00:00 PM","Title":"Hi, Junior","VideoFileUrl":"https://www.keithandthegirl.com/vip/download/shows/danny/video/97/TTSWD-2014-10-09.m3u8","VideoThumbnailUrl":"https://www.keithandthegirl.com/vip/download/shows/danny/video/97/TTSWD-2014-10-09-video.jpg","PreviewUrl":"https://www.youtube.com/watch?v=AXI4FgfDczk","FileUrl":"http://www.keithandthegirl.com/vip/download/shows/danny/TTSWD-2014-10-09.mp3","Type":"0","Public":"0","Timestamp":1412870400,"Guests":[]},{"ShowId":"3464","ShowNameId":"9","Number":"96","PostedDate":"9/25/2014 12:00:00 PM","Title":"The Dreamer","VideoFileUrl":"https://www.keithandthegirl.com/vip/download/shows/danny/video/96/TTSWD-2014-09-25.m3u8","VideoThumbnailUrl":"https://www.keithandthegirl.com/vip/download/shows/danny/video/96/TTSWD-2014-09-25-video.jpg","PreviewUrl":"https://www.youtube.com/watch?v=cufK6WqIj0E","FileUrl":"http://www.keithandthegirl.com/vip/download/shows/danny/TTSWD-2014-09-25.mp3","Type":"0","Public":"0","Timestamp":1411660800,"Guests":[]},{"ShowId":"3454","ShowNameId":"9","Number":"95","PostedDate":"9/18/2014 12:00:00 PM","Title":"U Know What I Mean?","VideoFileUrl":"https://www.keithandthegirl.com/vip/download/shows/danny/video/95/TTSWD-2014-09-18.m3u8","VideoThumbnailUrl":"https://www.keithandthegirl.com/vip/download/shows/danny/video/95/TTSWD-2014-09-18-video.jpg","PreviewUrl":"https://www.youtube.com/watch?v=3zDe72HLfDQ","FileUrl":"http://www.keithandthegirl.com/vip/download/shows/danny/TTSWD-2014-09-18.mp3","Type":"0","Public":"0","Timestamp":1411056000,"Guests":[]},{"ShowId":"3443","ShowNameId":"9","Number":"94","PostedDate":"9/11/2014 12:00:00 PM","Title":"The Greatest Magic","VideoFileUrl":"https://www.keithandthegirl.com/vip/download/shows/danny/video/94/TTSWD-2014-09-11.m3u8","VideoThumbnailUrl":"https://www.keithandthegirl.com/vip/download/shows/danny/video/94/TTSWD-2014-09-11-video.jpg","PreviewUrl":"https://www.youtube.com/watch?v=UUNs-Lyie3c","FileUrl":"http://www.keithandthegirl.com/vip/download/shows/danny/TTSWD-2014-09-11.mp3","Type":"0","Public":"0","Timestamp":1410451200,"Guests":[]},{"ShowId":"3435","ShowNameId":"9","Number":"93","PostedDate":"9/4/2014 12:00:00 PM","Title":"The Kiss","VideoFileUrl":"https://www.keithandthegirl.com/vip/download/shows/danny/video/93/TTSWD-2014-09-04.m3u8","VideoThumbnailUrl":"https://www.keithandthegirl.com/vip/download/shows/danny/video/93/TTSWD-2014-09-04-video.jpg","PreviewUrl":"https://www.youtube.com/watch?v=w2ud1x1jImc","FileUrl":"http://www.keithandthegirl.com/vip/download/shows/danny/TTSWD-2014-09-04.mp3","Type":"0","Public":"0","Timestamp":1409846400,"Guests":[]},{"ShowId":"3424","ShowNameId":"9","Number":"92","PostedDate":"8/28/2014 12:00:00 PM","Title":"The Fight","VideoFileUrl":"https://www.keithandthegirl.com/vip/download/shows/danny/video/92/TTSWD-2014-08-28.m3u8","VideoThumbnailUrl":"https://www.keithandthegirl.com/vip/download/shows/danny/video/92/TTSWD-2014-08-28-video.jpg","PreviewUrl":"https://www.youtube.com/watch?v=nSjIRmDubjU","FileUrl":"http://www.keithandthegirl.com/vip/download/shows/danny/TTSWD-2014-08-28.mp3","Type":"0","Public":"0","Timestamp":1409241600,"Guests":[]},{"ShowId":"3402","ShowNameId":"9","Number":"91","PostedDate":"8/14/2014 12:00:00 PM","Title":"Impressive","VideoFileUrl":"https://www.keithandthegirl.com/vip/download/shows/danny/video/91/TTSWD-2014-08-14.m3u8","VideoThumbnailUrl":"https://www.keithandthegirl.com/vip/download/shows/danny/video/91/TTSWD-2014-08-14-video.jpg","PreviewUrl":"https://www.youtube.com/watch?v=31qvgjykhwU","FileUrl":"http://www.keithandthegirl.com/vip/download/shows/danny/TTSWD-2014-08-14.mp3","Type":"0","Public":"0","Timestamp":1408032000,"Guests":[]},{"ShowId":"3389","ShowNameId":"9","Number":"90","PostedDate":"8/7/2014 12:00:00 PM","Title":"Bend and Snap","VideoFileUrl":"https://www.keithandthegirl.com/vip/download/shows/danny/video/90/TTSWD-2014-08-07.m3u8","VideoThumbnailUrl":"https://www.keithandthegirl.com/vip/download/shows/danny/video/90/TTSWD-2014-08-07-video.jpg","PreviewUrl":"https://www.youtube.com/watch?v=aeuIsWjvPco","FileUrl":"http://www.keithandthegirl.com/vip/download/shows/danny/TTSWD-2014-08-07.mp3","Type":"0","Public":"0","Timestamp":1407427200,"Guests":[]},{"ShowId":"3380","ShowNameId":"9","Number":"89","PostedDate":"7/31/2014 12:00:00 PM","Title":"Salviation","VideoFileUrl":"https://www.keithandthegirl.com/vip/download/shows/danny/video/89/TTSWD-2014-07-31.m3u8","VideoThumbnailUrl":"https://www.keithandthegirl.com/vip/download/shows/danny/video/89/TTSWD-2014-07-31-video.jpg","PreviewUrl":"https://www.youtube.com/watch?v=EZImf5Z8b3g","FileUrl":"http://www.keithandthegirl.com/vip/download/shows/danny/TTSWD-2014-07-31.mp3","Type":"0","Public":"0","Timestamp":1406822400,"Guests":[]},{"ShowId":"3366","ShowNameId":"9","Number":"88","PostedDate":"7/24/2014 12:00:00 PM","Title":"Chemda Is Always Right","VideoFileUrl":"https://www.keithandthegirl.com/vip/download/shows/danny/video/88/TTSWD-2014-07-24.m3u8","VideoThumbnailUrl":"https://www.keithandthegirl.com/vip/download/shows/danny/video/88/TTSWD-2014-07-24-video.jpg","PreviewUrl":"https://www.youtube.com/watch?v=qQr0x0K3uSc","FileUrl":"http://www.keithandthegirl.com/vip/download/shows/danny/TTSWD-2014-07-24.mp3","Type":"0","Public":"0","Timestamp":1406217600,"Guests":[]},{"ShowId":"3353","ShowNameId":"9","Number":"87","PostedDate":"7/17/2014 12:00:00 PM","Title":"Sweet and Tender Hooligan","VideoFileUrl":"https://www.keithandthegirl.com/vip/download/shows/danny/video/87/TTSWD-2014-07-17.m3u8","VideoThumbnailUrl":"https://www.keithandthegirl.com/vip/download/shows/danny/video/87/TTSWD-2014-07-17-video.jpg","PreviewUrl":"https://www.youtube.com/watch?v=263Aw7FfHgw","FileUrl":"http://www.keithandthegirl.com/vip/download/shows/danny/TTSWD-2014-07-17.mp3","Type":"0","Public":"0","Timestamp":1405612800,"Guests":[]},{"ShowId":"3338","ShowNameId":"9","Number":"86","PostedDate":"7/3/2014 12:00:00 PM","Title":"86 This Show","VideoFileUrl":"https://www.keithandthegirl.com/vip/download/shows/danny/video/86/TTSWD-2014-07-03.m3u8","VideoThumbnailUrl":"https://www.keithandthegirl.com/vip/download/shows/danny/video/86/TTSWD-2014-07-03-video.jpg","PreviewUrl":"https://www.youtube.com/watch?v=METXROuOfv0","FileUrl":"http://www.keithandthegirl.com/vip/download/shows/danny/TTSWD-2014-07-03.mp3","Type":"0","Public":"0","Timestamp":1404403200,"Guests":[]},{"ShowId":"3328","ShowNameId":"9","Number":"85","PostedDate":"6/26/2014 12:00:00 PM","Title":"Coming and Going","VideoFileUrl":"https://www.keithandthegirl.com/vip/download/shows/danny/video/85/TTSWD-2014-06-26.m3u8","VideoThumbnailUrl":"https://www.keithandthegirl.com/vip/download/shows/danny/video/85/TTSWD-2014-06-26-video.jpg","PreviewUrl":"https://www.youtube.com/watch?v=oNWwc-yinUg","FileUrl":"http://www.keithandthegirl.com/vip/download/shows/danny/TTSWD-2014-06-26.mp3","Type":"0","Public":"0","Timestamp":1403798400,"Guests":[]},{"ShowId":"3308","ShowNameId":"9","Number":"84","PostedDate":"6/12/2014 12:00:00 PM","Title":"The Dominatrix Revolutions","VideoFileUrl":"https://www.keithandthegirl.com/vip/download/shows/danny/video/84/TTSWD-2014-06-12.m3u8","VideoThumbnailUrl":"https://www.keithandthegirl.com/vip/download/shows/danny/video/84/TTSWD-2014-06-12-video.jpg","PreviewUrl":"https://www.youtube.com/watch?v=d5uxv73B3F8","FileUrl":"http://www.keithandthegirl.com/vip/download/shows/danny/TTSWD-2014-06-12.mp3","Type":"0","Public":"0","Timestamp":1402588800,"Guests":[]},{"ShowId":"3295","ShowNameId":"9","Number":"83","PostedDate":"6/5/2014 12:00:00 PM","Title":"Extra Virgin","VideoFileUrl":"https://www.keithandthegirl.com/vip/download/shows/danny/video/83/TTSWD-2014-06-05.m3u8","VideoThumbnailUrl":"https://www.keithandthegirl.com/vip/download/shows/danny/video/83/TTSWD-2014-06-05-video.jpg","PreviewUrl":"https://www.youtube.com/watch?v=AAPGBwFlbUY","FileUrl":"http://www.keithandthegirl.com/vip/download/shows/danny/TTSWD-2014-06-05.mp3","Type":"0","Public":"0","Timestamp":1401984000,"Guests":[]},{"ShowId":"3268","ShowNameId":"9","Number":"82","PostedDate":"5/22/2014 12:00:10 PM","Title":"RIP Danny?","VideoFileUrl":"https://www.keithandthegirl.com/vip/download/shows/danny/video/82/TTSWD-2014-05-22.m3u8","VideoThumbnailUrl":"https://www.keithandthegirl.com/vip/download/shows/danny/video/82/TTSWD-2014-05-22-video.jpg","PreviewUrl":"https://www.youtube.com/watch?v=O6OvkwSe9gk","FileUrl":"http://www.keithandthegirl.com/vip/download/shows/danny/TTSWD-2014-05-22.mp3","Type":"0","Public":"0","Timestamp":1400774410,"Guests":[]},{"ShowId":"3258","ShowNameId":"9","Number":"81","PostedDate":"5/15/2014 12:00:00 PM","Title":"You\u0027re Sure to (Brother) Love This Episode!","VideoFileUrl":"https://www.keithandthegirl.com/vip/download/shows/danny/video/81/TTSWD-2014-05-15.m3u8","VideoThumbnailUrl":"https://www.keithandthegirl.com/vip/download/shows/danny/video/81/TTSWD-2014-05-15-video.jpg","PreviewUrl":"https://www.youtube.com/watch?v=6MJbF8yUcW8","FileUrl":"http://www.keithandthegirl.com/vip/download/shows/danny/TTSWD-2014-05-15.mp3","Type":"0","Public":"0","Timestamp":1400169600,"Guests":[{"Data":"9","ShowGuestId":"9","RealName":"Brother Love","Description":"Host of The Brother Love Owwwr! and founder of Them Vibes.","PictureFilename":"Brother-Love.jpg","Url1":"http://www.facebook.com/brotherlove","Url2":"http://www.brotherloverocks.com","PictureUrl":"http://static-4.keithandthegirl.net/guests/pics/processed/Brother-Love-150x150.jpg","PictureUrlLarge":"http://static-4.keithandthegirl.net/guests/pics/processed/Brother-Love-600x600.jpg"}]},{"ShowId":"3248","ShowNameId":"9","Number":"80","PostedDate":"5/8/2014 12:00:00 PM","Title":"Dog-Ear-Dog World","VideoFileUrl":"https://www.keithandthegirl.com/vip/download/shows/danny/video/80/TTSWD-2014-05-08.m3u8","VideoThumbnailUrl":"https://www.keithandthegirl.com/vip/download/shows/danny/video/80/TTSWD-2014-05-08-video.jpg","PreviewUrl":"https://www.youtube.com/watch?v=6Exm5wJhx_I","FileUrl":"http://www.keithandthegirl.com/vip/download/shows/danny/TTSWD-2014-05-08.mp3","Type":"0","Public":"0","Timestamp":1399564800,"Guests":[]},{"ShowId":"3233","ShowNameId":"9","Number":"79","PostedDate":"5/1/2014 12:00:00 PM","Title":"Everything is a Fun Good Time, and This Show is a Prime Example of That","VideoFileUrl":"https://www.keithandthegirl.com/vip/download/shows/danny/video/79/TTSWD-2014-05-01.m3u8","VideoThumbnailUrl":"https://www.keithandthegirl.com/vip/download/shows/danny/video/79/TTSWD-2014-05-01-video.jpg","PreviewUrl":"https://www.youtube.com/watch?v=wBVSbZfldyw","FileUrl":"http://www.keithandthegirl.com/vip/download/shows/danny/TTSWD-2014-05-01.mp3","Type":"0","Public":"0","Timestamp":1398960000,"Guests":[]},{"ShowId":"3224","ShowNameId":"9","Number":"78","PostedDate":"4/24/2014 12:00:00 PM","Title":"Do the Robot (Live from KATG Week 2014)","VideoFileUrl":"https://www.keithandthegirl.com/vip/download/shows/danny/video/78/TTSWD-2014-04-24.m3u8","VideoThumbnailUrl":"https://www.keithandthegirl.com/vip/download/shows/danny/video/78/TTSWD-2014-04-24-video.jpg","PreviewUrl":"https://www.youtube.com/watch?v=uIqng3b31sk","FileUrl":"http://www.keithandthegirl.com/vip/download/shows/danny/TTSWD-2014-04-24.mp3","Type":"0","Public":"0","Timestamp":1398355200,"Guests":[{"Data":"263","ShowGuestId":"263","RealName":"Katharine Heller","Description":"Comedian and actress known for hosting the Tell the Bartender podcast.","PictureFilename":"Katharine-Heller.jpg","Url1":"http://katharineheller.com","Url2":"","PictureUrl":"http://static-1.keithandthegirl.net/guests/pics/processed/Katharine-Heller-150x150.jpg","PictureUrlLarge":"http://static-1.keithandthegirl.net/guests/pics/processed/Katharine-Heller-600x600.jpg"}]},{"ShowId":"3209","ShowNameId":"9","Number":"77","PostedDate":"4/10/2014 12:00:00 PM","Title":"The War on Drugs","VideoFileUrl":"https://www.keithandthegirl.com/vip/download/shows/danny/video/77/TTSWD-2014-04-10.m3u8","VideoThumbnailUrl":"https://www.keithandthegirl.com/vip/download/shows/danny/video/77/TTSWD-2014-04-10-video.jpg","PreviewUrl":"https://www.youtube.com/watch?v=f959KIJiz30","FileUrl":"http://www.keithandthegirl.com/vip/download/shows/danny/TTSWD-2014-04-10.mp3","Type":"0","Public":"0","Timestamp":1397145600,"Guests":[]},{"ShowId":"3199","ShowNameId":"9","Number":"76","PostedDate":"4/3/2014 12:00:00 PM","Title":"I Have a Drug Problem","VideoFileUrl":"https://www.keithandthegirl.com/vip/download/shows/danny/video/76/TTSWD-2014-04-03.m3u8","VideoThumbnailUrl":"https://www.keithandthegirl.com/vip/download/shows/danny/video/76/TTSWD-2014-04-03-video.jpg","PreviewUrl":"https://www.youtube.com/watch?v=lzoE5El-v_w","FileUrl":"http://www.keithandthegirl.com/vip/download/shows/danny/TTSWD-2014-04-03.mp3","Type":"0","Public":"0","Timestamp":1396540800,"Guests":[]},{"ShowId":"3188","ShowNameId":"9","Number":"75","PostedDate":"3/27/2014 12:00:00 PM","Title":"The U3 Amigos","VideoFileUrl":"https://www.keithandthegirl.com/vip/download/shows/danny/video/75/TTSWD-2014-03-27.m3u8","VideoThumbnailUrl":"https://www.keithandthegirl.com/vip/download/shows/danny/video/75/TTSWD-2014-03-27-video.jpg","PreviewUrl":"https://www.youtube.com/watch?v=fSoBW-g5X30","FileUrl":"http://www.keithandthegirl.com/vip/download/shows/danny/TTSWD-2014-03-27.mp3","Type":"0","Public":"0","Timestamp":1395936000,"Guests":[]},{"ShowId":"3178","ShowNameId":"9","Number":"74","PostedDate":"3/20/2014 12:00:00 PM","Title":"High, Man","VideoFileUrl":"https://www.keithandthegirl.com/vip/download/shows/danny/video/74/TTSWD-2014-03-20.m3u8","VideoThumbnailUrl":"https://www.keithandthegirl.com/vip/download/shows/danny/video/74/TTSWD-2014-03-20-video.jpg","PreviewUrl":"https://www.youtube.com/watch?v=1xAFndvBkp0","FileUrl":"http://www.keithandthegirl.com/vip/download/shows/danny/TTSWD-2014-03-20.mp3","Type":"0","Public":"0","Timestamp":1395331200,"Guests":[{"Data":"91","ShowGuestId":"91","RealName":"Myka Fox","Description":"Comedian and writer for Saturday Night Live and someecards, and host of Myka Fox \u0026 Friends.","PictureFilename":"Myka-Fox.jpg","Url1":"http://www.twitter.com/mykafox","Url2":"http://www.facebook.com/mykafox","PictureUrl":"http://static-3.keithandthegirl.net/guests/pics/processed/Myka-Fox-150x150.jpg","PictureUrlLarge":"http://static-3.keithandthegirl.net/guests/pics/processed/Myka-Fox-600x600.jpg"}]},{"ShowId":"3167","ShowNameId":"9","Number":"73","PostedDate":"3/13/2014 12:00:00 PM","Title":"Hooked on Megaphonics","VideoFileUrl":"https://www.keithandthegirl.com/vip/download/shows/danny/video/73/TTSWD-2014-03-13.m3u8","VideoThumbnailUrl":"https://www.keithandthegirl.com/vip/download/shows/danny/video/73/TTSWD-2014-03-13-video.jpg","PreviewUrl":"https://www.youtube.com/watch?v=oYsQEsLG3Us","FileUrl":"http://www.keithandthegirl.com/vip/download/shows/danny/TTSWD-2014-03-13.mp3","Type":"0","Public":"0","Timestamp":1394726400,"Guests":[]},{"ShowId":"3155","ShowNameId":"9","Number":"72","PostedDate":"3/6/2014 12:00:00 PM","Title":"RIP Shitty Jim\u0027s Terrible Shitty Condoms","VideoFileUrl":"https://www.keithandthegirl.com/vip/download/shows/danny/video/72/TTSWD-2014-03-06.m3u8","VideoThumbnailUrl":"https://www.keithandthegirl.com/vip/download/shows/danny/video/72/TTSWD-2014-03-06-video.jpg","PreviewUrl":"https://www.youtube.com/watch?v=4teqyMQvVwQ","FileUrl":"http://www.keithandthegirl.com/vip/download/shows/danny/TTSWD-2014-03-06.mp3","Type":"0","Public":"0","Timestamp":1394125200,"Guests":[{"Data":"256","ShowGuestId":"256","RealName":"Marisela Arias","Description":"Michael\u0027s girlfriend and maintainer of KATG from behind the scenes.","PictureFilename":"Marisela-Arias.jpg","Url1":"http://twitter.com/mariselanow","Url2":"","PictureUrl":"http://static-4.keithandthegirl.net/guests/pics/processed/Marisela-Arias-150x150.jpg","PictureUrlLarge":"http://static-4.keithandthegirl.net/guests/pics/processed/Marisela-Arias-600x600.jpg"},{"Data":"1","ShowGuestId":"1","RealName":"Michael Khalili","Description":"The girl\u0027s younger brother. Maintains this site and works on several other web projects. Former president of Atheists United.","PictureFilename":"Michael-Khalili.jpg","Url1":"http://www.facebook.com/MichaelApproved","Url2":"http://SkimThat.com","PictureUrl":"http://static-1.keithandthegirl.net/guests/pics/processed/Michael-Khalili-150x150.jpg","PictureUrlLarge":"http://static-1.keithandthegirl.net/guests/pics/processed/Michael-Khalili-600x600.jpg"}]},{"ShowId":"3143","ShowNameId":"9","Number":"71","PostedDate":"2/27/2014 12:00:00 PM","Title":"Libby Is Dead, Long Live Libby","VideoFileUrl":"https://www.keithandthegirl.com/vip/download/shows/danny/video/71/TTSWD-2014-02-27.m3u8","VideoThumbnailUrl":"https://www.keithandthegirl.com/vip/download/shows/danny/video/71/TTSWD-2014-02-27-video.jpg","PreviewUrl":"http://www.youtube.com/watch?v=3wRLrvay07I","FileUrl":"http://www.keithandthegirl.com/vip/download/shows/danny/TTSWD-2014-02-27.mp3","Type":"0","Public":"0","Timestamp":1393520400,"Guests":[{"Data":"479","ShowGuestId":"479","RealName":"Libby","Description":"Former Keith and The Girl PR representative and co-host of That\u0027s the Show with Danny.","PictureFilename":"libbyphillips.jpg","Url1":"","Url2":"https://twitter.com/ragingapathetic","PictureUrl":"http://static-4.keithandthegirl.net/guests/pics/processed/libbyphillips-150x150.jpg","PictureUrlLarge":"http://static-4.keithandthegirl.net/guests/pics/processed/libbyphillips-600x600.jpg"}]},{"ShowId":"3134","ShowNameId":"9","Number":"70","PostedDate":"2/20/2014 12:00:00 PM","Title":"Brought to You by Shitty Jim’s Terrible Shitty Condoms","VideoFileUrl":"https://www.keithandthegirl.com/vip/download/shows/danny/video/70/TTSWD-2014-02-20.m3u8","VideoThumbnailUrl":"https://www.keithandthegirl.com/vip/download/shows/danny/video/70/TTSWD-2014-02-20-video.jpg","PreviewUrl":"http://www.youtube.com/watch?v=MhWp4pc9lO8","FileUrl":"http://www.keithandthegirl.com/vip/download/shows/danny/TTSWD-2014-02-20.mp3","Type":"0","Public":"0","Timestamp":1392915600,"Guests":[]},{"ShowId":"3121","ShowNameId":"9","Number":"69","PostedDate":"2/13/2014 12:00:00 PM","Title":"Tea Man\u0027s Last Episode","VideoFileUrl":"https://www.keithandthegirl.com/vip/download/shows/danny/video/69/TTWSD-2014-02-13.m3u8","VideoThumbnailUrl":"https://www.keithandthegirl.com/vip/download/shows/danny/video/69/TTWSD-2014-02-13-video.jpg","PreviewUrl":"http://www.youtube.com/watch?v=1DJ--AcDwoU","FileUrl":"http://www.keithandthegirl.com/vip/download/shows/danny/TTWSD-2014-02-13.mp3","Type":"0","Public":"0","Timestamp":1392310800,"Guests":[]},{"ShowId":"3109","ShowNameId":"9","Number":"68","PostedDate":"2/6/2014 12:00:00 PM","Title":"The One Before Episode 69","VideoFileUrl":"https://www.keithandthegirl.com/vip/download/shows/danny/video/68/TTSWD-2014-02-06.m3u8","VideoThumbnailUrl":"https://www.keithandthegirl.com/vip/download/shows/danny/video/68/TTSWD-2014-02-06-video.jpg","PreviewUrl":"http://www.youtube.com/watch?v=rRsxbrgkms0","FileUrl":"http://www.keithandthegirl.com/vip/download/shows/danny/TTSWD-2014-02-06.mp3","Type":"0","Public":"0","Timestamp":1391706000,"Guests":[]},{"ShowId":"3097","ShowNameId":"9","Number":"67","PostedDate":"1/30/2014 12:00:00 PM","Title":"The Cutting Edge","VideoFileUrl":"https://www.keithandthegirl.com/vip/download/shows/danny/video/67/TTSWD-2014-01-30.m3u8","VideoThumbnailUrl":"https://www.keithandthegirl.com/vip/download/shows/danny/video/67/TTSWD-2014-01-30-video.jpg","PreviewUrl":"http://www.youtube.com/watch?v=-iSWmwdOv70","FileUrl":"http://www.keithandthegirl.com/vip/download/shows/danny/TTSWD-2014-01-30.mp3","Type":"0","Public":"0","Timestamp":1391101200,"Guests":[]},{"ShowId":"3087","ShowNameId":"9","Number":"66","PostedDate":"1/23/2014 12:00:00 PM","Title":"Sweet Dreams, Sweet Cheeks","VideoFileUrl":"https://www.keithandthegirl.com/vip/download/shows/danny/video/66/TTSWD-2014-01-23.m3u8","VideoThumbnailUrl":"https://www.keithandthegirl.com/vip/download/shows/danny/video/66/TTSWD-2014-01-23-video.jpg","PreviewUrl":"http://www.youtube.com/watch?v=Xf2W1bx9TrM","FileUrl":"http://www.keithandthegirl.com/vip/download/shows/danny/TTSWD-2014-01-23.mp3","Type":"0","Public":"0","Timestamp":1390496400,"Guests":[]},{"ShowId":"3076","ShowNameId":"9","Number":"65","PostedDate":"1/16/2014 12:00:00 PM","Title":"Being There","VideoFileUrl":"https://www.keithandthegirl.com/vip/download/shows/danny/video/65/TTSWD-2014-01-16.m3u8","VideoThumbnailUrl":"https://www.keithandthegirl.com/vip/download/shows/danny/video/65/TTSWD-2014-01-16-video.jpg","PreviewUrl":"http://www.youtube.com/watch?v=7Lo6a5hjtb8","FileUrl":"http://www.keithandthegirl.com/vip/download/shows/danny/TTSWD-2014-01-16.mp3","Type":"0","Public":"0","Timestamp":1389891600,"Guests":[]},{"ShowId":"3066","ShowNameId":"9","Number":"64","PostedDate":"1/9/2014 12:00:00 PM","Title":"Watered Down","VideoFileUrl":"https://www.keithandthegirl.com/vip/download/shows/danny/video/64/TTSWD-2014-01-09.m3u8","VideoThumbnailUrl":"https://www.keithandthegirl.com/vip/download/shows/danny/video/64/TTSWD-2014-01-09-video.jpg","PreviewUrl":"http://www.youtube.com/watch?v=vxrHUqc3mVQ","FileUrl":"http://www.keithandthegirl.com/vip/download/shows/danny/TTSWD-2014-01-09.mp3","Type":"0","Public":"0","Timestamp":1389286800,"Guests":[]},{"ShowId":"3052","ShowNameId":"9","Number":"63","PostedDate":"12/26/2013 12:00:00 PM","Title":"The 2013 Year in Review Spectacular","VideoFileUrl":"https://www.keithandthegirl.com/vip/download/shows/danny/video/63/TTSWD-2013-12-26.m3u8","VideoThumbnailUrl":"https://www.keithandthegirl.com/vip/download/shows/danny/video/63/TTSWD-2013-12-26-video.jpg","PreviewUrl":"http://www.youtube.com/watch?v=lFbjl3057PE","FileUrl":"http://www.keithandthegirl.com/vip/download/shows/danny/TTSWD-2013-12-26.mp3","Type":"0","Public":"0","Timestamp":1388077200,"Guests":[{"Data":"91","ShowGuestId":"91","RealName":"Myka Fox","Description":"Comedian and writer for Saturday Night Live and someecards, and host of Myka Fox \u0026 Friends.","PictureFilename":"Myka-Fox.jpg","Url1":"http://www.twitter.com/mykafox","Url2":"http://www.facebook.com/mykafox","PictureUrl":"http://static-3.keithandthegirl.net/guests/pics/processed/Myka-Fox-150x150.jpg","PictureUrlLarge":"http://static-3.keithandthegirl.net/guests/pics/processed/Myka-Fox-600x600.jpg"}]},{"ShowId":"3043","ShowNameId":"9","Number":"62","PostedDate":"12/19/2013 12:00:00 PM","Title":"You Win Some, You WIN SOME!!!","VideoFileUrl":"https://www.keithandthegirl.com/vip/download/shows/danny/video/62/TTSWD-2013-12-19.m3u8","VideoThumbnailUrl":"https://www.keithandthegirl.com/vip/download/shows/danny/video/62/TTSWD-2013-12-19-video.jpg","PreviewUrl":"http://www.youtube.com/watch?v=tjBRM9sKstg","FileUrl":"http://www.keithandthegirl.com/vip/download/shows/danny/TTSWD-2013-12-19.mp3","Type":"0","Public":"0","Timestamp":1387472400,"Guests":[{"Data":"51","ShowGuestId":"51","RealName":"Jesse Joyce","Description":"Comedian and writer who wrote for numerous Comedy Central Roasts and the 85th Academy Awards ceremony.","PictureFilename":"Jesse-Joyce.jpg","Url1":"http://www.facebook.com/profile.php?id=506265141\u0026ref=ts#!/JesseJoyce.comedy","Url2":"http://www.jessejoyce.com","PictureUrl":"http://static-1.keithandthegirl.net/guests/pics/processed/Jesse-Joyce-150x150.jpg","PictureUrlLarge":"http://static-1.keithandthegirl.net/guests/pics/processed/Jesse-Joyce-600x600.jpg"}]},{"ShowId":"3034","ShowNameId":"9","Number":"61","PostedDate":"12/12/2013 12:00:00 PM","Title":"Tops Up","VideoFileUrl":"https://www.keithandthegirl.com/vip/download/shows/danny/video/61/TTSWD-2013-12-12.m3u8","VideoThumbnailUrl":"https://www.keithandthegirl.com/vip/download/shows/danny/video/61/TTSWD-2013-12-12-video.jpg","PreviewUrl":"http://www.youtube.com/watch?v=3i1I5Lygyio","FileUrl":"http://www.keithandthegirl.com/vip/download/shows/danny/TTSWD-2013-12-12.mp3","Type":"0","Public":"0","Timestamp":1386867600,"Guests":[]},{"ShowId":"3023","ShowNameId":"9","Number":"60","PostedDate":"12/5/2013 12:00:00 PM","Title":"Holy Shit There Are Sixty of These","VideoFileUrl":"https://www.keithandthegirl.com/vip/download/shows/danny/video/60/TTSWD-2013-12-05.m3u8","VideoThumbnailUrl":"https://www.keithandthegirl.com/vip/download/shows/danny/video/60/TTSWD-2013-12-05-video.jpg","PreviewUrl":"http://www.youtube.com/watch?v=py5W0TF03fU","FileUrl":"http://www.keithandthegirl.com/vip/download/shows/danny/TTSWD-2013-12-05.mp3","Type":"0","Public":"0","Timestamp":1386262800,"Guests":[{"Data":"107","ShowGuestId":"107","RealName":"Micah Sherman","Description":"Comedian known for his documentary Like Me.","PictureFilename":"Micah-Sherman.jpg","Url1":"http://facebook.com/professionaldork","Url2":"http://www.micahsherman.com","PictureUrl":"http://static-2.keithandthegirl.net/guests/pics/processed/Micah-Sherman-150x150.jpg","PictureUrlLarge":"http://static-2.keithandthegirl.net/guests/pics/processed/Micah-Sherman-600x600.jpg"},{"Data":"92","ShowGuestId":"92","RealName":"Myq Kaplan","Description":"Comedian known for his appearances on Last Comic Standing and The Late Show with David Letterman, and for hosting the podcast Hang Out with Me.","PictureFilename":"Myq-Kaplan.jpg","Url1":"http://www.godzillionaire.blogspot.com","Url2":"http://www.myqkaplan.com","PictureUrl":"http://static-4.keithandthegirl.net/guests/pics/processed/Myq-Kaplan-150x150.jpg","PictureUrlLarge":"http://static-4.keithandthegirl.net/guests/pics/processed/Myq-Kaplan-600x600.jpg"}]},{"ShowId":"3006","ShowNameId":"9","Number":"59","PostedDate":"11/21/2013 12:00:00 PM","Title":"Come as You Are, Tiny Dancer","VideoFileUrl":"https://www.keithandthegirl.com/vip/download/shows/danny/video/59/TTSWD-2013-11-21.m3u8","VideoThumbnailUrl":"https://www.keithandthegirl.com/vip/download/shows/danny/video/59/TTSWD-2013-11-21-video.jpg","PreviewUrl":"http://www.youtube.com/watch?v=UeMJxlMTJ_8","FileUrl":"http://www.keithandthegirl.com/vip/download/shows/danny/TTSWD-2013-11-21.mp3","Type":"0","Public":"0","Timestamp":1385053200,"Guests":[{"Data":"91","ShowGuestId":"91","RealName":"Myka Fox","Description":"Comedian and writer for Saturday Night Live and someecards, and host of Myka Fox \u0026 Friends.","PictureFilename":"Myka-Fox.jpg","Url1":"http://www.twitter.com/mykafox","Url2":"http://www.facebook.com/mykafox","PictureUrl":"http://static-3.keithandthegirl.net/guests/pics/processed/Myka-Fox-150x150.jpg","PictureUrlLarge":"http://static-3.keithandthegirl.net/guests/pics/processed/Myka-Fox-600x600.jpg"}]},{"ShowId":"2997","ShowNameId":"9","Number":"58","PostedDate":"11/14/2013 12:00:00 PM","Title":"The Music Man","VideoFileUrl":"https://www.keithandthegirl.com/vip/download/shows/danny/video/58/TTSWD-2013-11-14.m3u8","VideoThumbnailUrl":"https://www.keithandthegirl.com/vip/download/shows/danny/video/58/TTSWD-2013-11-14-video.jpg","PreviewUrl":"http://www.youtube.com/watch?v=pQVqXno6YkQ","FileUrl":"http://www.keithandthegirl.com/vip/download/shows/danny/TTSWD-2013-11-14.mp3","Type":"0","Public":"0","Timestamp":1384448400,"Guests":[{"Data":"236","ShowGuestId":"236","RealName":"Chris Laker","Description":"Comedian best known for hosting the podcasts The Show with Chris Laker, The Week, and This Week in Jackin\u0027.","PictureFilename":"Chris-Laker.jpg","Url1":"http://chrislaker.com/","Url2":"","PictureUrl":"http://static-4.keithandthegirl.net/guests/pics/processed/Chris-Laker-150x150.jpg","PictureUrlLarge":"http://static-4.keithandthegirl.net/guests/pics/processed/Chris-Laker-600x600.jpg"}]},{"ShowId":"2985","ShowNameId":"9","Number":"57","PostedDate":"11/7/2013 12:00:00 PM","Title":"Victory","VideoFileUrl":"https://www.keithandthegirl.com/vip/download/shows/danny/video/57/TTSWD-2013-11-07.m3u8","VideoThumbnailUrl":"https://www.keithandthegirl.com/vip/download/shows/danny/video/57/TTSWD-2013-11-07-video.jpg","PreviewUrl":"http://www.youtube.com/watch?v=JR52M2o4GcM","FileUrl":"http://www.keithandthegirl.com/vip/download/shows/danny/TTSWD-2013-11-07.mp3","Type":"0","Public":"0","Timestamp":1383843600,"Guests":[{"Data":"7","ShowGuestId":"7","RealName":"Victor Varnado","Description":"Stand-up comic, actor, producer, and director of The Awkward Comedy Show and Tell Your Friends: The Concert Film.","PictureFilename":"Victor-Varnado.jpg","Url1":"http://www.facebook.com/#!/vvarnado?ref=ts","Url2":"http://www.bestalbino.com","PictureUrl":"http://static-3.keithandthegirl.net/guests/pics/processed/Victor-Varnado-150x150.jpg","PictureUrlLarge":"http://static-3.keithandthegirl.net/guests/pics/processed/Victor-Varnado-600x600.jpg"}]},{"ShowId":"2972","ShowNameId":"9","Number":"56","PostedDate":"10/31/2013 10:45:00 AM","Title":"Hang Out with Me","VideoFileUrl":"https://www.keithandthegirl.com/vip/download/shows/danny/video/56/TTSWD-2013-10-31.m3u8","VideoThumbnailUrl":"https://www.keithandthegirl.com/vip/download/shows/danny/video/56/TTSWD-2013-10-31-video.jpg","PreviewUrl":"http://www.youtube.com/watch?v=JLjyZX3mf14","FileUrl":"http://www.keithandthegirl.com/vip/download/shows/danny/TTSWD-2013-10-31.mp3","Type":"0","Public":"0","Timestamp":1383230700,"Guests":[{"Data":"263","ShowGuestId":"263","RealName":"Katharine Heller","Description":"Comedian and actress known for hosting the Tell the Bartender podcast.","PictureFilename":"Katharine-Heller.jpg","Url1":"http://katharineheller.com","Url2":"","PictureUrl":"http://static-1.keithandthegirl.net/guests/pics/processed/Katharine-Heller-150x150.jpg","PictureUrlLarge":"http://static-1.keithandthegirl.net/guests/pics/processed/Katharine-Heller-600x600.jpg"}]},{"ShowId":"2961","ShowNameId":"9","Number":"55","PostedDate":"10/24/2013 12:00:00 PM","Title":"The 2013 That\u0027s the Show with Danny Elliott Smith 10 Year Memorial Remembrance/Celebration Spectacular","VideoFileUrl":"https://www.keithandthegirl.com/vip/download/shows/danny/video/55/TTSWD-2013-10-24.m3u8","VideoThumbnailUrl":"https://www.keithandthegirl.com/vip/download/shows/danny/video/55/TTSWD-2013-10-24-video.jpg","PreviewUrl":"http://www.youtube.com/watch?v=t_6a5VPlaTw","FileUrl":"http://www.keithandthegirl.com/vip/download/shows/danny/TTSWD-2013-10-24.mp3","Type":"0","Public":"0","Timestamp":1382630400,"Guests":[]},{"ShowId":"2951","ShowNameId":"9","Number":"54","PostedDate":"10/17/2013 12:00:00 PM","Title":"RIP Brandon Lee","VideoFileUrl":"https://www.keithandthegirl.com/vip/download/shows/danny/video/54/TTSWD-2013-10-17.m3u8","VideoThumbnailUrl":"https://www.keithandthegirl.com/vip/download/shows/danny/video/54/TTSWD-2013-10-17-video.jpg","PreviewUrl":"http://www.youtube.com/watch?v=ZdDZm7uv5gA","FileUrl":"http://www.keithandthegirl.com/vip/download/shows/danny/TTSWD-2013-10-17.mp3","Type":"0","Public":"0","Timestamp":1382025600,"Guests":[]},{"ShowId":"2930","ShowNameId":"9","Number":"53","PostedDate":"10/3/2013 12:00:00 PM","Title":"Going Limp","VideoFileUrl":"https://www.keithandthegirl.com/vip/download/shows/danny/video/53/TTSWD-2013-10-03.m3u8","VideoThumbnailUrl":"https://www.keithandthegirl.com/vip/download/shows/danny/video/53/TTSWD-2013-10-03-video.jpg","PreviewUrl":"http://www.youtube.com/watch?v=0CWbCYk9r-M","FileUrl":"http://www.keithandthegirl.com/vip/download/shows/danny/TTSWD-2013-10-03.mp3","Type":"0","Public":"0","Timestamp":1380816000,"Guests":[]},{"ShowId":"2919","ShowNameId":"9","Number":"52","PostedDate":"9/26/2013 10:33:00 AM","Title":"An Absolute Fucking Travesty","VideoFileUrl":"https://www.keithandthegirl.com/vip/download/shows/danny/video/52/TTSWD-2013-09-26.m3u8","VideoThumbnailUrl":"https://www.keithandthegirl.com/vip/download/shows/danny/video/52/TTSWD-2013-09-26-video.jpg","PreviewUrl":"http://www.youtube.com/watch?v=GmFg2Au6K6Q","FileUrl":"http://www.keithandthegirl.com/vip/download/shows/danny/TTSWD-2013-09-26.mp3","Type":"0","Public":"0","Timestamp":1380205980,"Guests":[]},{"ShowId":"2912","ShowNameId":"9","Number":"51","PostedDate":"9/19/2013 12:00:29 PM","Title":"RIP Libby","VideoFileUrl":"https://www.keithandthegirl.com/vip/download/shows/danny/video/51/TTSWD-2013-09-19.m3u8","VideoThumbnailUrl":"https://www.keithandthegirl.com/vip/download/shows/danny/video/51/TTSWD-2013-09-19-video.jpg","PreviewUrl":"http://www.youtube.com/watch?v=QWpILeUb4hg","FileUrl":"http://www.keithandthegirl.com/vip/download/shows/danny/TTSWD-2013-09-19.mp3","Type":"0","Public":"0","Timestamp":1379606429,"Guests":[{"Data":"479","ShowGuestId":"479","RealName":"Libby","Description":"Former Keith and The Girl PR representative and co-host of That\u0027s the Show with Danny.","PictureFilename":"libbyphillips.jpg","Url1":"","Url2":"https://twitter.com/ragingapathetic","PictureUrl":"http://static-4.keithandthegirl.net/guests/pics/processed/libbyphillips-150x150.jpg","PictureUrlLarge":"http://static-4.keithandthegirl.net/guests/pics/processed/libbyphillips-600x600.jpg"}]},{"ShowId":"2902","ShowNameId":"9","Number":"50","PostedDate":"9/12/2013 12:00:09 PM","Title":"50 Shades of Show","VideoFileUrl":"https://www.keithandthegirl.com/vip/download/shows/danny/video/50/TTSWD-2013-09-12.m3u8","VideoThumbnailUrl":"https://www.keithandthegirl.com/vip/download/shows/danny/video/50/TTSWD-2013-09-12-video.jpg","PreviewUrl":"http://www.youtube.com/watch?v=75tLM74SWzQ","FileUrl":"http://www.keithandthegirl.com/vip/download/shows/danny/TTSWD-2013-09-12.mp3","Type":"0","Public":"0","Timestamp":1379001609,"Guests":[]},{"ShowId":"2893","ShowNameId":"9","Number":"49","PostedDate":"9/5/2013 6:00:00 PM","Title":"The Gin and the Sour Defeat","VideoFileUrl":"https://www.keithandthegirl.com/vip/download/shows/danny/video/49/TTSWD-2013-09-05.m3u8","VideoThumbnailUrl":"https://www.keithandthegirl.com/vip/download/shows/danny/video/49/TTSWD-2013-09-05-video.jpg","PreviewUrl":"http://www.youtube.com/watch?v=D9d6kd3N_Q0","FileUrl":"http://www.keithandthegirl.com/vip/download/shows/danny/TTSWD-2013-09-05.mp3","Type":"0","Public":"0","Timestamp":1378418400,"Guests":[{"Data":"92","ShowGuestId":"92","RealName":"Myq Kaplan","Description":"Comedian known for his appearances on Last Comic Standing and The Late Show with David Letterman, and for hosting the podcast Hang Out with Me.","PictureFilename":"Myq-Kaplan.jpg","Url1":"http://www.godzillionaire.blogspot.com","Url2":"http://www.myqkaplan.com","PictureUrl":"http://static-4.keithandthegirl.net/guests/pics/processed/Myq-Kaplan-150x150.jpg","PictureUrlLarge":"http://static-4.keithandthegirl.net/guests/pics/processed/Myq-Kaplan-600x600.jpg"}]},{"ShowId":"2883","ShowNameId":"9","Number":"48","PostedDate":"8/29/2013 12:19:50 PM","Title":"A Slight Discomfort","VideoFileUrl":"https://www.keithandthegirl.com/vip/download/shows/danny/video/48/TTSWD-2013-08-29.m3u8","VideoThumbnailUrl":"https://www.keithandthegirl.com/vip/download/shows/danny/video/48/TTSWD-2013-08-29-video.jpg","PreviewUrl":"http://www.youtube.com/watch?v=kVSFEt7MYZw","FileUrl":"http://www.keithandthegirl.com/vip/download/shows/danny/TTSWD-2013-08-29.mp3","Type":"0","Public":"0","Timestamp":1377793190,"Guests":[{"Data":"314","ShowGuestId":"314","RealName":"Chris Gethard","Description":"Comedian and writer best known for his book A Bad Idea I\u0027m About to Do and his television show The Chris Gethard Show.","PictureFilename":"Chris-Gethard.jpg","Url1":"","Url2":"http://thechrisgethardshow.com/","PictureUrl":"http://static-3.keithandthegirl.net/guests/pics/processed/Chris-Gethard-150x150.jpg","PictureUrlLarge":"http://static-3.keithandthegirl.net/guests/pics/processed/Chris-Gethard-600x600.jpg"}]},{"ShowId":"2873","ShowNameId":"9","Number":"47","PostedDate":"8/23/2013 4:23:44 PM","Title":"Gossip Friday","VideoFileUrl":"https://www.keithandthegirl.com/vip/download/shows/danny/video/47/TTSWD-2013-08-23.m3u8","VideoThumbnailUrl":"https://www.keithandthegirl.com/vip/download/shows/danny/video/47/TTSWD-2013-08-23-video.jpg","PreviewUrl":"http://www.youtube.com/watch?v=qyCmf2HCisE","FileUrl":"http://www.keithandthegirl.com/vip/download/shows/danny/TTSWD-2013-08-23.mp3","Type":"0","Public":"0","Timestamp":1377289424,"Guests":[]},{"ShowId":"2870","ShowNameId":"9","Number":"46","PostedDate":"8/22/2013 3:09:38 PM","Title":"Autumn Sweater","VideoFileUrl":"https://www.keithandthegirl.com/vip/download/shows/danny/video/46/TTSWD-2013-08-22.m3u8","VideoThumbnailUrl":"https://www.keithandthegirl.com/vip/download/shows/danny/video/46/TTSWD-2013-08-22-video.jpg","PreviewUrl":"http://www.youtube.com/watch?v=E6JO17WyIQk","FileUrl":"http://www.keithandthegirl.com/vip/download/shows/danny/TTSWD-2013-08-22.mp3","Type":"0","Public":"0","Timestamp":1377198578,"Guests":[{"Data":"364","ShowGuestId":"364","RealName":"Emily","Description":"Comedian and host of The Hot Mess Comedy Hour podcast.","PictureFilename":"emilylubin.jpg","Url1":"","Url2":"http://twitter.com/lubination","PictureUrl":"http://static-1.keithandthegirl.net/guests/pics/processed/emilylubin-150x150.jpg","PictureUrlLarge":"http://static-1.keithandthegirl.net/guests/pics/processed/emilylubin-600x600.jpg"}]},{"ShowId":"2856","ShowNameId":"9","Number":"45","PostedDate":"8/15/2013 12:00:00 PM","Title":"How to Tell Jokes","VideoFileUrl":"https://www.keithandthegirl.com/vip/download/shows/danny/video/45/TTSWD-2013-08-15.m3u8","VideoThumbnailUrl":"https://www.keithandthegirl.com/vip/download/shows/danny/video/45/TTSWD-2013-08-15-video.jpg","PreviewUrl":"http://www.youtube.com/watch?v=ikz5pt8_Eac","FileUrl":"http://www.keithandthegirl.com/vip/download/shows/danny/TTSWD-2013-08-15.mp3","Type":"0","Public":"0","Timestamp":1376582400,"Guests":[{"Data":"91","ShowGuestId":"91","RealName":"Myka Fox","Description":"Comedian and writer for Saturday Night Live and someecards, and host of Myka Fox \u0026 Friends.","PictureFilename":"Myka-Fox.jpg","Url1":"http://www.twitter.com/mykafox","Url2":"http://www.facebook.com/mykafox","PictureUrl":"http://static-3.keithandthegirl.net/guests/pics/processed/Myka-Fox-150x150.jpg","PictureUrlLarge":"http://static-3.keithandthegirl.net/guests/pics/processed/Myka-Fox-600x600.jpg"}]},{"ShowId":"2847","ShowNameId":"9","Number":"44","PostedDate":"8/9/2013 12:00:00 PM","Title":"The Price of Love","VideoFileUrl":"https://www.keithandthegirl.com/vip/download/shows/danny/video/44/TTSWD-2013-08-09.m3u8","VideoThumbnailUrl":"https://www.keithandthegirl.com/vip/download/shows/danny/video/44/TTSWD-2013-08-09-video.jpg","PreviewUrl":"http://www.youtube.com/watch?v=dAdx_gV4aH0","FileUrl":"http://www.keithandthegirl.com/vip/download/shows/danny/TTSWD-2013-08-09.mp3","Type":"0","Public":"0","Timestamp":1376064000,"Guests":[{"Data":"91","ShowGuestId":"91","RealName":"Myka Fox","Description":"Comedian and writer for Saturday Night Live and someecards, and host of Myka Fox \u0026 Friends.","PictureFilename":"Myka-Fox.jpg","Url1":"http://www.twitter.com/mykafox","Url2":"http://www.facebook.com/mykafox","PictureUrl":"http://static-3.keithandthegirl.net/guests/pics/processed/Myka-Fox-150x150.jpg","PictureUrlLarge":"http://static-3.keithandthegirl.net/guests/pics/processed/Myka-Fox-600x600.jpg"}]},{"ShowId":"2832","ShowNameId":"9","Number":"43","PostedDate":"8/1/2013 12:00:00 PM","Title":"Constructive Criticism","VideoFileUrl":"https://www.keithandthegirl.com/vip/download/shows/danny/video/43/TTSWD-2013-08-01.m3u8","VideoThumbnailUrl":"https://www.keithandthegirl.com/vip/download/shows/danny/video/43/TTSWD-2013-08-01-video.jpg","PreviewUrl":"http://www.youtube.com/watch?v=53yTiXcayys","FileUrl":"http://www.keithandthegirl.com/vip/download/shows/danny/TTSWD-2013-08-01.mp3","Type":"0","Public":"0","Timestamp":1375372800,"Guests":[]},{"ShowId":"2817","ShowNameId":"9","Number":"42","PostedDate":"7/25/2013 2:00:00 PM","Title":"The Inkblot Test","VideoFileUrl":"https://www.keithandthegirl.com/vip/download/shows/danny/video/42/TTSWD-2013-07-25.m3u8","VideoThumbnailUrl":"https://www.keithandthegirl.com/vip/download/shows/danny/video/42/TTSWD-2013-07-25-video.jpg","PreviewUrl":"http://www.youtube.com/watch?v=BA8mYfYl8kc","FileUrl":"http://www.keithandthegirl.com/vip/download/shows/danny/TTSWD-2013-07-25.mp3","Type":"0","Public":"0","Timestamp":1374775200,"Guests":[]},{"ShowId":"2798","ShowNameId":"9","Number":"41","PostedDate":"7/18/2013 9:00:00 AM","Title":"Dog Days","VideoFileUrl":"https://www.keithandthegirl.com/vip/download/shows/danny/video/41/TTSWD-2013-07-18.m3u8","VideoThumbnailUrl":"https://www.keithandthegirl.com/vip/download/shows/danny/video/41/TTSWD-2013-07-18-video.jpg","PreviewUrl":"http://www.youtube.com/watch?v=_BQF5t-ZUg8","FileUrl":"http://www.keithandthegirl.com/vip/download/shows/danny/TTSWD-2013-07-18.mp3","Type":"0","Public":"0","Timestamp":1374152400,"Guests":[]},{"ShowId":"2792","ShowNameId":"9","Number":"40","PostedDate":"7/11/2013 2:00:00 PM","Title":"This is 40","VideoFileUrl":"https://www.keithandthegirl.com/vip/download/shows/danny/video/40/TTSWD-2013-07-11.m3u8","VideoThumbnailUrl":"https://www.keithandthegirl.com/vip/download/shows/danny/video/40/TTSWD-2013-07-11-video.jpg","PreviewUrl":"http://www.youtube.com/watch?v=BQBjVr1iHH4","FileUrl":"http://www.keithandthegirl.com/vip/download/shows/danny/TTSWD-2013-07-11.mp3","Type":"0","Public":"0","Timestamp":1373565600,"Guests":[{"Data":"92","ShowGuestId":"92","RealName":"Myq Kaplan","Description":"Comedian known for his appearances on Last Comic Standing and The Late Show with David Letterman, and for hosting the podcast Hang Out with Me.","PictureFilename":"Myq-Kaplan.jpg","Url1":"http://www.godzillionaire.blogspot.com","Url2":"http://www.myqkaplan.com","PictureUrl":"http://static-4.keithandthegirl.net/guests/pics/processed/Myq-Kaplan-150x150.jpg","PictureUrlLarge":"http://static-4.keithandthegirl.net/guests/pics/processed/Myq-Kaplan-600x600.jpg"}]},{"ShowId":"2780","ShowNameId":"9","Number":"39","PostedDate":"7/4/2013 12:00:00 PM","Title":"Modesty is the Best Policy","VideoFileUrl":"https://www.keithandthegirl.com/vip/download/shows/danny/video/39/TTSWD-2013-07-04.m3u8","VideoThumbnailUrl":"https://www.keithandthegirl.com/vip/download/shows/danny/video/39/TTSWD-2013-07-04-video.jpg","PreviewUrl":"http://www.youtube.com/watch?v=fri3fjkC9Z8","FileUrl":"http://www.keithandthegirl.com/vip/download/shows/danny/TTSWD-2013-07-04.mp3","Type":"0","Public":"0","Timestamp":1372953600,"Guests":[]},{"ShowId":"2773","ShowNameId":"9","Number":"38","PostedDate":"6/28/2013 7:30:00 PM","Title":"Bye, Polar","VideoFileUrl":"https://www.keithandthegirl.com/vip/download/shows/danny/video/38/TTSWD-2013-06-28.m3u8","VideoThumbnailUrl":"https://www.keithandthegirl.com/vip/download/shows/danny/video/38/TTSWD-2013-06-28-video.jpg","PreviewUrl":"http://www.youtube.com/watch?v=GWYLilNZ8sg","FileUrl":"http://www.keithandthegirl.com/vip/download/shows/danny/TTSWD-2013-06-28.mp3","Type":"0","Public":"0","Timestamp":1372462200,"Guests":[]},{"ShowId":"2756","ShowNameId":"9","Number":"37","PostedDate":"6/13/2013 12:00:00 PM","Title":"And Here\u0027s Your Host, Brother Love!!!","VideoFileUrl":"https://www.keithandthegirl.com/vip/download/shows/danny/video/37/TTSWD-2013-06-13.m3u8","VideoThumbnailUrl":"https://www.keithandthegirl.com/vip/download/shows/danny/video/37/TTSWD-2013-06-13-video.jpg","PreviewUrl":"https://www.youtube.com/watch?v=tUtsKeKA5pU","FileUrl":"http://www.keithandthegirl.com/vip/download/shows/danny/TTSWD-2013-06-13.mp3","Type":"0","Public":"0","Timestamp":1371139200,"Guests":[{"Data":"9","ShowGuestId":"9","RealName":"Brother Love","Description":"Host of The Brother Love Owwwr! and founder of Them Vibes.","PictureFilename":"Brother-Love.jpg","Url1":"http://www.facebook.com/brotherlove","Url2":"http://www.brotherloverocks.com","PictureUrl":"http://static-4.keithandthegirl.net/guests/pics/processed/Brother-Love-150x150.jpg","PictureUrlLarge":"http://static-4.keithandthegirl.net/guests/pics/processed/Brother-Love-600x600.jpg"}]},{"ShowId":"2746","ShowNameId":"9","Number":"36","PostedDate":"6/6/2013 9:30:00 PM","Title":"That\u0027s the Show with Danny with Adam Brown, Minus Chemda","PreviewUrl":"","FileUrl":"http://www.keithandthegirl.com/vip/download/shows/danny/TTSWD-2013-06-06.mp3","Type":"0","Public":"0","Timestamp":1370568600,"Guests":[{"Data":"62","ShowGuestId":"62","RealName":"Adam Brown","Description":"Keith\u0027s Brooklyn Roommate, featured on Keith\u0027s DVD commentaries.","PictureFilename":"Adam-Brown.jpg","Url1":"","Url2":"","PictureUrl":"http://static-4.keithandthegirl.net/guests/pics/processed/Adam-Brown-150x150.jpg","PictureUrlLarge":"http://static-4.keithandthegirl.net/guests/pics/processed/Adam-Brown-600x600.jpg"}]},{"ShowId":"2725","ShowNameId":"9","Number":"35","PostedDate":"5/31/2013 7:00:00 PM","Title":"That\u0027s the Show with Danny with Chris Gethard","PreviewUrl":"","FileUrl":"http://www.keithandthegirl.com/vip/download/shows/danny/TTSWD-2013-05-31.mp3","Type":"0","Public":"0","Timestamp":1370041200,"Guests":[{"Data":"314","ShowGuestId":"314","RealName":"Chris Gethard","Description":"Comedian and writer best known for his book A Bad Idea I\u0027m About to Do and his television show The Chris Gethard Show.","PictureFilename":"Chris-Gethard.jpg","Url1":"","Url2":"http://thechrisgethardshow.com/","PictureUrl":"http://static-3.keithandthegirl.net/guests/pics/processed/Chris-Gethard-150x150.jpg","PictureUrlLarge":"http://static-3.keithandthegirl.net/guests/pics/processed/Chris-Gethard-600x600.jpg"}]},{"ShowId":"2664","ShowNameId":"9","Number":"34","PostedDate":"5/23/2013 5:00:00 PM","Title":"Cat Calls","PreviewUrl":"","FileUrl":"http://www.keithandthegirl.com/vip/download/shows/danny/TTSWD-2013-05-23.mp3","Type":"0","Public":"0","Timestamp":1369342800,"Guests":[]},{"ShowId":"2656","ShowNameId":"9","Number":"33","PostedDate":"5/16/2013 8:00:00 PM","Title":"A Heartbreaking Work of Staggering Penis","PreviewUrl":"","FileUrl":"http://www.keithandthegirl.com/vip/download/shows/danny/TTSWD-2013-05-16.mp3","Type":"0","Public":"0","Timestamp":1368748800,"Guests":[]},{"ShowId":"2650","ShowNameId":"9","Number":"32","PostedDate":"5/9/2013 7:00:00 PM","Title":"Mensa","PreviewUrl":"","FileUrl":"http://www.keithandthegirl.com/vip/download/shows/danny/TTSWD-2013-05-09.mp3","Type":"0","Public":"0","Timestamp":1368140400,"Guests":[]},{"ShowId":"2642","ShowNameId":"9","Number":"31","PostedDate":"5/2/2013 8:00:00 PM","Title":"Death Death Death Death Die Die Die Therapy","PreviewUrl":"","FileUrl":"http://www.keithandthegirl.com/vip/download/shows/danny/TTSWD-2013-05-02.mp3","Type":"0","Public":"0","Timestamp":1367539200,"Guests":[{"Data":"106","ShowGuestId":"106","RealName":"Lauren Hennessy","Description":"Icelandic Academy Award nominated actor, host of the podcast Bottoms Up with Hennessy, and Chemda\u0027s fiancé.","PictureFilename":"Lauren-Hennessy.jpg","Url1":"http://laurenhennessy.com","Url2":"http://www.facebook.com/lauren.hennessy","PictureUrl":"http://static-1.keithandthegirl.net/guests/pics/processed/Lauren-Hennessy-150x150.jpg","PictureUrlLarge":"http://static-1.keithandthegirl.net/guests/pics/processed/Lauren-Hennessy-600x600.jpg"}]},{"ShowId":"2635","ShowNameId":"9","Number":"30","PostedDate":"4/25/2013 7:00:00 PM","Title":"Keith and Chemda Hated My First Two Descriptions For This Episode","PreviewUrl":"","FileUrl":"http://www.keithandthegirl.com/vip/download/shows/danny/TTSWD-2013-04-25.mp3","Type":"0","Public":"0","Timestamp":1366930800,"Guests":[]},{"ShowId":"2617","ShowNameId":"9","Number":"28","PostedDate":"4/4/2013 12:00:00 PM","Title":"(What\u0027s So Funny \u0027Bout) Peace, Love, and Understanding ","PreviewUrl":"","FileUrl":"http://www.keithandthegirl.com/vip/download/shows/danny/TTSWD-2013-04-04.mp3","Type":"0","Public":"0","Timestamp":1365091200,"Guests":[]},{"ShowId":"2610","ShowNameId":"9","Number":"27","PostedDate":"3/28/2013 9:00:00 PM","Title":"The 27 Club","PreviewUrl":"","FileUrl":"http://www.keithandthegirl.com/vip/download/shows/danny/TTSWD-2013-03-28.mp3","Type":"0","Public":"0","Timestamp":1364518800,"Guests":[]},{"ShowId":"2600","ShowNameId":"9","Number":"26","PostedDate":"3/21/2013 8:00:00 PM","Title":"Great, Another One Of These","PreviewUrl":"","FileUrl":"http://www.keithandthegirl.com/vip/download/shows/danny/TTSWD-2013-03-21.mp3","Type":"0","Public":"0","Timestamp":1363910400,"Guests":[]},{"ShowId":"2594","ShowNameId":"9","Number":"25","PostedDate":"3/14/2013 7:00:00 PM","Title":"Hey","PreviewUrl":"","FileUrl":"http://www.keithandthegirl.com/vip/download/shows/danny/TTSWD-2013-03-14.mp3","Type":"0","Public":"0","Timestamp":1363302000,"Guests":[{"Data":"480","ShowGuestId":"480","RealName":"Kathryn Perry","Description":"Danny\u0027s former high school classmate and first crush.","PictureFilename":"kathrynperry.jpg","Url1":"","Url2":"https://www.facebook.com/kathryn.perry.18","PictureUrl":"http://static-2.keithandthegirl.net/guests/pics/processed/kathrynperry-150x150.jpg","PictureUrlLarge":"http://static-2.keithandthegirl.net/guests/pics/processed/kathrynperry-600x600.jpg"}]},{"ShowId":"2586","ShowNameId":"9","Number":"24","PostedDate":"3/8/2013 5:00:00 PM","Title":"Dreams Do Come True","PreviewUrl":"","FileUrl":"http://www.keithandthegirl.com/vip/download/shows/danny/TTSWD-2013-03-08.mp3","Type":"0","Public":"0","Timestamp":1362780000,"Guests":[{"Data":"254","ShowGuestId":"254","RealName":"Eugene Mirman","Description":"Comedian best known for his starring role on Bob\u0027s Burgers and his appearances on Flight of the Concords and Delocated.","PictureFilename":"Eugene-Mirman.jpg","Url1":"http://eugenemirman.com","Url2":"","PictureUrl":"http://static-1.keithandthegirl.net/guests/pics/processed/Eugene-Mirman-150x150.jpg","PictureUrlLarge":"http://static-1.keithandthegirl.net/guests/pics/processed/Eugene-Mirman-600x600.jpg"}]},{"ShowId":"2578","ShowNameId":"9","Number":"23","PostedDate":"2/28/2013 8:00:00 PM","Title":"The Show that Broke the Camel\u0027s Back","PreviewUrl":"","FileUrl":"http://www.keithandthegirl.com/vip/download/shows/danny/TTSWD-2013-02-28.mp3","Type":"0","Public":"0","Timestamp":1362099600,"Guests":[]},{"ShowId":"2569","ShowNameId":"9","Number":"22","PostedDate":"2/21/2013 12:00:00 PM","Title":"Bridgeburner","PreviewUrl":"","FileUrl":"http://www.keithandthegirl.com/vip/download/shows/danny/TTSWD-2013-02-21.mp3","Type":"0","Public":"0","Timestamp":1361466000,"Guests":[]},{"ShowId":"2560","ShowNameId":"9","Number":"21","PostedDate":"2/11/2013 12:00:00 PM","Title":"That\u0027s the Show with Apples","PreviewUrl":"","FileUrl":"http://www.keithandthegirl.com/vip/download/shows/danny/TTSWD-2013-02-11.mp3","Type":"0","Public":"0","Timestamp":1360602000,"Guests":[]},{"ShowId":"2556","ShowNameId":"9","Number":"20","PostedDate":"2/7/2013 2:00:00 PM","Title":"KATGuh Bait","PreviewUrl":"","FileUrl":"http://www.keithandthegirl.com/vip/download/shows/danny/TTSWD-2013-02-07.mp3","Type":"0","Public":"0","Timestamp":1360263600,"Guests":[]},{"ShowId":"2548","ShowNameId":"9","Number":"19","PostedDate":"1/31/2013 12:00:00 PM","Title":"That\u0027s the Live Show with Danny","PreviewUrl":"","FileUrl":"http://www.keithandthegirl.com/vip/download/shows/danny/TTSWD-2013-01-31.mp3","Type":"0","Public":"0","Timestamp":1359651600,"Guests":[]},{"ShowId":"2541","ShowNameId":"9","Number":"18","PostedDate":"1/24/2013 7:00:00 PM","Title":"Bring-Bring!","PreviewUrl":"","FileUrl":"http://www.keithandthegirl.com/vip/download/shows/danny/TTSWD-2013-01-24.mp3","Type":"0","Public":"0","Timestamp":1359072000,"Guests":[]},{"ShowId":"2535","ShowNameId":"9","Number":"17","PostedDate":"1/17/2013 5:30:00 PM","Title":"That was the Show with Danny","PreviewUrl":"","FileUrl":"http://www.keithandthegirl.com/vip/download/shows/danny/TTSWD-2013-01-17.mp3","Type":"0","Public":"0","Timestamp":1358461800,"Guests":[]},{"ShowId":"2530","ShowNameId":"9","Number":"16","PostedDate":"1/7/2013","Title":"DeLIVERing You Great Comedy Since 2012! Get it, Liver?","PreviewUrl":"","FileUrl":"http://www.keithandthegirl.com/vip/download/shows/danny/TTSWD-2013-01-07.mp3","Type":"0","Public":"0","Timestamp":1357534800,"Guests":[]},{"ShowId":"2524","ShowNameId":"9","Number":"15","PostedDate":"12/20/2012 5:00:00 PM","Title":"Holden Caulfield? More like Holden Great Conversations! High Five!","PreviewUrl":"","FileUrl":"http://www.keithandthegirl.com/vip/download/shows/danny/TTSWD-2012-12-20.mp3","Type":"0","Public":"0","Timestamp":1356040800,"Guests":[]},{"ShowId":"2516","ShowNameId":"9","Number":"14","PostedDate":"12/13/2012 6:00:00 PM","Title":"Broadpod","PreviewUrl":"","FileUrl":"http://www.keithandthegirl.com/vip/download/shows/danny/TTSWD-2012-12-13.mp3","Type":"0","Public":"0","Timestamp":1355439600,"Guests":[{"Data":"107","ShowGuestId":"107","RealName":"Micah Sherman","Description":"Comedian known for his documentary Like Me.","PictureFilename":"Micah-Sherman.jpg","Url1":"http://facebook.com/professionaldork","Url2":"http://www.micahsherman.com","PictureUrl":"http://static-2.keithandthegirl.net/guests/pics/processed/Micah-Sherman-150x150.jpg","PictureUrlLarge":"http://static-2.keithandthegirl.net/guests/pics/processed/Micah-Sherman-600x600.jpg"},{"Data":"92","ShowGuestId":"92","RealName":"Myq Kaplan","Description":"Comedian known for his appearances on Last Comic Standing and The Late Show with David Letterman, and for hosting the podcast Hang Out with Me.","PictureFilename":"Myq-Kaplan.jpg","Url1":"http://www.godzillionaire.blogspot.com","Url2":"http://www.myqkaplan.com","PictureUrl":"http://static-4.keithandthegirl.net/guests/pics/processed/Myq-Kaplan-150x150.jpg","PictureUrlLarge":"http://static-4.keithandthegirl.net/guests/pics/processed/Myq-Kaplan-600x600.jpg"}]},{"ShowId":"2509","ShowNameId":"9","Number":"13","PostedDate":"12/6/2012","Title":"Sorry, Mom","PreviewUrl":"http://www.keithandthegirl.com/mp3/promo/thats-the-show-with-danny/teaser-13.mp3","FileUrl":"http://www.keithandthegirl.com/vip/download/shows/danny/TTSWD-2012-12-06.mp3","Type":"0","Public":"0","Timestamp":1354770000,"Guests":[{"Data":"106","ShowGuestId":"106","RealName":"Lauren Hennessy","Description":"Icelandic Academy Award nominated actor, host of the podcast Bottoms Up with Hennessy, and Chemda\u0027s fiancé.","PictureFilename":"Lauren-Hennessy.jpg","Url1":"http://laurenhennessy.com","Url2":"http://www.facebook.com/lauren.hennessy","PictureUrl":"http://static-1.keithandthegirl.net/guests/pics/processed/Lauren-Hennessy-150x150.jpg","PictureUrlLarge":"http://static-1.keithandthegirl.net/guests/pics/processed/Lauren-Hennessy-600x600.jpg"}]},{"ShowId":"2503","ShowNameId":"9","Number":"12","PostedDate":"11/15/2012 2:20:00 PM","Title":"Butthurt","PreviewUrl":"http://www.keithandthegirl.com/mp3/promo/thats-the-show-with-danny/teaser-12.mp3","FileUrl":"http://www.keithandthegirl.com/vip/download/shows/danny/TTSWD-2012-11-15.mp3","Type":"0","Public":"0","Timestamp":1353007200,"Guests":[{"Data":"169","ShowGuestId":"169","RealName":"Lucas McCain","Description":"Hermit and former intern.","PictureFilename":"Lucas-McCain.jpg","Url1":"","Url2":"http://www.knucklewalker.com/","PictureUrl":"http://static-3.keithandthegirl.net/guests/pics/processed/Lucas-McCain-150x150.jpg","PictureUrlLarge":"http://static-3.keithandthegirl.net/guests/pics/processed/Lucas-McCain-600x600.jpg"}]},{"ShowId":"2497","ShowNameId":"9","Number":"11","PostedDate":"11/8/2012 12:00:00 PM","Title":"Triumphant Return","PreviewUrl":"http://www.keithandthegirl.com/mp3/promo/thats-the-show-with-danny/teaser-11.mp3","FileUrl":"http://www.keithandthegirl.com/vip/download/shows/danny/TTSWD-2012-11-08.mp3","Type":"0","Public":"0","Timestamp":1352394000,"Guests":[]},{"ShowId":"2488","ShowNameId":"9","Number":"10","PostedDate":"10/25/2012 7:00:00 PM","Title":"Robert Downer, Jr.","PreviewUrl":"","FileUrl":"http://www.keithandthegirl.com/vip/download/shows/danny/TTSWD-2012-10-25.mp3","Type":"0","Public":"0","Timestamp":1351206000,"Guests":[]},{"ShowId":"2481","ShowNameId":"9","Number":"9","PostedDate":"10/18/2012 6:00:00 PM","Title":"Holy Shit There Are Nine of These","PreviewUrl":"","FileUrl":"http://www.keithandthegirl.com/vip/download/shows/danny/TTSWD-2012-10-18.mp3","Type":"0","Public":"0","Timestamp":1350597600,"Guests":[{"Data":"107","ShowGuestId":"107","RealName":"Micah Sherman","Description":"Comedian known for his documentary Like Me.","PictureFilename":"Micah-Sherman.jpg","Url1":"http://facebook.com/professionaldork","Url2":"http://www.micahsherman.com","PictureUrl":"http://static-2.keithandthegirl.net/guests/pics/processed/Micah-Sherman-150x150.jpg","PictureUrlLarge":"http://static-2.keithandthegirl.net/guests/pics/processed/Micah-Sherman-600x600.jpg"},{"Data":"92","ShowGuestId":"92","RealName":"Myq Kaplan","Description":"Comedian known for his appearances on Last Comic Standing and The Late Show with David Letterman, and for hosting the podcast Hang Out with Me.","PictureFilename":"Myq-Kaplan.jpg","Url1":"http://www.godzillionaire.blogspot.com","Url2":"http://www.myqkaplan.com","PictureUrl":"http://static-4.keithandthegirl.net/guests/pics/processed/Myq-Kaplan-150x150.jpg","PictureUrlLarge":"http://static-4.keithandthegirl.net/guests/pics/processed/Myq-Kaplan-600x600.jpg"}]},{"ShowId":"2476","ShowNameId":"9","Number":"8","PostedDate":"10/12/2012 6:00:00 PM","Title":"This Show is Literally a Cry for Help","PreviewUrl":"","FileUrl":"http://www.keithandthegirl.com/vip/download/shows/danny/TTSWD-2012-10-12.mp3","Type":"0","Public":"0","Timestamp":1350079200,"Guests":[{"Data":"238","ShowGuestId":"238","RealName":"Kirstie Wolf","Description":"Danny\u0027s ex-girlfriend.","PictureFilename":"Kirstie-Wolf.jpg","Url1":"","Url2":"","PictureUrl":"http://static-2.keithandthegirl.net/guests/pics/processed/Kirstie-Wolf-150x150.jpg","PictureUrlLarge":"http://static-2.keithandthegirl.net/guests/pics/processed/Kirstie-Wolf-600x600.jpg"}]},{"ShowId":"2470","ShowNameId":"9","Number":"7","PostedDate":"10/4/2012","Title":"Well, I Guess Fucking Libby\u0027s Back. Awesome.","PreviewUrl":"","FileUrl":"http://www.keithandthegirl.com/vip/download/shows/danny/TTSWD-2012-10-04.mp3","Type":"0","Public":"0","Timestamp":1349323200,"Guests":[{"Data":"479","ShowGuestId":"479","RealName":"Libby","Description":"Former Keith and The Girl PR representative and co-host of That\u0027s the Show with Danny.","PictureFilename":"libbyphillips.jpg","Url1":"","Url2":"https://twitter.com/ragingapathetic","PictureUrl":"http://static-4.keithandthegirl.net/guests/pics/processed/libbyphillips-150x150.jpg","PictureUrlLarge":"http://static-4.keithandthegirl.net/guests/pics/processed/libbyphillips-600x600.jpg"}]},{"ShowId":"2464","ShowNameId":"9","Number":"6","PostedDate":"9/27/2012 10:00:00 PM","Title":"Off the Deep End","PreviewUrl":"","FileUrl":"http://www.keithandthegirl.com/vip/download/shows/danny/TTSWD-2012-09-27.mp3","Type":"0","Public":"0","Timestamp":1348797600,"Guests":[]},{"ShowId":"2421","ShowNameId":"9","Number":"5","PostedDate":"9/20/2012 7:00:00 PM","Title":"Skip This One, Dad","PreviewUrl":"","FileUrl":"http://www.keithandthegirl.com/vip/download/shows/danny/TTSWD-2012-09-20.mp3","Type":"0","Public":"0","Timestamp":1348182000,"Guests":[{"Data":"106","ShowGuestId":"106","RealName":"Lauren Hennessy","Description":"Icelandic Academy Award nominated actor, host of the podcast Bottoms Up with Hennessy, and Chemda\u0027s fiancé.","PictureFilename":"Lauren-Hennessy.jpg","Url1":"http://laurenhennessy.com","Url2":"http://www.facebook.com/lauren.hennessy","PictureUrl":"http://static-1.keithandthegirl.net/guests/pics/processed/Lauren-Hennessy-150x150.jpg","PictureUrlLarge":"http://static-1.keithandthegirl.net/guests/pics/processed/Lauren-Hennessy-600x600.jpg"}]},{"ShowId":"2418","ShowNameId":"9","Number":"4","PostedDate":"9/13/2012 8:00:00 PM","Title":"Morning Zoo Lou","PreviewUrl":"","FileUrl":"http://www.keithandthegirl.com/vip/download/shows/danny/TTSWD-2012-09-13.mp3","Type":"0","Public":"0","Timestamp":1347580800,"Guests":[{"Data":"479","ShowGuestId":"479","RealName":"Libby","Description":"Former Keith and The Girl PR representative and co-host of That\u0027s the Show with Danny.","PictureFilename":"libbyphillips.jpg","Url1":"","Url2":"https://twitter.com/ragingapathetic","PictureUrl":"http://static-4.keithandthegirl.net/guests/pics/processed/libbyphillips-150x150.jpg","PictureUrlLarge":"http://static-4.keithandthegirl.net/guests/pics/processed/libbyphillips-600x600.jpg"}]},{"ShowId":"2411","ShowNameId":"9","Number":"3","PostedDate":"9/6/2012 11:00:00 PM","Title":"Book Things","PreviewUrl":"","FileUrl":"http://www.keithandthegirl.com/vip/download/shows/danny/TTSWD-2012-09-06.mp3","Type":"0","Public":"0","Timestamp":1346986800,"Guests":[{"Data":"136","ShowGuestId":"136","RealName":"Scott Sigler","Description":"New York Times Bestselling Author of the Infected trilogy.","PictureFilename":"Scott-Sigler.jpg","Url1":"http://www.facebook.com/ScottSiglerPage","Url2":"http://www.scottsigler.com","PictureUrl":"http://static-2.keithandthegirl.net/guests/pics/processed/Scott-Sigler-150x150.jpg","PictureUrlLarge":"http://static-2.keithandthegirl.net/guests/pics/processed/Scott-Sigler-600x600.jpg"}]},{"ShowId":"2406","ShowNameId":"9","Number":"2","PostedDate":"8/30/2012 5:00:00 PM","Title":"Follow Your Deans","PreviewUrl":"","FileUrl":"http://www.keithandthegirl.com/vip/download/shows/danny/TTSWD-2012-08-30.mp3","Type":"0","Public":"0","Timestamp":1346360400,"Guests":[{"Data":"479","ShowGuestId":"479","RealName":"Libby","Description":"Former Keith and The Girl PR representative and co-host of That\u0027s the Show with Danny.","PictureFilename":"libbyphillips.jpg","Url1":"","Url2":"https://twitter.com/ragingapathetic","PictureUrl":"http://static-4.keithandthegirl.net/guests/pics/processed/libbyphillips-150x150.jpg","PictureUrlLarge":"http://static-4.keithandthegirl.net/guests/pics/processed/libbyphillips-600x600.jpg"}]},{"ShowId":"2397","ShowNameId":"9","Number":"1","PostedDate":"8/23/2012","Title":"Test Pilot","PreviewUrl":"","FileUrl":"http://www.keithandthegirl.com/vip/download/shows/danny/TTSWD-2012-08-23.mp3","Type":"0","Public":"0","Timestamp":1345694400,"Guests":[{"Data":"479","ShowGuestId":"479","RealName":"Libby","Description":"Former Keith and The Girl PR representative and co-host of That\u0027s the Show with Danny.","PictureFilename":"libbyphillips.jpg","Url1":"","Url2":"https://twitter.com/ragingapathetic","PictureUrl":"http://static-4.keithandthegirl.net/guests/pics/processed/libbyphillips-150x150.jpg","PictureUrlLarge":"http://static-4.keithandthegirl.net/guests/pics/processed/libbyphillips-600x600.jpg"}]}]