[{"ShowId":"3873","ShowNameId":"5","Number":"72","PostedDate":"7/2/2015 12:00:00 PM","Title":"Tourette Syndrome","VideoFileUrl":"https://www.keithandthegirl.com/vip/download/shows/wmn/video/72/WMN-2015-07-02.m3u8","VideoThumbnailUrl":"https://www.keithandthegirl.com/vip/download/shows/wmn/video/72/WMN-2015-07-02-video.jpg","PreviewUrl":"https://www.youtube.com/watch?v=IHAZj34M-Rc","FileUrl":"http://www.keithandthegirl.com/vip/download/shows/wmn/WMN-2015-07-02.mp3","Type":"0","Public":"0","Timestamp":1435852800,"Guests":[]},{"ShowId":"3819","ShowNameId":"5","Number":"71","PostedDate":"5/27/2015 12:00:00 PM","Title":"Swingers","VideoFileUrl":"https://www.keithandthegirl.com/vip/download/shows/wmn/video/71/WMN-2015-05-27.m3u8","VideoThumbnailUrl":"https://www.keithandthegirl.com/vip/download/shows/wmn/video/71/WMN-2015-05-27-video.jpg","PreviewUrl":"https://www.youtube.com/watch?v=m3DTBrleHNc","FileUrl":"http://www.keithandthegirl.com/vip/download/shows/wmn/WMN-2015-05-27.mp3","Type":"0","Public":"0","Timestamp":1432742400,"Guests":[{"Data":"563","ShowGuestId":"563","RealName":"Jason","Description":"Soldier who is married to Jessica and in The Lifestyle.","PictureFilename":"jasonalexander.jpg","Url1":"","Url2":"","PictureUrl":"http://static-4.keithandthegirl.net/guests/pics/processed/jasonalexander-150x150.jpg","PictureUrlLarge":"http://static-4.keithandthegirl.net/guests/pics/processed/jasonalexander-600x600.jpg"},{"Data":"564","ShowGuestId":"564","RealName":"Jessyka","Description":"Jason\u0027s wife. Also in The Lifestyle.","PictureFilename":"jessykaalexander.jpg","Url1":"","Url2":"","PictureUrl":"http://static-2.keithandthegirl.net/guests/pics/processed/jessykaalexander-150x150.jpg","PictureUrlLarge":"http://static-2.keithandthegirl.net/guests/pics/processed/jessykaalexander-600x600.jpg"}]},{"ShowId":"3787","ShowNameId":"5","Number":"70","PostedDate":"4/29/2015 12:00:00 PM","Title":"The Waiter Series: Part 3","PreviewUrl":"","FileUrl":"http://www.keithandthegirl.com/vip/download/shows/wmn/WMN-2015-04-30.mp3","Type":"0","Public":"0","Timestamp":1430323200,"Guests":[{"Data":"263","ShowGuestId":"263","RealName":"Katharine Heller","Description":"Comedian and actress known for hosting the Tell the Bartender podcast.","PictureFilename":"Katharine-Heller.jpg","Url1":"http://katharineheller.com","Url2":"","PictureUrl":"http://static-1.keithandthegirl.net/guests/pics/processed/Katharine-Heller-150x150.jpg","PictureUrlLarge":"http://static-1.keithandthegirl.net/guests/pics/processed/Katharine-Heller-600x600.jpg"},{"Data":"106","ShowGuestId":"106","RealName":"Lauren Hennessy","Description":"Icelandic Academy Award nominated actor, host of the podcast Bottoms Up with Hennessy, and Chemda\u0027s fiancé.","PictureFilename":"Lauren-Hennessy.jpg","Url1":"http://laurenhennessy.com","Url2":"http://www.facebook.com/lauren.hennessy","PictureUrl":"http://static-1.keithandthegirl.net/guests/pics/processed/Lauren-Hennessy-150x150.jpg","PictureUrlLarge":"http://static-1.keithandthegirl.net/guests/pics/processed/Lauren-Hennessy-600x600.jpg"},{"Data":"394","ShowGuestId":"394","RealName":"The Bitchy Waiter","Description":"Blogger and waiter who founded the blog The Bitchy Waiter.","PictureFilename":"BitchyWaiter.jpg","Url1":"https://twitter.com/bitchywaiter","Url2":"http://thebitchywaiter.com/","PictureUrl":"http://static-1.keithandthegirl.net/guests/pics/processed/BitchyWaiter-150x150.jpg","PictureUrlLarge":"http://static-1.keithandthegirl.net/guests/pics/processed/BitchyWaiter-600x600.jpg"}]},{"ShowId":"3748","ShowNameId":"5","Number":"69","PostedDate":"4/3/2015 12:00:00 PM","Title":"The Waiter Series: Part 2","PreviewUrl":"","FileUrl":"http://www.keithandthegirl.com/vip/download/shows/wmn/WMN-2015-04-03.mp3","Type":"0","Public":"0","Timestamp":1428076800,"Guests":[{"Data":"62","ShowGuestId":"62","RealName":"Adam Brown","Description":"Keith\u0027s Brooklyn Roommate, featured on Keith\u0027s DVD commentaries.","PictureFilename":"Adam-Brown.jpg","Url1":"","Url2":"","PictureUrl":"http://static-4.keithandthegirl.net/guests/pics/processed/Adam-Brown-150x150.jpg","PictureUrlLarge":"http://static-4.keithandthegirl.net/guests/pics/processed/Adam-Brown-600x600.jpg"},{"Data":"543","ShowGuestId":"543","RealName":"Keith Malley","Description":"Comedian and host of the Keith and The Girl Network.","PictureFilename":"keithmalley.jpg","Url1":"","Url2":"http://twitter.com/keithmalley","PictureUrl":"http://static-4.keithandthegirl.net/guests/pics/processed/keithmalley-150x150.jpg","PictureUrlLarge":"http://static-4.keithandthegirl.net/guests/pics/processed/keithmalley-600x600.jpg"}]},{"ShowId":"3693","ShowNameId":"5","Number":"68","PostedDate":"2/25/2015 12:00:00 PM","Title":"The Waiter Series: Part 1","PreviewUrl":"","FileUrl":"http://www.keithandthegirl.com/vip/download/shows/wmn/WMN-2015-02-25.mp3","Type":"0","Public":"0","Timestamp":1424883600,"Guests":[{"Data":"222","ShowGuestId":"222","RealName":"Annie Lederman","Description":"Comedian and actress who has appeared both on Chelsea Lately and in Grand Theft Auto V.","PictureFilename":"Annie-Lederman.jpg","Url1":"http://www.annielederman.com/","Url2":"","PictureUrl":"http://static-1.keithandthegirl.net/guests/pics/processed/Annie-Lederman-150x150.jpg","PictureUrlLarge":"http://static-1.keithandthegirl.net/guests/pics/processed/Annie-Lederman-600x600.jpg"},{"Data":"133","ShowGuestId":"133","RealName":"Diane O\u0027Debra","Description":"Comedian and actress known for her duo with her twin sister, The O\u0027Debra Twins, which won a Village Voice Best of New York Award and received ECNY Award Nomination for Best Duo.","PictureFilename":"Diane-ODebra.jpg","Url1":"http://www.facebook.com/diane.odebra","Url2":"","PictureUrl":"http://static-3.keithandthegirl.net/guests/pics/processed/Diane-ODebra-150x150.jpg","PictureUrlLarge":"http://static-3.keithandthegirl.net/guests/pics/processed/Diane-ODebra-600x600.jpg"},{"Data":"243","ShowGuestId":"243","RealName":"Jess Wood","Description":"Comedian best known for her appearances on AXS TV\u0027s Gotham Comedy Live and for hosting The Ratchet Hatchet podcast.","PictureFilename":"Jess-Wood.jpg","Url1":"http://thejesswood.wordpress.com","Url2":"","PictureUrl":"http://static-3.keithandthegirl.net/guests/pics/processed/Jess-Wood-150x150.jpg","PictureUrlLarge":"http://static-3.keithandthegirl.net/guests/pics/processed/Jess-Wood-600x600.jpg"},{"Data":"51","ShowGuestId":"51","RealName":"Jesse Joyce","Description":"Comedian and writer who wrote for numerous Comedy Central Roasts and the 85th Academy Awards ceremony.","PictureFilename":"Jesse-Joyce.jpg","Url1":"http://www.facebook.com/profile.php?id=506265141\u0026ref=ts#!/JesseJoyce.comedy","Url2":"http://www.jessejoyce.com","PictureUrl":"http://static-1.keithandthegirl.net/guests/pics/processed/Jesse-Joyce-150x150.jpg","PictureUrlLarge":"http://static-1.keithandthegirl.net/guests/pics/processed/Jesse-Joyce-600x600.jpg"}]},{"ShowId":"3624","ShowNameId":"5","Number":"67","PostedDate":"1/7/2015","Title":"Male Escort","VideoFileUrl":"https://www.keithandthegirl.com/vip/download/shows/wmn/video/67/WMN-2015-01-07.m3u8","VideoThumbnailUrl":"https://www.keithandthegirl.com/vip/download/shows/wmn/video/67/WMN-2015-01-07-video.jpg","PreviewUrl":"https://www.youtube.com/watch?v=03IRbL-AEvQ","FileUrl":"http://www.keithandthegirl.com/vip/download/shows/wmn/WMN-2015-01-07.mp3","Type":"0","Public":"0","Timestamp":1420606800,"Guests":[]},{"ShowId":"3557","ShowNameId":"5","Number":"66","PostedDate":"11/26/2014 12:00:00 PM","Title":"Burlesque","VideoFileUrl":"https://www.keithandthegirl.com/vip/download/shows/wmn/video/66/WMN-2014-11-26.m3u8","VideoThumbnailUrl":"https://www.keithandthegirl.com/vip/download/shows/wmn/video/66/WMN-2014-11-26-video.jpg","PreviewUrl":"https://www.youtube.com/watch?v=T4qJUMmWW7s","FileUrl":"http://www.keithandthegirl.com/vip/download/shows/wmn/WMN-2014-11-26.mp3","Type":"0","Public":"0","Timestamp":1417021200,"Guests":[]},{"ShowId":"3514","ShowNameId":"5","Number":"65","PostedDate":"10/29/2014 12:00:00 PM","Title":"The Saw Lady","VideoFileUrl":"https://www.keithandthegirl.com/vip/download/shows/wmn/video/65/WMN-2014-10-29.m3u8","VideoThumbnailUrl":"https://www.keithandthegirl.com/vip/download/shows/wmn/video/65/WMN-2014-10-29-video.jpg","PreviewUrl":"https://www.youtube.com/watch?v=7fxKywRPYWU","FileUrl":"http://www.keithandthegirl.com/vip/download/shows/wmn/WMN-2014-10-29.mp3","Type":"0","Public":"0","Timestamp":1414598400,"Guests":[]},{"ShowId":"3472","ShowNameId":"5","Number":"64","PostedDate":"10/1/2014 12:00:00 PM","Title":"Grindr Experiences","VideoFileUrl":"https://www.keithandthegirl.com/vip/download/shows/wmn/video/64/WMN-2014-10-01.m3u8","VideoThumbnailUrl":"https://www.keithandthegirl.com/vip/download/shows/wmn/video/64/WMN-2014-10-01-video.jpg","PreviewUrl":"https://www.youtube.com/watch?v=oPfjWtpOFHc","FileUrl":"http://www.keithandthegirl.com/vip/download/shows/wmn/WMN-2014-10-01.mp3","Type":"0","Public":"0","Timestamp":1412179200,"Guests":[]},{"ShowId":"3422","ShowNameId":"5","Number":"63","PostedDate":"8/27/2014 12:00:00 PM","Title":"Small Town USA","VideoFileUrl":"https://www.keithandthegirl.com/vip/download/shows/wmn/video/63/WMN-2014-08-27.m3u8","VideoThumbnailUrl":"https://www.keithandthegirl.com/vip/download/shows/wmn/video/63/WMN-2014-08-27-video.jpg","PreviewUrl":"https://www.youtube.com/watch?v=BzLBWfULzHU","FileUrl":"http://www.keithandthegirl.com/vip/download/shows/wmn/WMN-2014-08-27.mp3","Type":"0","Public":"0","Timestamp":1409155200,"Guests":[]},{"ShowId":"3388","ShowNameId":"5","Number":"62","PostedDate":"8/6/2014 12:00:00 PM","Title":"When Panic Attacks","VideoFileUrl":"https://www.keithandthegirl.com/vip/download/shows/wmn/video/62/WMN-2014-08-06.m3u8","VideoThumbnailUrl":"https://www.keithandthegirl.com/vip/download/shows/wmn/video/62/WMN-2014-08-06-video.jpg","PreviewUrl":"https://www.youtube.com/watch?v=1j8xAiQdJxM","FileUrl":"http://www.keithandthegirl.com/vip/download/shows/wmn/WMN-2014-08-06.mp3","Type":"0","Public":"0","Timestamp":1407340800,"Guests":[]},{"ShowId":"3325","ShowNameId":"5","Number":"61","PostedDate":"6/25/2014 12:00:00 PM","Title":"Surf Reality","VideoFileUrl":"https://www.keithandthegirl.com/vip/download/shows/wmn/video/61/WMN-2014-06-25.m3u8","VideoThumbnailUrl":"https://www.keithandthegirl.com/vip/download/shows/wmn/video/61/WMN-2014-06-25-video.jpg","PreviewUrl":"https://www.youtube.com/watch?v=q6DLBJ8lK5M","FileUrl":"http://www.keithandthegirl.com/vip/download/shows/wmn/WMN-2014-06-25.mp3","Type":"0","Public":"0","Timestamp":1403712000,"Guests":[]},{"ShowId":"3275","ShowNameId":"5","Number":"60","PostedDate":"5/28/2014 12:00:00 PM","Title":"Intersex","VideoFileUrl":"https://www.keithandthegirl.com/vip/download/shows/wmn/video/60/WMN-2014-05-28.m3u8","VideoThumbnailUrl":"https://www.keithandthegirl.com/vip/download/shows/wmn/video/60/WMN-2014-05-28-video.jpg","PreviewUrl":"https://www.youtube.com/watch?v=empkKOT0j7E","FileUrl":"http://www.keithandthegirl.com/vip/download/shows/wmn/WMN-2014-05-28.mp3","Type":"0","Public":"0","Timestamp":1401292800,"Guests":[]},{"ShowId":"3232","ShowNameId":"5","Number":"59","PostedDate":"4/30/2014 12:00:00 PM","Title":"Awkward Sex Moments","VideoFileUrl":"https://www.keithandthegirl.com/vip/download/shows/wmn/video/59/WMN-2014-04-30.m3u8","VideoThumbnailUrl":"https://www.keithandthegirl.com/vip/download/shows/wmn/video/59/WMN-2014-04-30-video.jpg","PreviewUrl":"https://www.youtube.com/watch?v=GnXRkucq92E","FileUrl":"http://www.keithandthegirl.com/vip/download/shows/wmn/WMN-2014-04-30.mp3","Type":"0","Public":"0","Timestamp":1398873600,"Guests":[{"Data":"262","ShowGuestId":"262","RealName":"Andrea Allan","Description":"Comedian and writer best known for her contributions to College Candy\u0027s Ask a Slut column.","PictureFilename":"Andrea-Allan.jpg","Url1":"http://www.facebook.com/andrea.allan.9","Url2":"","PictureUrl":"http://static-1.keithandthegirl.net/guests/pics/processed/Andrea-Allan-150x150.jpg","PictureUrlLarge":"http://static-1.keithandthegirl.net/guests/pics/processed/Andrea-Allan-600x600.jpg"},{"Data":"236","ShowGuestId":"236","RealName":"Chris Laker","Description":"Comedian best known for hosting the podcasts The Show with Chris Laker, The Week, and This Week in Jackin\u0027.","PictureFilename":"Chris-Laker.jpg","Url1":"http://chrislaker.com/","Url2":"","PictureUrl":"http://static-4.keithandthegirl.net/guests/pics/processed/Chris-Laker-150x150.jpg","PictureUrlLarge":"http://static-4.keithandthegirl.net/guests/pics/processed/Chris-Laker-600x600.jpg"},{"Data":"40","ShowGuestId":"40","RealName":"Christian Finnegan","Description":"Comedian known for his roles on Chapelle\u0027s Show and Are We There Yet? and his Netflix comedy special The Fun Part.","PictureFilename":"Christian-Finnegan.jpg","Url1":"http://www.facebook.com/ChristFinnegan","Url2":"http://christianfinnegan.com","PictureUrl":"http://static-4.keithandthegirl.net/guests/pics/processed/Christian-Finnegan-150x150.jpg","PictureUrlLarge":"http://static-4.keithandthegirl.net/guests/pics/processed/Christian-Finnegan-600x600.jpg"},{"Data":"203","ShowGuestId":"203","RealName":"Danny Hatch","Description":"Comedian, writer, and host of That’s the Show with Danny.","PictureFilename":"Danny-Hatch.jpg","Url1":"http://dannyhatch.tumblr.com","Url2":"http://twitter.com/dannyhatch","PictureUrl":"http://static-3.keithandthegirl.net/guests/pics/processed/Danny-Hatch-150x150.jpg","PictureUrlLarge":"http://static-3.keithandthegirl.net/guests/pics/processed/Danny-Hatch-600x600.jpg"},{"Data":"134","ShowGuestId":"134","RealName":"John F. O\u0027Donnell","Description":"Comedian known for hosting Live From Outer Space comedy show and for appearing as a correspondent on the television show Redacted Tonight.","PictureFilename":"John-F-ODonnell.jpg","Url1":"https://twitter.com/jfodcomedy","Url2":"http://www.livefromouterspace.com","PictureUrl":"http://static-2.keithandthegirl.net/guests/pics/processed/John-F-ODonnell-150x150.jpg","PictureUrlLarge":"http://static-2.keithandthegirl.net/guests/pics/processed/John-F-ODonnell-600x600.jpg"},{"Data":"263","ShowGuestId":"263","RealName":"Katharine Heller","Description":"Comedian and actress known for hosting the Tell the Bartender podcast.","PictureFilename":"Katharine-Heller.jpg","Url1":"http://katharineheller.com","Url2":"","PictureUrl":"http://static-1.keithandthegirl.net/guests/pics/processed/Katharine-Heller-150x150.jpg","PictureUrlLarge":"http://static-1.keithandthegirl.net/guests/pics/processed/Katharine-Heller-600x600.jpg"},{"Data":"270","ShowGuestId":"270","RealName":"Kelly Fastuca","Description":"Comedian best known for her appearances on the You Know What Dude! podcast.","PictureFilename":"Kelly-Fastuca.jpg","Url1":"http://www.kellyfastuca.com","Url2":"http://twitter.com/kellyfastuca","PictureUrl":"http://static-4.keithandthegirl.net/guests/pics/processed/Kelly-Fastuca-150x150.jpg","PictureUrlLarge":"http://static-4.keithandthegirl.net/guests/pics/processed/Kelly-Fastuca-600x600.jpg"},{"Data":"368","ShowGuestId":"368","RealName":"Kevin Allison","Description":"Host of the RISK! podcast, alumna of The State and champion of kinky sex.","PictureFilename":"Kevin-Allison.jpg","Url1":"https://twitter.com/TheKevinAllison","Url2":"http://risk-show.com/","PictureUrl":"http://static-3.keithandthegirl.net/guests/pics/processed/Kevin-Allison-150x150.jpg","PictureUrlLarge":"http://static-3.keithandthegirl.net/guests/pics/processed/Kevin-Allison-600x600.jpg"},{"Data":"357","ShowGuestId":"357","RealName":"Matteo Lane","Description":"Comedian and artist known for hosting the show In Good Spirits at Carolines comedy club.","PictureFilename":"matteo-lane.jpg","Url1":"https://twitter.com/MatteoLane","Url2":"http://mattlaneart.com/home.html","PictureUrl":"http://static-2.keithandthegirl.net/guests/pics/processed/matteo-lane-150x150.jpg","PictureUrlLarge":"http://static-2.keithandthegirl.net/guests/pics/processed/matteo-lane-600x600.jpg"},{"Data":"91","ShowGuestId":"91","RealName":"Myka Fox","Description":"Comedian and writer for Saturday Night Live and someecards, and host of Myka Fox \u0026 Friends.","PictureFilename":"Myka-Fox.jpg","Url1":"http://www.twitter.com/mykafox","Url2":"http://www.facebook.com/mykafox","PictureUrl":"http://static-3.keithandthegirl.net/guests/pics/processed/Myka-Fox-150x150.jpg","PictureUrlLarge":"http://static-3.keithandthegirl.net/guests/pics/processed/Myka-Fox-600x600.jpg"},{"Data":"92","ShowGuestId":"92","RealName":"Myq Kaplan","Description":"Comedian known for his appearances on Last Comic Standing and The Late Show with David Letterman, and for hosting the podcast Hang Out with Me.","PictureFilename":"Myq-Kaplan.jpg","Url1":"http://www.godzillionaire.blogspot.com","Url2":"http://www.myqkaplan.com","PictureUrl":"http://static-4.keithandthegirl.net/guests/pics/processed/Myq-Kaplan-150x150.jpg","PictureUrlLarge":"http://static-4.keithandthegirl.net/guests/pics/processed/Myq-Kaplan-600x600.jpg"}]},{"ShowId":"3192","ShowNameId":"5","Number":"58","PostedDate":"4/2/2014 12:00:00 PM","Title":"Cutting","VideoFileUrl":"https://www.keithandthegirl.com/vip/download/shows/wmn/video/58/WMN-2014-04-02.m3u8","VideoThumbnailUrl":"https://www.keithandthegirl.com/vip/download/shows/wmn/video/58/WMN-2014-04-02-video.jpg","PreviewUrl":"https://www.youtube.com/watch?v=9WvJZYosmFY","FileUrl":"http://www.keithandthegirl.com/vip/download/shows/wmn/WMN-2014-04-02.mp3","Type":"0","Public":"0","Timestamp":1396454400,"Guests":[{"Data":"370","ShowGuestId":"370","RealName":"Justy Dodge","Description":"Comedian and winner of Time Out New York\u0027s Joke of the Week competition.","PictureFilename":"Justy-Dodge.jpg","Url1":"","Url2":"https://twitter.com/justydodge","PictureUrl":"http://static-2.keithandthegirl.net/guests/pics/processed/Justy-Dodge-150x150.jpg","PictureUrlLarge":"http://static-2.keithandthegirl.net/guests/pics/processed/Justy-Dodge-600x600.jpg"}]},{"ShowId":"3153","ShowNameId":"5","Number":"57","PostedDate":"3/5/2014 12:00:00 PM","Title":"Home Schooled","VideoFileUrl":"https://www.keithandthegirl.com/vip/download/shows/wmn/video/57/WMN-2014-03-05.m3u8","VideoThumbnailUrl":"https://www.keithandthegirl.com/vip/download/shows/wmn/video/57/WMN-2014-03-05-video.jpg","PreviewUrl":"https://www.youtube.com/watch?v=R9BWljYvk50","FileUrl":"http://www.keithandthegirl.com/vip/download/shows/wmn/WMN-2014-03-05.mp3","Type":"0","Public":"0","Timestamp":1394038800,"Guests":[{"Data":"453","ShowGuestId":"453","RealName":"Chris Garner","Description":"Comedian and member of the Business Computer improv team.","PictureFilename":"chrisgarner.jpg","Url1":"","Url2":"https://www.facebook.com/Tophergarner","PictureUrl":"http://static-2.keithandthegirl.net/guests/pics/processed/chrisgarner-150x150.jpg","PictureUrlLarge":"http://static-2.keithandthegirl.net/guests/pics/processed/chrisgarner-600x600.jpg"}]},{"ShowId":"3106","ShowNameId":"5","Number":"56","PostedDate":"2/5/2014 12:00:00 PM","Title":"Asexuality","VideoFileUrl":"https://www.keithandthegirl.com/vip/download/shows/wmn/video/56/WMN-2014-02-05.m3u8","VideoThumbnailUrl":"https://www.keithandthegirl.com/vip/download/shows/wmn/video/56/WMN-2014-02-05-video.jpg","PreviewUrl":"http://www.youtube.com/watch?v=TMHtLUkFCfM","FileUrl":"http://www.keithandthegirl.com/vip/download/shows/wmn/WMN-2014-02-05.mp3","Type":"0","Public":"0","Timestamp":1391619600,"Guests":[{"Data":"452","ShowGuestId":"452","RealName":"Ben Rosen","Description":"Comedian and contributing writer at BuzzFeed.","PictureFilename":"benrosen.jpg","Url1":"","Url2":"http://www.rosencomedy.com/","PictureUrl":"http://static-1.keithandthegirl.net/guests/pics/processed/benrosen-150x150.jpg","PictureUrlLarge":"http://static-1.keithandthegirl.net/guests/pics/processed/benrosen-600x600.jpg"}]},{"ShowId":"3074","ShowNameId":"5","Number":"55","PostedDate":"1/15/2014 12:00:00 PM","Title":"Mixed Race","VideoFileUrl":"https://www.keithandthegirl.com/vip/download/shows/wmn/video/55/WMN-2014-01-15.m3u8","VideoThumbnailUrl":"https://www.keithandthegirl.com/vip/download/shows/wmn/video/55/WMN-2014-01-15-video.jpg","PreviewUrl":"http://www.youtube.com/watch?v=j-NaYcOOsyQ","FileUrl":"http://www.keithandthegirl.com/vip/download/shows/wmn/WMN-2014-01-15.mp3","Type":"0","Public":"0","Timestamp":1389805200,"Guests":[{"Data":"451","ShowGuestId":"451","RealName":"Elysee Inzunza","Description":"Production assistant who works at Jupiter Entertainment.","PictureFilename":"elyseeinzunza.jpg","Url1":"","Url2":"https://www.facebook.com/elysee.inzunza","PictureUrl":"http://static-4.keithandthegirl.net/guests/pics/processed/elyseeinzunza-150x150.jpg","PictureUrlLarge":"http://static-4.keithandthegirl.net/guests/pics/processed/elyseeinzunza-600x600.jpg"},{"Data":"387","ShowGuestId":"387","RealName":"Jordan Tierney","Description":"Actor and astrologer who will read your chart and tell you how you\u0027re going to die (probably.)","PictureFilename":"jordan-tierney.jpg","Url1":"https://twitter.com/JordanCTierney","Url2":"http://www.jordantierney.net/","PictureUrl":"http://static-4.keithandthegirl.net/guests/pics/processed/jordan-tierney-150x150.jpg","PictureUrlLarge":"http://static-4.keithandthegirl.net/guests/pics/processed/jordan-tierney-600x600.jpg"},{"Data":"450","ShowGuestId":"450","RealName":"Leah Nanako Winkler","Description":"Playwright whose work has been featured in Center Stage, MagicFutureBox, and Dixon Place.","PictureFilename":"leahwinkler.jpeg","Url1":"","Url2":"http://leahwinkler.org/","PictureUrl":"http://static-1.keithandthegirl.net/guests/pics/processed/leahwinkler-150x150.jpeg","PictureUrlLarge":"http://static-1.keithandthegirl.net/guests/pics/processed/leahwinkler-600x600.jpeg"}]},{"ShowId":"3053","ShowNameId":"5","Number":"54","PostedDate":"12/25/2013 12:00:00 PM","Title":"Backstage","VideoFileUrl":"https://www.keithandthegirl.com/vip/download/shows/wmn/video/54/WMN-2013-12-25.m3u8","VideoThumbnailUrl":"https://www.keithandthegirl.com/vip/download/shows/wmn/video/54/WMN-2013-12-25-video.jpg","PreviewUrl":"http://www.youtube.com/watch?v=VPK3rVAhi8k","FileUrl":"http://www.keithandthegirl.com/vip/download/shows/wmn/WMN-2013-12-25.mp3","Type":"0","Public":"0","Timestamp":1387990800,"Guests":[{"Data":"448","ShowGuestId":"448","RealName":"Jesse Geguzis","Description":"Actor and stuntman who has been featured in many Caps Lock Theatre productions.","PictureFilename":"jessegeguzis.jpg","Url1":"","Url2":"http://www.jessegeguzis.com/","PictureUrl":"http://static-1.keithandthegirl.net/guests/pics/processed/jessegeguzis-150x150.jpg","PictureUrlLarge":"http://static-1.keithandthegirl.net/guests/pics/processed/jessegeguzis-600x600.jpg"},{"Data":"449","ShowGuestId":"449","RealName":"Kim Gainer","Description":"Actor and burlesque performer who has been featured in many Caps Lock Theatre productions.","PictureFilename":"kimgainer.jpg","Url1":"","Url2":"https://www.facebook.com/MsMintyNewportSmokes","PictureUrl":"http://static-4.keithandthegirl.net/guests/pics/processed/kimgainer-150x150.jpg","PictureUrlLarge":"http://static-4.keithandthegirl.net/guests/pics/processed/kimgainer-600x600.jpg"},{"Data":"106","ShowGuestId":"106","RealName":"Lauren Hennessy","Description":"Icelandic Academy Award nominated actor, host of the podcast Bottoms Up with Hennessy, and Chemda\u0027s fiancé.","PictureFilename":"Lauren-Hennessy.jpg","Url1":"http://laurenhennessy.com","Url2":"http://www.facebook.com/lauren.hennessy","PictureUrl":"http://static-1.keithandthegirl.net/guests/pics/processed/Lauren-Hennessy-150x150.jpg","PictureUrlLarge":"http://static-1.keithandthegirl.net/guests/pics/processed/Lauren-Hennessy-600x600.jpg"}]},{"ShowId":"3020","ShowNameId":"5","Number":"53","PostedDate":"12/4/2013 12:00:00 PM","Title":"The Casting Couch","VideoFileUrl":"https://www.keithandthegirl.com/vip/download/shows/wmn/video/53/WMN-2013-12-04.m3u8","VideoThumbnailUrl":"https://www.keithandthegirl.com/vip/download/shows/wmn/video/53/WMN-2013-12-04-video.jpg","PreviewUrl":"http://www.youtube.com/watch?v=P_ub1n_n4SM","FileUrl":"http://www.keithandthegirl.com/vip/download/shows/wmn/WMN-2013-12-04.mp3","Type":"0","Public":"0","Timestamp":1386176400,"Guests":[{"Data":"447","ShowGuestId":"447","RealName":"John Harlacher","Description":"Actor and director of films and NYC\u0027s Nightmare haunted house","PictureFilename":"JohnHarlacher.jpg","Url1":"","Url2":"https://twitter.com/harlacher","PictureUrl":"http://static-3.keithandthegirl.net/guests/pics/processed/JohnHarlacher-150x150.jpg","PictureUrlLarge":"http://static-3.keithandthegirl.net/guests/pics/processed/JohnHarlacher-600x600.jpg"},{"Data":"457","ShowGuestId":"457","RealName":"Sean Williams","Description":"Executive producer of Gideon Productions.","PictureFilename":"seanwilliams.jpeg","Url1":"","Url2":"http://www.gideonth.com/","PictureUrl":"http://static-1.keithandthegirl.net/guests/pics/processed/seanwilliams-150x150.jpeg","PictureUrlLarge":"http://static-1.keithandthegirl.net/guests/pics/processed/seanwilliams-600x600.jpeg"}]},{"ShowId":"3002","ShowNameId":"5","Number":"52","PostedDate":"11/20/2013 12:00:00 PM","Title":"The Book of Mormon","VideoFileUrl":"https://www.keithandthegirl.com/vip/download/shows/wmn/video/52/WMN-2013-11-20.m3u8","VideoThumbnailUrl":"https://www.keithandthegirl.com/vip/download/shows/wmn/video/52/WMN-2013-11-20-video.jpg","PreviewUrl":"http://www.youtube.com/watch?v=5EW8YS2AB2I","FileUrl":"http://www.keithandthegirl.com/vip/download/shows/wmn/WMN-2013-11-20.mp3","Type":"0","Public":"0","Timestamp":1384966800,"Guests":[{"Data":"443","ShowGuestId":"443","RealName":"H. Alan Scott","Description":"Comedian, writer, and creator, producer, \u0026 host of The Tweet Spot: The Twitter Game Show","PictureFilename":"HAlanScott.jpg","Url1":"","Url2":"http://halanscott.com/","PictureUrl":"http://static-2.keithandthegirl.net/guests/pics/processed/HAlanScott-150x150.jpg","PictureUrlLarge":"http://static-2.keithandthegirl.net/guests/pics/processed/HAlanScott-600x600.jpg"}]},{"ShowId":"2958","ShowNameId":"5","Number":"51","PostedDate":"10/23/2013 12:00:00 PM","Title":"Acting","VideoFileUrl":"https://www.keithandthegirl.com/vip/download/shows/wmn/video/51/WMN-2013-10-23.m3u8","VideoThumbnailUrl":"https://www.keithandthegirl.com/vip/download/shows/wmn/video/51/WMN-2013-10-23-video.jpg","PreviewUrl":"http://www.youtube.com/watch?v=j7KbjTQ8S0w","FileUrl":"http://www.keithandthegirl.com/vip/download/shows/wmn/WMN-2013-10-23.mp3","Type":"0","Public":"0","Timestamp":1382544000,"Guests":[{"Data":"40","ShowGuestId":"40","RealName":"Christian Finnegan","Description":"Comedian known for his roles on Chapelle\u0027s Show and Are We There Yet? and his Netflix comedy special The Fun Part.","PictureFilename":"Christian-Finnegan.jpg","Url1":"http://www.facebook.com/ChristFinnegan","Url2":"http://christianfinnegan.com","PictureUrl":"http://static-4.keithandthegirl.net/guests/pics/processed/Christian-Finnegan-150x150.jpg","PictureUrlLarge":"http://static-4.keithandthegirl.net/guests/pics/processed/Christian-Finnegan-600x600.jpg"},{"Data":"387","ShowGuestId":"387","RealName":"Jordan Tierney","Description":"Actor and astrologer who will read your chart and tell you how you\u0027re going to die (probably.)","PictureFilename":"jordan-tierney.jpg","Url1":"https://twitter.com/JordanCTierney","Url2":"http://www.jordantierney.net/","PictureUrl":"http://static-4.keithandthegirl.net/guests/pics/processed/jordan-tierney-150x150.jpg","PictureUrlLarge":"http://static-4.keithandthegirl.net/guests/pics/processed/jordan-tierney-600x600.jpg"},{"Data":"106","ShowGuestId":"106","RealName":"Lauren Hennessy","Description":"Icelandic Academy Award nominated actor, host of the podcast Bottoms Up with Hennessy, and Chemda\u0027s fiancé.","PictureFilename":"Lauren-Hennessy.jpg","Url1":"http://laurenhennessy.com","Url2":"http://www.facebook.com/lauren.hennessy","PictureUrl":"http://static-1.keithandthegirl.net/guests/pics/processed/Lauren-Hennessy-150x150.jpg","PictureUrlLarge":"http://static-1.keithandthegirl.net/guests/pics/processed/Lauren-Hennessy-600x600.jpg"}]},{"ShowId":"2937","ShowNameId":"5","Number":"50","PostedDate":"10/9/2013 12:00:00 PM","Title":"Transmen","VideoFileUrl":"https://www.keithandthegirl.com/vip/download/shows/wmn/video/50/WMN-2013-10-09.m3u8","VideoThumbnailUrl":"https://www.keithandthegirl.com/vip/download/shows/wmn/video/50/WMN-2013-10-09-video.jpg","PreviewUrl":"http://www.youtube.com/watch?v=jEveJRkxWdw","FileUrl":"http://www.keithandthegirl.com/vip/download/shows/wmn/WMN-2013-10-09.mp3","Type":"0","Public":"0","Timestamp":1381334400,"Guests":[{"Data":"446","ShowGuestId":"446","RealName":"Kit Yan","Description":"Poet whose work has been reviewed in New York Magazine and Bitch Magazine","PictureFilename":"KitYan.jpg","Url1":"","Url2":"http://www.kityanpoet.com/","PictureUrl":"http://static-1.keithandthegirl.net/guests/pics/processed/KitYan-150x150.jpg","PictureUrlLarge":"http://static-1.keithandthegirl.net/guests/pics/processed/KitYan-600x600.jpg"},{"Data":"106","ShowGuestId":"106","RealName":"Lauren Hennessy","Description":"Icelandic Academy Award nominated actor, host of the podcast Bottoms Up with Hennessy, and Chemda\u0027s fiancé.","PictureFilename":"Lauren-Hennessy.jpg","Url1":"http://laurenhennessy.com","Url2":"http://www.facebook.com/lauren.hennessy","PictureUrl":"http://static-1.keithandthegirl.net/guests/pics/processed/Lauren-Hennessy-150x150.jpg","PictureUrlLarge":"http://static-1.keithandthegirl.net/guests/pics/processed/Lauren-Hennessy-600x600.jpg"}]},{"ShowId":"2920","ShowNameId":"5","Number":"49","PostedDate":"9/25/2013 12:00:00 PM","Title":"The Producers","VideoFileUrl":"https://www.keithandthegirl.com/vip/download/shows/wmn/video/49/WMN-2013-09-25.m3u8","VideoThumbnailUrl":"https://www.keithandthegirl.com/vip/download/shows/wmn/video/49/WMN-2013-09-25-video.jpg","PreviewUrl":"http://www.youtube.com/watch?v=m48NvdFKLQg","FileUrl":"http://www.keithandthegirl.com/vip/download/shows/wmn/WMN-2013-09-25.mp3","Type":"0","Public":"0","Timestamp":1380124800,"Guests":[{"Data":"215","ShowGuestId":"215","RealName":"Adam Spiegelman","Description":"Comedy booker and host of the podcast Proudly Resents.","PictureFilename":"Adam-Spiegelman.jpg","Url1":"","Url2":"http://www.facebook.com/reachadam","PictureUrl":"http://static-4.keithandthegirl.net/guests/pics/processed/Adam-Spiegelman-150x150.jpg","PictureUrlLarge":"http://static-4.keithandthegirl.net/guests/pics/processed/Adam-Spiegelman-600x600.jpg"},{"Data":"249","ShowGuestId":"249","RealName":"Kambri Crews","Description":"Author of Burn Down the Ground: A Memoir and Christian Finnegan\u0027s wife.","PictureFilename":"Kambri-Crews.jpg","Url1":"http://kambricrews.com/","Url2":"","PictureUrl":"http://static-2.keithandthegirl.net/guests/pics/processed/Kambri-Crews-150x150.jpg","PictureUrlLarge":"http://static-2.keithandthegirl.net/guests/pics/processed/Kambri-Crews-600x600.jpg"},{"Data":"91","ShowGuestId":"91","RealName":"Myka Fox","Description":"Comedian and writer for Saturday Night Live and someecards, and host of Myka Fox \u0026 Friends.","PictureFilename":"Myka-Fox.jpg","Url1":"http://www.twitter.com/mykafox","Url2":"http://www.facebook.com/mykafox","PictureUrl":"http://static-3.keithandthegirl.net/guests/pics/processed/Myka-Fox-150x150.jpg","PictureUrlLarge":"http://static-3.keithandthegirl.net/guests/pics/processed/Myka-Fox-600x600.jpg"}]},{"ShowId":"2900","ShowNameId":"5","Number":"48","PostedDate":"9/11/2013 11:47:47 AM","Title":"Prison Fights","VideoFileUrl":"https://www.keithandthegirl.com/vip/download/shows/wmn/video/48/WMN-2013-09-11.m3u8","VideoThumbnailUrl":"https://www.keithandthegirl.com/vip/download/shows/wmn/video/48/WMN-2013-09-11-video.jpg","PreviewUrl":"http://www.youtube.com/watch?v=W5utYVxZiXg","FileUrl":"http://www.keithandthegirl.com/vip/download/shows/wmn/WMN-2013-09-11.mp3","Type":"0","Public":"0","Timestamp":1378914467,"Guests":[{"Data":"434","ShowGuestId":"434","RealName":"Jonnie Flatbush","Description":"Artist and Chemda\u0027s former roommate.","PictureFilename":"jonnieflatbush.jpg","Url1":"","Url2":"","PictureUrl":"http://static-3.keithandthegirl.net/guests/pics/processed/jonnieflatbush-150x150.jpg","PictureUrlLarge":"http://static-3.keithandthegirl.net/guests/pics/processed/jonnieflatbush-600x600.jpg"}]},{"ShowId":"2881","ShowNameId":"5","Number":"47","PostedDate":"8/28/2013 12:00:00 PM","Title":"Surviving Heroin","VideoFileUrl":"https://www.keithandthegirl.com/vip/download/shows/wmn/video/47/WMN-2013-08-28.m3u8","VideoThumbnailUrl":"https://www.keithandthegirl.com/vip/download/shows/wmn/video/47/WMN-2013-08-28-video.jpg","PreviewUrl":"http://www.youtube.com/watch?v=fvjXciHIEwE","FileUrl":"http://www.keithandthegirl.com/vip/download/shows/wmn/WMN-2013-08-28.mp3","Type":"0","Public":"0","Timestamp":1377705600,"Guests":[{"Data":"445","ShowGuestId":"445","RealName":"J. Stephen Brantley","Description":"Actor and playwright who has appeared in many Caps Lock Theatre productions.","PictureFilename":"J-StephenBrantley.jpg","Url1":"","Url2":"http://www.jstephenbrantley.com/","PictureUrl":"http://static-1.keithandthegirl.net/guests/pics/processed/J-StephenBrantley-150x150.jpg","PictureUrlLarge":"http://static-1.keithandthegirl.net/guests/pics/processed/J-StephenBrantley-600x600.jpg"}]},{"ShowId":"2844","ShowNameId":"5","Number":"46","PostedDate":"8/7/2013 12:08:27 PM","Title":"Off the Chart","VideoFileUrl":"https://www.keithandthegirl.com/vip/download/shows/wmn/video/46/WMN-2013-08-07.m3u8","VideoThumbnailUrl":"https://www.keithandthegirl.com/vip/download/shows/wmn/video/46/WMN-2013-08-07-video.jpg","PreviewUrl":"http://www.youtube.com/watch?v=Ymdi2l_4k6E","FileUrl":"http://www.keithandthegirl.com/vip/download/shows/wmn/WMN-2013-08-07.mp3","Type":"0","Public":"0","Timestamp":1375891707,"Guests":[{"Data":"387","ShowGuestId":"387","RealName":"Jordan Tierney","Description":"Actor and astrologer who will read your chart and tell you how you\u0027re going to die (probably.)","PictureFilename":"jordan-tierney.jpg","Url1":"https://twitter.com/JordanCTierney","Url2":"http://www.jordantierney.net/","PictureUrl":"http://static-4.keithandthegirl.net/guests/pics/processed/jordan-tierney-150x150.jpg","PictureUrlLarge":"http://static-4.keithandthegirl.net/guests/pics/processed/jordan-tierney-600x600.jpg"},{"Data":"106","ShowGuestId":"106","RealName":"Lauren Hennessy","Description":"Icelandic Academy Award nominated actor, host of the podcast Bottoms Up with Hennessy, and Chemda\u0027s fiancé.","PictureFilename":"Lauren-Hennessy.jpg","Url1":"http://laurenhennessy.com","Url2":"http://www.facebook.com/lauren.hennessy","PictureUrl":"http://static-1.keithandthegirl.net/guests/pics/processed/Lauren-Hennessy-150x150.jpg","PictureUrlLarge":"http://static-1.keithandthegirl.net/guests/pics/processed/Lauren-Hennessy-600x600.jpg"}]},{"ShowId":"2814","ShowNameId":"5","Number":"45","PostedDate":"7/24/2013 12:54:54 PM","Title":"Motel California","VideoFileUrl":"https://www.keithandthegirl.com/vip/download/shows/wmn/video/45/WMN-2013-07-24.m3u8","VideoThumbnailUrl":"https://www.keithandthegirl.com/vip/download/shows/wmn/video/45/WMN-2013-07-24-video.jpg","PreviewUrl":"http://www.youtube.com/watch?v=NRoS0rM17ts","FileUrl":"http://www.keithandthegirl.com/vip/download/shows/wmn/WMN-2013-07-24.mp3","Type":"0","Public":"0","Timestamp":1374684894,"Guests":[{"Data":"444","ShowGuestId":"444","RealName":"Diana Oh","Description":"Actor, performer, and singer/songwriter known for her solo show Diana Oh is GOING ROGUE","PictureFilename":"DianaOh.jpg","Url1":"","Url2":"http://www.dianaoh.com/","PictureUrl":"http://static-3.keithandthegirl.net/guests/pics/processed/DianaOh-150x150.jpg","PictureUrlLarge":"http://static-3.keithandthegirl.net/guests/pics/processed/DianaOh-600x600.jpg"}]},{"ShowId":"2783","ShowNameId":"5","Number":"44","PostedDate":"7/7/2013 11:26:29 AM","Title":"Bad Roommates","VideoFileUrl":"https://www.keithandthegirl.com/vip/download/shows/wmn/video/44/WMN-2013-07-07.m3u8","VideoThumbnailUrl":"https://www.keithandthegirl.com/vip/download/shows/wmn/video/44/WMN-2013-07-07-video.jpg","PreviewUrl":"http://www.youtube.com/watch?v=CCbUJ_nCHA8","FileUrl":"http://www.keithandthegirl.com/vip/download/shows/wmn/WMN-2013-07-07.mp3","Type":"0","Public":"0","Timestamp":1373210789,"Guests":[{"Data":"211","ShowGuestId":"211","RealName":"Gaby Dunn","Description":"Writer and comedian known for her contributions to Playboy Magazine and her book Maybe in Another Universe.","PictureFilename":"Gaby-Dunn.jpg","Url1":"http://gabydunn.com/","Url2":"","PictureUrl":"http://static-1.keithandthegirl.net/guests/pics/processed/Gaby-Dunn-150x150.jpg","PictureUrlLarge":"http://static-1.keithandthegirl.net/guests/pics/processed/Gaby-Dunn-600x600.jpg"},{"Data":"243","ShowGuestId":"243","RealName":"Jess Wood","Description":"Comedian best known for her appearances on AXS TV\u0027s Gotham Comedy Live and for hosting The Ratchet Hatchet podcast.","PictureFilename":"Jess-Wood.jpg","Url1":"http://thejesswood.wordpress.com","Url2":"","PictureUrl":"http://static-3.keithandthegirl.net/guests/pics/processed/Jess-Wood-150x150.jpg","PictureUrlLarge":"http://static-3.keithandthegirl.net/guests/pics/processed/Jess-Wood-600x600.jpg"},{"Data":"134","ShowGuestId":"134","RealName":"John F. O\u0027Donnell","Description":"Comedian known for hosting Live From Outer Space comedy show and for appearing as a correspondent on the television show Redacted Tonight.","PictureFilename":"John-F-ODonnell.jpg","Url1":"https://twitter.com/jfodcomedy","Url2":"http://www.livefromouterspace.com","PictureUrl":"http://static-2.keithandthegirl.net/guests/pics/processed/John-F-ODonnell-150x150.jpg","PictureUrlLarge":"http://static-2.keithandthegirl.net/guests/pics/processed/John-F-ODonnell-600x600.jpg"},{"Data":"106","ShowGuestId":"106","RealName":"Lauren Hennessy","Description":"Icelandic Academy Award nominated actor, host of the podcast Bottoms Up with Hennessy, and Chemda\u0027s fiancé.","PictureFilename":"Lauren-Hennessy.jpg","Url1":"http://laurenhennessy.com","Url2":"http://www.facebook.com/lauren.hennessy","PictureUrl":"http://static-1.keithandthegirl.net/guests/pics/processed/Lauren-Hennessy-150x150.jpg","PictureUrlLarge":"http://static-1.keithandthegirl.net/guests/pics/processed/Lauren-Hennessy-600x600.jpg"},{"Data":"235","ShowGuestId":"235","RealName":"Liz Miele","Description":"Comedian and creator of the webseries\u0027 Apt. C3 and Damaged.","PictureFilename":"Liz-Miele.jpg","Url1":"http://lizmiele.com/","Url2":"","PictureUrl":"http://static-4.keithandthegirl.net/guests/pics/processed/Liz-Miele-150x150.jpg","PictureUrlLarge":"http://static-4.keithandthegirl.net/guests/pics/processed/Liz-Miele-600x600.jpg"},{"Data":"91","ShowGuestId":"91","RealName":"Myka Fox","Description":"Comedian and writer for Saturday Night Live and someecards, and host of Myka Fox \u0026 Friends.","PictureFilename":"Myka-Fox.jpg","Url1":"http://www.twitter.com/mykafox","Url2":"http://www.facebook.com/mykafox","PictureUrl":"http://static-3.keithandthegirl.net/guests/pics/processed/Myka-Fox-150x150.jpg","PictureUrlLarge":"http://static-3.keithandthegirl.net/guests/pics/processed/Myka-Fox-600x600.jpg"},{"Data":"92","ShowGuestId":"92","RealName":"Myq Kaplan","Description":"Comedian known for his appearances on Last Comic Standing and The Late Show with David Letterman, and for hosting the podcast Hang Out with Me.","PictureFilename":"Myq-Kaplan.jpg","Url1":"http://www.godzillionaire.blogspot.com","Url2":"http://www.myqkaplan.com","PictureUrl":"http://static-4.keithandthegirl.net/guests/pics/processed/Myq-Kaplan-150x150.jpg","PictureUrlLarge":"http://static-4.keithandthegirl.net/guests/pics/processed/Myq-Kaplan-600x600.jpg"},{"Data":"212","ShowGuestId":"212","RealName":"Paul Hooper","Description":"Comic who has been featured in Michael Moore and Jeff Garlin’s Traverse City Comedy Arts Festival and was a finalist in the 30th Annual Seattle International Comedy Competition.","PictureFilename":"Paul-Hooper.jpg","Url1":"http://www.paulhoopercomedy.com/","Url2":"","PictureUrl":"http://static-4.keithandthegirl.net/guests/pics/processed/Paul-Hooper-150x150.jpg","PictureUrlLarge":"http://static-4.keithandthegirl.net/guests/pics/processed/Paul-Hooper-600x600.jpg"},{"Data":"89","ShowGuestId":"89","RealName":"Ray DeVito","Description":"Comedian known for his work on MTV\u0027s Guy Code and his album, 1647 Waterbury.","PictureFilename":"Ray-DeVito.jpg","Url1":"http://www.facebook.com/ray.devito","Url2":"http://www.raydevito.net","PictureUrl":"http://static-4.keithandthegirl.net/guests/pics/processed/Ray-DeVito-150x150.jpg","PictureUrlLarge":"http://static-4.keithandthegirl.net/guests/pics/processed/Ray-DeVito-600x600.jpg"},{"Data":"175","ShowGuestId":"175","RealName":"Tim Dimond","Description":"Comedian and writer known for his contributions to VH1 and The History Channel.","PictureFilename":"Tim-Dimond.jpg","Url1":"http://www.facebook.com/profile.php?id=4803272","Url2":"http://www.timdimond.com","PictureUrl":"http://static-1.keithandthegirl.net/guests/pics/processed/Tim-Dimond-150x150.jpg","PictureUrlLarge":"http://static-1.keithandthegirl.net/guests/pics/processed/Tim-Dimond-600x600.jpg"}]},{"ShowId":"2744","ShowNameId":"5","Number":"43","PostedDate":"6/6/2013 2:00:00 PM","Title":"Laughing with Cancer","VideoFileUrl":"https://www.keithandthegirl.com/vip/download/shows/wmn/video/43/WMN-2013-06-06.m3u8","VideoThumbnailUrl":"https://www.keithandthegirl.com/vip/download/shows/wmn/video/43/WMN-2013-06-06-video.jpg","PreviewUrl":"https://www.youtube.com/watch?v=R__7NZIEwDI","FileUrl":"http://www.keithandthegirl.com/vip/download/shows/wmn/WMN-2013-06-06.mp3","Type":"0","Public":"0","Timestamp":1370541600,"Guests":[{"Data":"443","ShowGuestId":"443","RealName":"H. Alan Scott","Description":"Comedian, writer, and creator, producer, \u0026 host of The Tweet Spot: The Twitter Game Show","PictureFilename":"HAlanScott.jpg","Url1":"","Url2":"http://halanscott.com/","PictureUrl":"http://static-2.keithandthegirl.net/guests/pics/processed/HAlanScott-150x150.jpg","PictureUrlLarge":"http://static-2.keithandthegirl.net/guests/pics/processed/HAlanScott-600x600.jpg"}]},{"ShowId":"2662","ShowNameId":"5","Number":"42","PostedDate":"5/22/2013 8:00:00 PM","Title":"Dating with HIV","PreviewUrl":"","FileUrl":"http://www.keithandthegirl.com/vip/download/shows/wmn/WMN-2013-05-22.mp3","Type":"0","Public":"0","Timestamp":1369267200,"Guests":[{"Data":"442","ShowGuestId":"442","RealName":"Jack Mackenroth","Description":"Model and fashion designer who appeared on season 4 of Project Runway.","PictureFilename":"jackMackenroth.png","Url1":"","Url2":"http://jackmackenroth.com/","PictureUrl":"http://static-4.keithandthegirl.net/guests/pics/processed/jackMackenroth-150x150.png","PictureUrlLarge":"http://static-4.keithandthegirl.net/guests/pics/processed/jackMackenroth-600x600.png"}]},{"ShowId":"2646","ShowNameId":"5","Number":"41","PostedDate":"5/7/2013 12:00:00 PM","Title":"Owning The Comedy Cellar","PreviewUrl":"http://www.youtube.com/watch?v=hGFtGMNgr6o","FileUrl":"http://www.keithandthegirl.com/vip/download/shows/wmn/WMN-2013-05-07.mp3","Type":"0","Public":"0","Timestamp":1367942400,"Guests":[{"Data":"441","ShowGuestId":"441","RealName":"Noam Dworman","Description":"Owner of the Comedy Cellar","PictureFilename":"noamdworman.jpg","Url1":"","Url2":"http://www.comedycellar.com/","PictureUrl":"http://static-1.keithandthegirl.net/guests/pics/processed/noamdworman-150x150.jpg","PictureUrlLarge":"http://static-1.keithandthegirl.net/guests/pics/processed/noamdworman-600x600.jpg"}]},{"ShowId":"2633","ShowNameId":"5","Number":"40","PostedDate":"4/24/2013 5:00:00 PM","Title":"Family By Design","PreviewUrl":"https://www.youtube.com/watch?v=1ICS4NdBZNI","FileUrl":"http://www.keithandthegirl.com/vip/download/shows/wmn/WMN-2013-04-24.mp3","Type":"0","Public":"0","Timestamp":1366837200,"Guests":[{"Data":"440","ShowGuestId":"440","RealName":"Darren Spedale","Description":"Entrepreneur and author who founded the company FamilyByDesign.","PictureFilename":"DarrenSpedale.jpg","Url1":"","Url2":"http://www.familybydesign.com/","PictureUrl":"http://static-1.keithandthegirl.net/guests/pics/processed/DarrenSpedale-150x150.jpg","PictureUrlLarge":"http://static-1.keithandthegirl.net/guests/pics/processed/DarrenSpedale-600x600.jpg"}]},{"ShowId":"2609","ShowNameId":"5","Number":"39","PostedDate":"3/29/2013 9:00:00 AM","Title":"The Iraq War","PreviewUrl":"http://www.youtube.com/watch?v=sg0blLh8h_k\u0026list=PLqRSwyqnU1WHrZezYTL3928pgz5j4i2V-","FileUrl":"http://www.keithandthegirl.com/vip/download/shows/wmn/WMN-2013-03-29.mp3","Type":"0","Public":"0","Timestamp":1364562000,"Guests":[{"Data":"439","ShowGuestId":"439","RealName":"Myke Cole","Description":"War veteran and novelist; author of the Shadow Ops series.","PictureFilename":"MykeCole.jpg","Url1":"","Url2":"http://mykecole.com/","PictureUrl":"http://static-1.keithandthegirl.net/guests/pics/processed/MykeCole-150x150.jpg","PictureUrlLarge":"http://static-1.keithandthegirl.net/guests/pics/processed/MykeCole-600x600.jpg"}]},{"ShowId":"2555","ShowNameId":"5","Number":"38","PostedDate":"2/7/2013","Title":"What\u0027s So Funny","PreviewUrl":"","FileUrl":"http://www.keithandthegirl.com/vip/download/shows/wmn/WMN-2013-02-07.mp3","Type":"0","Public":"0","Timestamp":1360213200,"Guests":[{"Data":"438","ShowGuestId":"438","RealName":"Judy Batalion","Description":"Comedian, storyteller and author of White Walls: A Memoir About Motherhood, Daughterhood, and the Mess In Between.","PictureFilename":"judybatalion.jpg","Url1":"","Url2":"http://judybatalion.com/","PictureUrl":"http://static-4.keithandthegirl.net/guests/pics/processed/judybatalion-150x150.jpg","PictureUrlLarge":"http://static-4.keithandthegirl.net/guests/pics/processed/judybatalion-600x600.jpg"}]},{"ShowId":"2536","ShowNameId":"5","Number":"37","PostedDate":"1/17/2013 6:30:00 PM","Title":"Gun Control","PreviewUrl":"https://www.keithandthegirl.com/mp3/promo/whats-my-name-show/WMN-37-trailer.mp3","FileUrl":"http://www.keithandthegirl.com/vip/download/shows/wmn/WMN-2013-01-17.mp3","Type":"0","Public":"0","Timestamp":1358465400,"Guests":[{"Data":"429","ShowGuestId":"429","RealName":"Ron Winckler","Description":"Minister, wedding planner, and Lauren Hennessy\u0027s father.","PictureFilename":"ronwinckler.jpg","Url1":"","Url2":"http://mauiisland.com/","PictureUrl":"http://static-4.keithandthegirl.net/guests/pics/processed/ronwinckler-150x150.jpg","PictureUrlLarge":"http://static-4.keithandthegirl.net/guests/pics/processed/ronwinckler-600x600.jpg"}]},{"ShowId":"2517","ShowNameId":"5","Number":"36","PostedDate":"12/14/2012 12:00:00 PM","Title":"Birth Mother","PreviewUrl":"https://www.keithandthegirl.com/mp3/promo/whats-my-name-show/WMN-36-trailer.mp3","FileUrl":"http://www.keithandthegirl.com/vip/download/shows/wmn/WMN-2012-12-14.mp3","Type":"0","Public":"0","Timestamp":1355504400,"Guests":[{"Data":"426","ShowGuestId":"426","RealName":"Mariah MacCarthy","Description":"Playwright and author of the FringeNYC play Magic Trick","PictureFilename":"mariahmaccarthy.jpg","Url1":"","Url2":"https://twitter.com/MariahMacCarthy","PictureUrl":"http://static-2.keithandthegirl.net/guests/pics/processed/mariahmaccarthy-150x150.jpg","PictureUrlLarge":"http://static-2.keithandthegirl.net/guests/pics/processed/mariahmaccarthy-600x600.jpg"}]},{"ShowId":"2511","ShowNameId":"5","Number":"35","PostedDate":"12/6/2012 1:00:00 AM","Title":"Crystal Clear","PreviewUrl":"https://www.keithandthegirl.com/mp3/promo/whats-my-name-show/WMN-35-trailer.mp3","FileUrl":"http://www.keithandthegirl.com/vip/download/shows/wmn/WMN-2012-12-06.mp3","Type":"0","Public":"0","Timestamp":1354773600,"Guests":[{"Data":"437","ShowGuestId":"437","RealName":"Deke Haylon","Description":"Professional chef, comic, and storyteller.","PictureFilename":"dekehaylon.jpeg","Url1":"","Url2":"https://www.facebook.com/deke.haylon","PictureUrl":"http://static-2.keithandthegirl.net/guests/pics/processed/dekehaylon-150x150.jpeg","PictureUrlLarge":"http://static-2.keithandthegirl.net/guests/pics/processed/dekehaylon-600x600.jpeg"}]},{"ShowId":"2502","ShowNameId":"5","Number":"34","PostedDate":"11/15/2012 12:00:00 PM","Title":"Taxi Cab Confessions","PreviewUrl":"http://www.keithandthegirl.com/mp3/promo/whats-my-name-show/WMN-34-trailer.mp3","FileUrl":"http://www.keithandthegirl.com/vip/download/shows/wmn/WMN-2012-11-15.mp3","Type":"0","Public":"0","Timestamp":1352998800,"Guests":[{"Data":"379","ShowGuestId":"379","RealName":"Jimmy Failla","Description":"Comedian best known for appearing on America\u0027s Got Talent and for hosting the podcast Off the Meter.","PictureFilename":"jimmy-failla.jpg","Url1":"https://twitter.com/jimmyfailla","Url2":"http://jimmyfailla.com/","PictureUrl":"http://static-1.keithandthegirl.net/guests/pics/processed/jimmy-failla-150x150.jpg","PictureUrlLarge":"http://static-1.keithandthegirl.net/guests/pics/processed/jimmy-failla-600x600.jpg"}]},{"ShowId":"2473","ShowNameId":"5","Number":"33","PostedDate":"10/10/2012 6:00:00 PM","Title":"Hard Knock Life","PreviewUrl":"http://www.keithandthegirl.com/mp3/promo/whats-my-name-show/WMN-33-trailer.mp3","FileUrl":"http://www.keithandthegirl.com/vip/download/shows/wmn/WMN-2012-10-10.mp3","Type":"0","Public":"0","Timestamp":1349906400,"Guests":[{"Data":"243","ShowGuestId":"243","RealName":"Jess Wood","Description":"Comedian best known for her appearances on AXS TV\u0027s Gotham Comedy Live and for hosting The Ratchet Hatchet podcast.","PictureFilename":"Jess-Wood.jpg","Url1":"http://thejesswood.wordpress.com","Url2":"","PictureUrl":"http://static-3.keithandthegirl.net/guests/pics/processed/Jess-Wood-150x150.jpg","PictureUrlLarge":"http://static-3.keithandthegirl.net/guests/pics/processed/Jess-Wood-600x600.jpg"}]},{"ShowId":"2403","ShowNameId":"5","Number":"32","PostedDate":"8/28/2012 7:00:00 PM","Title":"Godless","PreviewUrl":"http://www.keithandthegirl.com/mp3/promo/whats-my-name-show/WMN-32-trailer.mp3","FileUrl":"http://www.keithandthegirl.com/vip/download/shows/wmn/WMN-2012-08-28.mp3","Type":"0","Public":"0","Timestamp":1346194800,"Guests":[{"Data":"1","ShowGuestId":"1","RealName":"Michael Khalili","Description":"The girl\u0027s younger brother. Maintains this site and works on several other web projects. Former president of Atheists United.","PictureFilename":"Michael-Khalili.jpg","Url1":"http://www.facebook.com/MichaelApproved","Url2":"http://SkimThat.com","PictureUrl":"http://static-1.keithandthegirl.net/guests/pics/processed/Michael-Khalili-150x150.jpg","PictureUrlLarge":"http://static-1.keithandthegirl.net/guests/pics/processed/Michael-Khalili-600x600.jpg"},{"Data":"92","ShowGuestId":"92","RealName":"Myq Kaplan","Description":"Comedian known for his appearances on Last Comic Standing and The Late Show with David Letterman, and for hosting the podcast Hang Out with Me.","PictureFilename":"Myq-Kaplan.jpg","Url1":"http://www.godzillionaire.blogspot.com","Url2":"http://www.myqkaplan.com","PictureUrl":"http://static-4.keithandthegirl.net/guests/pics/processed/Myq-Kaplan-150x150.jpg","PictureUrlLarge":"http://static-4.keithandthegirl.net/guests/pics/processed/Myq-Kaplan-600x600.jpg"}]},{"ShowId":"2381","ShowNameId":"5","Number":"31","PostedDate":"7/26/2012 7:00:00 PM","Title":"Trippin\u0027","PreviewUrl":"http://www.keithandthegirl.com/mp3/promo/whats-my-name-show/WMN-31-trailer.mp3","FileUrl":"http://www.keithandthegirl.com/vip/download/shows/wmn/WMN-2012-07-26.mp3","Type":"0","Public":"0","Timestamp":1343343600,"Guests":[{"Data":"106","ShowGuestId":"106","RealName":"Lauren Hennessy","Description":"Icelandic Academy Award nominated actor, host of the podcast Bottoms Up with Hennessy, and Chemda\u0027s fiancé.","PictureFilename":"Lauren-Hennessy.jpg","Url1":"http://laurenhennessy.com","Url2":"http://www.facebook.com/lauren.hennessy","PictureUrl":"http://static-1.keithandthegirl.net/guests/pics/processed/Lauren-Hennessy-150x150.jpg","PictureUrlLarge":"http://static-1.keithandthegirl.net/guests/pics/processed/Lauren-Hennessy-600x600.jpg"},{"Data":"92","ShowGuestId":"92","RealName":"Myq Kaplan","Description":"Comedian known for his appearances on Last Comic Standing and The Late Show with David Letterman, and for hosting the podcast Hang Out with Me.","PictureFilename":"Myq-Kaplan.jpg","Url1":"http://www.godzillionaire.blogspot.com","Url2":"http://www.myqkaplan.com","PictureUrl":"http://static-4.keithandthegirl.net/guests/pics/processed/Myq-Kaplan-150x150.jpg","PictureUrlLarge":"http://static-4.keithandthegirl.net/guests/pics/processed/Myq-Kaplan-600x600.jpg"}]},{"ShowId":"2377","ShowNameId":"5","Number":"30","PostedDate":"7/19/2012 8:00:00 PM","Title":"Emergency!","PreviewUrl":"http://www.keithandthegirl.com/mp3/promo/whats-my-name-show/WMN-30-trailer.mp3","FileUrl":"http://www.keithandthegirl.com/vip/download/shows/wmn/WMN-2012-07-19.mp3","Type":"0","Public":"0","Timestamp":1342742400,"Guests":[{"Data":"456","ShowGuestId":"456","RealName":"Jeff Jowdy","Description":"Sound engineer who worked on Super Bowl XLVIII","PictureFilename":"jeffjowdy.jpg","Url1":"","Url2":"https://www.facebook.com/jeff.jowdy","PictureUrl":"http://static-3.keithandthegirl.net/guests/pics/processed/jeffjowdy-150x150.jpg","PictureUrlLarge":"http://static-3.keithandthegirl.net/guests/pics/processed/jeffjowdy-600x600.jpg"}]},{"ShowId":"2370","ShowNameId":"5","Number":"29","PostedDate":"7/12/2012 12:00:00 PM","Title":"Roleplay","PreviewUrl":"http://www.keithandthegirl.com/mp3/promo/whats-my-name-show/WMN-29-trailer.mp3","FileUrl":"http://www.keithandthegirl.com/vip/download/shows/wmn/WMN-2012-07-12.mp3","Type":"0","Public":"0","Timestamp":1342108800,"Guests":[{"Data":"454","ShowGuestId":"454","RealName":"Drew Luckenbach","Description":"Actor who has appeared on Realm of LARP","PictureFilename":"drewluckenbach.png","Url1":"","Url2":"https://www.facebook.com/drew.luckenbach","PictureUrl":"http://static-1.keithandthegirl.net/guests/pics/processed/drewluckenbach-150x150.png","PictureUrlLarge":"http://static-1.keithandthegirl.net/guests/pics/processed/drewluckenbach-600x600.png"},{"Data":"91","ShowGuestId":"91","RealName":"Myka Fox","Description":"Comedian and writer for Saturday Night Live and someecards, and host of Myka Fox \u0026 Friends.","PictureFilename":"Myka-Fox.jpg","Url1":"http://www.twitter.com/mykafox","Url2":"http://www.facebook.com/mykafox","PictureUrl":"http://static-3.keithandthegirl.net/guests/pics/processed/Myka-Fox-150x150.jpg","PictureUrlLarge":"http://static-3.keithandthegirl.net/guests/pics/processed/Myka-Fox-600x600.jpg"},{"Data":"455","ShowGuestId":"455","RealName":"Pearce Larson","Description":"Role-player and dungeon master who has worked at New York Renaissance Faire.","PictureFilename":"pearcelarson.jpg","Url1":"","Url2":"https://www.facebook.com/pearce.larson","PictureUrl":"http://static-1.keithandthegirl.net/guests/pics/processed/pearcelarson-150x150.jpg","PictureUrlLarge":"http://static-1.keithandthegirl.net/guests/pics/processed/pearcelarson-600x600.jpg"}]},{"ShowId":"2337","ShowNameId":"5","Number":"28","PostedDate":"5/23/2012 12:00:00 PM","Title":"Coming to America","PreviewUrl":"http://www.keithandthegirl.com/mp3/promo/whats-my-name-show/WMN-28-trailer.mp3","FileUrl":"http://www.keithandthegirl.com/vip/download/shows/wmn/WMN-2012-05-23.mp3","Type":"0","Public":"0","Timestamp":1337788800,"Guests":[{"Data":"436","ShowGuestId":"436","RealName":"Asie Mohtarez","Description":"Comedian who has been featured on CNN and in Time Out NY.","PictureFilename":"asiemohtarez.jpg","Url1":"","Url2":"http://www.asiejoon.com/","PictureUrl":"http://static-4.keithandthegirl.net/guests/pics/processed/asiemohtarez-150x150.jpg","PictureUrlLarge":"http://static-4.keithandthegirl.net/guests/pics/processed/asiemohtarez-600x600.jpg"},{"Data":"127","ShowGuestId":"127","RealName":"Chris Iacono","Description":"Comedian known for his appearances on Jennifer Lopez\u0027s Glow After Dark show and the web series Rise of the Radio Show.","PictureFilename":"Chris-Iacono.jpg","Url1":"http://www.facebook.com/chrisiaconocomedy","Url2":"http://www.chrisiacono.com","PictureUrl":"http://static-1.keithandthegirl.net/guests/pics/processed/Chris-Iacono-150x150.jpg","PictureUrlLarge":"http://static-1.keithandthegirl.net/guests/pics/processed/Chris-Iacono-600x600.jpg"},{"Data":"2","ShowGuestId":"2","RealName":"Patrice Callender","Description":"Gossip Queen turned major scam artist that preys on close friends","PictureFilename":"Patrice.jpg","Url1":"","Url2":"","PictureUrl":"http://static-4.keithandthegirl.net/guests/pics/processed/Patrice-150x150.jpg","PictureUrlLarge":"http://static-4.keithandthegirl.net/guests/pics/processed/Patrice-600x600.jpg"}]},{"ShowId":"2324","ShowNameId":"5","Number":"27","PostedDate":"5/2/2012 8:00:01 PM","Title":"The First Time - SD video","PreviewUrl":"http://www.keithandthegirl.com/mp3/promo/whats-my-name-show/WMN-27-trailer.mp3","FileUrl":"http://www.keithandthegirl.com/vip/download/shows/wmn/WMN-live-27-SD.m4v","Type":"0","Public":"0","Timestamp":1336003201,"Guests":[{"Data":"111","ShowGuestId":"111","RealName":"Ben Lerman","Description":"Comedian and musician known for his EPs Size Matters and Ukelear Winter, and for hosting the podcast Serving Reelness.","PictureFilename":"Ben-Lerman.jpg","Url1":"http://www.facebook.com/thebenlerman","Url2":"http://www.benlerman.net","PictureUrl":"http://static-2.keithandthegirl.net/guests/pics/processed/Ben-Lerman-150x150.jpg","PictureUrlLarge":"http://static-2.keithandthegirl.net/guests/pics/processed/Ben-Lerman-600x600.jpg"},{"Data":"132","ShowGuestId":"132","RealName":"Carmen Lynch","Description":"Comedian known for her appearances on Late Show with David Letterman and her web series Apt. C3.","PictureFilename":"Carmen-Lynch.jpg","Url1":"http://www.facebook.com/LynchCarmen","Url2":"http://www.carmenlynch.com","PictureUrl":"http://static-2.keithandthegirl.net/guests/pics/processed/Carmen-Lynch-150x150.jpg","PictureUrlLarge":"http://static-2.keithandthegirl.net/guests/pics/processed/Carmen-Lynch-600x600.jpg"},{"Data":"127","ShowGuestId":"127","RealName":"Chris Iacono","Description":"Comedian known for his appearances on Jennifer Lopez\u0027s Glow After Dark show and the web series Rise of the Radio Show.","PictureFilename":"Chris-Iacono.jpg","Url1":"http://www.facebook.com/chrisiaconocomedy","Url2":"http://www.chrisiacono.com","PictureUrl":"http://static-1.keithandthegirl.net/guests/pics/processed/Chris-Iacono-150x150.jpg","PictureUrlLarge":"http://static-1.keithandthegirl.net/guests/pics/processed/Chris-Iacono-600x600.jpg"},{"Data":"133","ShowGuestId":"133","RealName":"Diane O\u0027Debra","Description":"Comedian and actress known for her duo with her twin sister, The O\u0027Debra Twins, which won a Village Voice Best of New York Award and received ECNY Award Nomination for Best Duo.","PictureFilename":"Diane-ODebra.jpg","Url1":"http://www.facebook.com/diane.odebra","Url2":"","PictureUrl":"http://static-3.keithandthegirl.net/guests/pics/processed/Diane-ODebra-150x150.jpg","PictureUrlLarge":"http://static-3.keithandthegirl.net/guests/pics/processed/Diane-ODebra-600x600.jpg"},{"Data":"125","ShowGuestId":"125","RealName":"Jessica Delfino","Description":"Comedian and musician known for her appearances on Good Morning America and her albums Dirty Folk Rock and I Wanna Be Famous.","PictureFilename":"Jessica-Delfino.jpg","Url1":"http://www.facebook.com/jessdelfino","Url2":"http://jessydelfino.blogspot.com","PictureUrl":"http://static-3.keithandthegirl.net/guests/pics/processed/Jessica-Delfino-150x150.jpg","PictureUrlLarge":"http://static-3.keithandthegirl.net/guests/pics/processed/Jessica-Delfino-600x600.jpg"},{"Data":"106","ShowGuestId":"106","RealName":"Lauren Hennessy","Description":"Icelandic Academy Award nominated actor, host of the podcast Bottoms Up with Hennessy, and Chemda\u0027s fiancé.","PictureFilename":"Lauren-Hennessy.jpg","Url1":"http://laurenhennessy.com","Url2":"http://www.facebook.com/lauren.hennessy","PictureUrl":"http://static-1.keithandthegirl.net/guests/pics/processed/Lauren-Hennessy-150x150.jpg","PictureUrlLarge":"http://static-1.keithandthegirl.net/guests/pics/processed/Lauren-Hennessy-600x600.jpg"},{"Data":"91","ShowGuestId":"91","RealName":"Myka Fox","Description":"Comedian and writer for Saturday Night Live and someecards, and host of Myka Fox \u0026 Friends.","PictureFilename":"Myka-Fox.jpg","Url1":"http://www.twitter.com/mykafox","Url2":"http://www.facebook.com/mykafox","PictureUrl":"http://static-3.keithandthegirl.net/guests/pics/processed/Myka-Fox-150x150.jpg","PictureUrlLarge":"http://static-3.keithandthegirl.net/guests/pics/processed/Myka-Fox-600x600.jpg"},{"Data":"86","ShowGuestId":"86","RealName":"Pat Dixon","Description":"Comedian known for his appearances on Best Week Ever and for his podcast, The New York City Crime Report.","PictureFilename":"Pat-Dixon.jpg","Url1":"http://www.facebook.com/comedianpatdixon?ref=ts","Url2":"http://www.ComedianPatDixon.com","PictureUrl":"http://static-1.keithandthegirl.net/guests/pics/processed/Pat-Dixon-150x150.jpg","PictureUrlLarge":"http://static-1.keithandthegirl.net/guests/pics/processed/Pat-Dixon-600x600.jpg"},{"Data":"89","ShowGuestId":"89","RealName":"Ray DeVito","Description":"Comedian known for his work on MTV\u0027s Guy Code and his album, 1647 Waterbury.","PictureFilename":"Ray-DeVito.jpg","Url1":"http://www.facebook.com/ray.devito","Url2":"http://www.raydevito.net","PictureUrl":"http://static-4.keithandthegirl.net/guests/pics/processed/Ray-DeVito-150x150.jpg","PictureUrlLarge":"http://static-4.keithandthegirl.net/guests/pics/processed/Ray-DeVito-600x600.jpg"},{"Data":"135","ShowGuestId":"135","RealName":"Trey Galyon","Description":"Comedian known for his albums Not Sure Where This Went Wrong and The Moronic.","PictureFilename":"Trey-Galyon.jpg","Url1":"http://www.facebook.com/home.php?#!/profile.php?id=585267627\u0026v=info\u0026ref=ts","Url2":"http://www.rooftopcomedy.com/comics/TreyGalyon","PictureUrl":"http://static-3.keithandthegirl.net/guests/pics/processed/Trey-Galyon-150x150.jpg","PictureUrlLarge":"http://static-3.keithandthegirl.net/guests/pics/processed/Trey-Galyon-600x600.jpg"}]},{"ShowId":"2323","ShowNameId":"5","Number":"27","PostedDate":"5/2/2012 8:00:02 PM","Title":"The First Time - HD video","PreviewUrl":"http://www.keithandthegirl.com/mp3/promo/whats-my-name-show/WMN-27-trailer.mp3","FileUrl":"http://www.keithandthegirl.com/vip/download/shows/wmn/WMN-live-27-HD.m4v","Type":"0","Public":"0","Timestamp":1336003202,"Guests":[{"Data":"111","ShowGuestId":"111","RealName":"Ben Lerman","Description":"Comedian and musician known for his EPs Size Matters and Ukelear Winter, and for hosting the podcast Serving Reelness.","PictureFilename":"Ben-Lerman.jpg","Url1":"http://www.facebook.com/thebenlerman","Url2":"http://www.benlerman.net","PictureUrl":"http://static-2.keithandthegirl.net/guests/pics/processed/Ben-Lerman-150x150.jpg","PictureUrlLarge":"http://static-2.keithandthegirl.net/guests/pics/processed/Ben-Lerman-600x600.jpg"},{"Data":"132","ShowGuestId":"132","RealName":"Carmen Lynch","Description":"Comedian known for her appearances on Late Show with David Letterman and her web series Apt. C3.","PictureFilename":"Carmen-Lynch.jpg","Url1":"http://www.facebook.com/LynchCarmen","Url2":"http://www.carmenlynch.com","PictureUrl":"http://static-2.keithandthegirl.net/guests/pics/processed/Carmen-Lynch-150x150.jpg","PictureUrlLarge":"http://static-2.keithandthegirl.net/guests/pics/processed/Carmen-Lynch-600x600.jpg"},{"Data":"127","ShowGuestId":"127","RealName":"Chris Iacono","Description":"Comedian known for his appearances on Jennifer Lopez\u0027s Glow After Dark show and the web series Rise of the Radio Show.","PictureFilename":"Chris-Iacono.jpg","Url1":"http://www.facebook.com/chrisiaconocomedy","Url2":"http://www.chrisiacono.com","PictureUrl":"http://static-1.keithandthegirl.net/guests/pics/processed/Chris-Iacono-150x150.jpg","PictureUrlLarge":"http://static-1.keithandthegirl.net/guests/pics/processed/Chris-Iacono-600x600.jpg"},{"Data":"133","ShowGuestId":"133","RealName":"Diane O\u0027Debra","Description":"Comedian and actress known for her duo with her twin sister, The O\u0027Debra Twins, which won a Village Voice Best of New York Award and received ECNY Award Nomination for Best Duo.","PictureFilename":"Diane-ODebra.jpg","Url1":"http://www.facebook.com/diane.odebra","Url2":"","PictureUrl":"http://static-3.keithandthegirl.net/guests/pics/processed/Diane-ODebra-150x150.jpg","PictureUrlLarge":"http://static-3.keithandthegirl.net/guests/pics/processed/Diane-ODebra-600x600.jpg"},{"Data":"125","ShowGuestId":"125","RealName":"Jessica Delfino","Description":"Comedian and musician known for her appearances on Good Morning America and her albums Dirty Folk Rock and I Wanna Be Famous.","PictureFilename":"Jessica-Delfino.jpg","Url1":"http://www.facebook.com/jessdelfino","Url2":"http://jessydelfino.blogspot.com","PictureUrl":"http://static-3.keithandthegirl.net/guests/pics/processed/Jessica-Delfino-150x150.jpg","PictureUrlLarge":"http://static-3.keithandthegirl.net/guests/pics/processed/Jessica-Delfino-600x600.jpg"},{"Data":"91","ShowGuestId":"91","RealName":"Myka Fox","Description":"Comedian and writer for Saturday Night Live and someecards, and host of Myka Fox \u0026 Friends.","PictureFilename":"Myka-Fox.jpg","Url1":"http://www.twitter.com/mykafox","Url2":"http://www.facebook.com/mykafox","PictureUrl":"http://static-3.keithandthegirl.net/guests/pics/processed/Myka-Fox-150x150.jpg","PictureUrlLarge":"http://static-3.keithandthegirl.net/guests/pics/processed/Myka-Fox-600x600.jpg"},{"Data":"86","ShowGuestId":"86","RealName":"Pat Dixon","Description":"Comedian known for his appearances on Best Week Ever and for his podcast, The New York City Crime Report.","PictureFilename":"Pat-Dixon.jpg","Url1":"http://www.facebook.com/comedianpatdixon?ref=ts","Url2":"http://www.ComedianPatDixon.com","PictureUrl":"http://static-1.keithandthegirl.net/guests/pics/processed/Pat-Dixon-150x150.jpg","PictureUrlLarge":"http://static-1.keithandthegirl.net/guests/pics/processed/Pat-Dixon-600x600.jpg"},{"Data":"89","ShowGuestId":"89","RealName":"Ray DeVito","Description":"Comedian known for his work on MTV\u0027s Guy Code and his album, 1647 Waterbury.","PictureFilename":"Ray-DeVito.jpg","Url1":"http://www.facebook.com/ray.devito","Url2":"http://www.raydevito.net","PictureUrl":"http://static-4.keithandthegirl.net/guests/pics/processed/Ray-DeVito-150x150.jpg","PictureUrlLarge":"http://static-4.keithandthegirl.net/guests/pics/processed/Ray-DeVito-600x600.jpg"},{"Data":"135","ShowGuestId":"135","RealName":"Trey Galyon","Description":"Comedian known for his albums Not Sure Where This Went Wrong and The Moronic.","PictureFilename":"Trey-Galyon.jpg","Url1":"http://www.facebook.com/home.php?#!/profile.php?id=585267627\u0026v=info\u0026ref=ts","Url2":"http://www.rooftopcomedy.com/comics/TreyGalyon","PictureUrl":"http://static-3.keithandthegirl.net/guests/pics/processed/Trey-Galyon-150x150.jpg","PictureUrlLarge":"http://static-3.keithandthegirl.net/guests/pics/processed/Trey-Galyon-600x600.jpg"}]},{"ShowId":"2322","ShowNameId":"5","Number":"27","PostedDate":"5/2/2012 8:00:00 PM","Title":"The First Time","PreviewUrl":"http://www.keithandthegirl.com/mp3/promo/whats-my-name-show/WMN-27-trailer.mp3","FileUrl":"http://www.keithandthegirl.com/vip/download/shows/wmn/WMN-2012-05-02.mp3","Type":"0","Public":"0","Timestamp":1336003200,"Guests":[]},{"ShowId":"2308","ShowNameId":"5","Number":"26","PostedDate":"4/18/2012 8:00:00 PM","Title":"Smooth (Phone Sex) Operator","PreviewUrl":"http://www.keithandthegirl.com/mp3/promo/whats-my-name-show/WMN-26-trailer.mp3","FileUrl":"http://www.keithandthegirl.com/vip/download/shows/wmn/WMN-2012-04-18.mp3","Type":"0","Public":"0","Timestamp":1334793600,"Guests":[{"Data":"435","ShowGuestId":"435","RealName":"Nicole Klingemier","Description":"Former phone sex actress.","PictureFilename":"Nicoleklingemier.jpg","Url1":"","Url2":"https://www.facebook.com/nicole.klingemier","PictureUrl":"http://static-4.keithandthegirl.net/guests/pics/processed/Nicoleklingemier-150x150.jpg","PictureUrlLarge":"http://static-4.keithandthegirl.net/guests/pics/processed/Nicoleklingemier-600x600.jpg"}]},{"ShowId":"2293","ShowNameId":"5","Number":"25","PostedDate":"3/21/2012 12:00:00 PM","Title":"Run Your Pockets","PreviewUrl":"http://www.keithandthegirl.com/mp3/promo/whats-my-name-show/WMN-25-trailer.mp3","FileUrl":"http://www.keithandthegirl.com/vip/download/shows/wmn/WMN-2012-03-21.mp3","Type":"0","Public":"0","Timestamp":1332345600,"Guests":[{"Data":"434","ShowGuestId":"434","RealName":"Jonnie Flatbush","Description":"Artist and Chemda\u0027s former roommate.","PictureFilename":"jonnieflatbush.jpg","Url1":"","Url2":"","PictureUrl":"http://static-3.keithandthegirl.net/guests/pics/processed/jonnieflatbush-150x150.jpg","PictureUrlLarge":"http://static-3.keithandthegirl.net/guests/pics/processed/jonnieflatbush-600x600.jpg"}]},{"ShowId":"2287","ShowNameId":"5","Number":"24","PostedDate":"3/14/2012 12:00:00 PM","Title":"How to Be Black","PreviewUrl":"http://www.keithandthegirl.com/mp3/promo/whats-my-name-show/WMN-24-trailer.mp3","FileUrl":"http://www.keithandthegirl.com/vip/download/shows/wmn/WMN-2012-03-14.mp3","Type":"0","Public":"0","Timestamp":1331740800,"Guests":[{"Data":"301","ShowGuestId":"301","RealName":"Baratunde Thurston","Description":"Comedian and writer best known for his book How to Be Black.","PictureFilename":"Baratunde-Thurston.jpg","Url1":"","Url2":"http://baratunde.com/","PictureUrl":"http://static-1.keithandthegirl.net/guests/pics/processed/Baratunde-Thurston-150x150.jpg","PictureUrlLarge":"http://static-1.keithandthegirl.net/guests/pics/processed/Baratunde-Thurston-600x600.jpg"}]},{"ShowId":"2282","ShowNameId":"5","Number":"23","PostedDate":"3/7/2012 5:30:00 PM","Title":"Burn Down The Ground","PreviewUrl":"http://www.keithandthegirl.com/mp3/promo/whats-my-name-show/WMN-23-trailer.mp3","FileUrl":"http://www.keithandthegirl.com/vip/download/shows/wmn/WMN-2012-03-07.mp3","Type":"0","Public":"0","Timestamp":1331159400,"Guests":[{"Data":"249","ShowGuestId":"249","RealName":"Kambri Crews","Description":"Author of Burn Down the Ground: A Memoir and Christian Finnegan\u0027s wife.","PictureFilename":"Kambri-Crews.jpg","Url1":"http://kambricrews.com/","Url2":"","PictureUrl":"http://static-2.keithandthegirl.net/guests/pics/processed/Kambri-Crews-150x150.jpg","PictureUrlLarge":"http://static-2.keithandthegirl.net/guests/pics/processed/Kambri-Crews-600x600.jpg"}]},{"ShowId":"2275","ShowNameId":"5","Number":"22","PostedDate":"2/29/2012 8:00:00 PM","Title":" How To Make Friends","PreviewUrl":"http://www.keithandthegirl.com/mp3/promo/whats-my-name-show/WMN-22-trailer.mp3","FileUrl":"http://www.keithandthegirl.com/vip/download/shows/wmn/WMN-2012-02-29.mp3","Type":"0","Public":"0","Timestamp":1330563600,"Guests":[{"Data":"93","ShowGuestId":"93","RealName":"Andrew Warner","Description":"The Girl\u0027s older brother.","PictureFilename":"Andrew-Warner.jpg","Url1":"http://www.mixergy.com","Url2":"","PictureUrl":"http://static-1.keithandthegirl.net/guests/pics/processed/Andrew-Warner-150x150.jpg","PictureUrlLarge":"http://static-1.keithandthegirl.net/guests/pics/processed/Andrew-Warner-600x600.jpg"}]},{"ShowId":"2268","ShowNameId":"5","Number":"21","PostedDate":"2/16/2012 8:00:00 PM","Title":"Are You Autistic?","PreviewUrl":"http://www.keithandthegirl.com/mp3/promo/whats-my-name-show/WMN-21-trailer.mp3","FileUrl":"http://www.keithandthegirl.com/vip/download/shows/wmn/WMN-2012-02-15.mp3","Type":"0","Public":"0","Timestamp":1329440400,"Guests":[{"Data":"433","ShowGuestId":"433","RealName":"Brian Gordon","Description":"Autism educator and social worker and former stand-up comedian","PictureFilename":"Brian-Gordon.jpg","Url1":"","Url2":"http://bsgsociallearning.com/","PictureUrl":"http://static-4.keithandthegirl.net/guests/pics/processed/Brian-Gordon-150x150.jpg","PictureUrlLarge":"http://static-4.keithandthegirl.net/guests/pics/processed/Brian-Gordon-600x600.jpg"}]},{"ShowId":"2264","ShowNameId":"5","Number":"20","PostedDate":"2/11/2012","Title":"Eak!","PreviewUrl":"http://www.keithandthegirl.com/mp3/promo/whats-my-name-show/WMN-20-trailer.mp3","FileUrl":"http://www.keithandthegirl.com/vip/download/shows/wmn/WMN-2012-02-08.mp3","Type":"0","Public":"0","Timestamp":1328936400,"Guests":[{"Data":"432","ShowGuestId":"432","RealName":"Eak the Geek","Description":"Renowned tattoo-covered sideshow performer.","PictureFilename":"eakthegeek.jpg","Url1":"","Url2":"","PictureUrl":"http://static-1.keithandthegirl.net/guests/pics/processed/eakthegeek-150x150.jpg","PictureUrlLarge":"http://static-1.keithandthegirl.net/guests/pics/processed/eakthegeek-600x600.jpg"}]},{"ShowId":"2257","ShowNameId":"5","Number":"19","PostedDate":"2/1/2012 6:00:00 PM","Title":"Stripper Stories","PreviewUrl":"http://www.keithandthegirl.com/mp3/promo/whats-my-name-show/WMN-19-trailer.mp3","FileUrl":"http://www.keithandthegirl.com/vip/download/shows/wmn/WMN-2012-02-01.mp3","Type":"0","Public":"0","Timestamp":1328137200,"Guests":[{"Data":"431","ShowGuestId":"431","RealName":"Stormy Leather","Description":"Burlesque performer ","PictureFilename":"stormyleathers.jpg","Url1":"","Url2":"","PictureUrl":"http://static-3.keithandthegirl.net/guests/pics/processed/stormyleathers-150x150.jpg","PictureUrlLarge":"http://static-3.keithandthegirl.net/guests/pics/processed/stormyleathers-600x600.jpg"}]},{"ShowId":"2250","ShowNameId":"5","Number":"18","PostedDate":"1/24/2012","Title":"From Wesley to Whitney","PreviewUrl":"http://www.keithandthegirl.com/mp3/promo/whats-my-name-show/WMN-18-trailer.mp3","FileUrl":"http://www.keithandthegirl.com/vip/download/shows/wmn/WMN-2012-01-25.mp3","Type":"0","Public":"0","Timestamp":1327381200,"Guests":[{"Data":"430","ShowGuestId":"430","RealName":"Whitney Urish","Description":"Writer and storyteller.","PictureFilename":"whitneyurish.jpg","Url1":"","Url2":"http://whitneyurish.blogspot.com/","PictureUrl":"http://static-2.keithandthegirl.net/guests/pics/processed/whitneyurish-150x150.jpg","PictureUrlLarge":"http://static-2.keithandthegirl.net/guests/pics/processed/whitneyurish-600x600.jpg"}]},{"ShowId":"2246","ShowNameId":"5","Number":"17","PostedDate":"1/18/2012 4:00:00 PM","Title":"Papa Don\u0027t Preach - Part Two","PreviewUrl":"http://www.keithandthegirl.com/mp3/promo/whats-my-name-show/WMN-17-trailer.mp3","FileUrl":"http://www.keithandthegirl.com/vip/download/shows/wmn/WMN-2012-01-18.mp3","Type":"0","Public":"0","Timestamp":1326920400,"Guests":[{"Data":"429","ShowGuestId":"429","RealName":"Ron Winckler","Description":"Minister, wedding planner, and Lauren Hennessy\u0027s father.","PictureFilename":"ronwinckler.jpg","Url1":"","Url2":"http://mauiisland.com/","PictureUrl":"http://static-4.keithandthegirl.net/guests/pics/processed/ronwinckler-150x150.jpg","PictureUrlLarge":"http://static-4.keithandthegirl.net/guests/pics/processed/ronwinckler-600x600.jpg"}]},{"ShowId":"2241","ShowNameId":"5","Number":"16","PostedDate":"1/11/2012 6:00:00 PM","Title":"Papa Don\u0027t Preach - Part One","PreviewUrl":"http://www.keithandthegirl.com/mp3/promo/whats-my-name-show/WMN-16-trailer.mp3","FileUrl":"http://www.keithandthegirl.com/vip/download/shows/wmn/WMN-2012-01-11.mp3","Type":"0","Public":"0","Timestamp":1326322800,"Guests":[{"Data":"429","ShowGuestId":"429","RealName":"Ron Winckler","Description":"Minister, wedding planner, and Lauren Hennessy\u0027s father.","PictureFilename":"ronwinckler.jpg","Url1":"","Url2":"http://mauiisland.com/","PictureUrl":"http://static-4.keithandthegirl.net/guests/pics/processed/ronwinckler-150x150.jpg","PictureUrlLarge":"http://static-4.keithandthegirl.net/guests/pics/processed/ronwinckler-600x600.jpg"}]},{"ShowId":"2233","ShowNameId":"5","Number":"15","PostedDate":"12/14/2011 7:00:00 PM","Title":"Death","PreviewUrl":"http://www.keithandthegirl.com/mp3/promo/whats-my-name-show/WMN-15-trailer.mp3","FileUrl":"http://www.keithandthegirl.com/vip/download/shows/wmn/WMN-2011-12-14.mp3","Type":"0","Public":"0","Timestamp":1323907200,"Guests":[{"Data":"9","ShowGuestId":"9","RealName":"Brother Love","Description":"Host of The Brother Love Owwwr! and founder of Them Vibes.","PictureFilename":"Brother-Love.jpg","Url1":"http://www.facebook.com/brotherlove","Url2":"http://www.brotherloverocks.com","PictureUrl":"http://static-4.keithandthegirl.net/guests/pics/processed/Brother-Love-150x150.jpg","PictureUrlLarge":"http://static-4.keithandthegirl.net/guests/pics/processed/Brother-Love-600x600.jpg"},{"Data":"51","ShowGuestId":"51","RealName":"Jesse Joyce","Description":"Comedian and writer who wrote for numerous Comedy Central Roasts and the 85th Academy Awards ceremony.","PictureFilename":"Jesse-Joyce.jpg","Url1":"http://www.facebook.com/profile.php?id=506265141\u0026ref=ts#!/JesseJoyce.comedy","Url2":"http://www.jessejoyce.com","PictureUrl":"http://static-1.keithandthegirl.net/guests/pics/processed/Jesse-Joyce-150x150.jpg","PictureUrlLarge":"http://static-1.keithandthegirl.net/guests/pics/processed/Jesse-Joyce-600x600.jpg"},{"Data":"106","ShowGuestId":"106","RealName":"Lauren Hennessy","Description":"Icelandic Academy Award nominated actor, host of the podcast Bottoms Up with Hennessy, and Chemda\u0027s fiancé.","PictureFilename":"Lauren-Hennessy.jpg","Url1":"http://laurenhennessy.com","Url2":"http://www.facebook.com/lauren.hennessy","PictureUrl":"http://static-1.keithandthegirl.net/guests/pics/processed/Lauren-Hennessy-150x150.jpg","PictureUrlLarge":"http://static-1.keithandthegirl.net/guests/pics/processed/Lauren-Hennessy-600x600.jpg"}]},{"ShowId":"2227","ShowNameId":"5","Number":"14","PostedDate":"12/8/2011","Title":"Marriage: Women","PreviewUrl":"http://www.keithandthegirl.com/mp3/promo/whats-my-name-show/WMN-14-trailer.mp3","FileUrl":"http://www.keithandthegirl.com/vip/download/shows/wmn/WMN-2011-12-07.mp3","Type":"0","Public":"0","Timestamp":1323320400,"Guests":[{"Data":"133","ShowGuestId":"133","RealName":"Diane O\u0027Debra","Description":"Comedian and actress known for her duo with her twin sister, The O\u0027Debra Twins, which won a Village Voice Best of New York Award and received ECNY Award Nomination for Best Duo.","PictureFilename":"Diane-ODebra.jpg","Url1":"http://www.facebook.com/diane.odebra","Url2":"","PictureUrl":"http://static-3.keithandthegirl.net/guests/pics/processed/Diane-ODebra-150x150.jpg","PictureUrlLarge":"http://static-3.keithandthegirl.net/guests/pics/processed/Diane-ODebra-600x600.jpg"},{"Data":"249","ShowGuestId":"249","RealName":"Kambri Crews","Description":"Author of Burn Down the Ground: A Memoir and Christian Finnegan\u0027s wife.","PictureFilename":"Kambri-Crews.jpg","Url1":"http://kambricrews.com/","Url2":"","PictureUrl":"http://static-2.keithandthegirl.net/guests/pics/processed/Kambri-Crews-150x150.jpg","PictureUrlLarge":"http://static-2.keithandthegirl.net/guests/pics/processed/Kambri-Crews-600x600.jpg"},{"Data":"159","ShowGuestId":"159","RealName":"Ophira Eisenberg","Description":"Comedian and storyteller known for hosting NPR\u0027s Ask Me Another, and for her book Screw Everyone.","PictureFilename":"Ophira-Eisenberg.jpg","Url1":"http://www.facebook.com/ophira","Url2":"http://www.ophiraeisenberg.com","PictureUrl":"http://static-1.keithandthegirl.net/guests/pics/processed/Ophira-Eisenberg-150x150.jpg","PictureUrlLarge":"http://static-1.keithandthegirl.net/guests/pics/processed/Ophira-Eisenberg-600x600.jpg"}]},{"ShowId":"2222","ShowNameId":"5","Number":"13","PostedDate":"11/30/2011 6:00:00 PM","Title":"Marriage: Men","PreviewUrl":"http://www.keithandthegirl.com/mp3/promo/whats-my-name-show/WMN-13-trailer.mp3","FileUrl":"http://www.keithandthegirl.com/vip/download/shows/wmn/WMN-2011-11-30.mp3","Type":"0","Public":"0","Timestamp":1322694000,"Guests":[{"Data":"40","ShowGuestId":"40","RealName":"Christian Finnegan","Description":"Comedian known for his roles on Chapelle\u0027s Show and Are We There Yet? and his Netflix comedy special The Fun Part.","PictureFilename":"Christian-Finnegan.jpg","Url1":"http://www.facebook.com/ChristFinnegan","Url2":"http://christianfinnegan.com","PictureUrl":"http://static-4.keithandthegirl.net/guests/pics/processed/Christian-Finnegan-150x150.jpg","PictureUrlLarge":"http://static-4.keithandthegirl.net/guests/pics/processed/Christian-Finnegan-600x600.jpg"},{"Data":"51","ShowGuestId":"51","RealName":"Jesse Joyce","Description":"Comedian and writer who wrote for numerous Comedy Central Roasts and the 85th Academy Awards ceremony.","PictureFilename":"Jesse-Joyce.jpg","Url1":"http://www.facebook.com/profile.php?id=506265141\u0026ref=ts#!/JesseJoyce.comedy","Url2":"http://www.jessejoyce.com","PictureUrl":"http://static-1.keithandthegirl.net/guests/pics/processed/Jesse-Joyce-150x150.jpg","PictureUrlLarge":"http://static-1.keithandthegirl.net/guests/pics/processed/Jesse-Joyce-600x600.jpg"},{"Data":"86","ShowGuestId":"86","RealName":"Pat Dixon","Description":"Comedian known for his appearances on Best Week Ever and for his podcast, The New York City Crime Report.","PictureFilename":"Pat-Dixon.jpg","Url1":"http://www.facebook.com/comedianpatdixon?ref=ts","Url2":"http://www.ComedianPatDixon.com","PictureUrl":"http://static-1.keithandthegirl.net/guests/pics/processed/Pat-Dixon-150x150.jpg","PictureUrlLarge":"http://static-1.keithandthegirl.net/guests/pics/processed/Pat-Dixon-600x600.jpg"}]},{"ShowId":"2202","ShowNameId":"5","Number":"12","PostedDate":"11/16/2011 11:00:00 PM","Title":"Talk Dirty to Me","PreviewUrl":"http://www.keithandthegirl.com/mp3/promo/whats-my-name-show/WMN-12-trailer.mp3","FileUrl":"http://www.keithandthegirl.com/vip/download/shows/wmn/WMN-2011-11-16.mp3","Type":"0","Public":"0","Timestamp":1321502400,"Guests":[{"Data":"428","ShowGuestId":"428","RealName":"Laura Antoniou","Description":"Novelist and author of The Marketplace novels","PictureFilename":"lauraantoniou.jpg","Url1":"","Url2":"http://www.lantoniou.com/","PictureUrl":"http://static-3.keithandthegirl.net/guests/pics/processed/lauraantoniou-150x150.jpg","PictureUrlLarge":"http://static-3.keithandthegirl.net/guests/pics/processed/lauraantoniou-600x600.jpg"},{"Data":"106","ShowGuestId":"106","RealName":"Lauren Hennessy","Description":"Icelandic Academy Award nominated actor, host of the podcast Bottoms Up with Hennessy, and Chemda\u0027s fiancé.","PictureFilename":"Lauren-Hennessy.jpg","Url1":"http://laurenhennessy.com","Url2":"http://www.facebook.com/lauren.hennessy","PictureUrl":"http://static-1.keithandthegirl.net/guests/pics/processed/Lauren-Hennessy-150x150.jpg","PictureUrlLarge":"http://static-1.keithandthegirl.net/guests/pics/processed/Lauren-Hennessy-600x600.jpg"}]},{"ShowId":"2196","ShowNameId":"5","Number":"11","PostedDate":"11/9/2011 12:00:00 PM","Title":"In This Economy","PreviewUrl":"http://www.keithandthegirl.com/mp3/promo/whats-my-name-show/WMN-11-trailer.mp3","FileUrl":"http://www.keithandthegirl.com/vip/download/shows/wmn/WMN-2011-11-09.mp3","Type":"0","Public":"0","Timestamp":1320858000,"Guests":[{"Data":"223","ShowGuestId":"223","RealName":"Marga Gomez","Description":"San Francisco based comic who has appeared in HBO’s Comic Relief VI, LOGO’s One Night Stand Up and Comedy Central’s Out There.","PictureFilename":"Marga-Gomez.jpg","Url1":"http://www.margagomez.com/","Url2":"","PictureUrl":"http://static-4.keithandthegirl.net/guests/pics/processed/Marga-Gomez-150x150.jpg","PictureUrlLarge":"http://static-4.keithandthegirl.net/guests/pics/processed/Marga-Gomez-600x600.jpg"}]},{"ShowId":"2191","ShowNameId":"5","Number":"10","PostedDate":"11/1/2011 12:00:00 PM","Title":"Married and Available","PreviewUrl":"http://www.keithandthegirl.com/mp3/promo/whats-my-name-show/WMN-10-trailer.mp3","FileUrl":"http://www.keithandthegirl.com/vip/download/shows/wmn/WMN-2011-11-02.mp3","Type":"0","Public":"0","Timestamp":1320163200,"Guests":[{"Data":"312","ShowGuestId":"312","RealName":"Erin Judge","Description":"Comedian best known for her appearances on Last Comic Standing and Live at Gotham.","PictureFilename":"Erin-Judge.jpg","Url1":"","Url2":"http://www.erinjudge.com/","PictureUrl":"http://static-4.keithandthegirl.net/guests/pics/processed/Erin-Judge-150x150.jpg","PictureUrlLarge":"http://static-4.keithandthegirl.net/guests/pics/processed/Erin-Judge-600x600.jpg"}]},{"ShowId":"2185","ShowNameId":"5","Number":"9","PostedDate":"10/26/2011","Title":"Let\u0027s Get High","PreviewUrl":"http://www.keithandthegirl.com/mp3/promo/whats-my-name-show/WMN-9-trailer.mp3","FileUrl":"http://www.keithandthegirl.com/vip/download/shows/wmn/WMN-2011-10-26.mp3","Type":"0","Public":"0","Timestamp":1319601600,"Guests":[{"Data":"106","ShowGuestId":"106","RealName":"Lauren Hennessy","Description":"Icelandic Academy Award nominated actor, host of the podcast Bottoms Up with Hennessy, and Chemda\u0027s fiancé.","PictureFilename":"Lauren-Hennessy.jpg","Url1":"http://laurenhennessy.com","Url2":"http://www.facebook.com/lauren.hennessy","PictureUrl":"http://static-1.keithandthegirl.net/guests/pics/processed/Lauren-Hennessy-150x150.jpg","PictureUrlLarge":"http://static-1.keithandthegirl.net/guests/pics/processed/Lauren-Hennessy-600x600.jpg"},{"Data":"175","ShowGuestId":"175","RealName":"Tim Dimond","Description":"Comedian and writer known for his contributions to VH1 and The History Channel.","PictureFilename":"Tim-Dimond.jpg","Url1":"http://www.facebook.com/profile.php?id=4803272","Url2":"http://www.timdimond.com","PictureUrl":"http://static-1.keithandthegirl.net/guests/pics/processed/Tim-Dimond-150x150.jpg","PictureUrlLarge":"http://static-1.keithandthegirl.net/guests/pics/processed/Tim-Dimond-600x600.jpg"},{"Data":"135","ShowGuestId":"135","RealName":"Trey Galyon","Description":"Comedian known for his albums Not Sure Where This Went Wrong and The Moronic.","PictureFilename":"Trey-Galyon.jpg","Url1":"http://www.facebook.com/home.php?#!/profile.php?id=585267627\u0026v=info\u0026ref=ts","Url2":"http://www.rooftopcomedy.com/comics/TreyGalyon","PictureUrl":"http://static-3.keithandthegirl.net/guests/pics/processed/Trey-Galyon-150x150.jpg","PictureUrlLarge":"http://static-3.keithandthegirl.net/guests/pics/processed/Trey-Galyon-600x600.jpg"}]},{"ShowId":"2181","ShowNameId":"5","Number":"8","PostedDate":"10/19/2011","Title":"By the Bi","PreviewUrl":"http://www.keithandthegirl.com/mp3/promo/whats-my-name-show/WMN-8-trailer.mp3","FileUrl":"http://www.keithandthegirl.com/vip/download/shows/wmn/WMN-2011-10-19.mp3","Type":"0","Public":"0","Timestamp":1318996800,"Guests":[{"Data":"425","ShowGuestId":"425","RealName":"Rachel Kramer Bussel","Description":"Erotic novelist and editor of Best Bondage Erotica 2014.","PictureFilename":"rachel.jpg","Url1":"","Url2":"http://www.rachelkramerbussel.com/","PictureUrl":"http://static-2.keithandthegirl.net/guests/pics/processed/rachel-150x150.jpg","PictureUrlLarge":"http://static-2.keithandthegirl.net/guests/pics/processed/rachel-600x600.jpg"}]},{"ShowId":"2176","ShowNameId":"5","Number":"7","PostedDate":"10/12/2011","Title":"Desperate Times","PreviewUrl":"http://www.keithandthegirl.com/mp3/promo/whats-my-name-show/WMN-7-trailer.mp3","FileUrl":"http://www.keithandthegirl.com/vip/download/shows/wmn/WMN-2011-10-12.mp3","Type":"0","Public":"0","Timestamp":1318392000,"Guests":[{"Data":"169","ShowGuestId":"169","RealName":"Lucas McCain","Description":"Hermit and former intern.","PictureFilename":"Lucas-McCain.jpg","Url1":"","Url2":"http://www.knucklewalker.com/","PictureUrl":"http://static-3.keithandthegirl.net/guests/pics/processed/Lucas-McCain-150x150.jpg","PictureUrlLarge":"http://static-3.keithandthegirl.net/guests/pics/processed/Lucas-McCain-600x600.jpg"}]},{"ShowId":"2169","ShowNameId":"5","Number":"6","PostedDate":"10/5/2011","Title":"Concrete Jungle","PreviewUrl":"http://www.keithandthegirl.com/mp3/promo/whats-my-name-show/WMN-6-trailer.mp3","FileUrl":"http://www.keithandthegirl.com/vip/download/shows/wmn/WMN-2011-10-05.mp3","Type":"0","Public":"0","Timestamp":1317787200,"Guests":[{"Data":"114","ShowGuestId":"114","RealName":"Faceboy","Description":"Performance artist and host of Faceboyz Open Mic at Surf Reality, where Keith and Chemda met.","PictureFilename":"Faceboy.jpg","Url1":"http://www.facebook.com/#!/profile.php?id=1577007221\u0026ref=ts","Url2":"","PictureUrl":"http://static-1.keithandthegirl.net/guests/pics/processed/Faceboy-150x150.jpg","PictureUrlLarge":"http://static-1.keithandthegirl.net/guests/pics/processed/Faceboy-600x600.jpg"},{"Data":"86","ShowGuestId":"86","RealName":"Pat Dixon","Description":"Comedian known for his appearances on Best Week Ever and for his podcast, The New York City Crime Report.","PictureFilename":"Pat-Dixon.jpg","Url1":"http://www.facebook.com/comedianpatdixon?ref=ts","Url2":"http://www.ComedianPatDixon.com","PictureUrl":"http://static-1.keithandthegirl.net/guests/pics/processed/Pat-Dixon-150x150.jpg","PictureUrlLarge":"http://static-1.keithandthegirl.net/guests/pics/processed/Pat-Dixon-600x600.jpg"},{"Data":"69","ShowGuestId":"69","RealName":"Emmy","Description":"KATG\u0027s original intern.","PictureFilename":"Sexy-PotatoE.jpg","Url1":"http://www.facebook.com/emmyp","Url2":"http://thehardcandy.com/","PictureUrl":"http://static-1.keithandthegirl.net/guests/pics/processed/Sexy-PotatoE-150x150.jpg","PictureUrlLarge":"http://static-1.keithandthegirl.net/guests/pics/processed/Sexy-PotatoE-600x600.jpg"}]},{"ShowId":"2163","ShowNameId":"5","Number":"5","PostedDate":"9/28/2011","Title":"Mommy Dearest","PreviewUrl":"http://www.keithandthegirl.com/mp3/promo/whats-my-name-show/WMN-5-trailer.mp3","FileUrl":"http://www.keithandthegirl.com/vip/download/shows/wmn/WMN-2011-09-28.mp3","Type":"0","Public":"0","Timestamp":1317182400,"Guests":[{"Data":"427","ShowGuestId":"427","RealName":"Debi Winckler","Description":"Wedding planner and Lauren Hennessy\u0027s mom","PictureFilename":"debiwinckler.jpg","Url1":"","Url2":"http://mauiisland.com/","PictureUrl":"http://static-4.keithandthegirl.net/guests/pics/processed/debiwinckler-150x150.jpg","PictureUrlLarge":"http://static-4.keithandthegirl.net/guests/pics/processed/debiwinckler-600x600.jpg"}]},{"ShowId":"2156","ShowNameId":"5","Number":"4","PostedDate":"9/21/2011","Title":"Hoarder in the Court","PreviewUrl":"http://www.keithandthegirl.com/mp3/promo/whats-my-name-show/WMN-4-trailer.mp3","FileUrl":"http://www.keithandthegirl.com/vip/download/shows/wmn/WMN-2011-09-21.mp3","Type":"0","Public":"0","Timestamp":1316577600,"Guests":[{"Data":"425","ShowGuestId":"425","RealName":"Rachel Kramer Bussel","Description":"Erotic novelist and editor of Best Bondage Erotica 2014.","PictureFilename":"rachel.jpg","Url1":"","Url2":"http://www.rachelkramerbussel.com/","PictureUrl":"http://static-2.keithandthegirl.net/guests/pics/processed/rachel-150x150.jpg","PictureUrlLarge":"http://static-2.keithandthegirl.net/guests/pics/processed/rachel-600x600.jpg"}]},{"ShowId":"2143","ShowNameId":"5","Number":"3","PostedDate":"9/14/2011","Title":"Are Women Funny","PreviewUrl":"http://www.keithandthegirl.com/mp3/promo/whats-my-name-show/WMN-3-trailer.mp3","FileUrl":"http://www.keithandthegirl.com/vip/download/shows/wmn/WMN-2011-09-14.mp3","Type":"0","Public":"0","Timestamp":1315972800,"Guests":[{"Data":"422","ShowGuestId":"422","RealName":"Ashley Brooke Roberts","Description":"Comedian who hosts Fresh Out! at UCB East every Thursday in New York Sunday","PictureFilename":"ashleybrookeroberts.png","Url1":"https://twitter.com/AshleyBRoberts","Url2":"http://www.ashleybrookeroberts.com/","PictureUrl":"http://static-3.keithandthegirl.net/guests/pics/processed/ashleybrookeroberts-150x150.png","PictureUrlLarge":"http://static-3.keithandthegirl.net/guests/pics/processed/ashleybrookeroberts-600x600.png"},{"Data":"173","ShowGuestId":"173","RealName":"Brian Baldinger","Description":"Comic manager and booker.","PictureFilename":"Brian-Baldinger.jpg","Url1":"http://www.facebook.com/brianbaldinger","Url2":"","PictureUrl":"http://static-3.keithandthegirl.net/guests/pics/processed/Brian-Baldinger-150x150.jpg","PictureUrlLarge":"http://static-3.keithandthegirl.net/guests/pics/processed/Brian-Baldinger-600x600.jpg"},{"Data":"132","ShowGuestId":"132","RealName":"Carmen Lynch","Description":"Comedian known for her appearances on Late Show with David Letterman and her web series Apt. C3.","PictureFilename":"Carmen-Lynch.jpg","Url1":"http://www.facebook.com/LynchCarmen","Url2":"http://www.carmenlynch.com","PictureUrl":"http://static-2.keithandthegirl.net/guests/pics/processed/Carmen-Lynch-150x150.jpg","PictureUrlLarge":"http://static-2.keithandthegirl.net/guests/pics/processed/Carmen-Lynch-600x600.jpg"}]},{"ShowId":"2141","ShowNameId":"5","Number":"2","PostedDate":"9/7/2011","Title":"Don\u0027t Be Gay","PreviewUrl":"http://www.keithandthegirl.com/mp3/promo/whats-my-name-show/WMN-2-trailer.mp3","FileUrl":"http://www.keithandthegirl.com/vip/download/shows/wmn/WMN-2011-09-07.mp3","Type":"0","Public":"0","Timestamp":1315368000,"Guests":[{"Data":"111","ShowGuestId":"111","RealName":"Ben Lerman","Description":"Comedian and musician known for his EPs Size Matters and Ukelear Winter, and for hosting the podcast Serving Reelness.","PictureFilename":"Ben-Lerman.jpg","Url1":"http://www.facebook.com/thebenlerman","Url2":"http://www.benlerman.net","PictureUrl":"http://static-2.keithandthegirl.net/guests/pics/processed/Ben-Lerman-150x150.jpg","PictureUrlLarge":"http://static-2.keithandthegirl.net/guests/pics/processed/Ben-Lerman-600x600.jpg"},{"Data":"2","ShowGuestId":"2","RealName":"Patrice Callender","Description":"Gossip Queen turned major scam artist that preys on close friends","PictureFilename":"Patrice.jpg","Url1":"","Url2":"","PictureUrl":"http://static-4.keithandthegirl.net/guests/pics/processed/Patrice-150x150.jpg","PictureUrlLarge":"http://static-4.keithandthegirl.net/guests/pics/processed/Patrice-600x600.jpg"}]},{"ShowId":"2140","ShowNameId":"5","Number":"1","PostedDate":"8/31/2011","Title":"Hey Jealousy","PreviewUrl":"http://www.keithandthegirl.com/mp3/promo/whats-my-name-show/WMN-1-trailer.mp3","FileUrl":"http://www.keithandthegirl.com/vip/download/shows/wmn/WMN-2011-08-31.mp3","Type":"0","Public":"0","Timestamp":1314763200,"Guests":[{"Data":"106","ShowGuestId":"106","RealName":"Lauren Hennessy","Description":"Icelandic Academy Award nominated actor, host of the podcast Bottoms Up with Hennessy, and Chemda\u0027s fiancé.","PictureFilename":"Lauren-Hennessy.jpg","Url1":"http://laurenhennessy.com","Url2":"http://www.facebook.com/lauren.hennessy","PictureUrl":"http://static-1.keithandthegirl.net/guests/pics/processed/Lauren-Hennessy-150x150.jpg","PictureUrlLarge":"http://static-1.keithandthegirl.net/guests/pics/processed/Lauren-Hennessy-600x600.jpg"},{"Data":"426","ShowGuestId":"426","RealName":"Mariah MacCarthy","Description":"Playwright and author of the FringeNYC play Magic Trick","PictureFilename":"mariahmaccarthy.jpg","Url1":"","Url2":"https://twitter.com/MariahMacCarthy","PictureUrl":"http://static-2.keithandthegirl.net/guests/pics/processed/mariahmaccarthy-150x150.jpg","PictureUrlLarge":"http://static-2.keithandthegirl.net/guests/pics/processed/mariahmaccarthy-600x600.jpg"}]}]